19:07:59.484369 IP 192.168.10.1.16384 > omega.16384: NetTLP: MWr, len 2, requester 00:00, tag 0x00, last 0xf, first 0xf, Addr 0x80000020
19:07:59.484376 IP 192.168.10.1.16384 > omega.16384: NetTLP: MWr, len 2, requester 00:00, tag 0x00, last 0xf, first 0xf, Addr 0x80000028
19:07:59.484377 IP 192.168.10.1.16384 > omega.16384: NetTLP: MWr, len 2, requester 00:00, tag 0x00, last 0xf, first 0xf, Addr 0x80000020
19:07:59.484380 IP 192.168.10.1.16384 > omega.16384: NetTLP: MWr, len 2, requester 00:00, tag 0x00, last 0xf, first 0xf, Addr 0x80000028
19:07:59.484381 IP 192.168.10.1.16384 > omega.16384: NetTLP: MWr, len 2, requester 00:00, tag 0x00, last 0xf, first 0xf, Addr 0x80000020
19:07:59.484382 IP 192.168.10.1.16384 > omega.16384: NetTLP: MWr, len 2, requester 00:00, tag 0x00, last 0xf, first 0xf, Addr 0x80000028
19:07:59.484383 IP 192.168.10.1.16384 > omega.16384: NetTLP: MWr, len 2, requester 00:00, tag 0x00, last 0xf, first 0xf, Addr 0x80000020
19:07:59.484384 IP 192.168.10.1.16384 > omega.16384: NetTLP: MWr, len 2, requester 00:00, tag 0x00, last 0xf, first 0xf, Addr 0x80000028
19:07:59.484391 IP 192.168.10.1.16384 > omega.16384: NetTLP: MWr, len 2, requester 00:00, tag 0x00, last 0xf, first 0xf, Addr 0x80000020
19:07:59.484392 IP 192.168.10.1.16384 > omega.16384: NetTLP: MWr, len 2, requester 00:00, tag 0x00, last 0xf, first 0xf, Addr 0x80000028
19:07:59.484401 IP 192.168.10.1.16384 > omega.16384: NetTLP: MWr, len 2, requester 00:00, tag 0x00, last 0xf, first 0xf, Addr 0x80000020
19:07:59.484402 IP 192.168.10.1.16384 > omega.16384: NetTLP: MWr, len 2, requester 00:00, tag 0x00, last 0xf, first 0xf, Addr 0x80000028
19:07:59.484403 IP 192.168.10.1.16384 > omega.16384: NetTLP: MWr, len 2, requester 00:00, tag 0x00, last 0xf, first 0xf, Addr 0x80000020
19:07:59.484404 IP 192.168.10.1.16384 > omega.16384: NetTLP: MWr, len 2, requester 00:00, tag 0x00, last 0xf, first 0xf, Addr 0x80000028
19:07:59.484408 IP omega.12288 > 192.168.10.1.12288: NetTLP: MRd, len 16, requester 01:00, tag 0x00, last 0xf, first 0xf, Addr 0x53aad800
19:07:59.484413 IP 192.168.10.1.16384 > omega.16384: NetTLP: MWr, len 2, requester 00:00, tag 0x00, last 0xf, first 0xf, Addr 0x80000020
19:07:59.484414 IP 192.168.10.1.16384 > omega.16384: NetTLP: MWr, len 2, requester 00:00, tag 0x00, last 0xf, first 0xf, Addr 0x80000028
19:07:59.484416 IP 192.168.10.1.16384 > omega.16384: NetTLP: MWr, len 2, requester 00:00, tag 0x00, last 0xf, first 0xf, Addr 0x80000020
19:07:59.484417 IP 192.168.10.1.16384 > omega.16384: NetTLP: MWr, len 2, requester 00:00, tag 0x00, last 0xf, first 0xf, Addr 0x80000028
19:07:59.484418 IP 192.168.10.1.12288 > omega.12288: NetTLP: CplD, len 16, completer 00:00, success, bc 64, requester 01:00, tag 0x00, lowaddr 0x00
19:07:59.484420 IP 192.168.10.1.16384 > omega.16384: NetTLP: MWr, len 2, requester 00:00, tag 0x00, last 0xf, first 0xf, Addr 0x80000020
19:07:59.484421 IP 192.168.10.1.16384 > omega.16384: NetTLP: MWr, len 2, requester 00:00, tag 0x00, last 0xf, first 0xf, Addr 0x80000028
19:07:59.484427 IP 192.168.10.1.16384 > omega.16384: NetTLP: MWr, len 2, requester 00:00, tag 0x00, last 0xf, first 0xf, Addr 0x80000020
19:07:59.484428 IP 192.168.10.1.16384 > omega.16384: NetTLP: MWr, len 2, requester 00:00, tag 0x00, last 0xf, first 0xf, Addr 0x80000028
19:07:59.484444 IP 192.168.10.1.16384 > omega.16384: NetTLP: MWr, len 2, requester 00:00, tag 0x00, last 0xf, first 0xf, Addr 0x80000020
19:07:59.484446 IP 192.168.10.1.16384 > omega.16384: NetTLP: MWr, len 2, requester 00:00, tag 0x00, last 0xf, first 0xf, Addr 0x80000028
19:07:59.484447 IP 192.168.10.1.16384 > omega.16384: NetTLP: MWr, len 2, requester 00:00, tag 0x00, last 0xf, first 0xf, Addr 0x80000020
19:07:59.484448 IP 192.168.10.1.16384 > omega.16384: NetTLP: MWr, len 2, requester 00:00, tag 0x00, last 0xf, first 0xf, Addr 0x80000028
19:07:59.484449 IP 192.168.10.1.16384 > omega.16384: NetTLP: MWr, len 2, requester 00:00, tag 0x00, last 0xf, first 0xf, Addr 0x80000020
19:07:59.484450 IP 192.168.10.1.16384 > omega.16384: NetTLP: MWr, len 2, requester 00:00, tag 0x00, last 0xf, first 0xf, Addr 0x80000028
19:07:59.484451 IP 192.168.10.1.16384 > omega.16384: NetTLP: MWr, len 2, requester 00:00, tag 0x00, last 0xf, first 0xf, Addr 0x80000020
19:07:59.484452 IP 192.168.10.1.16384 > omega.16384: NetTLP: MWr, len 2, requester 00:00, tag 0x00, last 0xf, first 0xf, Addr 0x80000028
19:07:59.484458 IP 192.168.10.1.16384 > omega.16384: NetTLP: MWr, len 2, requester 00:00, tag 0x00, last 0xf, first 0xf, Addr 0x80000020
19:07:59.484459 IP 192.168.10.1.16384 > omega.16384: NetTLP: MWr, len 2, requester 00:00, tag 0x00, last 0xf, first 0xf, Addr 0x80000028
19:07:59.484468 IP omega.12288 > 192.168.10.1.12288: NetTLP: MWr, len 1, requester 01:00, tag 0x00, last 0x0, first 0xf, Addr 0xfee01004
19:07:59.484472 IP 192.168.10.1.16384 > omega.16384: NetTLP: MWr, len 2, requester 00:00, tag 0x00, last 0xf, first 0xf, Addr 0x80000020
19:07:59.484473 IP omega.12288 > 192.168.10.1.12288: NetTLP: MRd, len 16, requester 01:00, tag 0x00, last 0xf, first 0xf, Addr 0x53aae000
19:07:59.484474 IP 192.168.10.1.16384 > omega.16384: NetTLP: MWr, len 2, requester 00:00, tag 0x00, last 0xf, first 0xf, Addr 0x80000028
19:07:59.484476 IP 192.168.10.1.16384 > omega.16384: NetTLP: MWr, len 2, requester 00:00, tag 0x00, last 0xf, first 0xf, Addr 0x80000020
19:07:59.484477 IP 192.168.10.1.16384 > omega.16384: NetTLP: MWr, len 2, requester 00:00, tag 0x00, last 0xf, first 0xf, Addr 0x80000028
19:07:59.484478 IP 192.168.10.1.16384 > omega.16384: NetTLP: MWr, len 2, requester 00:00, tag 0x00, last 0xf, first 0xf, Addr 0x80000020
19:07:59.484479 IP 192.168.10.1.16384 > omega.16384: NetTLP: MWr, len 2, requester 00:00, tag 0x00, last 0xf, first 0xf, Addr 0x80000028
19:07:59.484480 IP 192.168.10.1.16384 > omega.16384: NetTLP: MWr, len 2, requester 00:00, tag 0x00, last 0xf, first 0xf, Addr 0x80000020
19:07:59.484481 IP 192.168.10.1.16384 > omega.16384: NetTLP: MWr, len 2, requester 00:00, tag 0x00, last 0xf, first 0xf, Addr 0x80000028
19:07:59.484482 IP 192.168.10.1.12288 > omega.12288: NetTLP: CplD, len 16, completer 00:00, success, bc 64, requester 01:00, tag 0x00, lowaddr 0x00
19:07:59.484489 IP 192.168.10.1.16384 > omega.16384: NetTLP: MWr, len 2, requester 00:00, tag 0x00, last 0xf, first 0xf, Addr 0x80000020
19:07:59.484490 IP 192.168.10.1.16384 > omega.16384: NetTLP: MWr, len 2, requester 00:00, tag 0x00, last 0xf, first 0xf, Addr 0x80000028
19:07:59.484491 IP 192.168.10.1.16384 > omega.16384: NetTLP: MWr, len 2, requester 00:00, tag 0x00, last 0xf, first 0xf, Addr 0x80000020
19:07:59.484492 IP 192.168.10.1.16384 > omega.16384: NetTLP: MWr, len 2, requester 00:00, tag 0x00, last 0xf, first 0xf, Addr 0x80000028
19:07:59.484503 IP 192.168.10.1.16384 > omega.16384: NetTLP: MWr, len 2, requester 00:00, tag 0x00, last 0xf, first 0xf, Addr 0x80000020
19:07:59.484504 IP 192.168.10.1.16384 > omega.16384: NetTLP: MWr, len 2, requester 00:00, tag 0x00, last 0xf, first 0xf, Addr 0x80000028
19:07:59.484505 IP 192.168.10.1.16384 > omega.16384: NetTLP: MWr, len 2, requester 00:00, tag 0x00, last 0xf, first 0xf, Addr 0x80000020
19:07:59.484507 IP 192.168.10.1.16384 > omega.16384: NetTLP: MWr, len 2, requester 00:00, tag 0x00, last 0xf, first 0xf, Addr 0x80000028
19:07:59.484519 IP 192.168.10.1.16384 > omega.16384: NetTLP: MWr, len 2, requester 00:00, tag 0x00, last 0xf, first 0xf, Addr 0x80000020
19:07:59.484521 IP 192.168.10.1.16384 > omega.16384: NetTLP: MWr, len 2, requester 00:00, tag 0x00, last 0xf, first 0xf, Addr 0x80000028
19:07:59.484522 IP 192.168.10.1.16384 > omega.16384: NetTLP: MWr, len 2, requester 00:00, tag 0x00, last 0xf, first 0xf, Addr 0x80000020
19:07:59.484523 IP 192.168.10.1.16384 > omega.16384: NetTLP: MWr, len 2, requester 00:00, tag 0x00, last 0xf, first 0xf, Addr 0x80000028
19:07:59.484525 IP 192.168.10.1.16384 > omega.16384: NetTLP: MWr, len 2, requester 00:00, tag 0x00, last 0xf, first 0xf, Addr 0x80000020
19:07:59.484526 IP 192.168.10.1.16384 > omega.16384: NetTLP: MWr, len 2, requester 00:00, tag 0x00, last 0xf, first 0xf, Addr 0x80000028
19:07:59.484527 IP 192.168.10.1.16384 > omega.16384: NetTLP: MWr, len 2, requester 00:00, tag 0x00, last 0xf, first 0xf, Addr 0x80000020
19:07:59.484528 IP 192.168.10.1.16384 > omega.16384: NetTLP: MWr, len 2, requester 00:00, tag 0x00, last 0xf, first 0xf, Addr 0x80000028
19:07:59.484531 IP omega.12288 > 192.168.10.1.12288: NetTLP: MWr, len 1, requester 01:00, tag 0x00, last 0x0, first 0xf, Addr 0xfee01004
19:07:59.484534 IP omega.12288 > 192.168.10.1.12288: NetTLP: MRd, len 16, requester 01:00, tag 0x00, last 0xf, first 0xf, Addr 0x53aae800
19:07:59.484538 IP 192.168.10.1.16384 > omega.16384: NetTLP: MWr, len 2, requester 00:00, tag 0x00, last 0xf, first 0xf, Addr 0x80000020
19:07:59.484539 IP 192.168.10.1.16384 > omega.16384: NetTLP: MWr, len 2, requester 00:00, tag 0x00, last 0xf, first 0xf, Addr 0x80000028
19:07:59.484540 IP 192.168.10.1.16384 > omega.16384: NetTLP: MWr, len 2, requester 00:00, tag 0x00, last 0xf, first 0xf, Addr 0x80000020
19:07:59.484541 IP 192.168.10.1.16384 > omega.16384: NetTLP: MWr, len 2, requester 00:00, tag 0x00, last 0xf, first 0xf, Addr 0x80000028
19:07:59.484542 IP 192.168.10.1.12288 > omega.12288: NetTLP: CplD, len 16, completer 00:00, success, bc 64, requester 01:00, tag 0x00, lowaddr 0x00
19:07:59.484553 IP omega.12288 > 192.168.10.1.12288: NetTLP: MWr, len 1, requester 01:00, tag 0x00, last 0x0, first 0xf, Addr 0xfee01004
19:07:59.484555 IP omega.12288 > 192.168.10.1.12288: NetTLP: MRd, len 16, requester 01:00, tag 0x00, last 0xf, first 0xf, Addr 0x53aaf000
19:07:59.484559 IP 192.168.10.1.16384 > omega.16384: NetTLP: MWr, len 2, requester 00:00, tag 0x00, last 0xf, first 0xf, Addr 0x80000020
19:07:59.484561 IP 192.168.10.1.16384 > omega.16384: NetTLP: MWr, len 2, requester 00:00, tag 0x00, last 0xf, first 0xf, Addr 0x80000028
19:07:59.484562 IP 192.168.10.1.16384 > omega.16384: NetTLP: MWr, len 2, requester 00:00, tag 0x00, last 0xf, first 0xf, Addr 0x80000020
19:07:59.484563 IP 192.168.10.1.16384 > omega.16384: NetTLP: MWr, len 2, requester 00:00, tag 0x00, last 0xf, first 0xf, Addr 0x80000028
19:07:59.484564 IP 192.168.10.1.16384 > omega.16384: NetTLP: MWr, len 2, requester 00:00, tag 0x00, last 0xf, first 0xf, Addr 0x80000020
19:07:59.484565 IP 192.168.10.1.16384 > omega.16384: NetTLP: MWr, len 2, requester 00:00, tag 0x00, last 0xf, first 0xf, Addr 0x80000028
19:07:59.484567 IP 192.168.10.1.12288 > omega.12288: NetTLP: CplD, len 16, completer 00:00, success, bc 64, requester 01:00, tag 0x00, lowaddr 0x00
19:07:59.484568 IP 192.168.10.1.16384 > omega.16384: NetTLP: MWr, len 2, requester 00:00, tag 0x00, last 0xf, first 0xf, Addr 0x80000020
19:07:59.484570 IP 192.168.10.1.16384 > omega.16384: NetTLP: MWr, len 2, requester 00:00, tag 0x00, last 0xf, first 0xf, Addr 0x80000028
19:07:59.484581 IP 192.168.10.1.16384 > omega.16384: NetTLP: MWr, len 2, requester 00:00, tag 0x00, last 0xf, first 0xf, Addr 0x80000020
19:07:59.484583 IP 192.168.10.1.16384 > omega.16384: NetTLP: MWr, len 2, requester 00:00, tag 0x00, last 0xf, first 0xf, Addr 0x80000028
19:07:59.484584 IP 192.168.10.1.16384 > omega.16384: NetTLP: MWr, len 2, requester 00:00, tag 0x00, last 0xf, first 0xf, Addr 0x80000020
19:07:59.484585 IP 192.168.10.1.16384 > omega.16384: NetTLP: MWr, len 2, requester 00:00, tag 0x00, last 0xf, first 0xf, Addr 0x80000028
19:07:59.484586 IP omega.12288 > 192.168.10.1.12288: NetTLP: MWr, len 1, requester 01:00, tag 0x00, last 0x0, first 0xf, Addr 0xfee01004
19:07:59.484586 IP 192.168.10.1.16384 > omega.16384: NetTLP: MWr, len 2, requester 00:00, tag 0x00, last 0xf, first 0xf, Addr 0x80000020
19:07:59.484588 IP 192.168.10.1.16384 > omega.16384: NetTLP: MWr, len 2, requester 00:00, tag 0x00, last 0xf, first 0xf, Addr 0x80000028
19:07:59.484588 IP omega.12288 > 192.168.10.1.12288: NetTLP: MRd, len 16, requester 01:00, tag 0x00, last 0xf, first 0xf, Addr 0x53aaf800
19:07:59.484606 IP 192.168.10.1.16384 > omega.16384: NetTLP: MWr, len 2, requester 00:00, tag 0x00, last 0xf, first 0xf, Addr 0x80000020
19:07:59.484608 IP 192.168.10.1.16384 > omega.16384: NetTLP: MWr, len 2, requester 00:00, tag 0x00, last 0xf, first 0xf, Addr 0x80000028
19:07:59.484609 IP 192.168.10.1.12288 > omega.12288: NetTLP: CplD, len 16, completer 00:00, success, bc 64, requester 01:00, tag 0x00, lowaddr 0x00
19:07:59.484611 IP 192.168.10.1.16384 > omega.16384: NetTLP: MWr, len 2, requester 00:00, tag 0x00, last 0xf, first 0xf, Addr 0x80000020
19:07:59.484612 IP 192.168.10.1.16384 > omega.16384: NetTLP: MWr, len 2, requester 00:00, tag 0x00, last 0xf, first 0xf, Addr 0x80000028
19:07:59.484613 IP 192.168.10.1.16384 > omega.16384: NetTLP: MWr, len 2, requester 00:00, tag 0x00, last 0xf, first 0xf, Addr 0x80000020
19:07:59.484614 IP 192.168.10.1.16384 > omega.16384: NetTLP: MWr, len 2, requester 00:00, tag 0x00, last 0xf, first 0xf, Addr 0x80000028
19:07:59.484615 IP 192.168.10.1.16384 > omega.16384: NetTLP: MWr, len 2, requester 00:00, tag 0x00, last 0xf, first 0xf, Addr 0x80000020
19:07:59.484616 IP 192.168.10.1.16384 > omega.16384: NetTLP: MWr, len 2, requester 00:00, tag 0x00, last 0xf, first 0xf, Addr 0x80000028
19:07:59.484617 IP 192.168.10.1.16384 > omega.16384: NetTLP: MWr, len 2, requester 00:00, tag 0x00, last 0xf, first 0xf, Addr 0x80000020
19:07:59.484618 IP 192.168.10.1.16384 > omega.16384: NetTLP: MWr, len 2, requester 00:00, tag 0x00, last 0xf, first 0xf, Addr 0x80000028
19:07:59.484629 IP omega.12288 > 192.168.10.1.12288: NetTLP: MWr, len 1, requester 01:00, tag 0x00, last 0x0, first 0xf, Addr 0xfee01004
19:07:59.484631 IP omega.12288 > 192.168.10.1.12288: NetTLP: MRd, len 16, requester 01:00, tag 0x00, last 0xf, first 0xf, Addr 0x53ab0000
19:07:59.484632 IP 192.168.10.1.16384 > omega.16384: NetTLP: MWr, len 2, requester 00:00, tag 0x00, last 0xf, first 0xf, Addr 0x80000020
19:07:59.484634 IP 192.168.10.1.16384 > omega.16384: NetTLP: MWr, len 2, requester 00:00, tag 0x00, last 0xf, first 0xf, Addr 0x80000028
19:07:59.484664 IP 192.168.10.1.12288 > omega.12288: NetTLP: CplD, len 16, completer 00:00, success, bc 64, requester 01:00, tag 0x00, lowaddr 0x00
19:07:59.484666 IP 192.168.10.1.16384 > omega.16384: NetTLP: MWr, len 2, requester 00:00, tag 0x00, last 0xf, first 0xf, Addr 0x80000020
19:07:59.484668 IP 192.168.10.1.16384 > omega.16384: NetTLP: MWr, len 2, requester 00:00, tag 0x00, last 0xf, first 0xf, Addr 0x80000028
19:07:59.484669 IP 192.168.10.1.16384 > omega.16384: NetTLP: MWr, len 2, requester 00:00, tag 0x00, last 0xf, first 0xf, Addr 0x80000020
19:07:59.484669 IP omega.12288 > 192.168.10.1.12288: NetTLP: MWr, len 1, requester 01:00, tag 0x00, last 0x0, first 0xf, Addr 0xfee01004
19:07:59.484670 IP 192.168.10.1.16384 > omega.16384: NetTLP: MWr, len 2, requester 00:00, tag 0x00, last 0xf, first 0xf, Addr 0x80000028
19:07:59.484671 IP omega.12288 > 192.168.10.1.12288: NetTLP: MRd, len 16, requester 01:00, tag 0x00, last 0xf, first 0xf, Addr 0x53ab0800
19:07:59.484676 IP 192.168.10.1.16384 > omega.16384: NetTLP: MWr, len 2, requester 00:00, tag 0x00, last 0xf, first 0xf, Addr 0x80000020
19:07:59.484678 IP 192.168.10.1.16384 > omega.16384: NetTLP: MWr, len 2, requester 00:00, tag 0x00, last 0xf, first 0xf, Addr 0x80000028
19:07:59.484679 IP 192.168.10.1.12288 > omega.12288: NetTLP: CplD, len 16, completer 00:00, success, bc 64, requester 01:00, tag 0x00, lowaddr 0x00
19:07:59.484680 IP 192.168.10.1.16384 > omega.16384: NetTLP: MWr, len 2, requester 00:00, tag 0x00, last 0xf, first 0xf, Addr 0x80000020
19:07:59.484681 IP 192.168.10.1.16384 > omega.16384: NetTLP: MWr, len 2, requester 00:00, tag 0x00, last 0xf, first 0xf, Addr 0x80000028
19:07:59.484684 IP omega.12288 > 192.168.10.1.12288: NetTLP: MWr, len 1, requester 01:00, tag 0x00, last 0x0, first 0xf, Addr 0xfee01004
19:07:59.484686 IP omega.12288 > 192.168.10.1.12288: NetTLP: MRd, len 16, requester 01:00, tag 0x00, last 0xf, first 0xf, Addr 0x53ab1000
19:07:59.484691 IP 192.168.10.1.16384 > omega.16384: NetTLP: MWr, len 2, requester 00:00, tag 0x00, last 0xf, first 0xf, Addr 0x80000020
19:07:59.484692 IP 192.168.10.1.16384 > omega.16384: NetTLP: MWr, len 2, requester 00:00, tag 0x00, last 0xf, first 0xf, Addr 0x80000028
19:07:59.484707 IP 192.168.10.1.12288 > omega.12288: NetTLP: CplD, len 16, completer 00:00, success, bc 64, requester 01:00, tag 0x00, lowaddr 0x00
19:07:59.484709 IP 192.168.10.1.16384 > omega.16384: NetTLP: MWr, len 2, requester 00:00, tag 0x00, last 0xf, first 0xf, Addr 0x80000020
19:07:59.484710 IP 192.168.10.1.16384 > omega.16384: NetTLP: MWr, len 2, requester 00:00, tag 0x00, last 0xf, first 0xf, Addr 0x80000028
19:07:59.484711 IP 192.168.10.1.16384 > omega.16384: NetTLP: MWr, len 2, requester 00:00, tag 0x00, last 0xf, first 0xf, Addr 0x80000020
19:07:59.484712 IP omega.12288 > 192.168.10.1.12288: NetTLP: MWr, len 1, requester 01:00, tag 0x00, last 0x0, first 0xf, Addr 0xfee01004
19:07:59.484712 IP 192.168.10.1.16384 > omega.16384: NetTLP: MWr, len 2, requester 00:00, tag 0x00, last 0xf, first 0xf, Addr 0x80000028
19:07:59.484714 IP 192.168.10.1.16384 > omega.16384: NetTLP: MWr, len 2, requester 00:00, tag 0x00, last 0xf, first 0xf, Addr 0x80000020
19:07:59.484714 IP omega.12288 > 192.168.10.1.12288: NetTLP: MRd, len 16, requester 01:00, tag 0x00, last 0xf, first 0xf, Addr 0x53ab1800
19:07:59.484715 IP 192.168.10.1.16384 > omega.16384: NetTLP: MWr, len 2, requester 00:00, tag 0x00, last 0xf, first 0xf, Addr 0x80000028
19:07:59.484716 IP 192.168.10.1.16384 > omega.16384: NetTLP: MWr, len 2, requester 00:00, tag 0x00, last 0xf, first 0xf, Addr 0x80000020
19:07:59.484717 IP 192.168.10.1.16384 > omega.16384: NetTLP: MWr, len 2, requester 00:00, tag 0x00, last 0xf, first 0xf, Addr 0x80000028
19:07:59.484723 IP 192.168.10.1.16384 > omega.16384: NetTLP: MWr, len 2, requester 00:00, tag 0x00, last 0xf, first 0xf, Addr 0x80000020
19:07:59.484725 IP 192.168.10.1.16384 > omega.16384: NetTLP: MWr, len 2, requester 00:00, tag 0x00, last 0xf, first 0xf, Addr 0x80000028
19:07:59.484726 IP 192.168.10.1.12288 > omega.12288: NetTLP: CplD, len 16, completer 00:00, success, bc 64, requester 01:00, tag 0x00, lowaddr 0x00
19:07:59.484728 IP 192.168.10.1.16384 > omega.16384: NetTLP: MWr, len 2, requester 00:00, tag 0x00, last 0xf, first 0xf, Addr 0x80000020
19:07:59.484729 IP 192.168.10.1.16384 > omega.16384: NetTLP: MWr, len 2, requester 00:00, tag 0x00, last 0xf, first 0xf, Addr 0x80000028
19:07:59.484731 IP omega.12288 > 192.168.10.1.12288: NetTLP: MWr, len 1, requester 01:00, tag 0x00, last 0x0, first 0xf, Addr 0xfee01004
19:07:59.484733 IP omega.12288 > 192.168.10.1.12288: NetTLP: MRd, len 16, requester 01:00, tag 0x00, last 0xf, first 0xf, Addr 0x53ab2000
19:07:59.484738 IP 192.168.10.1.16384 > omega.16384: NetTLP: MWr, len 2, requester 00:00, tag 0x00, last 0xf, first 0xf, Addr 0x80000020
19:07:59.484739 IP 192.168.10.1.16384 > omega.16384: NetTLP: MWr, len 2, requester 00:00, tag 0x00, last 0xf, first 0xf, Addr 0x80000028
19:07:59.484740 IP 192.168.10.1.16384 > omega.16384: NetTLP: MWr, len 2, requester 00:00, tag 0x00, last 0xf, first 0xf, Addr 0x80000020
19:07:59.484741 IP 192.168.10.1.16384 > omega.16384: NetTLP: MWr, len 2, requester 00:00, tag 0x00, last 0xf, first 0xf, Addr 0x80000028
19:07:59.484742 IP 192.168.10.1.12288 > omega.12288: NetTLP: CplD, len 16, completer 00:00, success, bc 64, requester 01:00, tag 0x00, lowaddr 0x00
19:07:59.484747 IP omega.12288 > 192.168.10.1.12288: NetTLP: MWr, len 1, requester 01:00, tag 0x00, last 0x0, first 0xf, Addr 0xfee01004
19:07:59.484749 IP omega.12288 > 192.168.10.1.12288: NetTLP: MRd, len 16, requester 01:00, tag 0x00, last 0xf, first 0xf, Addr 0x53ab2800
19:07:59.484754 IP 192.168.10.1.16384 > omega.16384: NetTLP: MWr, len 2, requester 00:00, tag 0x00, last 0xf, first 0xf, Addr 0x80000020
19:07:59.484755 IP 192.168.10.1.16384 > omega.16384: NetTLP: MWr, len 2, requester 00:00, tag 0x00, last 0xf, first 0xf, Addr 0x80000028
19:07:59.484756 IP 192.168.10.1.16384 > omega.16384: NetTLP: MWr, len 2, requester 00:00, tag 0x00, last 0xf, first 0xf, Addr 0x80000020
19:07:59.484757 IP 192.168.10.1.16384 > omega.16384: NetTLP: MWr, len 2, requester 00:00, tag 0x00, last 0xf, first 0xf, Addr 0x80000028
19:07:59.484758 IP 192.168.10.1.12288 > omega.12288: NetTLP: CplD, len 16, completer 00:00, success, bc 64, requester 01:00, tag 0x00, lowaddr 0x00
19:07:59.484760 IP 192.168.10.1.16384 > omega.16384: NetTLP: MWr, len 2, requester 00:00, tag 0x00, last 0xf, first 0xf, Addr 0x80000020
19:07:59.484761 IP 192.168.10.1.16384 > omega.16384: NetTLP: MWr, len 2, requester 00:00, tag 0x00, last 0xf, first 0xf, Addr 0x80000028
19:07:59.484763 IP omega.12288 > 192.168.10.1.12288: NetTLP: MWr, len 1, requester 01:00, tag 0x00, last 0x0, first 0xf, Addr 0xfee01004
19:07:59.484765 IP omega.12288 > 192.168.10.1.12288: NetTLP: MRd, len 16, requester 01:00, tag 0x00, last 0xf, first 0xf, Addr 0x53ab3000
19:07:59.484773 IP 192.168.10.1.16384 > omega.16384: NetTLP: MWr, len 2, requester 00:00, tag 0x00, last 0xf, first 0xf, Addr 0x80000020
19:07:59.484775 IP 192.168.10.1.16384 > omega.16384: NetTLP: MWr, len 2, requester 00:00, tag 0x00, last 0xf, first 0xf, Addr 0x80000028
19:07:59.484776 IP 192.168.10.1.16384 > omega.16384: NetTLP: MWr, len 2, requester 00:00, tag 0x00, last 0xf, first 0xf, Addr 0x80000020
19:07:59.484777 IP 192.168.10.1.16384 > omega.16384: NetTLP: MWr, len 2, requester 00:00, tag 0x00, last 0xf, first 0xf, Addr 0x80000028
19:07:59.484778 IP 192.168.10.1.12288 > omega.12288: NetTLP: CplD, len 16, completer 00:00, success, bc 64, requester 01:00, tag 0x00, lowaddr 0x00
19:07:59.484780 IP 192.168.10.1.16384 > omega.16384: NetTLP: MWr, len 2, requester 00:00, tag 0x00, last 0xf, first 0xf, Addr 0x80000020
19:07:59.484781 IP 192.168.10.1.16384 > omega.16384: NetTLP: MWr, len 2, requester 00:00, tag 0x00, last 0xf, first 0xf, Addr 0x80000028
19:07:59.484790 IP omega.12288 > 192.168.10.1.12288: NetTLP: MWr, len 1, requester 01:00, tag 0x00, last 0x0, first 0xf, Addr 0xfee01004
19:07:59.484792 IP omega.12288 > 192.168.10.1.12288: NetTLP: MRd, len 16, requester 01:00, tag 0x00, last 0xf, first 0xf, Addr 0x53ab3800
19:07:59.484793 IP 192.168.10.1.16384 > omega.16384: NetTLP: MWr, len 2, requester 00:00, tag 0x00, last 0xf, first 0xf, Addr 0x80000020
19:07:59.484795 IP 192.168.10.1.16384 > omega.16384: NetTLP: MWr, len 2, requester 00:00, tag 0x00, last 0xf, first 0xf, Addr 0x80000028
19:07:59.484796 IP 192.168.10.1.16384 > omega.16384: NetTLP: MWr, len 2, requester 00:00, tag 0x00, last 0xf, first 0xf, Addr 0x80000020
19:07:59.484797 IP 192.168.10.1.16384 > omega.16384: NetTLP: MWr, len 2, requester 00:00, tag 0x00, last 0xf, first 0xf, Addr 0x80000028
19:07:59.484798 IP 192.168.10.1.16384 > omega.16384: NetTLP: MWr, len 2, requester 00:00, tag 0x00, last 0xf, first 0xf, Addr 0x80000020
19:07:59.484799 IP 192.168.10.1.16384 > omega.16384: NetTLP: MWr, len 2, requester 00:00, tag 0x00, last 0xf, first 0xf, Addr 0x80000028
19:07:59.484800 IP 192.168.10.1.12288 > omega.12288: NetTLP: CplD, len 16, completer 00:00, success, bc 64, requester 01:00, tag 0x00, lowaddr 0x00
19:07:59.484802 IP 192.168.10.1.16384 > omega.16384: NetTLP: MWr, len 2, requester 00:00, tag 0x00, last 0xf, first 0xf, Addr 0x80000020
19:07:59.484803 IP 192.168.10.1.16384 > omega.16384: NetTLP: MWr, len 2, requester 00:00, tag 0x00, last 0xf, first 0xf, Addr 0x80000028
19:07:59.484812 IP omega.12288 > 192.168.10.1.12288: NetTLP: MWr, len 1, requester 01:00, tag 0x00, last 0x0, first 0xf, Addr 0xfee01004
19:07:59.484814 IP omega.12288 > 192.168.10.1.12288: NetTLP: MRd, len 16, requester 01:00, tag 0x00, last 0xf, first 0xf, Addr 0x53ab4000
19:07:59.484816 IP 192.168.10.1.16384 > omega.16384: NetTLP: MWr, len 2, requester 00:00, tag 0x00, last 0xf, first 0xf, Addr 0x80000020
19:07:59.484817 IP 192.168.10.1.16384 > omega.16384: NetTLP: MWr, len 2, requester 00:00, tag 0x00, last 0xf, first 0xf, Addr 0x80000028
19:07:59.484818 IP 192.168.10.1.16384 > omega.16384: NetTLP: MWr, len 2, requester 00:00, tag 0x00, last 0xf, first 0xf, Addr 0x80000020
19:07:59.484819 IP 192.168.10.1.16384 > omega.16384: NetTLP: MWr, len 2, requester 00:00, tag 0x00, last 0xf, first 0xf, Addr 0x80000028
19:07:59.484820 IP 192.168.10.1.16384 > omega.16384: NetTLP: MWr, len 2, requester 00:00, tag 0x00, last 0xf, first 0xf, Addr 0x80000020
19:07:59.484822 IP 192.168.10.1.12288 > omega.12288: NetTLP: CplD, len 16, completer 00:00, success, bc 64, requester 01:00, tag 0x00, lowaddr 0x00
19:07:59.484823 IP 192.168.10.1.16384 > omega.16384: NetTLP: MWr, len 2, requester 00:00, tag 0x00, last 0xf, first 0xf, Addr 0x80000028
19:07:59.484831 IP omega.12288 > 192.168.10.1.12288: NetTLP: MWr, len 1, requester 01:00, tag 0x00, last 0x0, first 0xf, Addr 0xfee01004
19:07:59.484833 IP omega.12288 > 192.168.10.1.12288: NetTLP: MRd, len 16, requester 01:00, tag 0x00, last 0xf, first 0xf, Addr 0x53ab4800
19:07:59.484840 IP 192.168.10.1.16384 > omega.16384: NetTLP: MWr, len 2, requester 00:00, tag 0x00, last 0xf, first 0xf, Addr 0x80000020
19:07:59.484842 IP 192.168.10.1.16384 > omega.16384: NetTLP: MWr, len 2, requester 00:00, tag 0x00, last 0xf, first 0xf, Addr 0x80000028
19:07:59.484843 IP 192.168.10.1.16384 > omega.16384: NetTLP: MWr, len 2, requester 00:00, tag 0x00, last 0xf, first 0xf, Addr 0x80000020
19:07:59.484844 IP 192.168.10.1.16384 > omega.16384: NetTLP: MWr, len 2, requester 00:00, tag 0x00, last 0xf, first 0xf, Addr 0x80000028
19:07:59.484845 IP 192.168.10.1.16384 > omega.16384: NetTLP: MWr, len 2, requester 00:00, tag 0x00, last 0xf, first 0xf, Addr 0x80000020
19:07:59.484846 IP 192.168.10.1.16384 > omega.16384: NetTLP: MWr, len 2, requester 00:00, tag 0x00, last 0xf, first 0xf, Addr 0x80000028
19:07:59.484847 IP 192.168.10.1.12288 > omega.12288: NetTLP: CplD, len 16, completer 00:00, success, bc 64, requester 01:00, tag 0x00, lowaddr 0x00
19:07:59.484849 IP 192.168.10.1.16384 > omega.16384: NetTLP: MWr, len 2, requester 00:00, tag 0x00, last 0xf, first 0xf, Addr 0x80000020
19:07:59.484850 IP 192.168.10.1.16384 > omega.16384: NetTLP: MWr, len 2, requester 00:00, tag 0x00, last 0xf, first 0xf, Addr 0x80000028
19:07:59.484858 IP omega.12288 > 192.168.10.1.12288: NetTLP: MWr, len 1, requester 01:00, tag 0x00, last 0x0, first 0xf, Addr 0xfee01004
19:07:59.484860 IP omega.12288 > 192.168.10.1.12288: NetTLP: MRd, len 16, requester 01:00, tag 0x00, last 0xf, first 0xf, Addr 0x53ab5000
19:07:59.484867 IP 192.168.10.1.16384 > omega.16384: NetTLP: MWr, len 2, requester 00:00, tag 0x00, last 0xf, first 0xf, Addr 0x80000020
19:07:59.484868 IP 192.168.10.1.16384 > omega.16384: NetTLP: MWr, len 2, requester 00:00, tag 0x00, last 0xf, first 0xf, Addr 0x80000028
19:07:59.484869 IP 192.168.10.1.16384 > omega.16384: NetTLP: MWr, len 2, requester 00:00, tag 0x00, last 0xf, first 0xf, Addr 0x80000020
19:07:59.484870 IP 192.168.10.1.16384 > omega.16384: NetTLP: MWr, len 2, requester 00:00, tag 0x00, last 0xf, first 0xf, Addr 0x80000028
19:07:59.484871 IP 192.168.10.1.16384 > omega.16384: NetTLP: MWr, len 2, requester 00:00, tag 0x00, last 0xf, first 0xf, Addr 0x80000020
19:07:59.484873 IP 192.168.10.1.16384 > omega.16384: NetTLP: MWr, len 2, requester 00:00, tag 0x00, last 0xf, first 0xf, Addr 0x80000028
19:07:59.484874 IP 192.168.10.1.12288 > omega.12288: NetTLP: CplD, len 16, completer 00:00, success, bc 64, requester 01:00, tag 0x00, lowaddr 0x00
19:07:59.484875 IP 192.168.10.1.16384 > omega.16384: NetTLP: MWr, len 2, requester 00:00, tag 0x00, last 0xf, first 0xf, Addr 0x80000020
19:07:59.484876 IP 192.168.10.1.16384 > omega.16384: NetTLP: MWr, len 2, requester 00:00, tag 0x00, last 0xf, first 0xf, Addr 0x80000028
19:07:59.484877 IP 192.168.10.1.16384 > omega.16384: NetTLP: MWr, len 2, requester 00:00, tag 0x00, last 0xf, first 0xf, Addr 0x80000020
19:07:59.484879 IP 192.168.10.1.16384 > omega.16384: NetTLP: MWr, len 2, requester 00:00, tag 0x00, last 0xf, first 0xf, Addr 0x80000028
19:07:59.484888 IP omega.12288 > 192.168.10.1.12288: NetTLP: MWr, len 1, requester 01:00, tag 0x00, last 0x0, first 0xf, Addr 0xfee01004
19:07:59.484891 IP omega.12288 > 192.168.10.1.12288: NetTLP: MRd, len 16, requester 01:00, tag 0x00, last 0xf, first 0xf, Addr 0x53ab5800
19:07:59.484895 IP 192.168.10.1.16384 > omega.16384: NetTLP: MWr, len 2, requester 00:00, tag 0x00, last 0xf, first 0xf, Addr 0x80000020
19:07:59.484897 IP 192.168.10.1.16384 > omega.16384: NetTLP: MWr, len 2, requester 00:00, tag 0x00, last 0xf, first 0xf, Addr 0x80000028
19:07:59.484898 IP 192.168.10.1.16384 > omega.16384: NetTLP: MWr, len 2, requester 00:00, tag 0x00, last 0xf, first 0xf, Addr 0x80000020
19:07:59.484899 IP 192.168.10.1.16384 > omega.16384: NetTLP: MWr, len 2, requester 00:00, tag 0x00, last 0xf, first 0xf, Addr 0x80000028
19:07:59.484900 IP 192.168.10.1.16384 > omega.16384: NetTLP: MWr, len 2, requester 00:00, tag 0x00, last 0xf, first 0xf, Addr 0x80000020
19:07:59.484902 IP 192.168.10.1.16384 > omega.16384: NetTLP: MWr, len 2, requester 00:00, tag 0x00, last 0xf, first 0xf, Addr 0x80000028
19:07:59.484903 IP 192.168.10.1.12288 > omega.12288: NetTLP: CplD, len 16, completer 00:00, success, bc 64, requester 01:00, tag 0x00, lowaddr 0x00
19:07:59.484904 IP 192.168.10.1.16384 > omega.16384: NetTLP: MWr, len 2, requester 00:00, tag 0x00, last 0xf, first 0xf, Addr 0x80000020
19:07:59.484905 IP 192.168.10.1.16384 > omega.16384: NetTLP: MWr, len 2, requester 00:00, tag 0x00, last 0xf, first 0xf, Addr 0x80000028
19:07:59.484906 IP 192.168.10.1.16384 > omega.16384: NetTLP: MWr, len 2, requester 00:00, tag 0x00, last 0xf, first 0xf, Addr 0x80000020
19:07:59.484908 IP 192.168.10.1.16384 > omega.16384: NetTLP: MWr, len 2, requester 00:00, tag 0x00, last 0xf, first 0xf, Addr 0x80000028
19:07:59.484917 IP omega.12288 > 192.168.10.1.12288: NetTLP: MWr, len 1, requester 01:00, tag 0x00, last 0x0, first 0xf, Addr 0xfee01004
19:07:59.484919 IP omega.12288 > 192.168.10.1.12288: NetTLP: MRd, len 16, requester 01:00, tag 0x00, last 0xf, first 0xf, Addr 0x53ab6000
19:07:59.484926 IP 192.168.10.1.16384 > omega.16384: NetTLP: MWr, len 2, requester 00:00, tag 0x00, last 0xf, first 0xf, Addr 0x80000020
19:07:59.484928 IP 192.168.10.1.16384 > omega.16384: NetTLP: MWr, len 2, requester 00:00, tag 0x00, last 0xf, first 0xf, Addr 0x80000028
19:07:59.484929 IP 192.168.10.1.16384 > omega.16384: NetTLP: MWr, len 2, requester 00:00, tag 0x00, last 0xf, first 0xf, Addr 0x80000020
19:07:59.484930 IP 192.168.10.1.16384 > omega.16384: NetTLP: MWr, len 2, requester 00:00, tag 0x00, last 0xf, first 0xf, Addr 0x80000028
19:07:59.484931 IP 192.168.10.1.16384 > omega.16384: NetTLP: MWr, len 2, requester 00:00, tag 0x00, last 0xf, first 0xf, Addr 0x80000020
19:07:59.484932 IP 192.168.10.1.16384 > omega.16384: NetTLP: MWr, len 2, requester 00:00, tag 0x00, last 0xf, first 0xf, Addr 0x80000028
19:07:59.484933 IP 192.168.10.1.12288 > omega.12288: NetTLP: CplD, len 16, completer 00:00, success, bc 64, requester 01:00, tag 0x00, lowaddr 0x00
19:07:59.484935 IP 192.168.10.1.16384 > omega.16384: NetTLP: MWr, len 2, requester 00:00, tag 0x00, last 0xf, first 0xf, Addr 0x80000020
19:07:59.484936 IP 192.168.10.1.16384 > omega.16384: NetTLP: MWr, len 2, requester 00:00, tag 0x00, last 0xf, first 0xf, Addr 0x80000028
19:07:59.484937 IP 192.168.10.1.16384 > omega.16384: NetTLP: MWr, len 2, requester 00:00, tag 0x00, last 0xf, first 0xf, Addr 0x80000020
19:07:59.484939 IP 192.168.10.1.16384 > omega.16384: NetTLP: MWr, len 2, requester 00:00, tag 0x00, last 0xf, first 0xf, Addr 0x80000028
19:07:59.484947 IP omega.12288 > 192.168.10.1.12288: NetTLP: MWr, len 1, requester 01:00, tag 0x00, last 0x0, first 0xf, Addr 0xfee01004
19:07:59.484949 IP omega.12288 > 192.168.10.1.12288: NetTLP: MRd, len 16, requester 01:00, tag 0x00, last 0xf, first 0xf, Addr 0x53ab6800
19:07:59.484959 IP 192.168.10.1.16384 > omega.16384: NetTLP: MWr, len 2, requester 00:00, tag 0x00, last 0xf, first 0xf, Addr 0x80000020
19:07:59.484960 IP 192.168.10.1.16384 > omega.16384: NetTLP: MWr, len 2, requester 00:00, tag 0x00, last 0xf, first 0xf, Addr 0x80000028
19:07:59.484961 IP 192.168.10.1.16384 > omega.16384: NetTLP: MWr, len 2, requester 00:00, tag 0x00, last 0xf, first 0xf, Addr 0x80000020
19:07:59.484963 IP 192.168.10.1.16384 > omega.16384: NetTLP: MWr, len 2, requester 00:00, tag 0x00, last 0xf, first 0xf, Addr 0x80000028
19:07:59.484964 IP 192.168.10.1.16384 > omega.16384: NetTLP: MWr, len 2, requester 00:00, tag 0x00, last 0xf, first 0xf, Addr 0x80000020
19:07:59.484965 IP 192.168.10.1.16384 > omega.16384: NetTLP: MWr, len 2, requester 00:00, tag 0x00, last 0xf, first 0xf, Addr 0x80000028
19:07:59.484966 IP 192.168.10.1.12288 > omega.12288: NetTLP: CplD, len 16, completer 00:00, success, bc 64, requester 01:00, tag 0x00, lowaddr 0x00
19:07:59.484967 IP 192.168.10.1.16384 > omega.16384: NetTLP: MWr, len 2, requester 00:00, tag 0x00, last 0xf, first 0xf, Addr 0x80000020
19:07:59.484968 IP 192.168.10.1.16384 > omega.16384: NetTLP: MWr, len 2, requester 00:00, tag 0x00, last 0xf, first 0xf, Addr 0x80000028
19:07:59.484970 IP 192.168.10.1.16384 > omega.16384: NetTLP: MWr, len 2, requester 00:00, tag 0x00, last 0xf, first 0xf, Addr 0x80000020
19:07:59.484971 IP 192.168.10.1.16384 > omega.16384: NetTLP: MWr, len 2, requester 00:00, tag 0x00, last 0xf, first 0xf, Addr 0x80000028
19:07:59.484980 IP omega.12288 > 192.168.10.1.12288: NetTLP: MWr, len 1, requester 01:00, tag 0x00, last 0x0, first 0xf, Addr 0xfee01004
19:07:59.484982 IP omega.12288 > 192.168.10.1.12288: NetTLP: MRd, len 16, requester 01:00, tag 0x00, last 0xf, first 0xf, Addr 0x53ab7000
19:07:59.484994 IP 192.168.10.1.16384 > omega.16384: NetTLP: MWr, len 2, requester 00:00, tag 0x00, last 0xf, first 0xf, Addr 0x80000020
19:07:59.484996 IP 192.168.10.1.16384 > omega.16384: NetTLP: MWr, len 2, requester 00:00, tag 0x00, last 0xf, first 0xf, Addr 0x80000028
19:07:59.484997 IP 192.168.10.1.16384 > omega.16384: NetTLP: MWr, len 2, requester 00:00, tag 0x00, last 0xf, first 0xf, Addr 0x80000020
19:07:59.484998 IP 192.168.10.1.16384 > omega.16384: NetTLP: MWr, len 2, requester 00:00, tag 0x00, last 0xf, first 0xf, Addr 0x80000028
19:07:59.484999 IP 192.168.10.1.16384 > omega.16384: NetTLP: MWr, len 2, requester 00:00, tag 0x00, last 0xf, first 0xf, Addr 0x80000020
19:07:59.485000 IP 192.168.10.1.16384 > omega.16384: NetTLP: MWr, len 2, requester 00:00, tag 0x00, last 0xf, first 0xf, Addr 0x80000028
19:07:59.485001 IP 192.168.10.1.12288 > omega.12288: NetTLP: CplD, len 16, completer 00:00, success, bc 64, requester 01:00, tag 0x00, lowaddr 0x00
19:07:59.485003 IP 192.168.10.1.16384 > omega.16384: NetTLP: MWr, len 2, requester 00:00, tag 0x00, last 0xf, first 0xf, Addr 0x80000020
19:07:59.485004 IP 192.168.10.1.16384 > omega.16384: NetTLP: MWr, len 2, requester 00:00, tag 0x00, last 0xf, first 0xf, Addr 0x80000028
19:07:59.485005 IP 192.168.10.1.16384 > omega.16384: NetTLP: MWr, len 2, requester 00:00, tag 0x00, last 0xf, first 0xf, Addr 0x80000020
19:07:59.485006 IP 192.168.10.1.16384 > omega.16384: NetTLP: MWr, len 2, requester 00:00, tag 0x00, last 0xf, first 0xf, Addr 0x80000028
19:07:59.485007 IP 192.168.10.1.16384 > omega.16384: NetTLP: MWr, len 2, requester 00:00, tag 0x00, last 0xf, first 0xf, Addr 0x80000020
19:07:59.485008 IP 192.168.10.1.16384 > omega.16384: NetTLP: MWr, len 2, requester 00:00, tag 0x00, last 0xf, first 0xf, Addr 0x80000028
19:07:59.485018 IP omega.12288 > 192.168.10.1.12288: NetTLP: MWr, len 1, requester 01:00, tag 0x00, last 0x0, first 0xf, Addr 0xfee01004
19:07:59.485019 IP omega.12288 > 192.168.10.1.12288: NetTLP: MRd, len 16, requester 01:00, tag 0x00, last 0xf, first 0xf, Addr 0x53ab7800
19:07:59.485030 IP 192.168.10.1.16384 > omega.16384: NetTLP: MWr, len 2, requester 00:00, tag 0x00, last 0xf, first 0xf, Addr 0x80000020
19:07:59.485032 IP 192.168.10.1.16384 > omega.16384: NetTLP: MWr, len 2, requester 00:00, tag 0x00, last 0xf, first 0xf, Addr 0x80000028
19:07:59.485033 IP 192.168.10.1.16384 > omega.16384: NetTLP: MWr, len 2, requester 00:00, tag 0x00, last 0xf, first 0xf, Addr 0x80000020
19:07:59.485035 IP 192.168.10.1.16384 > omega.16384: NetTLP: MWr, len 2, requester 00:00, tag 0x00, last 0xf, first 0xf, Addr 0x80000028
19:07:59.485036 IP 192.168.10.1.16384 > omega.16384: NetTLP: MWr, len 2, requester 00:00, tag 0x00, last 0xf, first 0xf, Addr 0x80000020
19:07:59.485037 IP 192.168.10.1.16384 > omega.16384: NetTLP: MWr, len 2, requester 00:00, tag 0x00, last 0xf, first 0xf, Addr 0x80000028
19:07:59.485038 IP 192.168.10.1.12288 > omega.12288: NetTLP: CplD, len 16, completer 00:00, success, bc 64, requester 01:00, tag 0x00, lowaddr 0x00
19:07:59.485040 IP 192.168.10.1.16384 > omega.16384: NetTLP: MWr, len 2, requester 00:00, tag 0x00, last 0xf, first 0xf, Addr 0x80000020
19:07:59.485041 IP 192.168.10.1.16384 > omega.16384: NetTLP: MWr, len 2, requester 00:00, tag 0x00, last 0xf, first 0xf, Addr 0x80000028
19:07:59.485042 IP 192.168.10.1.16384 > omega.16384: NetTLP: MWr, len 2, requester 00:00, tag 0x00, last 0xf, first 0xf, Addr 0x80000020
19:07:59.485043 IP 192.168.10.1.16384 > omega.16384: NetTLP: MWr, len 2, requester 00:00, tag 0x00, last 0xf, first 0xf, Addr 0x80000028
19:07:59.485044 IP 192.168.10.1.16384 > omega.16384: NetTLP: MWr, len 2, requester 00:00, tag 0x00, last 0xf, first 0xf, Addr 0x80000020
19:07:59.485046 IP 192.168.10.1.16384 > omega.16384: NetTLP: MWr, len 2, requester 00:00, tag 0x00, last 0xf, first 0xf, Addr 0x80000028
19:07:59.485055 IP omega.12288 > 192.168.10.1.12288: NetTLP: MWr, len 1, requester 01:00, tag 0x00, last 0x0, first 0xf, Addr 0xfee01004
19:07:59.485057 IP omega.12288 > 192.168.10.1.12288: NetTLP: MRd, len 16, requester 01:00, tag 0x00, last 0xf, first 0xf, Addr 0x53ab8000
19:07:59.485069 IP 192.168.10.1.16384 > omega.16384: NetTLP: MWr, len 2, requester 00:00, tag 0x00, last 0xf, first 0xf, Addr 0x80000020
19:07:59.485071 IP 192.168.10.1.16384 > omega.16384: NetTLP: MWr, len 2, requester 00:00, tag 0x00, last 0xf, first 0xf, Addr 0x80000028
19:07:59.485072 IP 192.168.10.1.16384 > omega.16384: NetTLP: MWr, len 2, requester 00:00, tag 0x00, last 0xf, first 0xf, Addr 0x80000020
19:07:59.485074 IP 192.168.10.1.16384 > omega.16384: NetTLP: MWr, len 2, requester 00:00, tag 0x00, last 0xf, first 0xf, Addr 0x80000028
19:07:59.485075 IP 192.168.10.1.16384 > omega.16384: NetTLP: MWr, len 2, requester 00:00, tag 0x00, last 0xf, first 0xf, Addr 0x80000020
19:07:59.485076 IP 192.168.10.1.16384 > omega.16384: NetTLP: MWr, len 2, requester 00:00, tag 0x00, last 0xf, first 0xf, Addr 0x80000028
19:07:59.485077 IP 192.168.10.1.12288 > omega.12288: NetTLP: CplD, len 16, completer 00:00, success, bc 64, requester 01:00, tag 0x00, lowaddr 0x00
19:07:59.485079 IP 192.168.10.1.16384 > omega.16384: NetTLP: MWr, len 2, requester 00:00, tag 0x00, last 0xf, first 0xf, Addr 0x80000020
19:07:59.485080 IP 192.168.10.1.16384 > omega.16384: NetTLP: MWr, len 2, requester 00:00, tag 0x00, last 0xf, first 0xf, Addr 0x80000028
19:07:59.485081 IP 192.168.10.1.16384 > omega.16384: NetTLP: MWr, len 2, requester 00:00, tag 0x00, last 0xf, first 0xf, Addr 0x80000020
19:07:59.485082 IP 192.168.10.1.16384 > omega.16384: NetTLP: MWr, len 2, requester 00:00, tag 0x00, last 0xf, first 0xf, Addr 0x80000028
19:07:59.485083 IP 192.168.10.1.16384 > omega.16384: NetTLP: MWr, len 2, requester 00:00, tag 0x00, last 0xf, first 0xf, Addr 0x80000020
19:07:59.485084 IP 192.168.10.1.16384 > omega.16384: NetTLP: MWr, len 2, requester 00:00, tag 0x00, last 0xf, first 0xf, Addr 0x80000028
19:07:59.485085 IP 192.168.10.1.16384 > omega.16384: NetTLP: MWr, len 2, requester 00:00, tag 0x00, last 0xf, first 0xf, Addr 0x80000020
19:07:59.485086 IP 192.168.10.1.16384 > omega.16384: NetTLP: MWr, len 2, requester 00:00, tag 0x00, last 0xf, first 0xf, Addr 0x80000028
19:07:59.485096 IP omega.12288 > 192.168.10.1.12288: NetTLP: MWr, len 1, requester 01:00, tag 0x00, last 0x0, first 0xf, Addr 0xfee01004
