19:03:10.406514 IP 192.168.10.1.16384 > omega.16384: NetTLP: MWr, len 2, requester 00:00, tag 0x00, last 0xf, first 0xf, Addr 0x80000020
19:03:10.406519 IP 192.168.10.1.16384 > omega.16384: NetTLP: MWr, len 2, requester 00:00, tag 0x00, last 0xf, first 0xf, Addr 0x80000028
19:03:10.406520 IP 192.168.10.1.16384 > omega.16384: NetTLP: MWr, len 2, requester 00:00, tag 0x00, last 0xf, first 0xf, Addr 0x80000020
19:03:10.406521 IP 192.168.10.1.16384 > omega.16384: NetTLP: MWr, len 2, requester 00:00, tag 0x00, last 0xf, first 0xf, Addr 0x80000028
19:03:10.406527 IP 192.168.10.1.16384 > omega.16384: NetTLP: MWr, len 2, requester 00:00, tag 0x00, last 0xf, first 0xf, Addr 0x80000020
19:03:10.406528 IP 192.168.10.1.16384 > omega.16384: NetTLP: MWr, len 2, requester 00:00, tag 0x00, last 0xf, first 0xf, Addr 0x80000028
19:03:10.406537 IP 192.168.10.1.16384 > omega.16384: NetTLP: MWr, len 2, requester 00:00, tag 0x00, last 0xf, first 0xf, Addr 0x80000020
19:03:10.406538 IP omega.12288 > 192.168.10.1.12288: NetTLP: MRd, len 16, requester 01:00, tag 0x00, last 0xf, first 0xf, Addr 0x5364e800
19:03:10.406539 IP 192.168.10.1.16384 > omega.16384: NetTLP: MWr, len 2, requester 00:00, tag 0x00, last 0xf, first 0xf, Addr 0x80000028
19:03:10.406540 IP 192.168.10.1.16384 > omega.16384: NetTLP: MWr, len 2, requester 00:00, tag 0x00, last 0xf, first 0xf, Addr 0x80000020
19:03:10.406541 IP 192.168.10.1.16384 > omega.16384: NetTLP: MWr, len 2, requester 00:00, tag 0x00, last 0xf, first 0xf, Addr 0x80000028
19:03:10.406549 IP 192.168.10.1.16384 > omega.16384: NetTLP: MWr, len 2, requester 00:00, tag 0x00, last 0xf, first 0xf, Addr 0x80000020
19:03:10.406551 IP 192.168.10.1.16384 > omega.16384: NetTLP: MWr, len 2, requester 00:00, tag 0x00, last 0xf, first 0xf, Addr 0x80000028
19:03:10.406552 IP 192.168.10.1.12288 > omega.12288: NetTLP: CplD, len 16, completer 00:00, success, bc 64, requester 01:00, tag 0x00, lowaddr 0x00
19:03:10.406554 IP 192.168.10.1.16384 > omega.16384: NetTLP: MWr, len 2, requester 00:00, tag 0x00, last 0xf, first 0xf, Addr 0x80000020
19:03:10.406555 IP 192.168.10.1.16384 > omega.16384: NetTLP: MWr, len 2, requester 00:00, tag 0x00, last 0xf, first 0xf, Addr 0x80000028
19:03:10.406564 IP 192.168.10.1.16384 > omega.16384: NetTLP: MWr, len 2, requester 00:00, tag 0x00, last 0xf, first 0xf, Addr 0x80000020
19:03:10.406566 IP 192.168.10.1.16384 > omega.16384: NetTLP: MWr, len 2, requester 00:00, tag 0x00, last 0xf, first 0xf, Addr 0x80000028
19:03:10.406567 IP 192.168.10.1.16384 > omega.16384: NetTLP: MWr, len 2, requester 00:00, tag 0x00, last 0xf, first 0xf, Addr 0x80000020
19:03:10.406568 IP 192.168.10.1.16384 > omega.16384: NetTLP: MWr, len 2, requester 00:00, tag 0x00, last 0xf, first 0xf, Addr 0x80000028
19:03:10.406580 IP 192.168.10.1.16384 > omega.16384: NetTLP: MWr, len 2, requester 00:00, tag 0x00, last 0xf, first 0xf, Addr 0x80000020
19:03:10.406582 IP 192.168.10.1.16384 > omega.16384: NetTLP: MWr, len 2, requester 00:00, tag 0x00, last 0xf, first 0xf, Addr 0x80000028
19:03:10.406583 IP 192.168.10.1.16384 > omega.16384: NetTLP: MWr, len 2, requester 00:00, tag 0x00, last 0xf, first 0xf, Addr 0x80000020
19:03:10.406584 IP 192.168.10.1.16384 > omega.16384: NetTLP: MWr, len 2, requester 00:00, tag 0x00, last 0xf, first 0xf, Addr 0x80000028
19:03:10.406585 IP 192.168.10.1.16384 > omega.16384: NetTLP: MWr, len 2, requester 00:00, tag 0x00, last 0xf, first 0xf, Addr 0x80000020
19:03:10.406586 IP 192.168.10.1.16384 > omega.16384: NetTLP: MWr, len 2, requester 00:00, tag 0x00, last 0xf, first 0xf, Addr 0x80000028
19:03:10.406599 IP 192.168.10.1.16384 > omega.16384: NetTLP: MWr, len 2, requester 00:00, tag 0x00, last 0xf, first 0xf, Addr 0x80000020
19:03:10.406601 IP 192.168.10.1.16384 > omega.16384: NetTLP: MWr, len 2, requester 00:00, tag 0x00, last 0xf, first 0xf, Addr 0x80000028
19:03:10.406602 IP 192.168.10.1.16384 > omega.16384: NetTLP: MWr, len 2, requester 00:00, tag 0x00, last 0xf, first 0xf, Addr 0x80000020
19:03:10.406602 IP omega.12288 > 192.168.10.1.12288: NetTLP: MWr, len 1, requester 01:00, tag 0x00, last 0x0, first 0xf, Addr 0xfee01004
19:03:10.406603 IP 192.168.10.1.16384 > omega.16384: NetTLP: MWr, len 2, requester 00:00, tag 0x00, last 0xf, first 0xf, Addr 0x80000028
19:03:10.406604 IP 192.168.10.1.16384 > omega.16384: NetTLP: MWr, len 2, requester 00:00, tag 0x00, last 0xf, first 0xf, Addr 0x80000020
19:03:10.406605 IP 192.168.10.1.16384 > omega.16384: NetTLP: MWr, len 2, requester 00:00, tag 0x00, last 0xf, first 0xf, Addr 0x80000028
19:03:10.406607 IP omega.12288 > 192.168.10.1.12288: NetTLP: MRd, len 16, requester 01:00, tag 0x00, last 0xf, first 0xf, Addr 0x5364f000
19:03:10.406619 IP 192.168.10.1.16384 > omega.16384: NetTLP: MWr, len 2, requester 00:00, tag 0x00, last 0xf, first 0xf, Addr 0x80000020
19:03:10.406621 IP 192.168.10.1.16384 > omega.16384: NetTLP: MWr, len 2, requester 00:00, tag 0x00, last 0xf, first 0xf, Addr 0x80000028
19:03:10.406622 IP 192.168.10.1.16384 > omega.16384: NetTLP: MWr, len 2, requester 00:00, tag 0x00, last 0xf, first 0xf, Addr 0x80000020
19:03:10.406623 IP 192.168.10.1.16384 > omega.16384: NetTLP: MWr, len 2, requester 00:00, tag 0x00, last 0xf, first 0xf, Addr 0x80000028
19:03:10.406624 IP 192.168.10.1.12288 > omega.12288: NetTLP: CplD, len 16, completer 00:00, success, bc 64, requester 01:00, tag 0x00, lowaddr 0x00
19:03:10.406626 IP 192.168.10.1.16384 > omega.16384: NetTLP: MWr, len 2, requester 00:00, tag 0x00, last 0xf, first 0xf, Addr 0x80000020
19:03:10.406627 IP 192.168.10.1.16384 > omega.16384: NetTLP: MWr, len 2, requester 00:00, tag 0x00, last 0xf, first 0xf, Addr 0x80000028
19:03:10.406628 IP 192.168.10.1.16384 > omega.16384: NetTLP: MWr, len 2, requester 00:00, tag 0x00, last 0xf, first 0xf, Addr 0x80000020
19:03:10.406629 IP 192.168.10.1.16384 > omega.16384: NetTLP: MWr, len 2, requester 00:00, tag 0x00, last 0xf, first 0xf, Addr 0x80000028
19:03:10.406642 IP 192.168.10.1.16384 > omega.16384: NetTLP: MWr, len 2, requester 00:00, tag 0x00, last 0xf, first 0xf, Addr 0x80000020
19:03:10.406643 IP 192.168.10.1.16384 > omega.16384: NetTLP: MWr, len 2, requester 00:00, tag 0x00, last 0xf, first 0xf, Addr 0x80000028
19:03:10.406644 IP 192.168.10.1.16384 > omega.16384: NetTLP: MWr, len 2, requester 00:00, tag 0x00, last 0xf, first 0xf, Addr 0x80000020
19:03:10.406645 IP 192.168.10.1.16384 > omega.16384: NetTLP: MWr, len 2, requester 00:00, tag 0x00, last 0xf, first 0xf, Addr 0x80000028
19:03:10.406646 IP 192.168.10.1.16384 > omega.16384: NetTLP: MWr, len 2, requester 00:00, tag 0x00, last 0xf, first 0xf, Addr 0x80000020
19:03:10.406647 IP 192.168.10.1.16384 > omega.16384: NetTLP: MWr, len 2, requester 00:00, tag 0x00, last 0xf, first 0xf, Addr 0x80000028
19:03:10.406666 IP 192.168.10.1.16384 > omega.16384: NetTLP: MWr, len 2, requester 00:00, tag 0x00, last 0xf, first 0xf, Addr 0x80000020
19:03:10.406667 IP 192.168.10.1.16384 > omega.16384: NetTLP: MWr, len 2, requester 00:00, tag 0x00, last 0xf, first 0xf, Addr 0x80000028
19:03:10.406669 IP 192.168.10.1.16384 > omega.16384: NetTLP: MWr, len 2, requester 00:00, tag 0x00, last 0xf, first 0xf, Addr 0x80000020
19:03:10.406670 IP 192.168.10.1.16384 > omega.16384: NetTLP: MWr, len 2, requester 00:00, tag 0x00, last 0xf, first 0xf, Addr 0x80000028
19:03:10.406671 IP 192.168.10.1.16384 > omega.16384: NetTLP: MWr, len 2, requester 00:00, tag 0x00, last 0xf, first 0xf, Addr 0x80000020
19:03:10.406672 IP 192.168.10.1.16384 > omega.16384: NetTLP: MWr, len 2, requester 00:00, tag 0x00, last 0xf, first 0xf, Addr 0x80000028
19:03:10.406673 IP 192.168.10.1.16384 > omega.16384: NetTLP: MWr, len 2, requester 00:00, tag 0x00, last 0xf, first 0xf, Addr 0x80000020
19:03:10.406674 IP 192.168.10.1.16384 > omega.16384: NetTLP: MWr, len 2, requester 00:00, tag 0x00, last 0xf, first 0xf, Addr 0x80000028
19:03:10.406675 IP 192.168.10.1.16384 > omega.16384: NetTLP: MWr, len 2, requester 00:00, tag 0x00, last 0xf, first 0xf, Addr 0x80000020
19:03:10.406676 IP 192.168.10.1.16384 > omega.16384: NetTLP: MWr, len 2, requester 00:00, tag 0x00, last 0xf, first 0xf, Addr 0x80000028
19:03:10.406693 IP 192.168.10.1.16384 > omega.16384: NetTLP: MWr, len 2, requester 00:00, tag 0x00, last 0xf, first 0xf, Addr 0x80000020
19:03:10.406696 IP 192.168.10.1.16384 > omega.16384: NetTLP: MWr, len 2, requester 00:00, tag 0x00, last 0xf, first 0xf, Addr 0x80000028
19:03:10.406697 IP 192.168.10.1.16384 > omega.16384: NetTLP: MWr, len 2, requester 00:00, tag 0x00, last 0xf, first 0xf, Addr 0x80000020
19:03:10.406699 IP 192.168.10.1.16384 > omega.16384: NetTLP: MWr, len 2, requester 00:00, tag 0x00, last 0xf, first 0xf, Addr 0x80000028
19:03:10.406700 IP 192.168.10.1.16384 > omega.16384: NetTLP: MWr, len 2, requester 00:00, tag 0x00, last 0xf, first 0xf, Addr 0x80000020
19:03:10.406701 IP 192.168.10.1.16384 > omega.16384: NetTLP: MWr, len 2, requester 00:00, tag 0x00, last 0xf, first 0xf, Addr 0x80000028
19:03:10.406701 IP omega.12288 > 192.168.10.1.12288: NetTLP: MWr, len 1, requester 01:00, tag 0x00, last 0x0, first 0xf, Addr 0xfee01004
19:03:10.406702 IP 192.168.10.1.16384 > omega.16384: NetTLP: MWr, len 2, requester 00:00, tag 0x00, last 0xf, first 0xf, Addr 0x80000020
19:03:10.406703 IP 192.168.10.1.16384 > omega.16384: NetTLP: MWr, len 2, requester 00:00, tag 0x00, last 0xf, first 0xf, Addr 0x80000028
19:03:10.406704 IP omega.12288 > 192.168.10.1.12288: NetTLP: MRd, len 16, requester 01:00, tag 0x00, last 0xf, first 0xf, Addr 0x5364f800
19:03:10.406722 IP 192.168.10.1.16384 > omega.16384: NetTLP: MWr, len 2, requester 00:00, tag 0x00, last 0xf, first 0xf, Addr 0x80000020
19:03:10.406724 IP 192.168.10.1.16384 > omega.16384: NetTLP: MWr, len 2, requester 00:00, tag 0x00, last 0xf, first 0xf, Addr 0x80000028
19:03:10.406725 IP 192.168.10.1.16384 > omega.16384: NetTLP: MWr, len 2, requester 00:00, tag 0x00, last 0xf, first 0xf, Addr 0x80000020
19:03:10.406726 IP 192.168.10.1.12288 > omega.12288: NetTLP: CplD, len 16, completer 00:00, success, bc 64, requester 01:00, tag 0x00, lowaddr 0x00
19:03:10.406727 IP 192.168.10.1.16384 > omega.16384: NetTLP: MWr, len 2, requester 00:00, tag 0x00, last 0xf, first 0xf, Addr 0x80000028
19:03:10.406728 IP 192.168.10.1.16384 > omega.16384: NetTLP: MWr, len 2, requester 00:00, tag 0x00, last 0xf, first 0xf, Addr 0x80000020
19:03:10.406729 IP 192.168.10.1.16384 > omega.16384: NetTLP: MWr, len 2, requester 00:00, tag 0x00, last 0xf, first 0xf, Addr 0x80000028
19:03:10.406730 IP 192.168.10.1.16384 > omega.16384: NetTLP: MWr, len 2, requester 00:00, tag 0x00, last 0xf, first 0xf, Addr 0x80000020
19:03:10.406731 IP 192.168.10.1.16384 > omega.16384: NetTLP: MWr, len 2, requester 00:00, tag 0x00, last 0xf, first 0xf, Addr 0x80000028
19:03:10.406732 IP 192.168.10.1.16384 > omega.16384: NetTLP: MWr, len 2, requester 00:00, tag 0x00, last 0xf, first 0xf, Addr 0x80000020
19:03:10.406733 IP 192.168.10.1.16384 > omega.16384: NetTLP: MWr, len 2, requester 00:00, tag 0x00, last 0xf, first 0xf, Addr 0x80000028
19:03:10.406752 IP 192.168.10.1.16384 > omega.16384: NetTLP: MWr, len 2, requester 00:00, tag 0x00, last 0xf, first 0xf, Addr 0x80000020
19:03:10.406754 IP 192.168.10.1.16384 > omega.16384: NetTLP: MWr, len 2, requester 00:00, tag 0x00, last 0xf, first 0xf, Addr 0x80000028
19:03:10.406755 IP 192.168.10.1.16384 > omega.16384: NetTLP: MWr, len 2, requester 00:00, tag 0x00, last 0xf, first 0xf, Addr 0x80000020
19:03:10.406756 IP 192.168.10.1.16384 > omega.16384: NetTLP: MWr, len 2, requester 00:00, tag 0x00, last 0xf, first 0xf, Addr 0x80000028
19:03:10.406757 IP 192.168.10.1.16384 > omega.16384: NetTLP: MWr, len 2, requester 00:00, tag 0x00, last 0xf, first 0xf, Addr 0x80000020
19:03:10.406758 IP 192.168.10.1.16384 > omega.16384: NetTLP: MWr, len 2, requester 00:00, tag 0x00, last 0xf, first 0xf, Addr 0x80000028
19:03:10.406759 IP 192.168.10.1.16384 > omega.16384: NetTLP: MWr, len 2, requester 00:00, tag 0x00, last 0xf, first 0xf, Addr 0x80000020
19:03:10.406760 IP 192.168.10.1.16384 > omega.16384: NetTLP: MWr, len 2, requester 00:00, tag 0x00, last 0xf, first 0xf, Addr 0x80000028
19:03:10.406785 IP 192.168.10.1.16384 > omega.16384: NetTLP: MWr, len 2, requester 00:00, tag 0x00, last 0xf, first 0xf, Addr 0x80000020
19:03:10.406787 IP 192.168.10.1.16384 > omega.16384: NetTLP: MWr, len 2, requester 00:00, tag 0x00, last 0xf, first 0xf, Addr 0x80000028
19:03:10.406788 IP 192.168.10.1.16384 > omega.16384: NetTLP: MWr, len 2, requester 00:00, tag 0x00, last 0xf, first 0xf, Addr 0x80000020
19:03:10.406789 IP 192.168.10.1.16384 > omega.16384: NetTLP: MWr, len 2, requester 00:00, tag 0x00, last 0xf, first 0xf, Addr 0x80000028
19:03:10.406790 IP omega.12288 > 192.168.10.1.12288: NetTLP: MWr, len 1, requester 01:00, tag 0x00, last 0x0, first 0xf, Addr 0xfee01004
19:03:10.406790 IP 192.168.10.1.16384 > omega.16384: NetTLP: MWr, len 2, requester 00:00, tag 0x00, last 0xf, first 0xf, Addr 0x80000020
19:03:10.406792 IP 192.168.10.1.16384 > omega.16384: NetTLP: MWr, len 2, requester 00:00, tag 0x00, last 0xf, first 0xf, Addr 0x80000028
19:03:10.406793 IP 192.168.10.1.16384 > omega.16384: NetTLP: MWr, len 2, requester 00:00, tag 0x00, last 0xf, first 0xf, Addr 0x80000020
19:03:10.406793 IP omega.12288 > 192.168.10.1.12288: NetTLP: MRd, len 16, requester 01:00, tag 0x00, last 0xf, first 0xf, Addr 0x53650000
19:03:10.406794 IP 192.168.10.1.16384 > omega.16384: NetTLP: MWr, len 2, requester 00:00, tag 0x00, last 0xf, first 0xf, Addr 0x80000028
19:03:10.406795 IP 192.168.10.1.16384 > omega.16384: NetTLP: MWr, len 2, requester 00:00, tag 0x00, last 0xf, first 0xf, Addr 0x80000020
19:03:10.406796 IP 192.168.10.1.16384 > omega.16384: NetTLP: MWr, len 2, requester 00:00, tag 0x00, last 0xf, first 0xf, Addr 0x80000028
19:03:10.406797 IP 192.168.10.1.16384 > omega.16384: NetTLP: MWr, len 2, requester 00:00, tag 0x00, last 0xf, first 0xf, Addr 0x80000020
19:03:10.406798 IP 192.168.10.1.16384 > omega.16384: NetTLP: MWr, len 2, requester 00:00, tag 0x00, last 0xf, first 0xf, Addr 0x80000028
19:03:10.406799 IP 192.168.10.1.16384 > omega.16384: NetTLP: MWr, len 2, requester 00:00, tag 0x00, last 0xf, first 0xf, Addr 0x80000020
19:03:10.406800 IP 192.168.10.1.16384 > omega.16384: NetTLP: MWr, len 2, requester 00:00, tag 0x00, last 0xf, first 0xf, Addr 0x80000028
19:03:10.406801 IP 192.168.10.1.12288 > omega.12288: NetTLP: CplD, len 16, completer 00:00, success, bc 64, requester 01:00, tag 0x00, lowaddr 0x00
19:03:10.406820 IP 192.168.10.1.16384 > omega.16384: NetTLP: MWr, len 2, requester 00:00, tag 0x00, last 0xf, first 0xf, Addr 0x80000020
19:03:10.406821 IP 192.168.10.1.16384 > omega.16384: NetTLP: MWr, len 2, requester 00:00, tag 0x00, last 0xf, first 0xf, Addr 0x80000028
19:03:10.406822 IP 192.168.10.1.16384 > omega.16384: NetTLP: MWr, len 2, requester 00:00, tag 0x00, last 0xf, first 0xf, Addr 0x80000020
19:03:10.406823 IP 192.168.10.1.16384 > omega.16384: NetTLP: MWr, len 2, requester 00:00, tag 0x00, last 0xf, first 0xf, Addr 0x80000028
19:03:10.406824 IP 192.168.10.1.16384 > omega.16384: NetTLP: MWr, len 2, requester 00:00, tag 0x00, last 0xf, first 0xf, Addr 0x80000020
19:03:10.406825 IP 192.168.10.1.16384 > omega.16384: NetTLP: MWr, len 2, requester 00:00, tag 0x00, last 0xf, first 0xf, Addr 0x80000028
19:03:10.406826 IP 192.168.10.1.16384 > omega.16384: NetTLP: MWr, len 2, requester 00:00, tag 0x00, last 0xf, first 0xf, Addr 0x80000020
19:03:10.406827 IP 192.168.10.1.16384 > omega.16384: NetTLP: MWr, len 2, requester 00:00, tag 0x00, last 0xf, first 0xf, Addr 0x80000028
19:03:10.406848 IP omega.12288 > 192.168.10.1.12288: NetTLP: MWr, len 1, requester 01:00, tag 0x00, last 0x0, first 0xf, Addr 0xfee01004
19:03:10.406852 IP omega.12288 > 192.168.10.1.12288: NetTLP: MRd, len 16, requester 01:00, tag 0x00, last 0xf, first 0xf, Addr 0x53650800
19:03:10.406857 IP 192.168.10.1.16384 > omega.16384: NetTLP: MWr, len 2, requester 00:00, tag 0x00, last 0xf, first 0xf, Addr 0x80000020
19:03:10.406859 IP 192.168.10.1.16384 > omega.16384: NetTLP: MWr, len 2, requester 00:00, tag 0x00, last 0xf, first 0xf, Addr 0x80000028
19:03:10.406860 IP 192.168.10.1.16384 > omega.16384: NetTLP: MWr, len 2, requester 00:00, tag 0x00, last 0xf, first 0xf, Addr 0x80000020
19:03:10.406861 IP 192.168.10.1.16384 > omega.16384: NetTLP: MWr, len 2, requester 00:00, tag 0x00, last 0xf, first 0xf, Addr 0x80000028
19:03:10.406862 IP 192.168.10.1.16384 > omega.16384: NetTLP: MWr, len 2, requester 00:00, tag 0x00, last 0xf, first 0xf, Addr 0x80000020
19:03:10.406863 IP 192.168.10.1.16384 > omega.16384: NetTLP: MWr, len 2, requester 00:00, tag 0x00, last 0xf, first 0xf, Addr 0x80000028
19:03:10.406864 IP 192.168.10.1.16384 > omega.16384: NetTLP: MWr, len 2, requester 00:00, tag 0x00, last 0xf, first 0xf, Addr 0x80000020
19:03:10.406865 IP 192.168.10.1.16384 > omega.16384: NetTLP: MWr, len 2, requester 00:00, tag 0x00, last 0xf, first 0xf, Addr 0x80000028
19:03:10.406866 IP 192.168.10.1.16384 > omega.16384: NetTLP: MWr, len 2, requester 00:00, tag 0x00, last 0xf, first 0xf, Addr 0x80000020
19:03:10.406867 IP 192.168.10.1.16384 > omega.16384: NetTLP: MWr, len 2, requester 00:00, tag 0x00, last 0xf, first 0xf, Addr 0x80000028
19:03:10.406868 IP 192.168.10.1.12288 > omega.12288: NetTLP: CplD, len 16, completer 00:00, success, bc 64, requester 01:00, tag 0x00, lowaddr 0x00
19:03:10.406870 IP 192.168.10.1.16384 > omega.16384: NetTLP: MWr, len 2, requester 00:00, tag 0x00, last 0xf, first 0xf, Addr 0x80000020
19:03:10.406871 IP 192.168.10.1.16384 > omega.16384: NetTLP: MWr, len 2, requester 00:00, tag 0x00, last 0xf, first 0xf, Addr 0x80000028
19:03:10.406872 IP 192.168.10.1.16384 > omega.16384: NetTLP: MWr, len 2, requester 00:00, tag 0x00, last 0xf, first 0xf, Addr 0x80000020
19:03:10.406873 IP 192.168.10.1.16384 > omega.16384: NetTLP: MWr, len 2, requester 00:00, tag 0x00, last 0xf, first 0xf, Addr 0x80000028
19:03:10.406874 IP 192.168.10.1.16384 > omega.16384: NetTLP: MWr, len 2, requester 00:00, tag 0x00, last 0xf, first 0xf, Addr 0x80000020
19:03:10.406875 IP 192.168.10.1.16384 > omega.16384: NetTLP: MWr, len 2, requester 00:00, tag 0x00, last 0xf, first 0xf, Addr 0x80000028
19:03:10.406894 IP omega.12288 > 192.168.10.1.12288: NetTLP: MWr, len 1, requester 01:00, tag 0x00, last 0x0, first 0xf, Addr 0xfee01004
19:03:10.406896 IP 192.168.10.1.16384 > omega.16384: NetTLP: MWr, len 2, requester 00:00, tag 0x00, last 0xf, first 0xf, Addr 0x80000020
19:03:10.406896 IP omega.12288 > 192.168.10.1.12288: NetTLP: MRd, len 16, requester 01:00, tag 0x00, last 0xf, first 0xf, Addr 0x53651000
19:03:10.406898 IP 192.168.10.1.16384 > omega.16384: NetTLP: MWr, len 2, requester 00:00, tag 0x00, last 0xf, first 0xf, Addr 0x80000028
19:03:10.406899 IP 192.168.10.1.16384 > omega.16384: NetTLP: MWr, len 2, requester 00:00, tag 0x00, last 0xf, first 0xf, Addr 0x80000020
19:03:10.406900 IP 192.168.10.1.16384 > omega.16384: NetTLP: MWr, len 2, requester 00:00, tag 0x00, last 0xf, first 0xf, Addr 0x80000028
19:03:10.406901 IP 192.168.10.1.16384 > omega.16384: NetTLP: MWr, len 2, requester 00:00, tag 0x00, last 0xf, first 0xf, Addr 0x80000020
19:03:10.406902 IP 192.168.10.1.16384 > omega.16384: NetTLP: MWr, len 2, requester 00:00, tag 0x00, last 0xf, first 0xf, Addr 0x80000028
19:03:10.406903 IP 192.168.10.1.16384 > omega.16384: NetTLP: MWr, len 2, requester 00:00, tag 0x00, last 0xf, first 0xf, Addr 0x80000020
19:03:10.406904 IP 192.168.10.1.16384 > omega.16384: NetTLP: MWr, len 2, requester 00:00, tag 0x00, last 0xf, first 0xf, Addr 0x80000028
19:03:10.406905 IP 192.168.10.1.12288 > omega.12288: NetTLP: CplD, len 16, completer 00:00, success, bc 64, requester 01:00, tag 0x00, lowaddr 0x00
19:03:10.406907 IP 192.168.10.1.16384 > omega.16384: NetTLP: MWr, len 2, requester 00:00, tag 0x00, last 0xf, first 0xf, Addr 0x80000020
19:03:10.406908 IP 192.168.10.1.16384 > omega.16384: NetTLP: MWr, len 2, requester 00:00, tag 0x00, last 0xf, first 0xf, Addr 0x80000028
19:03:10.406911 IP omega.12288 > 192.168.10.1.12288: NetTLP: MWr, len 1, requester 01:00, tag 0x00, last 0x0, first 0xf, Addr 0xfee01004
19:03:10.406912 IP omega.12288 > 192.168.10.1.12288: NetTLP: MRd, len 16, requester 01:00, tag 0x00, last 0xf, first 0xf, Addr 0x53651800
19:03:10.406937 IP 192.168.10.1.16384 > omega.16384: NetTLP: MWr, len 2, requester 00:00, tag 0x00, last 0xf, first 0xf, Addr 0x80000020
19:03:10.406939 IP 192.168.10.1.16384 > omega.16384: NetTLP: MWr, len 2, requester 00:00, tag 0x00, last 0xf, first 0xf, Addr 0x80000028
19:03:10.406940 IP 192.168.10.1.16384 > omega.16384: NetTLP: MWr, len 2, requester 00:00, tag 0x00, last 0xf, first 0xf, Addr 0x80000020
19:03:10.406941 IP 192.168.10.1.16384 > omega.16384: NetTLP: MWr, len 2, requester 00:00, tag 0x00, last 0xf, first 0xf, Addr 0x80000028
19:03:10.406942 IP 192.168.10.1.12288 > omega.12288: NetTLP: CplD, len 16, completer 00:00, success, bc 64, requester 01:00, tag 0x00, lowaddr 0x00
19:03:10.406943 IP 192.168.10.1.16384 > omega.16384: NetTLP: MWr, len 2, requester 00:00, tag 0x00, last 0xf, first 0xf, Addr 0x80000020
19:03:10.406945 IP 192.168.10.1.16384 > omega.16384: NetTLP: MWr, len 2, requester 00:00, tag 0x00, last 0xf, first 0xf, Addr 0x80000028
19:03:10.406946 IP 192.168.10.1.16384 > omega.16384: NetTLP: MWr, len 2, requester 00:00, tag 0x00, last 0xf, first 0xf, Addr 0x80000020
19:03:10.406947 IP 192.168.10.1.16384 > omega.16384: NetTLP: MWr, len 2, requester 00:00, tag 0x00, last 0xf, first 0xf, Addr 0x80000028
19:03:10.406948 IP 192.168.10.1.16384 > omega.16384: NetTLP: MWr, len 2, requester 00:00, tag 0x00, last 0xf, first 0xf, Addr 0x80000020
19:03:10.406949 IP 192.168.10.1.16384 > omega.16384: NetTLP: MWr, len 2, requester 00:00, tag 0x00, last 0xf, first 0xf, Addr 0x80000028
19:03:10.406950 IP 192.168.10.1.16384 > omega.16384: NetTLP: MWr, len 2, requester 00:00, tag 0x00, last 0xf, first 0xf, Addr 0x80000020
19:03:10.406951 IP 192.168.10.1.16384 > omega.16384: NetTLP: MWr, len 2, requester 00:00, tag 0x00, last 0xf, first 0xf, Addr 0x80000028
19:03:10.406952 IP 192.168.10.1.16384 > omega.16384: NetTLP: MWr, len 2, requester 00:00, tag 0x00, last 0xf, first 0xf, Addr 0x80000020
19:03:10.406953 IP 192.168.10.1.16384 > omega.16384: NetTLP: MWr, len 2, requester 00:00, tag 0x00, last 0xf, first 0xf, Addr 0x80000028
19:03:10.406954 IP 192.168.10.1.16384 > omega.16384: NetTLP: MWr, len 2, requester 00:00, tag 0x00, last 0xf, first 0xf, Addr 0x80000020
19:03:10.406956 IP 192.168.10.1.16384 > omega.16384: NetTLP: MWr, len 2, requester 00:00, tag 0x00, last 0xf, first 0xf, Addr 0x80000028
19:03:10.406968 IP omega.12288 > 192.168.10.1.12288: NetTLP: MWr, len 1, requester 01:00, tag 0x00, last 0x0, first 0xf, Addr 0xfee01004
19:03:10.406970 IP omega.12288 > 192.168.10.1.12288: NetTLP: MRd, len 16, requester 01:00, tag 0x00, last 0xf, first 0xf, Addr 0x53652000
19:03:10.406980 IP 192.168.10.1.16384 > omega.16384: NetTLP: MWr, len 2, requester 00:00, tag 0x00, last 0xf, first 0xf, Addr 0x80000020
19:03:10.406981 IP 192.168.10.1.16384 > omega.16384: NetTLP: MWr, len 2, requester 00:00, tag 0x00, last 0xf, first 0xf, Addr 0x80000028
19:03:10.406982 IP 192.168.10.1.16384 > omega.16384: NetTLP: MWr, len 2, requester 00:00, tag 0x00, last 0xf, first 0xf, Addr 0x80000020
19:03:10.406983 IP 192.168.10.1.16384 > omega.16384: NetTLP: MWr, len 2, requester 00:00, tag 0x00, last 0xf, first 0xf, Addr 0x80000028
19:03:10.406985 IP 192.168.10.1.16384 > omega.16384: NetTLP: MWr, len 2, requester 00:00, tag 0x00, last 0xf, first 0xf, Addr 0x80000020
19:03:10.406987 IP 192.168.10.1.16384 > omega.16384: NetTLP: MWr, len 2, requester 00:00, tag 0x00, last 0xf, first 0xf, Addr 0x80000028
19:03:10.406988 IP 192.168.10.1.12288 > omega.12288: NetTLP: CplD, len 16, completer 00:00, success, bc 64, requester 01:00, tag 0x00, lowaddr 0x00
19:03:10.406989 IP 192.168.10.1.16384 > omega.16384: NetTLP: MWr, len 2, requester 00:00, tag 0x00, last 0xf, first 0xf, Addr 0x80000020
19:03:10.406990 IP 192.168.10.1.16384 > omega.16384: NetTLP: MWr, len 2, requester 00:00, tag 0x00, last 0xf, first 0xf, Addr 0x80000028
19:03:10.406991 IP 192.168.10.1.16384 > omega.16384: NetTLP: MWr, len 2, requester 00:00, tag 0x00, last 0xf, first 0xf, Addr 0x80000020
19:03:10.406993 IP 192.168.10.1.16384 > omega.16384: NetTLP: MWr, len 2, requester 00:00, tag 0x00, last 0xf, first 0xf, Addr 0x80000028
19:03:10.406994 IP 192.168.10.1.16384 > omega.16384: NetTLP: MWr, len 2, requester 00:00, tag 0x00, last 0xf, first 0xf, Addr 0x80000020
19:03:10.406995 IP 192.168.10.1.16384 > omega.16384: NetTLP: MWr, len 2, requester 00:00, tag 0x00, last 0xf, first 0xf, Addr 0x80000028
19:03:10.407004 IP omega.12288 > 192.168.10.1.12288: NetTLP: MWr, len 1, requester 01:00, tag 0x00, last 0x0, first 0xf, Addr 0xfee01004
19:03:10.407006 IP omega.12288 > 192.168.10.1.12288: NetTLP: MRd, len 16, requester 01:00, tag 0x00, last 0xf, first 0xf, Addr 0x53652800
19:03:10.407025 IP 192.168.10.1.16384 > omega.16384: NetTLP: MWr, len 2, requester 00:00, tag 0x00, last 0xf, first 0xf, Addr 0x80000020
19:03:10.407026 IP 192.168.10.1.16384 > omega.16384: NetTLP: MWr, len 2, requester 00:00, tag 0x00, last 0xf, first 0xf, Addr 0x80000028
19:03:10.407027 IP 192.168.10.1.16384 > omega.16384: NetTLP: MWr, len 2, requester 00:00, tag 0x00, last 0xf, first 0xf, Addr 0x80000020
19:03:10.407028 IP 192.168.10.1.16384 > omega.16384: NetTLP: MWr, len 2, requester 00:00, tag 0x00, last 0xf, first 0xf, Addr 0x80000028
19:03:10.407029 IP 192.168.10.1.16384 > omega.16384: NetTLP: MWr, len 2, requester 00:00, tag 0x00, last 0xf, first 0xf, Addr 0x80000020
19:03:10.407030 IP 192.168.10.1.16384 > omega.16384: NetTLP: MWr, len 2, requester 00:00, tag 0x00, last 0xf, first 0xf, Addr 0x80000028
19:03:10.407032 IP 192.168.10.1.12288 > omega.12288: NetTLP: CplD, len 16, completer 00:00, success, bc 64, requester 01:00, tag 0x00, lowaddr 0x00
19:03:10.407033 IP 192.168.10.1.16384 > omega.16384: NetTLP: MWr, len 2, requester 00:00, tag 0x00, last 0xf, first 0xf, Addr 0x80000020
19:03:10.407035 IP 192.168.10.1.16384 > omega.16384: NetTLP: MWr, len 2, requester 00:00, tag 0x00, last 0xf, first 0xf, Addr 0x80000028
19:03:10.407036 IP 192.168.10.1.16384 > omega.16384: NetTLP: MWr, len 2, requester 00:00, tag 0x00, last 0xf, first 0xf, Addr 0x80000020
19:03:10.407037 IP 192.168.10.1.16384 > omega.16384: NetTLP: MWr, len 2, requester 00:00, tag 0x00, last 0xf, first 0xf, Addr 0x80000028
19:03:10.407038 IP 192.168.10.1.16384 > omega.16384: NetTLP: MWr, len 2, requester 00:00, tag 0x00, last 0xf, first 0xf, Addr 0x80000020
19:03:10.407039 IP 192.168.10.1.16384 > omega.16384: NetTLP: MWr, len 2, requester 00:00, tag 0x00, last 0xf, first 0xf, Addr 0x80000028
19:03:10.407040 IP 192.168.10.1.16384 > omega.16384: NetTLP: MWr, len 2, requester 00:00, tag 0x00, last 0xf, first 0xf, Addr 0x80000020
19:03:10.407041 IP 192.168.10.1.16384 > omega.16384: NetTLP: MWr, len 2, requester 00:00, tag 0x00, last 0xf, first 0xf, Addr 0x80000028
19:03:10.407051 IP omega.12288 > 192.168.10.1.12288: NetTLP: MWr, len 1, requester 01:00, tag 0x00, last 0x0, first 0xf, Addr 0xfee01004
19:03:10.407053 IP omega.12288 > 192.168.10.1.12288: NetTLP: MRd, len 16, requester 01:00, tag 0x00, last 0xf, first 0xf, Addr 0x53653000
19:03:10.407072 IP 192.168.10.1.16384 > omega.16384: NetTLP: MWr, len 2, requester 00:00, tag 0x00, last 0xf, first 0xf, Addr 0x80000020
19:03:10.407074 IP 192.168.10.1.16384 > omega.16384: NetTLP: MWr, len 2, requester 00:00, tag 0x00, last 0xf, first 0xf, Addr 0x80000028
19:03:10.407075 IP 192.168.10.1.16384 > omega.16384: NetTLP: MWr, len 2, requester 00:00, tag 0x00, last 0xf, first 0xf, Addr 0x80000020
19:03:10.407076 IP 192.168.10.1.16384 > omega.16384: NetTLP: MWr, len 2, requester 00:00, tag 0x00, last 0xf, first 0xf, Addr 0x80000028
19:03:10.407077 IP 192.168.10.1.16384 > omega.16384: NetTLP: MWr, len 2, requester 00:00, tag 0x00, last 0xf, first 0xf, Addr 0x80000020
19:03:10.407078 IP 192.168.10.1.16384 > omega.16384: NetTLP: MWr, len 2, requester 00:00, tag 0x00, last 0xf, first 0xf, Addr 0x80000028
19:03:10.407079 IP 192.168.10.1.12288 > omega.12288: NetTLP: CplD, len 16, completer 00:00, success, bc 64, requester 01:00, tag 0x00, lowaddr 0x00
19:03:10.407081 IP 192.168.10.1.16384 > omega.16384: NetTLP: MWr, len 2, requester 00:00, tag 0x00, last 0xf, first 0xf, Addr 0x80000020
19:03:10.407082 IP 192.168.10.1.16384 > omega.16384: NetTLP: MWr, len 2, requester 00:00, tag 0x00, last 0xf, first 0xf, Addr 0x80000028
19:03:10.407083 IP 192.168.10.1.16384 > omega.16384: NetTLP: MWr, len 2, requester 00:00, tag 0x00, last 0xf, first 0xf, Addr 0x80000020
19:03:10.407084 IP 192.168.10.1.16384 > omega.16384: NetTLP: MWr, len 2, requester 00:00, tag 0x00, last 0xf, first 0xf, Addr 0x80000028
19:03:10.407085 IP 192.168.10.1.16384 > omega.16384: NetTLP: MWr, len 2, requester 00:00, tag 0x00, last 0xf, first 0xf, Addr 0x80000020
19:03:10.407086 IP 192.168.10.1.16384 > omega.16384: NetTLP: MWr, len 2, requester 00:00, tag 0x00, last 0xf, first 0xf, Addr 0x80000028
19:03:10.407087 IP 192.168.10.1.16384 > omega.16384: NetTLP: MWr, len 2, requester 00:00, tag 0x00, last 0xf, first 0xf, Addr 0x80000020
19:03:10.407089 IP 192.168.10.1.16384 > omega.16384: NetTLP: MWr, len 2, requester 00:00, tag 0x00, last 0xf, first 0xf, Addr 0x80000028
19:03:10.407090 IP 192.168.10.1.16384 > omega.16384: NetTLP: MWr, len 2, requester 00:00, tag 0x00, last 0xf, first 0xf, Addr 0x80000020
19:03:10.407091 IP 192.168.10.1.16384 > omega.16384: NetTLP: MWr, len 2, requester 00:00, tag 0x00, last 0xf, first 0xf, Addr 0x80000028
19:03:10.407101 IP omega.12288 > 192.168.10.1.12288: NetTLP: MWr, len 1, requester 01:00, tag 0x00, last 0x0, first 0xf, Addr 0xfee01004
19:03:10.407103 IP omega.12288 > 192.168.10.1.12288: NetTLP: MRd, len 16, requester 01:00, tag 0x00, last 0xf, first 0xf, Addr 0x53653800
19:03:10.407121 IP 192.168.10.1.16384 > omega.16384: NetTLP: MWr, len 2, requester 00:00, tag 0x00, last 0xf, first 0xf, Addr 0x80000020
19:03:10.407123 IP 192.168.10.1.16384 > omega.16384: NetTLP: MWr, len 2, requester 00:00, tag 0x00, last 0xf, first 0xf, Addr 0x80000028
19:03:10.407124 IP 192.168.10.1.16384 > omega.16384: NetTLP: MWr, len 2, requester 00:00, tag 0x00, last 0xf, first 0xf, Addr 0x80000020
19:03:10.407125 IP 192.168.10.1.16384 > omega.16384: NetTLP: MWr, len 2, requester 00:00, tag 0x00, last 0xf, first 0xf, Addr 0x80000028
19:03:10.407126 IP 192.168.10.1.16384 > omega.16384: NetTLP: MWr, len 2, requester 00:00, tag 0x00, last 0xf, first 0xf, Addr 0x80000020
19:03:10.407127 IP 192.168.10.1.16384 > omega.16384: NetTLP: MWr, len 2, requester 00:00, tag 0x00, last 0xf, first 0xf, Addr 0x80000028
19:03:10.407128 IP 192.168.10.1.12288 > omega.12288: NetTLP: CplD, len 16, completer 00:00, success, bc 64, requester 01:00, tag 0x00, lowaddr 0x00
19:03:10.407129 IP 192.168.10.1.16384 > omega.16384: NetTLP: MWr, len 2, requester 00:00, tag 0x00, last 0xf, first 0xf, Addr 0x80000020
19:03:10.407131 IP 192.168.10.1.16384 > omega.16384: NetTLP: MWr, len 2, requester 00:00, tag 0x00, last 0xf, first 0xf, Addr 0x80000028
19:03:10.407132 IP 192.168.10.1.16384 > omega.16384: NetTLP: MWr, len 2, requester 00:00, tag 0x00, last 0xf, first 0xf, Addr 0x80000020
19:03:10.407133 IP 192.168.10.1.16384 > omega.16384: NetTLP: MWr, len 2, requester 00:00, tag 0x00, last 0xf, first 0xf, Addr 0x80000028
19:03:10.407134 IP 192.168.10.1.16384 > omega.16384: NetTLP: MWr, len 2, requester 00:00, tag 0x00, last 0xf, first 0xf, Addr 0x80000020
19:03:10.407135 IP 192.168.10.1.16384 > omega.16384: NetTLP: MWr, len 2, requester 00:00, tag 0x00, last 0xf, first 0xf, Addr 0x80000028
19:03:10.407136 IP 192.168.10.1.16384 > omega.16384: NetTLP: MWr, len 2, requester 00:00, tag 0x00, last 0xf, first 0xf, Addr 0x80000020
19:03:10.407138 IP 192.168.10.1.16384 > omega.16384: NetTLP: MWr, len 2, requester 00:00, tag 0x00, last 0xf, first 0xf, Addr 0x80000028
19:03:10.407148 IP omega.12288 > 192.168.10.1.12288: NetTLP: MWr, len 1, requester 01:00, tag 0x00, last 0x0, first 0xf, Addr 0xfee01004
19:03:10.407150 IP omega.12288 > 192.168.10.1.12288: NetTLP: MRd, len 16, requester 01:00, tag 0x00, last 0xf, first 0xf, Addr 0x53654000
19:03:10.407172 IP 192.168.10.1.12288 > omega.12288: NetTLP: CplD, len 16, completer 00:00, success, bc 64, requester 01:00, tag 0x00, lowaddr 0x00
19:03:10.407178 IP omega.12288 > 192.168.10.1.12288: NetTLP: MWr, len 1, requester 01:00, tag 0x00, last 0x0, first 0xf, Addr 0xfee01004
19:03:10.407181 IP omega.12288 > 192.168.10.1.12288: NetTLP: MRd, len 16, requester 01:00, tag 0x00, last 0xf, first 0xf, Addr 0x53654800
19:03:10.407229 IP 192.168.10.1.12288 > omega.12288: NetTLP: CplD, len 16, completer 00:00, success, bc 64, requester 01:00, tag 0x00, lowaddr 0x00
19:03:10.407234 IP omega.12288 > 192.168.10.1.12288: NetTLP: MWr, len 1, requester 01:00, tag 0x00, last 0x0, first 0xf, Addr 0xfee01004
19:03:10.407236 IP omega.12288 > 192.168.10.1.12288: NetTLP: MRd, len 16, requester 01:00, tag 0x00, last 0xf, first 0xf, Addr 0x53655000
19:03:10.407248 IP 192.168.10.1.12288 > omega.12288: NetTLP: CplD, len 16, completer 00:00, success, bc 64, requester 01:00, tag 0x00, lowaddr 0x00
19:03:10.407253 IP omega.12288 > 192.168.10.1.12288: NetTLP: MWr, len 1, requester 01:00, tag 0x00, last 0x0, first 0xf, Addr 0xfee01004
19:03:10.407255 IP omega.12288 > 192.168.10.1.12288: NetTLP: MRd, len 16, requester 01:00, tag 0x00, last 0xf, first 0xf, Addr 0x53655800
19:03:10.407266 IP 192.168.10.1.12288 > omega.12288: NetTLP: CplD, len 16, completer 00:00, success, bc 64, requester 01:00, tag 0x00, lowaddr 0x00
19:03:10.407272 IP omega.12288 > 192.168.10.1.12288: NetTLP: MWr, len 1, requester 01:00, tag 0x00, last 0x0, first 0xf, Addr 0xfee01004
19:03:10.407273 IP omega.12288 > 192.168.10.1.12288: NetTLP: MRd, len 16, requester 01:00, tag 0x00, last 0xf, first 0xf, Addr 0x53656000
19:03:10.407285 IP 192.168.10.1.12288 > omega.12288: NetTLP: CplD, len 16, completer 00:00, success, bc 64, requester 01:00, tag 0x00, lowaddr 0x00
19:03:10.407290 IP omega.12288 > 192.168.10.1.12288: NetTLP: MWr, len 1, requester 01:00, tag 0x00, last 0x0, first 0xf, Addr 0xfee01004
19:03:10.407292 IP omega.12288 > 192.168.10.1.12288: NetTLP: MRd, len 16, requester 01:00, tag 0x00, last 0xf, first 0xf, Addr 0x53656800
19:03:10.407303 IP 192.168.10.1.12288 > omega.12288: NetTLP: CplD, len 16, completer 00:00, success, bc 64, requester 01:00, tag 0x00, lowaddr 0x00
19:03:10.407308 IP omega.12288 > 192.168.10.1.12288: NetTLP: MWr, len 1, requester 01:00, tag 0x00, last 0x0, first 0xf, Addr 0xfee01004
19:03:10.407310 IP omega.12288 > 192.168.10.1.12288: NetTLP: MRd, len 16, requester 01:00, tag 0x00, last 0xf, first 0xf, Addr 0x53657000
19:03:10.407322 IP 192.168.10.1.12288 > omega.12288: NetTLP: CplD, len 16, completer 00:00, success, bc 64, requester 01:00, tag 0x00, lowaddr 0x00
19:03:10.407327 IP omega.12288 > 192.168.10.1.12288: NetTLP: MWr, len 1, requester 01:00, tag 0x00, last 0x0, first 0xf, Addr 0xfee01004
19:03:10.407328 IP omega.12288 > 192.168.10.1.12288: NetTLP: MRd, len 16, requester 01:00, tag 0x00, last 0xf, first 0xf, Addr 0x53657800
19:03:10.407340 IP 192.168.10.1.12288 > omega.12288: NetTLP: CplD, len 16, completer 00:00, success, bc 64, requester 01:00, tag 0x00, lowaddr 0x00
19:03:10.407345 IP omega.12288 > 192.168.10.1.12288: NetTLP: MWr, len 1, requester 01:00, tag 0x00, last 0x0, first 0xf, Addr 0xfee01004
19:03:10.407347 IP omega.12288 > 192.168.10.1.12288: NetTLP: MRd, len 16, requester 01:00, tag 0x00, last 0xf, first 0xf, Addr 0x53658000
19:03:10.407358 IP 192.168.10.1.12288 > omega.12288: NetTLP: CplD, len 16, completer 00:00, success, bc 64, requester 01:00, tag 0x00, lowaddr 0x00
19:03:10.407364 IP omega.12288 > 192.168.10.1.12288: NetTLP: MWr, len 1, requester 01:00, tag 0x00, last 0x0, first 0xf, Addr 0xfee01004
19:03:10.407365 IP omega.12288 > 192.168.10.1.12288: NetTLP: MRd, len 16, requester 01:00, tag 0x00, last 0xf, first 0xf, Addr 0x53658800
19:03:10.407377 IP 192.168.10.1.12288 > omega.12288: NetTLP: CplD, len 16, completer 00:00, success, bc 64, requester 01:00, tag 0x00, lowaddr 0x00
19:03:10.407382 IP omega.12288 > 192.168.10.1.12288: NetTLP: MWr, len 1, requester 01:00, tag 0x00, last 0x0, first 0xf, Addr 0xfee01004
19:03:10.407384 IP omega.12288 > 192.168.10.1.12288: NetTLP: MRd, len 16, requester 01:00, tag 0x00, last 0xf, first 0xf, Addr 0x53659000
19:03:10.407395 IP 192.168.10.1.12288 > omega.12288: NetTLP: CplD, len 16, completer 00:00, success, bc 64, requester 01:00, tag 0x00, lowaddr 0x00
19:03:10.407400 IP omega.12288 > 192.168.10.1.12288: NetTLP: MWr, len 1, requester 01:00, tag 0x00, last 0x0, first 0xf, Addr 0xfee01004
19:03:10.407402 IP omega.12288 > 192.168.10.1.12288: NetTLP: MRd, len 16, requester 01:00, tag 0x00, last 0xf, first 0xf, Addr 0x53659800
19:03:10.407414 IP 192.168.10.1.12288 > omega.12288: NetTLP: CplD, len 16, completer 00:00, success, bc 64, requester 01:00, tag 0x00, lowaddr 0x00
19:03:10.407419 IP omega.12288 > 192.168.10.1.12288: NetTLP: MWr, len 1, requester 01:00, tag 0x00, last 0x0, first 0xf, Addr 0xfee01004
19:03:10.407421 IP omega.12288 > 192.168.10.1.12288: NetTLP: MRd, len 16, requester 01:00, tag 0x00, last 0xf, first 0xf, Addr 0x5365a000
19:03:10.407432 IP 192.168.10.1.12288 > omega.12288: NetTLP: CplD, len 16, completer 00:00, success, bc 64, requester 01:00, tag 0x00, lowaddr 0x00
19:03:10.407437 IP omega.12288 > 192.168.10.1.12288: NetTLP: MWr, len 1, requester 01:00, tag 0x00, last 0x0, first 0xf, Addr 0xfee01004
19:03:10.407439 IP omega.12288 > 192.168.10.1.12288: NetTLP: MRd, len 16, requester 01:00, tag 0x00, last 0xf, first 0xf, Addr 0x5365a800
19:03:10.407451 IP 192.168.10.1.12288 > omega.12288: NetTLP: CplD, len 16, completer 00:00, success, bc 64, requester 01:00, tag 0x00, lowaddr 0x00
19:03:10.407456 IP omega.12288 > 192.168.10.1.12288: NetTLP: MWr, len 1, requester 01:00, tag 0x00, last 0x0, first 0xf, Addr 0xfee01004
19:03:10.407458 IP omega.12288 > 192.168.10.1.12288: NetTLP: MRd, len 16, requester 01:00, tag 0x00, last 0xf, first 0xf, Addr 0x5365b000
19:03:10.407469 IP 192.168.10.1.12288 > omega.12288: NetTLP: CplD, len 16, completer 00:00, success, bc 64, requester 01:00, tag 0x00, lowaddr 0x00
19:03:10.407474 IP omega.12288 > 192.168.10.1.12288: NetTLP: MWr, len 1, requester 01:00, tag 0x00, last 0x0, first 0xf, Addr 0xfee01004
19:03:10.407476 IP omega.12288 > 192.168.10.1.12288: NetTLP: MRd, len 16, requester 01:00, tag 0x00, last 0xf, first 0xf, Addr 0x5365b800
19:03:10.407487 IP 192.168.10.1.12288 > omega.12288: NetTLP: CplD, len 16, completer 00:00, success, bc 64, requester 01:00, tag 0x00, lowaddr 0x00
19:03:10.407493 IP omega.12288 > 192.168.10.1.12288: NetTLP: MWr, len 1, requester 01:00, tag 0x00, last 0x0, first 0xf, Addr 0xfee01004
19:03:10.407495 IP omega.12288 > 192.168.10.1.12288: NetTLP: MRd, len 16, requester 01:00, tag 0x00, last 0xf, first 0xf, Addr 0x5365c000
19:03:10.407506 IP 192.168.10.1.12288 > omega.12288: NetTLP: CplD, len 16, completer 00:00, success, bc 64, requester 01:00, tag 0x00, lowaddr 0x00
19:03:10.407511 IP omega.12288 > 192.168.10.1.12288: NetTLP: MWr, len 1, requester 01:00, tag 0x00, last 0x0, first 0xf, Addr 0xfee01004
19:03:10.407513 IP omega.12288 > 192.168.10.1.12288: NetTLP: MRd, len 16, requester 01:00, tag 0x00, last 0xf, first 0xf, Addr 0x5365c800
19:03:10.407524 IP 192.168.10.1.12288 > omega.12288: NetTLP: CplD, len 16, completer 00:00, success, bc 64, requester 01:00, tag 0x00, lowaddr 0x00
19:03:10.407530 IP omega.12288 > 192.168.10.1.12288: NetTLP: MWr, len 1, requester 01:00, tag 0x00, last 0x0, first 0xf, Addr 0xfee01004
19:03:10.407531 IP omega.12288 > 192.168.10.1.12288: NetTLP: MRd, len 16, requester 01:00, tag 0x00, last 0xf, first 0xf, Addr 0x5365d000
19:03:10.407543 IP 192.168.10.1.12288 > omega.12288: NetTLP: CplD, len 16, completer 00:00, success, bc 64, requester 01:00, tag 0x00, lowaddr 0x00
19:03:10.407548 IP omega.12288 > 192.168.10.1.12288: NetTLP: MWr, len 1, requester 01:00, tag 0x00, last 0x0, first 0xf, Addr 0xfee01004
19:03:10.407550 IP omega.12288 > 192.168.10.1.12288: NetTLP: MRd, len 16, requester 01:00, tag 0x00, last 0xf, first 0xf, Addr 0x5365d800
19:03:10.407561 IP 192.168.10.1.12288 > omega.12288: NetTLP: CplD, len 16, completer 00:00, success, bc 64, requester 01:00, tag 0x00, lowaddr 0x00
19:03:10.407567 IP omega.12288 > 192.168.10.1.12288: NetTLP: MWr, len 1, requester 01:00, tag 0x00, last 0x0, first 0xf, Addr 0xfee01004
19:03:10.407569 IP omega.12288 > 192.168.10.1.12288: NetTLP: MRd, len 16, requester 01:00, tag 0x00, last 0xf, first 0xf, Addr 0x5365e000
19:03:10.407579 IP 192.168.10.1.12288 > omega.12288: NetTLP: CplD, len 16, completer 00:00, success, bc 64, requester 01:00, tag 0x00, lowaddr 0x00
19:03:10.407585 IP omega.12288 > 192.168.10.1.12288: NetTLP: MWr, len 1, requester 01:00, tag 0x00, last 0x0, first 0xf, Addr 0xfee01004
19:03:10.407586 IP omega.12288 > 192.168.10.1.12288: NetTLP: MRd, len 16, requester 01:00, tag 0x00, last 0xf, first 0xf, Addr 0x5365e800
19:03:10.407597 IP 192.168.10.1.12288 > omega.12288: NetTLP: CplD, len 16, completer 00:00, success, bc 64, requester 01:00, tag 0x00, lowaddr 0x00
19:03:10.407602 IP omega.12288 > 192.168.10.1.12288: NetTLP: MWr, len 1, requester 01:00, tag 0x00, last 0x0, first 0xf, Addr 0xfee01004
19:03:10.407604 IP omega.12288 > 192.168.10.1.12288: NetTLP: MRd, len 16, requester 01:00, tag 0x00, last 0xf, first 0xf, Addr 0x5365f000
19:03:10.407615 IP 192.168.10.1.12288 > omega.12288: NetTLP: CplD, len 16, completer 00:00, success, bc 64, requester 01:00, tag 0x00, lowaddr 0x00
19:03:10.407621 IP omega.12288 > 192.168.10.1.12288: NetTLP: MWr, len 1, requester 01:00, tag 0x00, last 0x0, first 0xf, Addr 0xfee01004
19:03:10.407622 IP omega.12288 > 192.168.10.1.12288: NetTLP: MRd, len 16, requester 01:00, tag 0x00, last 0xf, first 0xf, Addr 0x5365f800
19:03:10.407634 IP 192.168.10.1.12288 > omega.12288: NetTLP: CplD, len 16, completer 00:00, success, bc 64, requester 01:00, tag 0x00, lowaddr 0x00
19:03:10.407639 IP omega.12288 > 192.168.10.1.12288: NetTLP: MWr, len 1, requester 01:00, tag 0x00, last 0x0, first 0xf, Addr 0xfee01004
19:03:10.407641 IP omega.12288 > 192.168.10.1.12288: NetTLP: MRd, len 16, requester 01:00, tag 0x00, last 0xf, first 0xf, Addr 0x53660000
19:03:10.407652 IP 192.168.10.1.12288 > omega.12288: NetTLP: CplD, len 16, completer 00:00, success, bc 64, requester 01:00, tag 0x00, lowaddr 0x00
19:03:10.407658 IP omega.12288 > 192.168.10.1.12288: NetTLP: MWr, len 1, requester 01:00, tag 0x00, last 0x0, first 0xf, Addr 0xfee01004
19:03:10.407659 IP omega.12288 > 192.168.10.1.12288: NetTLP: MRd, len 16, requester 01:00, tag 0x00, last 0xf, first 0xf, Addr 0x53660800
19:03:10.407671 IP 192.168.10.1.12288 > omega.12288: NetTLP: CplD, len 16, completer 00:00, success, bc 64, requester 01:00, tag 0x00, lowaddr 0x00
19:03:10.407676 IP omega.12288 > 192.168.10.1.12288: NetTLP: MWr, len 1, requester 01:00, tag 0x00, last 0x0, first 0xf, Addr 0xfee01004
19:03:10.407678 IP omega.12288 > 192.168.10.1.12288: NetTLP: MRd, len 16, requester 01:00, tag 0x00, last 0xf, first 0xf, Addr 0x53661000
19:03:10.407689 IP 192.168.10.1.12288 > omega.12288: NetTLP: CplD, len 16, completer 00:00, success, bc 64, requester 01:00, tag 0x00, lowaddr 0x00
19:03:10.407694 IP omega.12288 > 192.168.10.1.12288: NetTLP: MWr, len 1, requester 01:00, tag 0x00, last 0x0, first 0xf, Addr 0xfee01004
19:03:10.407696 IP omega.12288 > 192.168.10.1.12288: NetTLP: MRd, len 16, requester 01:00, tag 0x00, last 0xf, first 0xf, Addr 0x53661800
19:03:10.407708 IP 192.168.10.1.12288 > omega.12288: NetTLP: CplD, len 16, completer 00:00, success, bc 64, requester 01:00, tag 0x00, lowaddr 0x00
19:03:10.407713 IP omega.12288 > 192.168.10.1.12288: NetTLP: MWr, len 1, requester 01:00, tag 0x00, last 0x0, first 0xf, Addr 0xfee01004
19:03:10.407715 IP omega.12288 > 192.168.10.1.12288: NetTLP: MRd, len 16, requester 01:00, tag 0x00, last 0xf, first 0xf, Addr 0x53662000
19:03:10.407726 IP 192.168.10.1.12288 > omega.12288: NetTLP: CplD, len 16, completer 00:00, success, bc 64, requester 01:00, tag 0x00, lowaddr 0x00
19:03:10.407731 IP omega.12288 > 192.168.10.1.12288: NetTLP: MWr, len 1, requester 01:00, tag 0x00, last 0x0, first 0xf, Addr 0xfee01004
19:03:10.407733 IP omega.12288 > 192.168.10.1.12288: NetTLP: MRd, len 16, requester 01:00, tag 0x00, last 0xf, first 0xf, Addr 0x53662800
19:03:10.407744 IP 192.168.10.1.12288 > omega.12288: NetTLP: CplD, len 16, completer 00:00, success, bc 64, requester 01:00, tag 0x00, lowaddr 0x00
19:03:10.407750 IP omega.12288 > 192.168.10.1.12288: NetTLP: MWr, len 1, requester 01:00, tag 0x00, last 0x0, first 0xf, Addr 0xfee01004
19:03:10.407751 IP omega.12288 > 192.168.10.1.12288: NetTLP: MRd, len 16, requester 01:00, tag 0x00, last 0xf, first 0xf, Addr 0x53663000
19:03:10.407763 IP 192.168.10.1.12288 > omega.12288: NetTLP: CplD, len 16, completer 00:00, success, bc 64, requester 01:00, tag 0x00, lowaddr 0x00
19:03:10.407768 IP omega.12288 > 192.168.10.1.12288: NetTLP: MWr, len 1, requester 01:00, tag 0x00, last 0x0, first 0xf, Addr 0xfee01004
19:03:10.407770 IP omega.12288 > 192.168.10.1.12288: NetTLP: MRd, len 16, requester 01:00, tag 0x00, last 0xf, first 0xf, Addr 0x53663800
19:03:10.407781 IP 192.168.10.1.12288 > omega.12288: NetTLP: CplD, len 16, completer 00:00, success, bc 64, requester 01:00, tag 0x00, lowaddr 0x00
19:03:10.407787 IP omega.12288 > 192.168.10.1.12288: NetTLP: MWr, len 1, requester 01:00, tag 0x00, last 0x0, first 0xf, Addr 0xfee01004
19:03:10.407788 IP omega.12288 > 192.168.10.1.12288: NetTLP: MRd, len 16, requester 01:00, tag 0x00, last 0xf, first 0xf, Addr 0x53664000
19:03:10.407800 IP 192.168.10.1.12288 > omega.12288: NetTLP: CplD, len 16, completer 00:00, success, bc 64, requester 01:00, tag 0x00, lowaddr 0x00
19:03:10.407805 IP omega.12288 > 192.168.10.1.12288: NetTLP: MWr, len 1, requester 01:00, tag 0x00, last 0x0, first 0xf, Addr 0xfee01004
19:03:10.407808 IP omega.12288 > 192.168.10.1.12288: NetTLP: MRd, len 16, requester 01:00, tag 0x00, last 0xf, first 0xf, Addr 0x53664800
19:03:10.407819 IP 192.168.10.1.12288 > omega.12288: NetTLP: CplD, len 16, completer 00:00, success, bc 64, requester 01:00, tag 0x00, lowaddr 0x00
19:03:10.407825 IP omega.12288 > 192.168.10.1.12288: NetTLP: MWr, len 1, requester 01:00, tag 0x00, last 0x0, first 0xf, Addr 0xfee01004
19:03:10.407826 IP omega.12288 > 192.168.10.1.12288: NetTLP: MRd, len 16, requester 01:00, tag 0x00, last 0xf, first 0xf, Addr 0x53665000
19:03:10.407838 IP 192.168.10.1.12288 > omega.12288: NetTLP: CplD, len 16, completer 00:00, success, bc 64, requester 01:00, tag 0x00, lowaddr 0x00
19:03:10.407843 IP omega.12288 > 192.168.10.1.12288: NetTLP: MWr, len 1, requester 01:00, tag 0x00, last 0x0, first 0xf, Addr 0xfee01004
19:03:10.407845 IP omega.12288 > 192.168.10.1.12288: NetTLP: MRd, len 16, requester 01:00, tag 0x00, last 0xf, first 0xf, Addr 0x53665800
19:03:10.407856 IP 192.168.10.1.12288 > omega.12288: NetTLP: CplD, len 16, completer 00:00, success, bc 64, requester 01:00, tag 0x00, lowaddr 0x00
19:03:10.407861 IP omega.12288 > 192.168.10.1.12288: NetTLP: MWr, len 1, requester 01:00, tag 0x00, last 0x0, first 0xf, Addr 0xfee01004
19:03:10.407863 IP omega.12288 > 192.168.10.1.12288: NetTLP: MRd, len 16, requester 01:00, tag 0x00, last 0xf, first 0xf, Addr 0x53666000
19:03:10.407875 IP 192.168.10.1.12288 > omega.12288: NetTLP: CplD, len 16, completer 00:00, success, bc 64, requester 01:00, tag 0x00, lowaddr 0x00
19:03:10.407880 IP omega.12288 > 192.168.10.1.12288: NetTLP: MWr, len 1, requester 01:00, tag 0x00, last 0x0, first 0xf, Addr 0xfee01004
19:03:10.407882 IP omega.12288 > 192.168.10.1.12288: NetTLP: MRd, len 16, requester 01:00, tag 0x00, last 0xf, first 0xf, Addr 0x53666800
19:03:10.407893 IP 192.168.10.1.12288 > omega.12288: NetTLP: CplD, len 16, completer 00:00, success, bc 64, requester 01:00, tag 0x00, lowaddr 0x00
19:03:10.407898 IP omega.12288 > 192.168.10.1.12288: NetTLP: MWr, len 1, requester 01:00, tag 0x00, last 0x0, first 0xf, Addr 0xfee01004
19:03:10.407900 IP omega.12288 > 192.168.10.1.12288: NetTLP: MRd, len 16, requester 01:00, tag 0x00, last 0xf, first 0xf, Addr 0x53667000
19:03:10.407911 IP 192.168.10.1.12288 > omega.12288: NetTLP: CplD, len 16, completer 00:00, success, bc 64, requester 01:00, tag 0x00, lowaddr 0x00
19:03:10.407917 IP omega.12288 > 192.168.10.1.12288: NetTLP: MWr, len 1, requester 01:00, tag 0x00, last 0x0, first 0xf, Addr 0xfee01004
19:03:10.407918 IP omega.12288 > 192.168.10.1.12288: NetTLP: MRd, len 16, requester 01:00, tag 0x00, last 0xf, first 0xf, Addr 0x53667800
19:03:10.407930 IP 192.168.10.1.12288 > omega.12288: NetTLP: CplD, len 16, completer 00:00, success, bc 64, requester 01:00, tag 0x00, lowaddr 0x00
19:03:10.407935 IP omega.12288 > 192.168.10.1.12288: NetTLP: MWr, len 1, requester 01:00, tag 0x00, last 0x0, first 0xf, Addr 0xfee01004
19:03:10.407937 IP omega.12288 > 192.168.10.1.12288: NetTLP: MRd, len 16, requester 01:00, tag 0x00, last 0xf, first 0xf, Addr 0x53668000
19:03:10.407948 IP 192.168.10.1.12288 > omega.12288: NetTLP: CplD, len 16, completer 00:00, success, bc 64, requester 01:00, tag 0x00, lowaddr 0x00
19:03:10.407953 IP omega.12288 > 192.168.10.1.12288: NetTLP: MWr, len 1, requester 01:00, tag 0x00, last 0x0, first 0xf, Addr 0xfee01004
19:03:10.407955 IP omega.12288 > 192.168.10.1.12288: NetTLP: MRd, len 16, requester 01:00, tag 0x00, last 0xf, first 0xf, Addr 0x53668800
19:03:10.407968 IP 192.168.10.1.12288 > omega.12288: NetTLP: CplD, len 16, completer 00:00, success, bc 64, requester 01:00, tag 0x00, lowaddr 0x00
19:03:10.407974 IP omega.12288 > 192.168.10.1.12288: NetTLP: MWr, len 1, requester 01:00, tag 0x00, last 0x0, first 0xf, Addr 0xfee01004
19:03:10.407975 IP omega.12288 > 192.168.10.1.12288: NetTLP: MRd, len 16, requester 01:00, tag 0x00, last 0xf, first 0xf, Addr 0x53669000
19:03:10.407986 IP 192.168.10.1.12288 > omega.12288: NetTLP: CplD, len 16, completer 00:00, success, bc 64, requester 01:00, tag 0x00, lowaddr 0x00
19:03:10.407991 IP omega.12288 > 192.168.10.1.12288: NetTLP: MWr, len 1, requester 01:00, tag 0x00, last 0x0, first 0xf, Addr 0xfee01004
19:03:10.407993 IP omega.12288 > 192.168.10.1.12288: NetTLP: MRd, len 16, requester 01:00, tag 0x00, last 0xf, first 0xf, Addr 0x53669800
19:03:10.408005 IP 192.168.10.1.12288 > omega.12288: NetTLP: CplD, len 16, completer 00:00, success, bc 64, requester 01:00, tag 0x00, lowaddr 0x00
19:03:10.408010 IP omega.12288 > 192.168.10.1.12288: NetTLP: MWr, len 1, requester 01:00, tag 0x00, last 0x0, first 0xf, Addr 0xfee01004
19:03:10.408012 IP omega.12288 > 192.168.10.1.12288: NetTLP: MRd, len 16, requester 01:00, tag 0x00, last 0xf, first 0xf, Addr 0x5366a000
19:03:10.408023 IP 192.168.10.1.12288 > omega.12288: NetTLP: CplD, len 16, completer 00:00, success, bc 64, requester 01:00, tag 0x00, lowaddr 0x00
19:03:10.408028 IP omega.12288 > 192.168.10.1.12288: NetTLP: MWr, len 1, requester 01:00, tag 0x00, last 0x0, first 0xf, Addr 0xfee01004
19:03:10.408030 IP omega.12288 > 192.168.10.1.12288: NetTLP: MRd, len 16, requester 01:00, tag 0x00, last 0xf, first 0xf, Addr 0x5366a800
19:03:10.408041 IP 192.168.10.1.12288 > omega.12288: NetTLP: CplD, len 16, completer 00:00, success, bc 64, requester 01:00, tag 0x00, lowaddr 0x00
19:03:10.408047 IP omega.12288 > 192.168.10.1.12288: NetTLP: MWr, len 1, requester 01:00, tag 0x00, last 0x0, first 0xf, Addr 0xfee01004
19:03:10.408048 IP omega.12288 > 192.168.10.1.12288: NetTLP: MRd, len 16, requester 01:00, tag 0x00, last 0xf, first 0xf, Addr 0x5366b000
19:03:10.408060 IP 192.168.10.1.12288 > omega.12288: NetTLP: CplD, len 16, completer 00:00, success, bc 64, requester 01:00, tag 0x00, lowaddr 0x00
19:03:10.408065 IP omega.12288 > 192.168.10.1.12288: NetTLP: MWr, len 1, requester 01:00, tag 0x00, last 0x0, first 0xf, Addr 0xfee01004
19:03:10.408067 IP omega.12288 > 192.168.10.1.12288: NetTLP: MRd, len 16, requester 01:00, tag 0x00, last 0xf, first 0xf, Addr 0x5366b800
19:03:10.408078 IP 192.168.10.1.12288 > omega.12288: NetTLP: CplD, len 16, completer 00:00, success, bc 64, requester 01:00, tag 0x00, lowaddr 0x00
19:03:10.408084 IP omega.12288 > 192.168.10.1.12288: NetTLP: MWr, len 1, requester 01:00, tag 0x00, last 0x0, first 0xf, Addr 0xfee01004
19:03:10.408085 IP omega.12288 > 192.168.10.1.12288: NetTLP: MRd, len 16, requester 01:00, tag 0x00, last 0xf, first 0xf, Addr 0x5366c000
19:03:10.408097 IP 192.168.10.1.12288 > omega.12288: NetTLP: CplD, len 16, completer 00:00, success, bc 64, requester 01:00, tag 0x00, lowaddr 0x00
19:03:10.408102 IP omega.12288 > 192.168.10.1.12288: NetTLP: MWr, len 1, requester 01:00, tag 0x00, last 0x0, first 0xf, Addr 0xfee01004
19:03:10.408104 IP omega.12288 > 192.168.10.1.12288: NetTLP: MRd, len 16, requester 01:00, tag 0x00, last 0xf, first 0xf, Addr 0x5366c800
19:03:10.408115 IP 192.168.10.1.12288 > omega.12288: NetTLP: CplD, len 16, completer 00:00, success, bc 64, requester 01:00, tag 0x00, lowaddr 0x00
19:03:10.408122 IP omega.12288 > 192.168.10.1.12288: NetTLP: MWr, len 1, requester 01:00, tag 0x00, last 0x0, first 0xf, Addr 0xfee01004
19:03:10.408124 IP omega.12288 > 192.168.10.1.12288: NetTLP: MRd, len 16, requester 01:00, tag 0x00, last 0xf, first 0xf, Addr 0x5366d000
19:03:10.408136 IP 192.168.10.1.12288 > omega.12288: NetTLP: CplD, len 16, completer 00:00, success, bc 64, requester 01:00, tag 0x00, lowaddr 0x00
19:03:10.408141 IP omega.12288 > 192.168.10.1.12288: NetTLP: MWr, len 1, requester 01:00, tag 0x00, last 0x0, first 0xf, Addr 0xfee01004
19:03:10.408143 IP omega.12288 > 192.168.10.1.12288: NetTLP: MRd, len 16, requester 01:00, tag 0x00, last 0xf, first 0xf, Addr 0x5366d800
19:03:10.408154 IP 192.168.10.1.12288 > omega.12288: NetTLP: CplD, len 16, completer 00:00, success, bc 64, requester 01:00, tag 0x00, lowaddr 0x00
19:03:10.408160 IP omega.12288 > 192.168.10.1.12288: NetTLP: MWr, len 1, requester 01:00, tag 0x00, last 0x0, first 0xf, Addr 0xfee01004
19:03:10.408161 IP omega.12288 > 192.168.10.1.12288: NetTLP: MRd, len 16, requester 01:00, tag 0x00, last 0xf, first 0xf, Addr 0x5366e000
19:03:10.408172 IP 192.168.10.1.12288 > omega.12288: NetTLP: CplD, len 16, completer 00:00, success, bc 64, requester 01:00, tag 0x00, lowaddr 0x00
19:03:10.408178 IP omega.12288 > 192.168.10.1.12288: NetTLP: MWr, len 1, requester 01:00, tag 0x00, last 0x0, first 0xf, Addr 0xfee01004
19:03:10.408179 IP omega.12288 > 192.168.10.1.12288: NetTLP: MRd, len 16, requester 01:00, tag 0x00, last 0xf, first 0xf, Addr 0x5366e800
19:03:10.408191 IP 192.168.10.1.12288 > omega.12288: NetTLP: CplD, len 16, completer 00:00, success, bc 64, requester 01:00, tag 0x00, lowaddr 0x00
19:03:10.408196 IP omega.12288 > 192.168.10.1.12288: NetTLP: MWr, len 1, requester 01:00, tag 0x00, last 0x0, first 0xf, Addr 0xfee01004
19:03:10.408198 IP omega.12288 > 192.168.10.1.12288: NetTLP: MRd, len 16, requester 01:00, tag 0x00, last 0xf, first 0xf, Addr 0x5366f000
19:03:10.408209 IP 192.168.10.1.12288 > omega.12288: NetTLP: CplD, len 16, completer 00:00, success, bc 64, requester 01:00, tag 0x00, lowaddr 0x00
19:03:10.408215 IP omega.12288 > 192.168.10.1.12288: NetTLP: MWr, len 1, requester 01:00, tag 0x00, last 0x0, first 0xf, Addr 0xfee01004
19:03:10.408216 IP omega.12288 > 192.168.10.1.12288: NetTLP: MRd, len 16, requester 01:00, tag 0x00, last 0xf, first 0xf, Addr 0x5366f800
19:03:10.408228 IP 192.168.10.1.12288 > omega.12288: NetTLP: CplD, len 16, completer 00:00, success, bc 64, requester 01:00, tag 0x00, lowaddr 0x00
19:03:10.408233 IP omega.12288 > 192.168.10.1.12288: NetTLP: MWr, len 1, requester 01:00, tag 0x00, last 0x0, first 0xf, Addr 0xfee01004
19:03:10.408235 IP omega.12288 > 192.168.10.1.12288: NetTLP: MRd, len 16, requester 01:00, tag 0x00, last 0xf, first 0xf, Addr 0x53670000
19:03:10.408246 IP 192.168.10.1.12288 > omega.12288: NetTLP: CplD, len 16, completer 00:00, success, bc 64, requester 01:00, tag 0x00, lowaddr 0x00
19:03:10.408252 IP omega.12288 > 192.168.10.1.12288: NetTLP: MWr, len 1, requester 01:00, tag 0x00, last 0x0, first 0xf, Addr 0xfee01004
19:03:10.408253 IP omega.12288 > 192.168.10.1.12288: NetTLP: MRd, len 16, requester 01:00, tag 0x00, last 0xf, first 0xf, Addr 0x53670800
19:03:10.408265 IP 192.168.10.1.12288 > omega.12288: NetTLP: CplD, len 16, completer 00:00, success, bc 64, requester 01:00, tag 0x00, lowaddr 0x00
19:03:10.408270 IP omega.12288 > 192.168.10.1.12288: NetTLP: MWr, len 1, requester 01:00, tag 0x00, last 0x0, first 0xf, Addr 0xfee01004
19:03:10.408272 IP omega.12288 > 192.168.10.1.12288: NetTLP: MRd, len 16, requester 01:00, tag 0x00, last 0xf, first 0xf, Addr 0x53671000
19:03:10.408283 IP 192.168.10.1.12288 > omega.12288: NetTLP: CplD, len 16, completer 00:00, success, bc 64, requester 01:00, tag 0x00, lowaddr 0x00
19:03:10.408288 IP omega.12288 > 192.168.10.1.12288: NetTLP: MWr, len 1, requester 01:00, tag 0x00, last 0x0, first 0xf, Addr 0xfee01004
19:03:10.408290 IP omega.12288 > 192.168.10.1.12288: NetTLP: MRd, len 16, requester 01:00, tag 0x00, last 0xf, first 0xf, Addr 0x53671800
19:03:10.408302 IP 192.168.10.1.12288 > omega.12288: NetTLP: CplD, len 16, completer 00:00, success, bc 64, requester 01:00, tag 0x00, lowaddr 0x00
19:03:10.408307 IP omega.12288 > 192.168.10.1.12288: NetTLP: MWr, len 1, requester 01:00, tag 0x00, last 0x0, first 0xf, Addr 0xfee01004
19:03:10.408309 IP omega.12288 > 192.168.10.1.12288: NetTLP: MRd, len 16, requester 01:00, tag 0x00, last 0xf, first 0xf, Addr 0x53672000
19:03:10.408320 IP 192.168.10.1.12288 > omega.12288: NetTLP: CplD, len 16, completer 00:00, success, bc 64, requester 01:00, tag 0x00, lowaddr 0x00
19:03:10.408325 IP omega.12288 > 192.168.10.1.12288: NetTLP: MWr, len 1, requester 01:00, tag 0x00, last 0x0, first 0xf, Addr 0xfee01004
19:03:10.408327 IP omega.12288 > 192.168.10.1.12288: NetTLP: MRd, len 16, requester 01:00, tag 0x00, last 0xf, first 0xf, Addr 0x53672800
19:03:10.408338 IP 192.168.10.1.12288 > omega.12288: NetTLP: CplD, len 16, completer 00:00, success, bc 64, requester 01:00, tag 0x00, lowaddr 0x00
19:03:10.408344 IP omega.12288 > 192.168.10.1.12288: NetTLP: MWr, len 1, requester 01:00, tag 0x00, last 0x0, first 0xf, Addr 0xfee01004
19:03:10.408345 IP omega.12288 > 192.168.10.1.12288: NetTLP: MRd, len 16, requester 01:00, tag 0x00, last 0xf, first 0xf, Addr 0x53673000
19:03:10.408357 IP 192.168.10.1.12288 > omega.12288: NetTLP: CplD, len 16, completer 00:00, success, bc 64, requester 01:00, tag 0x00, lowaddr 0x00
19:03:10.408362 IP omega.12288 > 192.168.10.1.12288: NetTLP: MWr, len 1, requester 01:00, tag 0x00, last 0x0, first 0xf, Addr 0xfee01004
19:03:10.408364 IP omega.12288 > 192.168.10.1.12288: NetTLP: MRd, len 16, requester 01:00, tag 0x00, last 0xf, first 0xf, Addr 0x53673800
19:03:10.408375 IP 192.168.10.1.12288 > omega.12288: NetTLP: CplD, len 16, completer 00:00, success, bc 64, requester 01:00, tag 0x00, lowaddr 0x00
19:03:10.408385 IP omega.12288 > 192.168.10.1.12288: NetTLP: MWr, len 1, requester 01:00, tag 0x00, last 0x0, first 0xf, Addr 0xfee01004
19:03:10.408387 IP omega.12288 > 192.168.10.1.12288: NetTLP: MRd, len 16, requester 01:00, tag 0x00, last 0xf, first 0xf, Addr 0x53674000
19:03:10.408398 IP 192.168.10.1.12288 > omega.12288: NetTLP: CplD, len 16, completer 00:00, success, bc 64, requester 01:00, tag 0x00, lowaddr 0x00
19:03:10.408403 IP omega.12288 > 192.168.10.1.12288: NetTLP: MWr, len 1, requester 01:00, tag 0x00, last 0x0, first 0xf, Addr 0xfee01004
19:03:10.408406 IP omega.12288 > 192.168.10.1.12288: NetTLP: MRd, len 16, requester 01:00, tag 0x00, last 0xf, first 0xf, Addr 0x53674800
19:03:10.408417 IP 192.168.10.1.12288 > omega.12288: NetTLP: CplD, len 16, completer 00:00, success, bc 64, requester 01:00, tag 0x00, lowaddr 0x00
19:03:10.408423 IP omega.12288 > 192.168.10.1.12288: NetTLP: MWr, len 1, requester 01:00, tag 0x00, last 0x0, first 0xf, Addr 0xfee01004
19:03:10.408425 IP omega.12288 > 192.168.10.1.12288: NetTLP: MRd, len 16, requester 01:00, tag 0x00, last 0xf, first 0xf, Addr 0x53675000
19:03:10.408436 IP 192.168.10.1.12288 > omega.12288: NetTLP: CplD, len 16, completer 00:00, success, bc 64, requester 01:00, tag 0x00, lowaddr 0x00
19:03:10.408441 IP omega.12288 > 192.168.10.1.12288: NetTLP: MWr, len 1, requester 01:00, tag 0x00, last 0x0, first 0xf, Addr 0xfee01004
19:03:10.408443 IP omega.12288 > 192.168.10.1.12288: NetTLP: MRd, len 16, requester 01:00, tag 0x00, last 0xf, first 0xf, Addr 0x53675800
19:03:10.408455 IP 192.168.10.1.12288 > omega.12288: NetTLP: CplD, len 16, completer 00:00, success, bc 64, requester 01:00, tag 0x00, lowaddr 0x00
19:03:10.408460 IP omega.12288 > 192.168.10.1.12288: NetTLP: MWr, len 1, requester 01:00, tag 0x00, last 0x0, first 0xf, Addr 0xfee01004
19:03:10.408461 IP omega.12288 > 192.168.10.1.12288: NetTLP: MRd, len 16, requester 01:00, tag 0x00, last 0xf, first 0xf, Addr 0x53676000
19:03:10.408473 IP 192.168.10.1.12288 > omega.12288: NetTLP: CplD, len 16, completer 00:00, success, bc 64, requester 01:00, tag 0x00, lowaddr 0x00
19:03:10.408478 IP omega.12288 > 192.168.10.1.12288: NetTLP: MWr, len 1, requester 01:00, tag 0x00, last 0x0, first 0xf, Addr 0xfee01004
19:03:10.408480 IP omega.12288 > 192.168.10.1.12288: NetTLP: MRd, len 16, requester 01:00, tag 0x00, last 0xf, first 0xf, Addr 0x53676800
19:03:10.408491 IP 192.168.10.1.12288 > omega.12288: NetTLP: CplD, len 16, completer 00:00, success, bc 64, requester 01:00, tag 0x00, lowaddr 0x00
19:03:10.408496 IP omega.12288 > 192.168.10.1.12288: NetTLP: MWr, len 1, requester 01:00, tag 0x00, last 0x0, first 0xf, Addr 0xfee01004
19:03:10.408498 IP omega.12288 > 192.168.10.1.12288: NetTLP: MRd, len 16, requester 01:00, tag 0x00, last 0xf, first 0xf, Addr 0x53677000
19:03:10.408509 IP 192.168.10.1.12288 > omega.12288: NetTLP: CplD, len 16, completer 00:00, success, bc 64, requester 01:00, tag 0x00, lowaddr 0x00
19:03:10.408515 IP omega.12288 > 192.168.10.1.12288: NetTLP: MWr, len 1, requester 01:00, tag 0x00, last 0x0, first 0xf, Addr 0xfee01004
19:03:10.408516 IP omega.12288 > 192.168.10.1.12288: NetTLP: MRd, len 16, requester 01:00, tag 0x00, last 0xf, first 0xf, Addr 0x53677800
19:03:10.408528 IP 192.168.10.1.12288 > omega.12288: NetTLP: CplD, len 16, completer 00:00, success, bc 64, requester 01:00, tag 0x00, lowaddr 0x00
19:03:10.408533 IP omega.12288 > 192.168.10.1.12288: NetTLP: MWr, len 1, requester 01:00, tag 0x00, last 0x0, first 0xf, Addr 0xfee01004
19:03:10.408535 IP omega.12288 > 192.168.10.1.12288: NetTLP: MRd, len 16, requester 01:00, tag 0x00, last 0xf, first 0xf, Addr 0x53678000
19:03:10.408546 IP 192.168.10.1.12288 > omega.12288: NetTLP: CplD, len 16, completer 00:00, success, bc 64, requester 01:00, tag 0x00, lowaddr 0x00
19:03:10.408552 IP omega.12288 > 192.168.10.1.12288: NetTLP: MWr, len 1, requester 01:00, tag 0x00, last 0x0, first 0xf, Addr 0xfee01004
19:03:10.408553 IP omega.12288 > 192.168.10.1.12288: NetTLP: MRd, len 16, requester 01:00, tag 0x00, last 0xf, first 0xf, Addr 0x53678800
19:03:10.408565 IP 192.168.10.1.12288 > omega.12288: NetTLP: CplD, len 16, completer 00:00, success, bc 64, requester 01:00, tag 0x00, lowaddr 0x00
19:03:10.408570 IP omega.12288 > 192.168.10.1.12288: NetTLP: MWr, len 1, requester 01:00, tag 0x00, last 0x0, first 0xf, Addr 0xfee01004
19:03:10.408572 IP omega.12288 > 192.168.10.1.12288: NetTLP: MRd, len 16, requester 01:00, tag 0x00, last 0xf, first 0xf, Addr 0x53679000
19:03:10.408583 IP 192.168.10.1.12288 > omega.12288: NetTLP: CplD, len 16, completer 00:00, success, bc 64, requester 01:00, tag 0x00, lowaddr 0x00
19:03:10.408588 IP omega.12288 > 192.168.10.1.12288: NetTLP: MWr, len 1, requester 01:00, tag 0x00, last 0x0, first 0xf, Addr 0xfee01004
19:03:10.408590 IP omega.12288 > 192.168.10.1.12288: NetTLP: MRd, len 16, requester 01:00, tag 0x00, last 0xf, first 0xf, Addr 0x53679800
19:03:10.408601 IP 192.168.10.1.12288 > omega.12288: NetTLP: CplD, len 16, completer 00:00, success, bc 64, requester 01:00, tag 0x00, lowaddr 0x00
19:03:10.408607 IP omega.12288 > 192.168.10.1.12288: NetTLP: MWr, len 1, requester 01:00, tag 0x00, last 0x0, first 0xf, Addr 0xfee01004
19:03:10.408608 IP omega.12288 > 192.168.10.1.12288: NetTLP: MRd, len 16, requester 01:00, tag 0x00, last 0xf, first 0xf, Addr 0x5367a000
19:03:10.408620 IP 192.168.10.1.12288 > omega.12288: NetTLP: CplD, len 16, completer 00:00, success, bc 64, requester 01:00, tag 0x00, lowaddr 0x00
19:03:10.408625 IP omega.12288 > 192.168.10.1.12288: NetTLP: MWr, len 1, requester 01:00, tag 0x00, last 0x0, first 0xf, Addr 0xfee01004
19:03:10.408627 IP omega.12288 > 192.168.10.1.12288: NetTLP: MRd, len 16, requester 01:00, tag 0x00, last 0xf, first 0xf, Addr 0x5367a800
19:03:10.408638 IP 192.168.10.1.12288 > omega.12288: NetTLP: CplD, len 16, completer 00:00, success, bc 64, requester 01:00, tag 0x00, lowaddr 0x00
19:03:10.408644 IP omega.12288 > 192.168.10.1.12288: NetTLP: MWr, len 1, requester 01:00, tag 0x00, last 0x0, first 0xf, Addr 0xfee01004
19:03:10.408645 IP omega.12288 > 192.168.10.1.12288: NetTLP: MRd, len 16, requester 01:00, tag 0x00, last 0xf, first 0xf, Addr 0x5367b000
19:03:10.408657 IP 192.168.10.1.12288 > omega.12288: NetTLP: CplD, len 16, completer 00:00, success, bc 64, requester 01:00, tag 0x00, lowaddr 0x00
19:03:10.408662 IP omega.12288 > 192.168.10.1.12288: NetTLP: MWr, len 1, requester 01:00, tag 0x00, last 0x0, first 0xf, Addr 0xfee01004
19:03:10.408664 IP omega.12288 > 192.168.10.1.12288: NetTLP: MRd, len 16, requester 01:00, tag 0x00, last 0xf, first 0xf, Addr 0x5367b800
19:03:10.408675 IP 192.168.10.1.12288 > omega.12288: NetTLP: CplD, len 16, completer 00:00, success, bc 64, requester 01:00, tag 0x00, lowaddr 0x00
19:03:10.408681 IP omega.12288 > 192.168.10.1.12288: NetTLP: MWr, len 1, requester 01:00, tag 0x00, last 0x0, first 0xf, Addr 0xfee01004
19:03:10.408683 IP omega.12288 > 192.168.10.1.12288: NetTLP: MRd, len 16, requester 01:00, tag 0x00, last 0xf, first 0xf, Addr 0x5367c000
19:03:10.408694 IP 192.168.10.1.12288 > omega.12288: NetTLP: CplD, len 16, completer 00:00, success, bc 64, requester 01:00, tag 0x00, lowaddr 0x00
19:03:10.408699 IP omega.12288 > 192.168.10.1.12288: NetTLP: MWr, len 1, requester 01:00, tag 0x00, last 0x0, first 0xf, Addr 0xfee01004
19:03:10.408701 IP omega.12288 > 192.168.10.1.12288: NetTLP: MRd, len 16, requester 01:00, tag 0x00, last 0xf, first 0xf, Addr 0x5367c800
19:03:10.408713 IP 192.168.10.1.12288 > omega.12288: NetTLP: CplD, len 16, completer 00:00, success, bc 64, requester 01:00, tag 0x00, lowaddr 0x00
19:03:10.408718 IP omega.12288 > 192.168.10.1.12288: NetTLP: MWr, len 1, requester 01:00, tag 0x00, last 0x0, first 0xf, Addr 0xfee01004
19:03:10.408720 IP omega.12288 > 192.168.10.1.12288: NetTLP: MRd, len 16, requester 01:00, tag 0x00, last 0xf, first 0xf, Addr 0x5367d000
19:03:10.408731 IP 192.168.10.1.12288 > omega.12288: NetTLP: CplD, len 16, completer 00:00, success, bc 64, requester 01:00, tag 0x00, lowaddr 0x00
19:03:10.408736 IP omega.12288 > 192.168.10.1.12288: NetTLP: MWr, len 1, requester 01:00, tag 0x00, last 0x0, first 0xf, Addr 0xfee01004
19:03:10.408737 IP omega.12288 > 192.168.10.1.12288: NetTLP: MRd, len 16, requester 01:00, tag 0x00, last 0xf, first 0xf, Addr 0x5367d800
19:03:10.408748 IP 192.168.10.1.12288 > omega.12288: NetTLP: CplD, len 16, completer 00:00, success, bc 64, requester 01:00, tag 0x00, lowaddr 0x00
19:03:10.408753 IP omega.12288 > 192.168.10.1.12288: NetTLP: MWr, len 1, requester 01:00, tag 0x00, last 0x0, first 0xf, Addr 0xfee01004
19:03:10.408755 IP omega.12288 > 192.168.10.1.12288: NetTLP: MRd, len 16, requester 01:00, tag 0x00, last 0xf, first 0xf, Addr 0x5367e000
19:03:10.408766 IP 192.168.10.1.12288 > omega.12288: NetTLP: CplD, len 16, completer 00:00, success, bc 64, requester 01:00, tag 0x00, lowaddr 0x00
19:03:10.408772 IP omega.12288 > 192.168.10.1.12288: NetTLP: MWr, len 1, requester 01:00, tag 0x00, last 0x0, first 0xf, Addr 0xfee01004
19:03:10.408773 IP omega.12288 > 192.168.10.1.12288: NetTLP: MRd, len 16, requester 01:00, tag 0x00, last 0xf, first 0xf, Addr 0x5367e800
19:03:10.408785 IP 192.168.10.1.12288 > omega.12288: NetTLP: CplD, len 16, completer 00:00, success, bc 64, requester 01:00, tag 0x00, lowaddr 0x00
19:03:10.408790 IP omega.12288 > 192.168.10.1.12288: NetTLP: MWr, len 1, requester 01:00, tag 0x00, last 0x0, first 0xf, Addr 0xfee01004
19:03:10.408792 IP omega.12288 > 192.168.10.1.12288: NetTLP: MRd, len 16, requester 01:00, tag 0x00, last 0xf, first 0xf, Addr 0x5367f000
19:03:10.408803 IP 192.168.10.1.12288 > omega.12288: NetTLP: CplD, len 16, completer 00:00, success, bc 64, requester 01:00, tag 0x00, lowaddr 0x00
19:03:10.408809 IP omega.12288 > 192.168.10.1.12288: NetTLP: MWr, len 1, requester 01:00, tag 0x00, last 0x0, first 0xf, Addr 0xfee01004
19:03:10.408810 IP omega.12288 > 192.168.10.1.12288: NetTLP: MRd, len 16, requester 01:00, tag 0x00, last 0xf, first 0xf, Addr 0x5367f800
19:03:10.408822 IP 192.168.10.1.12288 > omega.12288: NetTLP: CplD, len 16, completer 00:00, success, bc 64, requester 01:00, tag 0x00, lowaddr 0x00
19:03:10.408827 IP omega.12288 > 192.168.10.1.12288: NetTLP: MWr, len 1, requester 01:00, tag 0x00, last 0x0, first 0xf, Addr 0xfee01004
19:03:10.408829 IP omega.12288 > 192.168.10.1.12288: NetTLP: MRd, len 16, requester 01:00, tag 0x00, last 0xf, first 0xf, Addr 0x53680000
19:03:10.408840 IP 192.168.10.1.12288 > omega.12288: NetTLP: CplD, len 16, completer 00:00, success, bc 64, requester 01:00, tag 0x00, lowaddr 0x00
19:03:10.408845 IP omega.12288 > 192.168.10.1.12288: NetTLP: MWr, len 1, requester 01:00, tag 0x00, last 0x0, first 0xf, Addr 0xfee01004

