
19:01:07.320105 IP 192.168.10.1.16384 > omega.16384: NetTLP: MWr, len 2, requester 00:00, tag 0x00, last 0xf, first 0xf, Addr 0x80000030
19:01:07.320110 IP 192.168.10.1.16384 > omega.16384: NetTLP: MWr, len 2, requester 00:00, tag 0x00, last 0xf, first 0xf, Addr 0x80000038
19:01:07.320112 IP 192.168.10.1.16384 > omega.16384: NetTLP: MWr, len 2, requester 00:00, tag 0x00, last 0xf, first 0xf, Addr 0x80000030
19:01:07.320113 IP 192.168.10.1.16384 > omega.16384: NetTLP: MWr, len 2, requester 00:00, tag 0x00, last 0xf, first 0xf, Addr 0x80000038
19:01:07.320114 IP 192.168.10.1.16384 > omega.16384: NetTLP: MWr, len 2, requester 00:00, tag 0x00, last 0xf, first 0xf, Addr 0x80000030
19:01:07.320115 IP 192.168.10.1.16384 > omega.16384: NetTLP: MWr, len 2, requester 00:00, tag 0x00, last 0xf, first 0xf, Addr 0x80000038
19:01:07.320121 IP 192.168.10.1.16384 > omega.16384: NetTLP: MWr, len 2, requester 00:00, tag 0x00, last 0xf, first 0xf, Addr 0x80000030
19:01:07.320123 IP 192.168.10.1.16384 > omega.16384: NetTLP: MWr, len 2, requester 00:00, tag 0x00, last 0xf, first 0xf, Addr 0x80000038
19:01:07.320131 IP 192.168.10.1.16384 > omega.16384: NetTLP: MWr, len 2, requester 00:00, tag 0x00, last 0xf, first 0xf, Addr 0x80000030
19:01:07.320131 IP omega.12289 > 192.168.10.1.12289: NetTLP: MRd, len 16, requester 01:00, tag 0x01, last 0xf, first 0xf, Addr 0x53640800
19:01:07.320132 IP 192.168.10.1.16384 > omega.16384: NetTLP: MWr, len 2, requester 00:00, tag 0x00, last 0xf, first 0xf, Addr 0x80000038
19:01:07.320134 IP 192.168.10.1.16384 > omega.16384: NetTLP: MWr, len 2, requester 00:00, tag 0x00, last 0xf, first 0xf, Addr 0x80000030
19:01:07.320135 IP 192.168.10.1.16384 > omega.16384: NetTLP: MWr, len 2, requester 00:00, tag 0x00, last 0xf, first 0xf, Addr 0x80000038
19:01:07.320144 IP 192.168.10.1.16384 > omega.16384: NetTLP: MWr, len 2, requester 00:00, tag 0x00, last 0xf, first 0xf, Addr 0x80000030
19:01:07.320145 IP 192.168.10.1.16384 > omega.16384: NetTLP: MWr, len 2, requester 00:00, tag 0x00, last 0xf, first 0xf, Addr 0x80000038
19:01:07.320146 IP 192.168.10.1.12289 > omega.12289: NetTLP: CplD, len 16, completer 00:00, success, bc 64, requester 01:00, tag 0x01, lowaddr 0x00
19:01:07.320148 IP 192.168.10.1.16384 > omega.16384: NetTLP: MWr, len 2, requester 00:00, tag 0x00, last 0xf, first 0xf, Addr 0x80000030
19:01:07.320149 IP 192.168.10.1.16384 > omega.16384: NetTLP: MWr, len 2, requester 00:00, tag 0x00, last 0xf, first 0xf, Addr 0x80000038
19:01:07.320153 IP omega.12289 > 192.168.10.1.12289: NetTLP: MWr, len 1, requester 01:00, tag 0x01, last 0x0, first 0xf, Addr 0xfee02004
19:01:07.320157 IP omega.12289 > 192.168.10.1.12289: NetTLP: MRd, len 16, requester 01:00, tag 0x01, last 0xf, first 0xf, Addr 0x53641000
19:01:07.320158 IP 192.168.10.1.16384 > omega.16384: NetTLP: MWr, len 2, requester 00:00, tag 0x00, last 0xf, first 0xf, Addr 0x80000030
19:01:07.320160 IP 192.168.10.1.16384 > omega.16384: NetTLP: MWr, len 2, requester 00:00, tag 0x00, last 0xf, first 0xf, Addr 0x80000038
19:01:07.320161 IP 192.168.10.1.16384 > omega.16384: NetTLP: MWr, len 2, requester 00:00, tag 0x00, last 0xf, first 0xf, Addr 0x80000030
19:01:07.320163 IP 192.168.10.1.16384 > omega.16384: NetTLP: MWr, len 2, requester 00:00, tag 0x00, last 0xf, first 0xf, Addr 0x80000038
19:01:07.320181 IP 192.168.10.1.12289 > omega.12289: NetTLP: CplD, len 16, completer 00:00, success, bc 64, requester 01:00, tag 0x01, lowaddr 0x00
19:01:07.320186 IP omega.12289 > 192.168.10.1.12289: NetTLP: MWr, len 1, requester 01:00, tag 0x01, last 0x0, first 0xf, Addr 0xfee02004
19:01:07.320188 IP omega.12289 > 192.168.10.1.12289: NetTLP: MRd, len 16, requester 01:00, tag 0x01, last 0xf, first 0xf, Addr 0x53641800
19:01:07.320200 IP 192.168.10.1.12289 > omega.12289: NetTLP: CplD, len 16, completer 00:00, success, bc 64, requester 01:00, tag 0x01, lowaddr 0x00
19:01:07.320205 IP omega.12289 > 192.168.10.1.12289: NetTLP: MWr, len 1, requester 01:00, tag 0x01, last 0x0, first 0xf, Addr 0xfee02004
19:01:07.320207 IP omega.12289 > 192.168.10.1.12289: NetTLP: MRd, len 16, requester 01:00, tag 0x01, last 0xf, first 0xf, Addr 0x53642000
19:01:07.320219 IP 192.168.10.1.12289 > omega.12289: NetTLP: CplD, len 16, completer 00:00, success, bc 64, requester 01:00, tag 0x01, lowaddr 0x00
19:01:07.320224 IP omega.12289 > 192.168.10.1.12289: NetTLP: MWr, len 1, requester 01:00, tag 0x01, last 0x0, first 0xf, Addr 0xfee02004
19:01:07.320226 IP omega.12289 > 192.168.10.1.12289: NetTLP: MRd, len 16, requester 01:00, tag 0x01, last 0xf, first 0xf, Addr 0x53642800
19:01:07.320237 IP 192.168.10.1.12289 > omega.12289: NetTLP: CplD, len 16, completer 00:00, success, bc 64, requester 01:00, tag 0x01, lowaddr 0x00
19:01:07.320242 IP omega.12289 > 192.168.10.1.12289: NetTLP: MWr, len 1, requester 01:00, tag 0x01, last 0x0, first 0xf, Addr 0xfee02004
19:01:07.320244 IP omega.12289 > 192.168.10.1.12289: NetTLP: MRd, len 16, requester 01:00, tag 0x01, last 0xf, first 0xf, Addr 0x53643000
19:01:07.320255 IP 192.168.10.1.12289 > omega.12289: NetTLP: CplD, len 16, completer 00:00, success, bc 64, requester 01:00, tag 0x01, lowaddr 0x00
19:01:07.320261 IP omega.12289 > 192.168.10.1.12289: NetTLP: MWr, len 1, requester 01:00, tag 0x01, last 0x0, first 0xf, Addr 0xfee02004
19:01:07.320262 IP omega.12289 > 192.168.10.1.12289: NetTLP: MRd, len 16, requester 01:00, tag 0x01, last 0xf, first 0xf, Addr 0x53643800
19:01:07.320274 IP 192.168.10.1.12289 > omega.12289: NetTLP: CplD, len 16, completer 00:00, success, bc 64, requester 01:00, tag 0x01, lowaddr 0x00
19:01:07.320279 IP omega.12289 > 192.168.10.1.12289: NetTLP: MWr, len 1, requester 01:00, tag 0x01, last 0x0, first 0xf, Addr 0xfee02004
19:01:07.320281 IP omega.12289 > 192.168.10.1.12289: NetTLP: MRd, len 16, requester 01:00, tag 0x01, last 0xf, first 0xf, Addr 0x53644000
19:01:07.320292 IP 192.168.10.1.12289 > omega.12289: NetTLP: CplD, len 16, completer 00:00, success, bc 64, requester 01:00, tag 0x01, lowaddr 0x00
19:01:07.320297 IP omega.12289 > 192.168.10.1.12289: NetTLP: MWr, len 1, requester 01:00, tag 0x01, last 0x0, first 0xf, Addr 0xfee02004
19:01:07.320300 IP omega.12289 > 192.168.10.1.12289: NetTLP: MRd, len 16, requester 01:00, tag 0x01, last 0xf, first 0xf, Addr 0x53644800
19:01:07.320312 IP 192.168.10.1.12289 > omega.12289: NetTLP: CplD, len 16, completer 00:00, success, bc 64, requester 01:00, tag 0x01, lowaddr 0x00
19:01:07.320317 IP omega.12289 > 192.168.10.1.12289: NetTLP: MWr, len 1, requester 01:00, tag 0x01, last 0x0, first 0xf, Addr 0xfee02004
19:01:07.320318 IP omega.12289 > 192.168.10.1.12289: NetTLP: MRd, len 16, requester 01:00, tag 0x01, last 0xf, first 0xf, Addr 0x53645000
19:01:07.320330 IP 192.168.10.1.12289 > omega.12289: NetTLP: CplD, len 16, completer 00:00, success, bc 64, requester 01:00, tag 0x01, lowaddr 0x00
19:01:07.320335 IP omega.12289 > 192.168.10.1.12289: NetTLP: MWr, len 1, requester 01:00, tag 0x01, last 0x0, first 0xf, Addr 0xfee02004

