19:08:15.253959 IP 192.168.10.1.16384 > omega.16384: NetTLP: MWr, len 2, requester 00:00, tag 0x00, last 0xf, first 0xf, Addr 0x80000030
19:08:15.253962 IP 192.168.10.1.16384 > omega.16384: NetTLP: MWr, len 2, requester 00:00, tag 0x00, last 0xf, first 0xf, Addr 0x80000038
19:08:15.253963 IP 192.168.10.1.16384 > omega.16384: NetTLP: MWr, len 2, requester 00:00, tag 0x00, last 0xf, first 0xf, Addr 0x80000030
19:08:15.253965 IP 192.168.10.1.16384 > omega.16384: NetTLP: MWr, len 2, requester 00:00, tag 0x00, last 0xf, first 0xf, Addr 0x80000038
19:08:15.253966 IP 192.168.10.1.16384 > omega.16384: NetTLP: MWr, len 2, requester 00:00, tag 0x00, last 0xf, first 0xf, Addr 0x80000030
19:08:15.253967 IP 192.168.10.1.16384 > omega.16384: NetTLP: MWr, len 2, requester 00:00, tag 0x00, last 0xf, first 0xf, Addr 0x80000038
19:08:15.253973 IP 192.168.10.1.16384 > omega.16384: NetTLP: MWr, len 2, requester 00:00, tag 0x00, last 0xf, first 0xf, Addr 0x80000030
19:08:15.253974 IP 192.168.10.1.16384 > omega.16384: NetTLP: MWr, len 2, requester 00:00, tag 0x00, last 0xf, first 0xf, Addr 0x80000038
19:08:15.253977 IP omega.12289 > 192.168.10.1.12289: NetTLP: MRd, len 16, requester 01:00, tag 0x01, last 0xf, first 0xf, Addr 0x53ca2000
19:08:15.253983 IP 192.168.10.1.16384 > omega.16384: NetTLP: MWr, len 2, requester 00:00, tag 0x00, last 0xf, first 0xf, Addr 0x80000030
19:08:15.253984 IP 192.168.10.1.16384 > omega.16384: NetTLP: MWr, len 2, requester 00:00, tag 0x00, last 0xf, first 0xf, Addr 0x80000038
19:08:15.253985 IP 192.168.10.1.16384 > omega.16384: NetTLP: MWr, len 2, requester 00:00, tag 0x00, last 0xf, first 0xf, Addr 0x80000030
19:08:15.253986 IP 192.168.10.1.12289 > omega.12289: NetTLP: CplD, len 16, completer 00:00, success, bc 64, requester 01:00, tag 0x01, lowaddr 0x00
19:08:15.253988 IP 192.168.10.1.16384 > omega.16384: NetTLP: MWr, len 2, requester 00:00, tag 0x00, last 0xf, first 0xf, Addr 0x80000038
19:08:15.253994 IP omega.12289 > 192.168.10.1.12289: NetTLP: MWr, len 1, requester 01:00, tag 0x01, last 0x0, first 0xf, Addr 0xfee02004
19:08:15.253996 IP 192.168.10.1.16384 > omega.16384: NetTLP: MWr, len 2, requester 00:00, tag 0x00, last 0xf, first 0xf, Addr 0x80000030
19:08:15.253997 IP 192.168.10.1.16384 > omega.16384: NetTLP: MWr, len 2, requester 00:00, tag 0x00, last 0xf, first 0xf, Addr 0x80000038
19:08:15.253997 IP omega.12289 > 192.168.10.1.12289: NetTLP: MRd, len 16, requester 01:00, tag 0x01, last 0xf, first 0xf, Addr 0x53ca2800
19:08:15.253998 IP 192.168.10.1.16384 > omega.16384: NetTLP: MWr, len 2, requester 00:00, tag 0x00, last 0xf, first 0xf, Addr 0x80000030
19:08:15.253999 IP 192.168.10.1.16384 > omega.16384: NetTLP: MWr, len 2, requester 00:00, tag 0x00, last 0xf, first 0xf, Addr 0x80000038
19:08:15.254010 IP 192.168.10.1.16384 > omega.16384: NetTLP: MWr, len 2, requester 00:00, tag 0x00, last 0xf, first 0xf, Addr 0x80000030
19:08:15.254012 IP 192.168.10.1.16384 > omega.16384: NetTLP: MWr, len 2, requester 00:00, tag 0x00, last 0xf, first 0xf, Addr 0x80000038
19:08:15.254013 IP 192.168.10.1.12289 > omega.12289: NetTLP: CplD, len 16, completer 00:00, success, bc 64, requester 01:00, tag 0x01, lowaddr 0x00
19:08:15.254015 IP 192.168.10.1.16384 > omega.16384: NetTLP: MWr, len 2, requester 00:00, tag 0x00, last 0xf, first 0xf, Addr 0x80000030
19:08:15.254016 IP 192.168.10.1.16384 > omega.16384: NetTLP: MWr, len 2, requester 00:00, tag 0x00, last 0xf, first 0xf, Addr 0x80000038
19:08:15.254017 IP 192.168.10.1.16384 > omega.16384: NetTLP: MWr, len 2, requester 00:00, tag 0x00, last 0xf, first 0xf, Addr 0x80000030
19:08:15.254018 IP 192.168.10.1.16384 > omega.16384: NetTLP: MWr, len 2, requester 00:00, tag 0x00, last 0xf, first 0xf, Addr 0x80000038
19:08:15.254026 IP 192.168.10.1.16384 > omega.16384: NetTLP: MWr, len 2, requester 00:00, tag 0x00, last 0xf, first 0xf, Addr 0x80000030
19:08:15.254028 IP omega.12289 > 192.168.10.1.12289: NetTLP: MWr, len 1, requester 01:00, tag 0x01, last 0x0, first 0xf, Addr 0xfee02004
19:08:15.254028 IP 192.168.10.1.16384 > omega.16384: NetTLP: MWr, len 2, requester 00:00, tag 0x00, last 0xf, first 0xf, Addr 0x80000038
19:08:15.254029 IP 192.168.10.1.16384 > omega.16384: NetTLP: MWr, len 2, requester 00:00, tag 0x00, last 0xf, first 0xf, Addr 0x80000030
19:08:15.254030 IP omega.12289 > 192.168.10.1.12289: NetTLP: MRd, len 16, requester 01:00, tag 0x01, last 0xf, first 0xf, Addr 0x53ca3000
19:08:15.254030 IP 192.168.10.1.16384 > omega.16384: NetTLP: MWr, len 2, requester 00:00, tag 0x00, last 0xf, first 0xf, Addr 0x80000038
19:08:15.254045 IP 192.168.10.1.16384 > omega.16384: NetTLP: MWr, len 2, requester 00:00, tag 0x00, last 0xf, first 0xf, Addr 0x80000030
19:08:15.254047 IP 192.168.10.1.16384 > omega.16384: NetTLP: MWr, len 2, requester 00:00, tag 0x00, last 0xf, first 0xf, Addr 0x80000038
19:08:15.254048 IP 192.168.10.1.12289 > omega.12289: NetTLP: CplD, len 16, completer 00:00, success, bc 64, requester 01:00, tag 0x01, lowaddr 0x00
19:08:15.254050 IP 192.168.10.1.16384 > omega.16384: NetTLP: MWr, len 2, requester 00:00, tag 0x00, last 0xf, first 0xf, Addr 0x80000030
19:08:15.254051 IP 192.168.10.1.16384 > omega.16384: NetTLP: MWr, len 2, requester 00:00, tag 0x00, last 0xf, first 0xf, Addr 0x80000038
19:08:15.254052 IP 192.168.10.1.16384 > omega.16384: NetTLP: MWr, len 2, requester 00:00, tag 0x00, last 0xf, first 0xf, Addr 0x80000030
19:08:15.254053 IP 192.168.10.1.16384 > omega.16384: NetTLP: MWr, len 2, requester 00:00, tag 0x00, last 0xf, first 0xf, Addr 0x80000038
19:08:15.254061 IP omega.12289 > 192.168.10.1.12289: NetTLP: MWr, len 1, requester 01:00, tag 0x01, last 0x0, first 0xf, Addr 0xfee02004
19:08:15.254063 IP omega.12289 > 192.168.10.1.12289: NetTLP: MRd, len 16, requester 01:00, tag 0x01, last 0xf, first 0xf, Addr 0x53ca3800
19:08:15.254065 IP 192.168.10.1.16384 > omega.16384: NetTLP: MWr, len 2, requester 00:00, tag 0x00, last 0xf, first 0xf, Addr 0x80000030
19:08:15.254067 IP 192.168.10.1.16384 > omega.16384: NetTLP: MWr, len 2, requester 00:00, tag 0x00, last 0xf, first 0xf, Addr 0x80000038
19:08:15.254068 IP 192.168.10.1.16384 > omega.16384: NetTLP: MWr, len 2, requester 00:00, tag 0x00, last 0xf, first 0xf, Addr 0x80000030
19:08:15.254069 IP 192.168.10.1.16384 > omega.16384: NetTLP: MWr, len 2, requester 00:00, tag 0x00, last 0xf, first 0xf, Addr 0x80000038
19:08:15.254070 IP 192.168.10.1.16384 > omega.16384: NetTLP: MWr, len 2, requester 00:00, tag 0x00, last 0xf, first 0xf, Addr 0x80000030
19:08:15.254072 IP 192.168.10.1.16384 > omega.16384: NetTLP: MWr, len 2, requester 00:00, tag 0x00, last 0xf, first 0xf, Addr 0x80000038
19:08:15.254073 IP 192.168.10.1.12289 > omega.12289: NetTLP: CplD, len 16, completer 00:00, success, bc 64, requester 01:00, tag 0x01, lowaddr 0x00
19:08:15.254074 IP 192.168.10.1.16384 > omega.16384: NetTLP: MWr, len 2, requester 00:00, tag 0x00, last 0xf, first 0xf, Addr 0x80000030
19:08:15.254075 IP 192.168.10.1.16384 > omega.16384: NetTLP: MWr, len 2, requester 00:00, tag 0x00, last 0xf, first 0xf, Addr 0x80000038
19:08:15.254083 IP omega.12289 > 192.168.10.1.12289: NetTLP: MWr, len 1, requester 01:00, tag 0x01, last 0x0, first 0xf, Addr 0xfee02004
19:08:15.254085 IP omega.12289 > 192.168.10.1.12289: NetTLP: MRd, len 16, requester 01:00, tag 0x01, last 0xf, first 0xf, Addr 0x53ca4000
19:08:15.254088 IP 192.168.10.1.16384 > omega.16384: NetTLP: MWr, len 2, requester 00:00, tag 0x00, last 0xf, first 0xf, Addr 0x80000030
19:08:15.254089 IP 192.168.10.1.16384 > omega.16384: NetTLP: MWr, len 2, requester 00:00, tag 0x00, last 0xf, first 0xf, Addr 0x80000038
19:08:15.254091 IP 192.168.10.1.16384 > omega.16384: NetTLP: MWr, len 2, requester 00:00, tag 0x00, last 0xf, first 0xf, Addr 0x80000030
19:08:15.254092 IP 192.168.10.1.16384 > omega.16384: NetTLP: MWr, len 2, requester 00:00, tag 0x00, last 0xf, first 0xf, Addr 0x80000038
19:08:15.254093 IP 192.168.10.1.12289 > omega.12289: NetTLP: CplD, len 16, completer 00:00, success, bc 64, requester 01:00, tag 0x01, lowaddr 0x00
19:08:15.254094 IP 192.168.10.1.16384 > omega.16384: NetTLP: MWr, len 2, requester 00:00, tag 0x00, last 0xf, first 0xf, Addr 0x80000030
19:08:15.254095 IP 192.168.10.1.16384 > omega.16384: NetTLP: MWr, len 2, requester 00:00, tag 0x00, last 0xf, first 0xf, Addr 0x80000038
19:08:15.254103 IP omega.12289 > 192.168.10.1.12289: NetTLP: MWr, len 1, requester 01:00, tag 0x01, last 0x0, first 0xf, Addr 0xfee02004
19:08:15.254105 IP omega.12289 > 192.168.10.1.12289: NetTLP: MRd, len 16, requester 01:00, tag 0x01, last 0xf, first 0xf, Addr 0x53ca4800
19:08:15.254112 IP 192.168.10.1.16384 > omega.16384: NetTLP: MWr, len 2, requester 00:00, tag 0x00, last 0xf, first 0xf, Addr 0x80000030
19:08:15.254114 IP 192.168.10.1.16384 > omega.16384: NetTLP: MWr, len 2, requester 00:00, tag 0x00, last 0xf, first 0xf, Addr 0x80000038
19:08:15.254115 IP 192.168.10.1.16384 > omega.16384: NetTLP: MWr, len 2, requester 00:00, tag 0x00, last 0xf, first 0xf, Addr 0x80000030
19:08:15.254116 IP 192.168.10.1.16384 > omega.16384: NetTLP: MWr, len 2, requester 00:00, tag 0x00, last 0xf, first 0xf, Addr 0x80000038
19:08:15.254118 IP 192.168.10.1.12289 > omega.12289: NetTLP: CplD, len 16, completer 00:00, success, bc 64, requester 01:00, tag 0x01, lowaddr 0x00
19:08:15.254119 IP 192.168.10.1.16384 > omega.16384: NetTLP: MWr, len 2, requester 00:00, tag 0x00, last 0xf, first 0xf, Addr 0x80000030
19:08:15.254120 IP 192.168.10.1.16384 > omega.16384: NetTLP: MWr, len 2, requester 00:00, tag 0x00, last 0xf, first 0xf, Addr 0x80000038
19:08:15.254121 IP 192.168.10.1.16384 > omega.16384: NetTLP: MWr, len 2, requester 00:00, tag 0x00, last 0xf, first 0xf, Addr 0x80000030
19:08:15.254122 IP 192.168.10.1.16384 > omega.16384: NetTLP: MWr, len 2, requester 00:00, tag 0x00, last 0xf, first 0xf, Addr 0x80000038
19:08:15.254130 IP omega.12289 > 192.168.10.1.12289: NetTLP: MWr, len 1, requester 01:00, tag 0x01, last 0x0, first 0xf, Addr 0xfee02004
19:08:15.254133 IP omega.12289 > 192.168.10.1.12289: NetTLP: MRd, len 16, requester 01:00, tag 0x01, last 0xf, first 0xf, Addr 0x53ca5000
19:08:15.254139 IP 192.168.10.1.16384 > omega.16384: NetTLP: MWr, len 2, requester 00:00, tag 0x00, last 0xf, first 0xf, Addr 0x80000030
19:08:15.254141 IP 192.168.10.1.16384 > omega.16384: NetTLP: MWr, len 2, requester 00:00, tag 0x00, last 0xf, first 0xf, Addr 0x80000038
19:08:15.254142 IP 192.168.10.1.16384 > omega.16384: NetTLP: MWr, len 2, requester 00:00, tag 0x00, last 0xf, first 0xf, Addr 0x80000030
19:08:15.254143 IP 192.168.10.1.16384 > omega.16384: NetTLP: MWr, len 2, requester 00:00, tag 0x00, last 0xf, first 0xf, Addr 0x80000038
19:08:15.254144 IP 192.168.10.1.16384 > omega.16384: NetTLP: MWr, len 2, requester 00:00, tag 0x00, last 0xf, first 0xf, Addr 0x80000030
19:08:15.254145 IP 192.168.10.1.16384 > omega.16384: NetTLP: MWr, len 2, requester 00:00, tag 0x00, last 0xf, first 0xf, Addr 0x80000038
19:08:15.254146 IP 192.168.10.1.12289 > omega.12289: NetTLP: CplD, len 16, completer 00:00, success, bc 64, requester 01:00, tag 0x01, lowaddr 0x00
19:08:15.254147 IP 192.168.10.1.16384 > omega.16384: NetTLP: MWr, len 2, requester 00:00, tag 0x00, last 0xf, first 0xf, Addr 0x80000030
19:08:15.254148 IP 192.168.10.1.16384 > omega.16384: NetTLP: MWr, len 2, requester 00:00, tag 0x00, last 0xf, first 0xf, Addr 0x80000038
19:08:15.254157 IP omega.12289 > 192.168.10.1.12289: NetTLP: MWr, len 1, requester 01:00, tag 0x01, last 0x0, first 0xf, Addr 0xfee02004
19:08:15.254159 IP omega.12289 > 192.168.10.1.12289: NetTLP: MRd, len 16, requester 01:00, tag 0x01, last 0xf, first 0xf, Addr 0x53ca5800
19:08:15.254168 IP 192.168.10.1.16384 > omega.16384: NetTLP: MWr, len 2, requester 00:00, tag 0x00, last 0xf, first 0xf, Addr 0x80000030
19:08:15.254169 IP 192.168.10.1.16384 > omega.16384: NetTLP: MWr, len 2, requester 00:00, tag 0x00, last 0xf, first 0xf, Addr 0x80000038
19:08:15.254171 IP 192.168.10.1.16384 > omega.16384: NetTLP: MWr, len 2, requester 00:00, tag 0x00, last 0xf, first 0xf, Addr 0x80000030
19:08:15.254172 IP 192.168.10.1.16384 > omega.16384: NetTLP: MWr, len 2, requester 00:00, tag 0x00, last 0xf, first 0xf, Addr 0x80000038
19:08:15.254173 IP 192.168.10.1.16384 > omega.16384: NetTLP: MWr, len 2, requester 00:00, tag 0x00, last 0xf, first 0xf, Addr 0x80000030
19:08:15.254174 IP 192.168.10.1.16384 > omega.16384: NetTLP: MWr, len 2, requester 00:00, tag 0x00, last 0xf, first 0xf, Addr 0x80000038
19:08:15.254175 IP 192.168.10.1.12289 > omega.12289: NetTLP: CplD, len 16, completer 00:00, success, bc 64, requester 01:00, tag 0x01, lowaddr 0x00
19:08:15.254176 IP 192.168.10.1.16384 > omega.16384: NetTLP: MWr, len 2, requester 00:00, tag 0x00, last 0xf, first 0xf, Addr 0x80000030
19:08:15.254177 IP 192.168.10.1.16384 > omega.16384: NetTLP: MWr, len 2, requester 00:00, tag 0x00, last 0xf, first 0xf, Addr 0x80000038
19:08:15.254178 IP 192.168.10.1.16384 > omega.16384: NetTLP: MWr, len 2, requester 00:00, tag 0x00, last 0xf, first 0xf, Addr 0x80000030
19:08:15.254179 IP 192.168.10.1.16384 > omega.16384: NetTLP: MWr, len 2, requester 00:00, tag 0x00, last 0xf, first 0xf, Addr 0x80000038
19:08:15.254188 IP omega.12289 > 192.168.10.1.12289: NetTLP: MWr, len 1, requester 01:00, tag 0x01, last 0x0, first 0xf, Addr 0xfee02004
19:08:15.254190 IP omega.12289 > 192.168.10.1.12289: NetTLP: MRd, len 16, requester 01:00, tag 0x01, last 0xf, first 0xf, Addr 0x53ca6000
19:08:15.254198 IP 192.168.10.1.16384 > omega.16384: NetTLP: MWr, len 2, requester 00:00, tag 0x00, last 0xf, first 0xf, Addr 0x80000030
19:08:15.254200 IP 192.168.10.1.16384 > omega.16384: NetTLP: MWr, len 2, requester 00:00, tag 0x00, last 0xf, first 0xf, Addr 0x80000038
19:08:15.254201 IP 192.168.10.1.16384 > omega.16384: NetTLP: MWr, len 2, requester 00:00, tag 0x00, last 0xf, first 0xf, Addr 0x80000030
19:08:15.254202 IP 192.168.10.1.16384 > omega.16384: NetTLP: MWr, len 2, requester 00:00, tag 0x00, last 0xf, first 0xf, Addr 0x80000038
19:08:15.254203 IP 192.168.10.1.16384 > omega.16384: NetTLP: MWr, len 2, requester 00:00, tag 0x00, last 0xf, first 0xf, Addr 0x80000030
19:08:15.254204 IP 192.168.10.1.16384 > omega.16384: NetTLP: MWr, len 2, requester 00:00, tag 0x00, last 0xf, first 0xf, Addr 0x80000038
19:08:15.254206 IP 192.168.10.1.12289 > omega.12289: NetTLP: CplD, len 16, completer 00:00, success, bc 64, requester 01:00, tag 0x01, lowaddr 0x00
19:08:15.254207 IP 192.168.10.1.16384 > omega.16384: NetTLP: MWr, len 2, requester 00:00, tag 0x00, last 0xf, first 0xf, Addr 0x80000030
19:08:15.254208 IP 192.168.10.1.16384 > omega.16384: NetTLP: MWr, len 2, requester 00:00, tag 0x00, last 0xf, first 0xf, Addr 0x80000038
19:08:15.254216 IP omega.12289 > 192.168.10.1.12289: NetTLP: MWr, len 1, requester 01:00, tag 0x01, last 0x0, first 0xf, Addr 0xfee02004
19:08:15.254218 IP omega.12289 > 192.168.10.1.12289: NetTLP: MRd, len 16, requester 01:00, tag 0x01, last 0xf, first 0xf, Addr 0x53ca6800
19:08:15.254231 IP 192.168.10.1.16384 > omega.16384: NetTLP: MWr, len 2, requester 00:00, tag 0x00, last 0xf, first 0xf, Addr 0x80000030
19:08:15.254233 IP 192.168.10.1.16384 > omega.16384: NetTLP: MWr, len 2, requester 00:00, tag 0x00, last 0xf, first 0xf, Addr 0x80000038
19:08:15.254234 IP 192.168.10.1.16384 > omega.16384: NetTLP: MWr, len 2, requester 00:00, tag 0x00, last 0xf, first 0xf, Addr 0x80000030
19:08:15.254235 IP 192.168.10.1.16384 > omega.16384: NetTLP: MWr, len 2, requester 00:00, tag 0x00, last 0xf, first 0xf, Addr 0x80000038
19:08:15.254236 IP 192.168.10.1.16384 > omega.16384: NetTLP: MWr, len 2, requester 00:00, tag 0x00, last 0xf, first 0xf, Addr 0x80000030
19:08:15.254237 IP 192.168.10.1.16384 > omega.16384: NetTLP: MWr, len 2, requester 00:00, tag 0x00, last 0xf, first 0xf, Addr 0x80000038
19:08:15.254238 IP 192.168.10.1.12289 > omega.12289: NetTLP: CplD, len 16, completer 00:00, success, bc 64, requester 01:00, tag 0x01, lowaddr 0x00
19:08:15.254239 IP 192.168.10.1.16384 > omega.16384: NetTLP: MWr, len 2, requester 00:00, tag 0x00, last 0xf, first 0xf, Addr 0x80000030
19:08:15.254240 IP 192.168.10.1.16384 > omega.16384: NetTLP: MWr, len 2, requester 00:00, tag 0x00, last 0xf, first 0xf, Addr 0x80000038
19:08:15.254242 IP 192.168.10.1.16384 > omega.16384: NetTLP: MWr, len 2, requester 00:00, tag 0x00, last 0xf, first 0xf, Addr 0x80000030
19:08:15.254243 IP 192.168.10.1.16384 > omega.16384: NetTLP: MWr, len 2, requester 00:00, tag 0x00, last 0xf, first 0xf, Addr 0x80000038
19:08:15.254244 IP 192.168.10.1.16384 > omega.16384: NetTLP: MWr, len 2, requester 00:00, tag 0x00, last 0xf, first 0xf, Addr 0x80000030
19:08:15.254245 IP 192.168.10.1.16384 > omega.16384: NetTLP: MWr, len 2, requester 00:00, tag 0x00, last 0xf, first 0xf, Addr 0x80000038
19:08:15.254254 IP omega.12289 > 192.168.10.1.12289: NetTLP: MWr, len 1, requester 01:00, tag 0x01, last 0x0, first 0xf, Addr 0xfee02004
19:08:15.254256 IP omega.12289 > 192.168.10.1.12289: NetTLP: MRd, len 16, requester 01:00, tag 0x01, last 0xf, first 0xf, Addr 0x53ca7000
19:08:15.254266 IP 192.168.10.1.16384 > omega.16384: NetTLP: MWr, len 2, requester 00:00, tag 0x00, last 0xf, first 0xf, Addr 0x80000030
19:08:15.254268 IP 192.168.10.1.16384 > omega.16384: NetTLP: MWr, len 2, requester 00:00, tag 0x00, last 0xf, first 0xf, Addr 0x80000038
19:08:15.254269 IP 192.168.10.1.16384 > omega.16384: NetTLP: MWr, len 2, requester 00:00, tag 0x00, last 0xf, first 0xf, Addr 0x80000030
19:08:15.254270 IP 192.168.10.1.16384 > omega.16384: NetTLP: MWr, len 2, requester 00:00, tag 0x00, last 0xf, first 0xf, Addr 0x80000038
19:08:15.254271 IP 192.168.10.1.16384 > omega.16384: NetTLP: MWr, len 2, requester 00:00, tag 0x00, last 0xf, first 0xf, Addr 0x80000030
19:08:15.254272 IP 192.168.10.1.16384 > omega.16384: NetTLP: MWr, len 2, requester 00:00, tag 0x00, last 0xf, first 0xf, Addr 0x80000038
19:08:15.254273 IP 192.168.10.1.12289 > omega.12289: NetTLP: CplD, len 16, completer 00:00, success, bc 64, requester 01:00, tag 0x01, lowaddr 0x00
19:08:15.254274 IP 192.168.10.1.16384 > omega.16384: NetTLP: MWr, len 2, requester 00:00, tag 0x00, last 0xf, first 0xf, Addr 0x80000030
19:08:15.254275 IP 192.168.10.1.16384 > omega.16384: NetTLP: MWr, len 2, requester 00:00, tag 0x00, last 0xf, first 0xf, Addr 0x80000038
19:08:15.254276 IP 192.168.10.1.16384 > omega.16384: NetTLP: MWr, len 2, requester 00:00, tag 0x00, last 0xf, first 0xf, Addr 0x80000030
19:08:15.254278 IP 192.168.10.1.16384 > omega.16384: NetTLP: MWr, len 2, requester 00:00, tag 0x00, last 0xf, first 0xf, Addr 0x80000038
19:08:15.254287 IP omega.12289 > 192.168.10.1.12289: NetTLP: MWr, len 1, requester 01:00, tag 0x01, last 0x0, first 0xf, Addr 0xfee02004
19:08:15.254289 IP omega.12289 > 192.168.10.1.12289: NetTLP: MRd, len 16, requester 01:00, tag 0x01, last 0xf, first 0xf, Addr 0x53ca7800
19:08:15.254303 IP 192.168.10.1.16384 > omega.16384: NetTLP: MWr, len 2, requester 00:00, tag 0x00, last 0xf, first 0xf, Addr 0x80000030
19:08:15.254305 IP 192.168.10.1.16384 > omega.16384: NetTLP: MWr, len 2, requester 00:00, tag 0x00, last 0xf, first 0xf, Addr 0x80000038
19:08:15.254306 IP 192.168.10.1.16384 > omega.16384: NetTLP: MWr, len 2, requester 00:00, tag 0x00, last 0xf, first 0xf, Addr 0x80000030
19:08:15.254307 IP 192.168.10.1.16384 > omega.16384: NetTLP: MWr, len 2, requester 00:00, tag 0x00, last 0xf, first 0xf, Addr 0x80000038
19:08:15.254308 IP 192.168.10.1.16384 > omega.16384: NetTLP: MWr, len 2, requester 00:00, tag 0x00, last 0xf, first 0xf, Addr 0x80000030
19:08:15.254309 IP 192.168.10.1.16384 > omega.16384: NetTLP: MWr, len 2, requester 00:00, tag 0x00, last 0xf, first 0xf, Addr 0x80000038
19:08:15.254310 IP 192.168.10.1.12289 > omega.12289: NetTLP: CplD, len 16, completer 00:00, success, bc 64, requester 01:00, tag 0x01, lowaddr 0x00
19:08:15.254311 IP 192.168.10.1.16384 > omega.16384: NetTLP: MWr, len 2, requester 00:00, tag 0x00, last 0xf, first 0xf, Addr 0x80000030
19:08:15.254312 IP 192.168.10.1.16384 > omega.16384: NetTLP: MWr, len 2, requester 00:00, tag 0x00, last 0xf, first 0xf, Addr 0x80000038
19:08:15.254314 IP 192.168.10.1.16384 > omega.16384: NetTLP: MWr, len 2, requester 00:00, tag 0x00, last 0xf, first 0xf, Addr 0x80000030
19:08:15.254315 IP 192.168.10.1.16384 > omega.16384: NetTLP: MWr, len 2, requester 00:00, tag 0x00, last 0xf, first 0xf, Addr 0x80000038
19:08:15.254316 IP 192.168.10.1.16384 > omega.16384: NetTLP: MWr, len 2, requester 00:00, tag 0x00, last 0xf, first 0xf, Addr 0x80000030
19:08:15.254317 IP 192.168.10.1.16384 > omega.16384: NetTLP: MWr, len 2, requester 00:00, tag 0x00, last 0xf, first 0xf, Addr 0x80000038
19:08:15.254318 IP 192.168.10.1.16384 > omega.16384: NetTLP: MWr, len 2, requester 00:00, tag 0x00, last 0xf, first 0xf, Addr 0x80000030
19:08:15.254319 IP 192.168.10.1.16384 > omega.16384: NetTLP: MWr, len 2, requester 00:00, tag 0x00, last 0xf, first 0xf, Addr 0x80000038
19:08:15.254329 IP omega.12289 > 192.168.10.1.12289: NetTLP: MWr, len 1, requester 01:00, tag 0x01, last 0x0, first 0xf, Addr 0xfee02004
19:08:15.254331 IP omega.12289 > 192.168.10.1.12289: NetTLP: MRd, len 16, requester 01:00, tag 0x01, last 0xf, first 0xf, Addr 0x53ca8000
19:08:15.254342 IP 192.168.10.1.16384 > omega.16384: NetTLP: MWr, len 2, requester 00:00, tag 0x00, last 0xf, first 0xf, Addr 0x80000030
19:08:15.254343 IP 192.168.10.1.16384 > omega.16384: NetTLP: MWr, len 2, requester 00:00, tag 0x00, last 0xf, first 0xf, Addr 0x80000038
19:08:15.254344 IP 192.168.10.1.16384 > omega.16384: NetTLP: MWr, len 2, requester 00:00, tag 0x00, last 0xf, first 0xf, Addr 0x80000030
19:08:15.254345 IP 192.168.10.1.16384 > omega.16384: NetTLP: MWr, len 2, requester 00:00, tag 0x00, last 0xf, first 0xf, Addr 0x80000038
19:08:15.254346 IP 192.168.10.1.16384 > omega.16384: NetTLP: MWr, len 2, requester 00:00, tag 0x00, last 0xf, first 0xf, Addr 0x80000030
19:08:15.254347 IP 192.168.10.1.16384 > omega.16384: NetTLP: MWr, len 2, requester 00:00, tag 0x00, last 0xf, first 0xf, Addr 0x80000038
19:08:15.254349 IP 192.168.10.1.12289 > omega.12289: NetTLP: CplD, len 16, completer 00:00, success, bc 64, requester 01:00, tag 0x01, lowaddr 0x00
19:08:15.254350 IP 192.168.10.1.16384 > omega.16384: NetTLP: MWr, len 2, requester 00:00, tag 0x00, last 0xf, first 0xf, Addr 0x80000030
19:08:15.254351 IP 192.168.10.1.16384 > omega.16384: NetTLP: MWr, len 2, requester 00:00, tag 0x00, last 0xf, first 0xf, Addr 0x80000038
19:08:15.254352 IP 192.168.10.1.16384 > omega.16384: NetTLP: MWr, len 2, requester 00:00, tag 0x00, last 0xf, first 0xf, Addr 0x80000030
19:08:15.254353 IP 192.168.10.1.16384 > omega.16384: NetTLP: MWr, len 2, requester 00:00, tag 0x00, last 0xf, first 0xf, Addr 0x80000038
19:08:15.254362 IP omega.12289 > 192.168.10.1.12289: NetTLP: MWr, len 1, requester 01:00, tag 0x01, last 0x0, first 0xf, Addr 0xfee02004
19:08:15.254364 IP omega.12289 > 192.168.10.1.12289: NetTLP: MRd, len 16, requester 01:00, tag 0x01, last 0xf, first 0xf, Addr 0x53ca8800
19:08:15.254383 IP 192.168.10.1.16384 > omega.16384: NetTLP: MWr, len 2, requester 00:00, tag 0x00, last 0xf, first 0xf, Addr 0x80000030
19:08:15.254384 IP 192.168.10.1.16384 > omega.16384: NetTLP: MWr, len 2, requester 00:00, tag 0x00, last 0xf, first 0xf, Addr 0x80000038
19:08:15.254386 IP 192.168.10.1.16384 > omega.16384: NetTLP: MWr, len 2, requester 00:00, tag 0x00, last 0xf, first 0xf, Addr 0x80000030
19:08:15.254387 IP 192.168.10.1.16384 > omega.16384: NetTLP: MWr, len 2, requester 00:00, tag 0x00, last 0xf, first 0xf, Addr 0x80000038
19:08:15.254388 IP 192.168.10.1.16384 > omega.16384: NetTLP: MWr, len 2, requester 00:00, tag 0x00, last 0xf, first 0xf, Addr 0x80000030
19:08:15.254389 IP 192.168.10.1.16384 > omega.16384: NetTLP: MWr, len 2, requester 00:00, tag 0x00, last 0xf, first 0xf, Addr 0x80000038
19:08:15.254390 IP 192.168.10.1.12289 > omega.12289: NetTLP: CplD, len 16, completer 00:00, success, bc 64, requester 01:00, tag 0x01, lowaddr 0x00
19:08:15.254391 IP 192.168.10.1.16384 > omega.16384: NetTLP: MWr, len 2, requester 00:00, tag 0x00, last 0xf, first 0xf, Addr 0x80000030
19:08:15.254392 IP 192.168.10.1.16384 > omega.16384: NetTLP: MWr, len 2, requester 00:00, tag 0x00, last 0xf, first 0xf, Addr 0x80000038
19:08:15.254393 IP 192.168.10.1.16384 > omega.16384: NetTLP: MWr, len 2, requester 00:00, tag 0x00, last 0xf, first 0xf, Addr 0x80000030
19:08:15.254394 IP 192.168.10.1.16384 > omega.16384: NetTLP: MWr, len 2, requester 00:00, tag 0x00, last 0xf, first 0xf, Addr 0x80000038
19:08:15.254396 IP 192.168.10.1.16384 > omega.16384: NetTLP: MWr, len 2, requester 00:00, tag 0x00, last 0xf, first 0xf, Addr 0x80000030
19:08:15.254396 IP 192.168.10.1.16384 > omega.16384: NetTLP: MWr, len 2, requester 00:00, tag 0x00, last 0xf, first 0xf, Addr 0x80000038
19:08:15.254397 IP 192.168.10.1.16384 > omega.16384: NetTLP: MWr, len 2, requester 00:00, tag 0x00, last 0xf, first 0xf, Addr 0x80000030
19:08:15.254399 IP 192.168.10.1.16384 > omega.16384: NetTLP: MWr, len 2, requester 00:00, tag 0x00, last 0xf, first 0xf, Addr 0x80000038
19:08:15.254400 IP 192.168.10.1.16384 > omega.16384: NetTLP: MWr, len 2, requester 00:00, tag 0x00, last 0xf, first 0xf, Addr 0x80000030
19:08:15.254401 IP 192.168.10.1.16384 > omega.16384: NetTLP: MWr, len 2, requester 00:00, tag 0x00, last 0xf, first 0xf, Addr 0x80000038
19:08:15.254411 IP omega.12289 > 192.168.10.1.12289: NetTLP: MWr, len 1, requester 01:00, tag 0x01, last 0x0, first 0xf, Addr 0xfee02004
19:08:15.254413 IP omega.12289 > 192.168.10.1.12289: NetTLP: MRd, len 16, requester 01:00, tag 0x01, last 0xf, first 0xf, Addr 0x53ca9000
19:08:15.254426 IP 192.168.10.1.16384 > omega.16384: NetTLP: MWr, len 2, requester 00:00, tag 0x00, last 0xf, first 0xf, Addr 0x80000030
19:08:15.254427 IP 192.168.10.1.16384 > omega.16384: NetTLP: MWr, len 2, requester 00:00, tag 0x00, last 0xf, first 0xf, Addr 0x80000038
19:08:15.254428 IP 192.168.10.1.16384 > omega.16384: NetTLP: MWr, len 2, requester 00:00, tag 0x00, last 0xf, first 0xf, Addr 0x80000030
19:08:15.254429 IP 192.168.10.1.16384 > omega.16384: NetTLP: MWr, len 2, requester 00:00, tag 0x00, last 0xf, first 0xf, Addr 0x80000038
19:08:15.254430 IP 192.168.10.1.16384 > omega.16384: NetTLP: MWr, len 2, requester 00:00, tag 0x00, last 0xf, first 0xf, Addr 0x80000030
19:08:15.254431 IP 192.168.10.1.16384 > omega.16384: NetTLP: MWr, len 2, requester 00:00, tag 0x00, last 0xf, first 0xf, Addr 0x80000038
19:08:15.254432 IP 192.168.10.1.12289 > omega.12289: NetTLP: CplD, len 16, completer 00:00, success, bc 64, requester 01:00, tag 0x01, lowaddr 0x00
19:08:15.254434 IP 192.168.10.1.16384 > omega.16384: NetTLP: MWr, len 2, requester 00:00, tag 0x00, last 0xf, first 0xf, Addr 0x80000030
19:08:15.254435 IP 192.168.10.1.16384 > omega.16384: NetTLP: MWr, len 2, requester 00:00, tag 0x00, last 0xf, first 0xf, Addr 0x80000038
19:08:15.254436 IP 192.168.10.1.16384 > omega.16384: NetTLP: MWr, len 2, requester 00:00, tag 0x00, last 0xf, first 0xf, Addr 0x80000030
19:08:15.254437 IP 192.168.10.1.16384 > omega.16384: NetTLP: MWr, len 2, requester 00:00, tag 0x00, last 0xf, first 0xf, Addr 0x80000038
19:08:15.254438 IP 192.168.10.1.16384 > omega.16384: NetTLP: MWr, len 2, requester 00:00, tag 0x00, last 0xf, first 0xf, Addr 0x80000030
19:08:15.254439 IP 192.168.10.1.16384 > omega.16384: NetTLP: MWr, len 2, requester 00:00, tag 0x00, last 0xf, first 0xf, Addr 0x80000038
19:08:15.254449 IP omega.12289 > 192.168.10.1.12289: NetTLP: MWr, len 1, requester 01:00, tag 0x01, last 0x0, first 0xf, Addr 0xfee02004
19:08:15.254451 IP omega.12289 > 192.168.10.1.12289: NetTLP: MRd, len 16, requester 01:00, tag 0x01, last 0xf, first 0xf, Addr 0x53ca9800
19:08:15.254471 IP 192.168.10.1.16384 > omega.16384: NetTLP: MWr, len 2, requester 00:00, tag 0x00, last 0xf, first 0xf, Addr 0x80000030
19:08:15.254472 IP 192.168.10.1.16384 > omega.16384: NetTLP: MWr, len 2, requester 00:00, tag 0x00, last 0xf, first 0xf, Addr 0x80000038
19:08:15.254473 IP 192.168.10.1.16384 > omega.16384: NetTLP: MWr, len 2, requester 00:00, tag 0x00, last 0xf, first 0xf, Addr 0x80000030
19:08:15.254474 IP 192.168.10.1.16384 > omega.16384: NetTLP: MWr, len 2, requester 00:00, tag 0x00, last 0xf, first 0xf, Addr 0x80000038
19:08:15.254475 IP 192.168.10.1.16384 > omega.16384: NetTLP: MWr, len 2, requester 00:00, tag 0x00, last 0xf, first 0xf, Addr 0x80000030
19:08:15.254476 IP 192.168.10.1.16384 > omega.16384: NetTLP: MWr, len 2, requester 00:00, tag 0x00, last 0xf, first 0xf, Addr 0x80000038
19:08:15.254477 IP 192.168.10.1.12289 > omega.12289: NetTLP: CplD, len 16, completer 00:00, success, bc 64, requester 01:00, tag 0x01, lowaddr 0x00
19:08:15.254479 IP 192.168.10.1.16384 > omega.16384: NetTLP: MWr, len 2, requester 00:00, tag 0x00, last 0xf, first 0xf, Addr 0x80000030
19:08:15.254480 IP 192.168.10.1.16384 > omega.16384: NetTLP: MWr, len 2, requester 00:00, tag 0x00, last 0xf, first 0xf, Addr 0x80000038
19:08:15.254481 IP 192.168.10.1.16384 > omega.16384: NetTLP: MWr, len 2, requester 00:00, tag 0x00, last 0xf, first 0xf, Addr 0x80000030
19:08:15.254482 IP 192.168.10.1.16384 > omega.16384: NetTLP: MWr, len 2, requester 00:00, tag 0x00, last 0xf, first 0xf, Addr 0x80000038
19:08:15.254483 IP 192.168.10.1.16384 > omega.16384: NetTLP: MWr, len 2, requester 00:00, tag 0x00, last 0xf, first 0xf, Addr 0x80000030
19:08:15.254484 IP 192.168.10.1.16384 > omega.16384: NetTLP: MWr, len 2, requester 00:00, tag 0x00, last 0xf, first 0xf, Addr 0x80000038
19:08:15.254486 IP 192.168.10.1.16384 > omega.16384: NetTLP: MWr, len 2, requester 00:00, tag 0x00, last 0xf, first 0xf, Addr 0x80000030
19:08:15.254487 IP 192.168.10.1.16384 > omega.16384: NetTLP: MWr, len 2, requester 00:00, tag 0x00, last 0xf, first 0xf, Addr 0x80000038
19:08:15.254496 IP omega.12289 > 192.168.10.1.12289: NetTLP: MWr, len 1, requester 01:00, tag 0x01, last 0x0, first 0xf, Addr 0xfee02004
19:08:15.254498 IP omega.12289 > 192.168.10.1.12289: NetTLP: MRd, len 16, requester 01:00, tag 0x01, last 0xf, first 0xf, Addr 0x53caa000
19:08:15.254518 IP 192.168.10.1.16384 > omega.16384: NetTLP: MWr, len 2, requester 00:00, tag 0x00, last 0xf, first 0xf, Addr 0x80000030
19:08:15.254520 IP 192.168.10.1.16384 > omega.16384: NetTLP: MWr, len 2, requester 00:00, tag 0x00, last 0xf, first 0xf, Addr 0x80000038
19:08:15.254521 IP 192.168.10.1.16384 > omega.16384: NetTLP: MWr, len 2, requester 00:00, tag 0x00, last 0xf, first 0xf, Addr 0x80000030
19:08:15.254522 IP 192.168.10.1.16384 > omega.16384: NetTLP: MWr, len 2, requester 00:00, tag 0x00, last 0xf, first 0xf, Addr 0x80000038
19:08:15.254523 IP 192.168.10.1.16384 > omega.16384: NetTLP: MWr, len 2, requester 00:00, tag 0x00, last 0xf, first 0xf, Addr 0x80000030
19:08:15.254523 IP 192.168.10.1.16384 > omega.16384: NetTLP: MWr, len 2, requester 00:00, tag 0x00, last 0xf, first 0xf, Addr 0x80000038
19:08:15.254525 IP 192.168.10.1.12289 > omega.12289: NetTLP: CplD, len 16, completer 00:00, success, bc 64, requester 01:00, tag 0x01, lowaddr 0x00
19:08:15.254526 IP 192.168.10.1.16384 > omega.16384: NetTLP: MWr, len 2, requester 00:00, tag 0x00, last 0xf, first 0xf, Addr 0x80000030
19:08:15.254527 IP 192.168.10.1.16384 > omega.16384: NetTLP: MWr, len 2, requester 00:00, tag 0x00, last 0xf, first 0xf, Addr 0x80000038
19:08:15.254528 IP 192.168.10.1.16384 > omega.16384: NetTLP: MWr, len 2, requester 00:00, tag 0x00, last 0xf, first 0xf, Addr 0x80000030
19:08:15.254529 IP 192.168.10.1.16384 > omega.16384: NetTLP: MWr, len 2, requester 00:00, tag 0x00, last 0xf, first 0xf, Addr 0x80000038
19:08:15.254530 IP 192.168.10.1.16384 > omega.16384: NetTLP: MWr, len 2, requester 00:00, tag 0x00, last 0xf, first 0xf, Addr 0x80000030
19:08:15.254531 IP 192.168.10.1.16384 > omega.16384: NetTLP: MWr, len 2, requester 00:00, tag 0x00, last 0xf, first 0xf, Addr 0x80000038
19:08:15.254533 IP 192.168.10.1.16384 > omega.16384: NetTLP: MWr, len 2, requester 00:00, tag 0x00, last 0xf, first 0xf, Addr 0x80000030
19:08:15.254534 IP 192.168.10.1.16384 > omega.16384: NetTLP: MWr, len 2, requester 00:00, tag 0x00, last 0xf, first 0xf, Addr 0x80000038
19:08:15.254535 IP 192.168.10.1.16384 > omega.16384: NetTLP: MWr, len 2, requester 00:00, tag 0x00, last 0xf, first 0xf, Addr 0x80000030
19:08:15.254536 IP 192.168.10.1.16384 > omega.16384: NetTLP: MWr, len 2, requester 00:00, tag 0x00, last 0xf, first 0xf, Addr 0x80000038
19:08:15.254547 IP omega.12289 > 192.168.10.1.12289: NetTLP: MWr, len 1, requester 01:00, tag 0x01, last 0x0, first 0xf, Addr 0xfee02004
19:08:15.254548 IP omega.12289 > 192.168.10.1.12289: NetTLP: MRd, len 16, requester 01:00, tag 0x01, last 0xf, first 0xf, Addr 0x53caa800
19:08:15.254567 IP 192.168.10.1.16384 > omega.16384: NetTLP: MWr, len 2, requester 00:00, tag 0x00, last 0xf, first 0xf, Addr 0x80000030
19:08:15.254569 IP 192.168.10.1.16384 > omega.16384: NetTLP: MWr, len 2, requester 00:00, tag 0x00, last 0xf, first 0xf, Addr 0x80000038
19:08:15.254570 IP 192.168.10.1.16384 > omega.16384: NetTLP: MWr, len 2, requester 00:00, tag 0x00, last 0xf, first 0xf, Addr 0x80000030
19:08:15.254571 IP 192.168.10.1.16384 > omega.16384: NetTLP: MWr, len 2, requester 00:00, tag 0x00, last 0xf, first 0xf, Addr 0x80000038
19:08:15.254572 IP 192.168.10.1.16384 > omega.16384: NetTLP: MWr, len 2, requester 00:00, tag 0x00, last 0xf, first 0xf, Addr 0x80000030
19:08:15.254573 IP 192.168.10.1.16384 > omega.16384: NetTLP: MWr, len 2, requester 00:00, tag 0x00, last 0xf, first 0xf, Addr 0x80000038
19:08:15.254574 IP 192.168.10.1.12289 > omega.12289: NetTLP: CplD, len 16, completer 00:00, success, bc 64, requester 01:00, tag 0x01, lowaddr 0x00
19:08:15.254575 IP 192.168.10.1.16384 > omega.16384: NetTLP: MWr, len 2, requester 00:00, tag 0x00, last 0xf, first 0xf, Addr 0x80000030
19:08:15.254576 IP 192.168.10.1.16384 > omega.16384: NetTLP: MWr, len 2, requester 00:00, tag 0x00, last 0xf, first 0xf, Addr 0x80000038
19:08:15.254578 IP 192.168.10.1.16384 > omega.16384: NetTLP: MWr, len 2, requester 00:00, tag 0x00, last 0xf, first 0xf, Addr 0x80000030
19:08:15.254579 IP 192.168.10.1.16384 > omega.16384: NetTLP: MWr, len 2, requester 00:00, tag 0x00, last 0xf, first 0xf, Addr 0x80000038
19:08:15.254580 IP 192.168.10.1.16384 > omega.16384: NetTLP: MWr, len 2, requester 00:00, tag 0x00, last 0xf, first 0xf, Addr 0x80000030
19:08:15.254581 IP 192.168.10.1.16384 > omega.16384: NetTLP: MWr, len 2, requester 00:00, tag 0x00, last 0xf, first 0xf, Addr 0x80000038
19:08:15.254582 IP 192.168.10.1.16384 > omega.16384: NetTLP: MWr, len 2, requester 00:00, tag 0x00, last 0xf, first 0xf, Addr 0x80000030
19:08:15.254583 IP 192.168.10.1.16384 > omega.16384: NetTLP: MWr, len 2, requester 00:00, tag 0x00, last 0xf, first 0xf, Addr 0x80000038
19:08:15.254593 IP omega.12289 > 192.168.10.1.12289: NetTLP: MWr, len 1, requester 01:00, tag 0x01, last 0x0, first 0xf, Addr 0xfee02004
19:08:15.254595 IP omega.12289 > 192.168.10.1.12289: NetTLP: MRd, len 16, requester 01:00, tag 0x01, last 0xf, first 0xf, Addr 0x53cab000
19:08:15.254618 IP 192.168.10.1.16384 > omega.16384: NetTLP: MWr, len 2, requester 00:00, tag 0x00, last 0xf, first 0xf, Addr 0x80000030
19:08:15.254620 IP 192.168.10.1.16384 > omega.16384: NetTLP: MWr, len 2, requester 00:00, tag 0x00, last 0xf, first 0xf, Addr 0x80000038
19:08:15.254621 IP 192.168.10.1.16384 > omega.16384: NetTLP: MWr, len 2, requester 00:00, tag 0x00, last 0xf, first 0xf, Addr 0x80000030
19:08:15.254622 IP 192.168.10.1.16384 > omega.16384: NetTLP: MWr, len 2, requester 00:00, tag 0x00, last 0xf, first 0xf, Addr 0x80000038
19:08:15.254623 IP 192.168.10.1.16384 > omega.16384: NetTLP: MWr, len 2, requester 00:00, tag 0x00, last 0xf, first 0xf, Addr 0x80000030
19:08:15.254624 IP 192.168.10.1.16384 > omega.16384: NetTLP: MWr, len 2, requester 00:00, tag 0x00, last 0xf, first 0xf, Addr 0x80000038
19:08:15.254625 IP 192.168.10.1.12289 > omega.12289: NetTLP: CplD, len 16, completer 00:00, success, bc 64, requester 01:00, tag 0x01, lowaddr 0x00
19:08:15.254627 IP 192.168.10.1.16384 > omega.16384: NetTLP: MWr, len 2, requester 00:00, tag 0x00, last 0xf, first 0xf, Addr 0x80000030
19:08:15.254628 IP 192.168.10.1.16384 > omega.16384: NetTLP: MWr, len 2, requester 00:00, tag 0x00, last 0xf, first 0xf, Addr 0x80000038
19:08:15.254629 IP 192.168.10.1.16384 > omega.16384: NetTLP: MWr, len 2, requester 00:00, tag 0x00, last 0xf, first 0xf, Addr 0x80000030
19:08:15.254630 IP 192.168.10.1.16384 > omega.16384: NetTLP: MWr, len 2, requester 00:00, tag 0x00, last 0xf, first 0xf, Addr 0x80000038
19:08:15.254631 IP 192.168.10.1.16384 > omega.16384: NetTLP: MWr, len 2, requester 00:00, tag 0x00, last 0xf, first 0xf, Addr 0x80000030
19:08:15.254632 IP 192.168.10.1.16384 > omega.16384: NetTLP: MWr, len 2, requester 00:00, tag 0x00, last 0xf, first 0xf, Addr 0x80000038
19:08:15.254633 IP 192.168.10.1.16384 > omega.16384: NetTLP: MWr, len 2, requester 00:00, tag 0x00, last 0xf, first 0xf, Addr 0x80000030
19:08:15.254635 IP 192.168.10.1.16384 > omega.16384: NetTLP: MWr, len 2, requester 00:00, tag 0x00, last 0xf, first 0xf, Addr 0x80000038
19:08:15.254636 IP 192.168.10.1.16384 > omega.16384: NetTLP: MWr, len 2, requester 00:00, tag 0x00, last 0xf, first 0xf, Addr 0x80000030
19:08:15.254637 IP 192.168.10.1.16384 > omega.16384: NetTLP: MWr, len 2, requester 00:00, tag 0x00, last 0xf, first 0xf, Addr 0x80000038
19:08:15.254638 IP 192.168.10.1.16384 > omega.16384: NetTLP: MWr, len 2, requester 00:00, tag 0x00, last 0xf, first 0xf, Addr 0x80000030
19:08:15.254639 IP 192.168.10.1.16384 > omega.16384: NetTLP: MWr, len 2, requester 00:00, tag 0x00, last 0xf, first 0xf, Addr 0x80000038
19:08:15.254650 IP omega.12289 > 192.168.10.1.12289: NetTLP: MWr, len 1, requester 01:00, tag 0x01, last 0x0, first 0xf, Addr 0xfee02004
19:08:15.254652 IP omega.12289 > 192.168.10.1.12289: NetTLP: MRd, len 16, requester 01:00, tag 0x01, last 0xf, first 0xf, Addr 0x53cab800
19:08:15.254672 IP 192.168.10.1.16384 > omega.16384: NetTLP: MWr, len 2, requester 00:00, tag 0x00, last 0xf, first 0xf, Addr 0x80000030
19:08:15.254673 IP 192.168.10.1.16384 > omega.16384: NetTLP: MWr, len 2, requester 00:00, tag 0x00, last 0xf, first 0xf, Addr 0x80000038
19:08:15.254674 IP 192.168.10.1.16384 > omega.16384: NetTLP: MWr, len 2, requester 00:00, tag 0x00, last 0xf, first 0xf, Addr 0x80000030
19:08:15.254675 IP 192.168.10.1.16384 > omega.16384: NetTLP: MWr, len 2, requester 00:00, tag 0x00, last 0xf, first 0xf, Addr 0x80000038
19:08:15.254676 IP 192.168.10.1.16384 > omega.16384: NetTLP: MWr, len 2, requester 00:00, tag 0x00, last 0xf, first 0xf, Addr 0x80000030
19:08:15.254677 IP 192.168.10.1.16384 > omega.16384: NetTLP: MWr, len 2, requester 00:00, tag 0x00, last 0xf, first 0xf, Addr 0x80000038
19:08:15.254678 IP 192.168.10.1.12289 > omega.12289: NetTLP: CplD, len 16, completer 00:00, success, bc 64, requester 01:00, tag 0x01, lowaddr 0x00
19:08:15.254680 IP 192.168.10.1.16384 > omega.16384: NetTLP: MWr, len 2, requester 00:00, tag 0x00, last 0xf, first 0xf, Addr 0x80000030
19:08:15.254681 IP 192.168.10.1.16384 > omega.16384: NetTLP: MWr, len 2, requester 00:00, tag 0x00, last 0xf, first 0xf, Addr 0x80000038
19:08:15.254682 IP 192.168.10.1.16384 > omega.16384: NetTLP: MWr, len 2, requester 00:00, tag 0x00, last 0xf, first 0xf, Addr 0x80000030
19:08:15.254683 IP 192.168.10.1.16384 > omega.16384: NetTLP: MWr, len 2, requester 00:00, tag 0x00, last 0xf, first 0xf, Addr 0x80000038
19:08:15.254685 IP 192.168.10.1.16384 > omega.16384: NetTLP: MWr, len 2, requester 00:00, tag 0x00, last 0xf, first 0xf, Addr 0x80000030
19:08:15.254686 IP 192.168.10.1.16384 > omega.16384: NetTLP: MWr, len 2, requester 00:00, tag 0x00, last 0xf, first 0xf, Addr 0x80000038
19:08:15.254687 IP 192.168.10.1.16384 > omega.16384: NetTLP: MWr, len 2, requester 00:00, tag 0x00, last 0xf, first 0xf, Addr 0x80000030
19:08:15.254688 IP 192.168.10.1.16384 > omega.16384: NetTLP: MWr, len 2, requester 00:00, tag 0x00, last 0xf, first 0xf, Addr 0x80000038
19:08:15.254689 IP 192.168.10.1.16384 > omega.16384: NetTLP: MWr, len 2, requester 00:00, tag 0x00, last 0xf, first 0xf, Addr 0x80000030
