19:06:23.586804 IP 192.168.10.1.16384 > omega.16384: NetTLP: MWr, len 2, requester 00:00, tag 0x00, last 0xf, first 0xf, Addr 0x80000030
19:06:23.586809 IP 192.168.10.1.16384 > omega.16384: NetTLP: MWr, len 2, requester 00:00, tag 0x00, last 0xf, first 0xf, Addr 0x80000038
19:06:23.586810 IP 192.168.10.1.16384 > omega.16384: NetTLP: MWr, len 2, requester 00:00, tag 0x00, last 0xf, first 0xf, Addr 0x80000030
19:06:23.586811 IP 192.168.10.1.16384 > omega.16384: NetTLP: MWr, len 2, requester 00:00, tag 0x00, last 0xf, first 0xf, Addr 0x80000038
19:06:23.586818 IP 192.168.10.1.16384 > omega.16384: NetTLP: MWr, len 2, requester 00:00, tag 0x00, last 0xf, first 0xf, Addr 0x80000030
19:06:23.586819 IP 192.168.10.1.16384 > omega.16384: NetTLP: MWr, len 2, requester 00:00, tag 0x00, last 0xf, first 0xf, Addr 0x80000038
19:06:23.586825 IP omega.12289 > 192.168.10.1.12289: NetTLP: MRd, len 16, requester 01:00, tag 0x01, last 0xf, first 0xf, Addr 0x536c1800
19:06:23.586827 IP 192.168.10.1.16384 > omega.16384: NetTLP: MWr, len 2, requester 00:00, tag 0x00, last 0xf, first 0xf, Addr 0x80000030
19:06:23.586830 IP 192.168.10.1.16384 > omega.16384: NetTLP: MWr, len 2, requester 00:00, tag 0x00, last 0xf, first 0xf, Addr 0x80000038
19:06:23.586831 IP 192.168.10.1.16384 > omega.16384: NetTLP: MWr, len 2, requester 00:00, tag 0x00, last 0xf, first 0xf, Addr 0x80000030
19:06:23.586832 IP 192.168.10.1.16384 > omega.16384: NetTLP: MWr, len 2, requester 00:00, tag 0x00, last 0xf, first 0xf, Addr 0x80000038
19:06:23.586833 IP 192.168.10.1.16384 > omega.16384: NetTLP: MWr, len 2, requester 00:00, tag 0x00, last 0xf, first 0xf, Addr 0x80000030
19:06:23.586835 IP 192.168.10.1.16384 > omega.16384: NetTLP: MWr, len 2, requester 00:00, tag 0x00, last 0xf, first 0xf, Addr 0x80000038
19:06:23.586836 IP 192.168.10.1.12289 > omega.12289: NetTLP: CplD, len 16, completer 00:00, success, bc 64, requester 01:00, tag 0x01, lowaddr 0x00
19:06:23.586843 IP 192.168.10.1.16384 > omega.16384: NetTLP: MWr, len 2, requester 00:00, tag 0x00, last 0xf, first 0xf, Addr 0x80000030
19:06:23.586845 IP 192.168.10.1.16384 > omega.16384: NetTLP: MWr, len 2, requester 00:00, tag 0x00, last 0xf, first 0xf, Addr 0x80000038
19:06:23.586846 IP 192.168.10.1.16384 > omega.16384: NetTLP: MWr, len 2, requester 00:00, tag 0x00, last 0xf, first 0xf, Addr 0x80000030
19:06:23.586847 IP omega.12289 > 192.168.10.1.12289: NetTLP: MWr, len 1, requester 01:00, tag 0x01, last 0x0, first 0xf, Addr 0xfee02004
19:06:23.586847 IP 192.168.10.1.16384 > omega.16384: NetTLP: MWr, len 2, requester 00:00, tag 0x00, last 0xf, first 0xf, Addr 0x80000038
19:06:23.586850 IP omega.12289 > 192.168.10.1.12289: NetTLP: MRd, len 16, requester 01:00, tag 0x01, last 0xf, first 0xf, Addr 0x536c2000
19:06:23.586857 IP 192.168.10.1.16384 > omega.16384: NetTLP: MWr, len 2, requester 00:00, tag 0x00, last 0xf, first 0xf, Addr 0x80000030
19:06:23.586859 IP 192.168.10.1.16384 > omega.16384: NetTLP: MWr, len 2, requester 00:00, tag 0x00, last 0xf, first 0xf, Addr 0x80000038
19:06:23.586860 IP 192.168.10.1.12289 > omega.12289: NetTLP: CplD, len 16, completer 00:00, success, bc 64, requester 01:00, tag 0x01, lowaddr 0x00
19:06:23.586862 IP 192.168.10.1.16384 > omega.16384: NetTLP: MWr, len 2, requester 00:00, tag 0x00, last 0xf, first 0xf, Addr 0x80000030
19:06:23.586863 IP 192.168.10.1.16384 > omega.16384: NetTLP: MWr, len 2, requester 00:00, tag 0x00, last 0xf, first 0xf, Addr 0x80000038
19:06:23.586872 IP omega.12289 > 192.168.10.1.12289: NetTLP: MWr, len 1, requester 01:00, tag 0x01, last 0x0, first 0xf, Addr 0xfee02004
19:06:23.586874 IP omega.12289 > 192.168.10.1.12289: NetTLP: MRd, len 16, requester 01:00, tag 0x01, last 0xf, first 0xf, Addr 0x536c2800
19:06:23.586897 IP 192.168.10.1.12289 > omega.12289: NetTLP: CplD, len 16, completer 00:00, success, bc 64, requester 01:00, tag 0x01, lowaddr 0x00
19:06:23.586902 IP omega.12289 > 192.168.10.1.12289: NetTLP: MWr, len 1, requester 01:00, tag 0x01, last 0x0, first 0xf, Addr 0xfee02004
19:06:23.586904 IP omega.12289 > 192.168.10.1.12289: NetTLP: MRd, len 16, requester 01:00, tag 0x01, last 0xf, first 0xf, Addr 0x536c3000
19:06:23.586912 IP 192.168.10.1.16384 > omega.16384: NetTLP: MWr, len 2, requester 00:00, tag 0x00, last 0xf, first 0xf, Addr 0x80000030
19:06:23.586914 IP 192.168.10.1.16384 > omega.16384: NetTLP: MWr, len 2, requester 00:00, tag 0x00, last 0xf, first 0xf, Addr 0x80000038
19:06:23.586916 IP 192.168.10.1.12289 > omega.12289: NetTLP: CplD, len 16, completer 00:00, success, bc 64, requester 01:00, tag 0x01, lowaddr 0x00
19:06:23.586917 IP 192.168.10.1.16384 > omega.16384: NetTLP: MWr, len 2, requester 00:00, tag 0x00, last 0xf, first 0xf, Addr 0x80000030
19:06:23.586918 IP 192.168.10.1.16384 > omega.16384: NetTLP: MWr, len 2, requester 00:00, tag 0x00, last 0xf, first 0xf, Addr 0x80000038
19:06:23.586925 IP omega.12289 > 192.168.10.1.12289: NetTLP: MWr, len 1, requester 01:00, tag 0x01, last 0x0, first 0xf, Addr 0xfee02004
19:06:23.586927 IP omega.12289 > 192.168.10.1.12289: NetTLP: MRd, len 16, requester 01:00, tag 0x01, last 0xf, first 0xf, Addr 0x536c3800
19:06:23.586929 IP 192.168.10.1.16384 > omega.16384: NetTLP: MWr, len 2, requester 00:00, tag 0x00, last 0xf, first 0xf, Addr 0x80000030
19:06:23.586931 IP 192.168.10.1.16384 > omega.16384: NetTLP: MWr, len 2, requester 00:00, tag 0x00, last 0xf, first 0xf, Addr 0x80000038
19:06:23.586932 IP 192.168.10.1.16384 > omega.16384: NetTLP: MWr, len 2, requester 00:00, tag 0x00, last 0xf, first 0xf, Addr 0x80000030
19:06:23.586933 IP 192.168.10.1.16384 > omega.16384: NetTLP: MWr, len 2, requester 00:00, tag 0x00, last 0xf, first 0xf, Addr 0x80000038
19:06:23.586947 IP 192.168.10.1.12289 > omega.12289: NetTLP: CplD, len 16, completer 00:00, success, bc 64, requester 01:00, tag 0x01, lowaddr 0x00
19:06:23.586949 IP 192.168.10.1.16384 > omega.16384: NetTLP: MWr, len 2, requester 00:00, tag 0x00, last 0xf, first 0xf, Addr 0x80000030
19:06:23.586951 IP 192.168.10.1.16384 > omega.16384: NetTLP: MWr, len 2, requester 00:00, tag 0x00, last 0xf, first 0xf, Addr 0x80000038
19:06:23.586952 IP 192.168.10.1.16384 > omega.16384: NetTLP: MWr, len 2, requester 00:00, tag 0x00, last 0xf, first 0xf, Addr 0x80000030
19:06:23.586952 IP omega.12289 > 192.168.10.1.12289: NetTLP: MWr, len 1, requester 01:00, tag 0x01, last 0x0, first 0xf, Addr 0xfee02004
19:06:23.586953 IP 192.168.10.1.16384 > omega.16384: NetTLP: MWr, len 2, requester 00:00, tag 0x00, last 0xf, first 0xf, Addr 0x80000038
19:06:23.586954 IP 192.168.10.1.16384 > omega.16384: NetTLP: MWr, len 2, requester 00:00, tag 0x00, last 0xf, first 0xf, Addr 0x80000030
19:06:23.586954 IP omega.12289 > 192.168.10.1.12289: NetTLP: MRd, len 16, requester 01:00, tag 0x01, last 0xf, first 0xf, Addr 0x536c4000
19:06:23.586955 IP 192.168.10.1.16384 > omega.16384: NetTLP: MWr, len 2, requester 00:00, tag 0x00, last 0xf, first 0xf, Addr 0x80000038
19:06:23.586956 IP 192.168.10.1.16384 > omega.16384: NetTLP: MWr, len 2, requester 00:00, tag 0x00, last 0xf, first 0xf, Addr 0x80000030
19:06:23.586957 IP 192.168.10.1.16384 > omega.16384: NetTLP: MWr, len 2, requester 00:00, tag 0x00, last 0xf, first 0xf, Addr 0x80000038
19:06:23.586968 IP 192.168.10.1.12289 > omega.12289: NetTLP: CplD, len 16, completer 00:00, success, bc 64, requester 01:00, tag 0x01, lowaddr 0x00
19:06:23.586970 IP 192.168.10.1.16384 > omega.16384: NetTLP: MWr, len 2, requester 00:00, tag 0x00, last 0xf, first 0xf, Addr 0x80000030
19:06:23.586971 IP 192.168.10.1.16384 > omega.16384: NetTLP: MWr, len 2, requester 00:00, tag 0x00, last 0xf, first 0xf, Addr 0x80000038
19:06:23.586972 IP 192.168.10.1.16384 > omega.16384: NetTLP: MWr, len 2, requester 00:00, tag 0x00, last 0xf, first 0xf, Addr 0x80000030
19:06:23.586973 IP 192.168.10.1.16384 > omega.16384: NetTLP: MWr, len 2, requester 00:00, tag 0x00, last 0xf, first 0xf, Addr 0x80000038
19:06:23.586974 IP omega.12289 > 192.168.10.1.12289: NetTLP: MWr, len 1, requester 01:00, tag 0x01, last 0x0, first 0xf, Addr 0xfee02004
19:06:23.586976 IP omega.12289 > 192.168.10.1.12289: NetTLP: MRd, len 16, requester 01:00, tag 0x01, last 0xf, first 0xf, Addr 0x536c4800
19:06:23.586990 IP 192.168.10.1.16384 > omega.16384: NetTLP: MWr, len 2, requester 00:00, tag 0x00, last 0xf, first 0xf, Addr 0x80000030
19:06:23.586992 IP 192.168.10.1.16384 > omega.16384: NetTLP: MWr, len 2, requester 00:00, tag 0x00, last 0xf, first 0xf, Addr 0x80000038
19:06:23.586993 IP 192.168.10.1.16384 > omega.16384: NetTLP: MWr, len 2, requester 00:00, tag 0x00, last 0xf, first 0xf, Addr 0x80000030
19:06:23.586994 IP 192.168.10.1.12289 > omega.12289: NetTLP: CplD, len 16, completer 00:00, success, bc 64, requester 01:00, tag 0x01, lowaddr 0x00
19:06:23.586996 IP 192.168.10.1.16384 > omega.16384: NetTLP: MWr, len 2, requester 00:00, tag 0x00, last 0xf, first 0xf, Addr 0x80000038
19:06:23.587004 IP omega.12289 > 192.168.10.1.12289: NetTLP: MWr, len 1, requester 01:00, tag 0x01, last 0x0, first 0xf, Addr 0xfee02004
19:06:23.587006 IP omega.12289 > 192.168.10.1.12289: NetTLP: MRd, len 16, requester 01:00, tag 0x01, last 0xf, first 0xf, Addr 0x536c5000
19:06:23.587015 IP 192.168.10.1.16384 > omega.16384: NetTLP: MWr, len 2, requester 00:00, tag 0x00, last 0xf, first 0xf, Addr 0x80000030
19:06:23.587017 IP 192.168.10.1.16384 > omega.16384: NetTLP: MWr, len 2, requester 00:00, tag 0x00, last 0xf, first 0xf, Addr 0x80000038
19:06:23.587018 IP 192.168.10.1.12289 > omega.12289: NetTLP: CplD, len 16, completer 00:00, success, bc 64, requester 01:00, tag 0x01, lowaddr 0x00
19:06:23.587019 IP 192.168.10.1.16384 > omega.16384: NetTLP: MWr, len 2, requester 00:00, tag 0x00, last 0xf, first 0xf, Addr 0x80000030
19:06:23.587020 IP 192.168.10.1.16384 > omega.16384: NetTLP: MWr, len 2, requester 00:00, tag 0x00, last 0xf, first 0xf, Addr 0x80000038
19:06:23.587028 IP omega.12289 > 192.168.10.1.12289: NetTLP: MWr, len 1, requester 01:00, tag 0x01, last 0x0, first 0xf, Addr 0xfee02004
19:06:23.587030 IP omega.12289 > 192.168.10.1.12289: NetTLP: MRd, len 16, requester 01:00, tag 0x01, last 0xf, first 0xf, Addr 0x536c5800
19:06:23.587041 IP 192.168.10.1.16384 > omega.16384: NetTLP: MWr, len 2, requester 00:00, tag 0x00, last 0xf, first 0xf, Addr 0x80000030
19:06:23.587043 IP 192.168.10.1.16384 > omega.16384: NetTLP: MWr, len 2, requester 00:00, tag 0x00, last 0xf, first 0xf, Addr 0x80000038
19:06:23.587044 IP 192.168.10.1.16384 > omega.16384: NetTLP: MWr, len 2, requester 00:00, tag 0x00, last 0xf, first 0xf, Addr 0x80000030
19:06:23.587046 IP 192.168.10.1.16384 > omega.16384: NetTLP: MWr, len 2, requester 00:00, tag 0x00, last 0xf, first 0xf, Addr 0x80000038
19:06:23.587047 IP 192.168.10.1.12289 > omega.12289: NetTLP: CplD, len 16, completer 00:00, success, bc 64, requester 01:00, tag 0x01, lowaddr 0x00
19:06:23.587048 IP 192.168.10.1.16384 > omega.16384: NetTLP: MWr, len 2, requester 00:00, tag 0x00, last 0xf, first 0xf, Addr 0x80000030
19:06:23.587050 IP 192.168.10.1.16384 > omega.16384: NetTLP: MWr, len 2, requester 00:00, tag 0x00, last 0xf, first 0xf, Addr 0x80000038
19:06:23.587051 IP 192.168.10.1.16384 > omega.16384: NetTLP: MWr, len 2, requester 00:00, tag 0x00, last 0xf, first 0xf, Addr 0x80000030
19:06:23.587052 IP 192.168.10.1.16384 > omega.16384: NetTLP: MWr, len 2, requester 00:00, tag 0x00, last 0xf, first 0xf, Addr 0x80000038
19:06:23.587053 IP 192.168.10.1.16384 > omega.16384: NetTLP: MWr, len 2, requester 00:00, tag 0x00, last 0xf, first 0xf, Addr 0x80000030
19:06:23.587054 IP 192.168.10.1.16384 > omega.16384: NetTLP: MWr, len 2, requester 00:00, tag 0x00, last 0xf, first 0xf, Addr 0x80000038
19:06:23.587062 IP omega.12289 > 192.168.10.1.12289: NetTLP: MWr, len 1, requester 01:00, tag 0x01, last 0x0, first 0xf, Addr 0xfee02004
19:06:23.587064 IP omega.12289 > 192.168.10.1.12289: NetTLP: MRd, len 16, requester 01:00, tag 0x01, last 0xf, first 0xf, Addr 0x536c6000
19:06:23.587070 IP 192.168.10.1.16384 > omega.16384: NetTLP: MWr, len 2, requester 00:00, tag 0x00, last 0xf, first 0xf, Addr 0x80000030
19:06:23.587072 IP 192.168.10.1.16384 > omega.16384: NetTLP: MWr, len 2, requester 00:00, tag 0x00, last 0xf, first 0xf, Addr 0x80000038
19:06:23.587073 IP 192.168.10.1.16384 > omega.16384: NetTLP: MWr, len 2, requester 00:00, tag 0x00, last 0xf, first 0xf, Addr 0x80000030
19:06:23.587074 IP 192.168.10.1.16384 > omega.16384: NetTLP: MWr, len 2, requester 00:00, tag 0x00, last 0xf, first 0xf, Addr 0x80000038
19:06:23.587075 IP 192.168.10.1.16384 > omega.16384: NetTLP: MWr, len 2, requester 00:00, tag 0x00, last 0xf, first 0xf, Addr 0x80000030
19:06:23.587076 IP 192.168.10.1.12289 > omega.12289: NetTLP: CplD, len 16, completer 00:00, success, bc 64, requester 01:00, tag 0x01, lowaddr 0x00
19:06:23.587077 IP 192.168.10.1.16384 > omega.16384: NetTLP: MWr, len 2, requester 00:00, tag 0x00, last 0xf, first 0xf, Addr 0x80000038
19:06:23.587079 IP 192.168.10.1.16384 > omega.16384: NetTLP: MWr, len 2, requester 00:00, tag 0x00, last 0xf, first 0xf, Addr 0x80000030
19:06:23.587080 IP 192.168.10.1.16384 > omega.16384: NetTLP: MWr, len 2, requester 00:00, tag 0x00, last 0xf, first 0xf, Addr 0x80000038
19:06:23.587088 IP omega.12289 > 192.168.10.1.12289: NetTLP: MWr, len 1, requester 01:00, tag 0x01, last 0x0, first 0xf, Addr 0xfee02004
19:06:23.587090 IP omega.12289 > 192.168.10.1.12289: NetTLP: MRd, len 16, requester 01:00, tag 0x01, last 0xf, first 0xf, Addr 0x536c6800
19:06:23.587101 IP 192.168.10.1.16384 > omega.16384: NetTLP: MWr, len 2, requester 00:00, tag 0x00, last 0xf, first 0xf, Addr 0x80000030
19:06:23.587103 IP 192.168.10.1.16384 > omega.16384: NetTLP: MWr, len 2, requester 00:00, tag 0x00, last 0xf, first 0xf, Addr 0x80000038
19:06:23.587104 IP 192.168.10.1.16384 > omega.16384: NetTLP: MWr, len 2, requester 00:00, tag 0x00, last 0xf, first 0xf, Addr 0x80000030
19:06:23.587105 IP 192.168.10.1.16384 > omega.16384: NetTLP: MWr, len 2, requester 00:00, tag 0x00, last 0xf, first 0xf, Addr 0x80000038
19:06:23.587106 IP 192.168.10.1.12289 > omega.12289: NetTLP: CplD, len 16, completer 00:00, success, bc 64, requester 01:00, tag 0x01, lowaddr 0x00
19:06:23.587107 IP 192.168.10.1.16384 > omega.16384: NetTLP: MWr, len 2, requester 00:00, tag 0x00, last 0xf, first 0xf, Addr 0x80000030
19:06:23.587108 IP 192.168.10.1.16384 > omega.16384: NetTLP: MWr, len 2, requester 00:00, tag 0x00, last 0xf, first 0xf, Addr 0x80000038
19:06:23.587110 IP 192.168.10.1.16384 > omega.16384: NetTLP: MWr, len 2, requester 00:00, tag 0x00, last 0xf, first 0xf, Addr 0x80000030
19:06:23.587111 IP 192.168.10.1.16384 > omega.16384: NetTLP: MWr, len 2, requester 00:00, tag 0x00, last 0xf, first 0xf, Addr 0x80000038
19:06:23.587119 IP omega.12289 > 192.168.10.1.12289: NetTLP: MWr, len 1, requester 01:00, tag 0x01, last 0x0, first 0xf, Addr 0xfee02004
19:06:23.587121 IP omega.12289 > 192.168.10.1.12289: NetTLP: MRd, len 16, requester 01:00, tag 0x01, last 0xf, first 0xf, Addr 0x536c7000
19:06:23.587134 IP 192.168.10.1.16384 > omega.16384: NetTLP: MWr, len 2, requester 00:00, tag 0x00, last 0xf, first 0xf, Addr 0x80000030
19:06:23.587135 IP 192.168.10.1.16384 > omega.16384: NetTLP: MWr, len 2, requester 00:00, tag 0x00, last 0xf, first 0xf, Addr 0x80000038
19:06:23.587136 IP 192.168.10.1.16384 > omega.16384: NetTLP: MWr, len 2, requester 00:00, tag 0x00, last 0xf, first 0xf, Addr 0x80000030
19:06:23.587137 IP 192.168.10.1.16384 > omega.16384: NetTLP: MWr, len 2, requester 00:00, tag 0x00, last 0xf, first 0xf, Addr 0x80000038
19:06:23.587139 IP 192.168.10.1.16384 > omega.16384: NetTLP: MWr, len 2, requester 00:00, tag 0x00, last 0xf, first 0xf, Addr 0x80000030
19:06:23.587140 IP 192.168.10.1.16384 > omega.16384: NetTLP: MWr, len 2, requester 00:00, tag 0x00, last 0xf, first 0xf, Addr 0x80000038
19:06:23.587141 IP 192.168.10.1.12289 > omega.12289: NetTLP: CplD, len 16, completer 00:00, success, bc 64, requester 01:00, tag 0x01, lowaddr 0x00
19:06:23.587143 IP 192.168.10.1.16384 > omega.16384: NetTLP: MWr, len 2, requester 00:00, tag 0x00, last 0xf, first 0xf, Addr 0x80000030
19:06:23.587144 IP 192.168.10.1.16384 > omega.16384: NetTLP: MWr, len 2, requester 00:00, tag 0x00, last 0xf, first 0xf, Addr 0x80000038
19:06:23.587145 IP 192.168.10.1.16384 > omega.16384: NetTLP: MWr, len 2, requester 00:00, tag 0x00, last 0xf, first 0xf, Addr 0x80000030
19:06:23.587146 IP 192.168.10.1.16384 > omega.16384: NetTLP: MWr, len 2, requester 00:00, tag 0x00, last 0xf, first 0xf, Addr 0x80000038
19:06:23.587147 IP 192.168.10.1.16384 > omega.16384: NetTLP: MWr, len 2, requester 00:00, tag 0x00, last 0xf, first 0xf, Addr 0x80000030
19:06:23.587148 IP 192.168.10.1.16384 > omega.16384: NetTLP: MWr, len 2, requester 00:00, tag 0x00, last 0xf, first 0xf, Addr 0x80000038
19:06:23.587157 IP omega.12289 > 192.168.10.1.12289: NetTLP: MWr, len 1, requester 01:00, tag 0x01, last 0x0, first 0xf, Addr 0xfee02004
19:06:23.587159 IP omega.12289 > 192.168.10.1.12289: NetTLP: MRd, len 16, requester 01:00, tag 0x01, last 0xf, first 0xf, Addr 0x536c7800
19:06:23.587168 IP 192.168.10.1.16384 > omega.16384: NetTLP: MWr, len 2, requester 00:00, tag 0x00, last 0xf, first 0xf, Addr 0x80000030
19:06:23.587170 IP 192.168.10.1.16384 > omega.16384: NetTLP: MWr, len 2, requester 00:00, tag 0x00, last 0xf, first 0xf, Addr 0x80000038
19:06:23.587171 IP 192.168.10.1.16384 > omega.16384: NetTLP: MWr, len 2, requester 00:00, tag 0x00, last 0xf, first 0xf, Addr 0x80000030
19:06:23.587172 IP 192.168.10.1.16384 > omega.16384: NetTLP: MWr, len 2, requester 00:00, tag 0x00, last 0xf, first 0xf, Addr 0x80000038
19:06:23.587173 IP 192.168.10.1.16384 > omega.16384: NetTLP: MWr, len 2, requester 00:00, tag 0x00, last 0xf, first 0xf, Addr 0x80000030
19:06:23.587174 IP 192.168.10.1.16384 > omega.16384: NetTLP: MWr, len 2, requester 00:00, tag 0x00, last 0xf, first 0xf, Addr 0x80000038
19:06:23.587175 IP 192.168.10.1.12289 > omega.12289: NetTLP: CplD, len 16, completer 00:00, success, bc 64, requester 01:00, tag 0x01, lowaddr 0x00
19:06:23.587177 IP 192.168.10.1.16384 > omega.16384: NetTLP: MWr, len 2, requester 00:00, tag 0x00, last 0xf, first 0xf, Addr 0x80000030
19:06:23.587178 IP 192.168.10.1.16384 > omega.16384: NetTLP: MWr, len 2, requester 00:00, tag 0x00, last 0xf, first 0xf, Addr 0x80000038
19:06:23.587179 IP 192.168.10.1.16384 > omega.16384: NetTLP: MWr, len 2, requester 00:00, tag 0x00, last 0xf, first 0xf, Addr 0x80000030
19:06:23.587180 IP 192.168.10.1.16384 > omega.16384: NetTLP: MWr, len 2, requester 00:00, tag 0x00, last 0xf, first 0xf, Addr 0x80000038
19:06:23.587189 IP omega.12289 > 192.168.10.1.12289: NetTLP: MWr, len 1, requester 01:00, tag 0x01, last 0x0, first 0xf, Addr 0xfee02004
19:06:23.587191 IP omega.12289 > 192.168.10.1.12289: NetTLP: MRd, len 16, requester 01:00, tag 0x01, last 0xf, first 0xf, Addr 0x536c8000
19:06:23.587205 IP 192.168.10.1.16384 > omega.16384: NetTLP: MWr, len 2, requester 00:00, tag 0x00, last 0xf, first 0xf, Addr 0x80000030
19:06:23.587207 IP 192.168.10.1.16384 > omega.16384: NetTLP: MWr, len 2, requester 00:00, tag 0x00, last 0xf, first 0xf, Addr 0x80000038
19:06:23.587208 IP 192.168.10.1.16384 > omega.16384: NetTLP: MWr, len 2, requester 00:00, tag 0x00, last 0xf, first 0xf, Addr 0x80000030
19:06:23.587209 IP 192.168.10.1.16384 > omega.16384: NetTLP: MWr, len 2, requester 00:00, tag 0x00, last 0xf, first 0xf, Addr 0x80000038
19:06:23.587210 IP 192.168.10.1.12289 > omega.12289: NetTLP: CplD, len 16, completer 00:00, success, bc 64, requester 01:00, tag 0x01, lowaddr 0x00
19:06:23.587212 IP 192.168.10.1.16384 > omega.16384: NetTLP: MWr, len 2, requester 00:00, tag 0x00, last 0xf, first 0xf, Addr 0x80000030
19:06:23.587213 IP 192.168.10.1.16384 > omega.16384: NetTLP: MWr, len 2, requester 00:00, tag 0x00, last 0xf, first 0xf, Addr 0x80000038
19:06:23.587214 IP 192.168.10.1.16384 > omega.16384: NetTLP: MWr, len 2, requester 00:00, tag 0x00, last 0xf, first 0xf, Addr 0x80000030
19:06:23.587215 IP 192.168.10.1.16384 > omega.16384: NetTLP: MWr, len 2, requester 00:00, tag 0x00, last 0xf, first 0xf, Addr 0x80000038
19:06:23.587216 IP 192.168.10.1.16384 > omega.16384: NetTLP: MWr, len 2, requester 00:00, tag 0x00, last 0xf, first 0xf, Addr 0x80000030
19:06:23.587217 IP 192.168.10.1.16384 > omega.16384: NetTLP: MWr, len 2, requester 00:00, tag 0x00, last 0xf, first 0xf, Addr 0x80000038
19:06:23.587226 IP omega.12289 > 192.168.10.1.12289: NetTLP: MWr, len 1, requester 01:00, tag 0x01, last 0x0, first 0xf, Addr 0xfee02004
19:06:23.587228 IP omega.12289 > 192.168.10.1.12289: NetTLP: MRd, len 16, requester 01:00, tag 0x01, last 0xf, first 0xf, Addr 0x536c8800
19:06:23.587244 IP 192.168.10.1.16384 > omega.16384: NetTLP: MWr, len 2, requester 00:00, tag 0x00, last 0xf, first 0xf, Addr 0x80000030
19:06:23.587246 IP 192.168.10.1.16384 > omega.16384: NetTLP: MWr, len 2, requester 00:00, tag 0x00, last 0xf, first 0xf, Addr 0x80000038
19:06:23.587248 IP 192.168.10.1.16384 > omega.16384: NetTLP: MWr, len 2, requester 00:00, tag 0x00, last 0xf, first 0xf, Addr 0x80000030
19:06:23.587249 IP 192.168.10.1.16384 > omega.16384: NetTLP: MWr, len 2, requester 00:00, tag 0x00, last 0xf, first 0xf, Addr 0x80000038
19:06:23.587250 IP 192.168.10.1.16384 > omega.16384: NetTLP: MWr, len 2, requester 00:00, tag 0x00, last 0xf, first 0xf, Addr 0x80000030
19:06:23.587251 IP 192.168.10.1.16384 > omega.16384: NetTLP: MWr, len 2, requester 00:00, tag 0x00, last 0xf, first 0xf, Addr 0x80000038
19:06:23.587252 IP 192.168.10.1.12289 > omega.12289: NetTLP: CplD, len 16, completer 00:00, success, bc 64, requester 01:00, tag 0x01, lowaddr 0x00
19:06:23.587253 IP 192.168.10.1.16384 > omega.16384: NetTLP: MWr, len 2, requester 00:00, tag 0x00, last 0xf, first 0xf, Addr 0x80000030
19:06:23.587254 IP 192.168.10.1.16384 > omega.16384: NetTLP: MWr, len 2, requester 00:00, tag 0x00, last 0xf, first 0xf, Addr 0x80000038
19:06:23.587256 IP 192.168.10.1.16384 > omega.16384: NetTLP: MWr, len 2, requester 00:00, tag 0x00, last 0xf, first 0xf, Addr 0x80000030
19:06:23.587256 IP 192.168.10.1.16384 > omega.16384: NetTLP: MWr, len 2, requester 00:00, tag 0x00, last 0xf, first 0xf, Addr 0x80000038
19:06:23.587258 IP 192.168.10.1.16384 > omega.16384: NetTLP: MWr, len 2, requester 00:00, tag 0x00, last 0xf, first 0xf, Addr 0x80000030
19:06:23.587259 IP 192.168.10.1.16384 > omega.16384: NetTLP: MWr, len 2, requester 00:00, tag 0x00, last 0xf, first 0xf, Addr 0x80000038
19:06:23.587260 IP 192.168.10.1.16384 > omega.16384: NetTLP: MWr, len 2, requester 00:00, tag 0x00, last 0xf, first 0xf, Addr 0x80000030
19:06:23.587261 IP 192.168.10.1.16384 > omega.16384: NetTLP: MWr, len 2, requester 00:00, tag 0x00, last 0xf, first 0xf, Addr 0x80000038
19:06:23.587270 IP omega.12289 > 192.168.10.1.12289: NetTLP: MWr, len 1, requester 01:00, tag 0x01, last 0x0, first 0xf, Addr 0xfee02004
19:06:23.587272 IP omega.12289 > 192.168.10.1.12289: NetTLP: MRd, len 16, requester 01:00, tag 0x01, last 0xf, first 0xf, Addr 0x536c9000
19:06:23.587285 IP 192.168.10.1.16384 > omega.16384: NetTLP: MWr, len 2, requester 00:00, tag 0x00, last 0xf, first 0xf, Addr 0x80000030
19:06:23.587287 IP 192.168.10.1.16384 > omega.16384: NetTLP: MWr, len 2, requester 00:00, tag 0x00, last 0xf, first 0xf, Addr 0x80000038
19:06:23.587288 IP 192.168.10.1.16384 > omega.16384: NetTLP: MWr, len 2, requester 00:00, tag 0x00, last 0xf, first 0xf, Addr 0x80000030
19:06:23.587289 IP 192.168.10.1.16384 > omega.16384: NetTLP: MWr, len 2, requester 00:00, tag 0x00, last 0xf, first 0xf, Addr 0x80000038
19:06:23.587290 IP 192.168.10.1.16384 > omega.16384: NetTLP: MWr, len 2, requester 00:00, tag 0x00, last 0xf, first 0xf, Addr 0x80000030
19:06:23.587291 IP 192.168.10.1.16384 > omega.16384: NetTLP: MWr, len 2, requester 00:00, tag 0x00, last 0xf, first 0xf, Addr 0x80000038
19:06:23.587292 IP 192.168.10.1.12289 > omega.12289: NetTLP: CplD, len 16, completer 00:00, success, bc 64, requester 01:00, tag 0x01, lowaddr 0x00
19:06:23.587294 IP 192.168.10.1.16384 > omega.16384: NetTLP: MWr, len 2, requester 00:00, tag 0x00, last 0xf, first 0xf, Addr 0x80000030
19:06:23.587295 IP 192.168.10.1.16384 > omega.16384: NetTLP: MWr, len 2, requester 00:00, tag 0x00, last 0xf, first 0xf, Addr 0x80000038
19:06:23.587296 IP 192.168.10.1.16384 > omega.16384: NetTLP: MWr, len 2, requester 00:00, tag 0x00, last 0xf, first 0xf, Addr 0x80000030
19:06:23.587297 IP 192.168.10.1.16384 > omega.16384: NetTLP: MWr, len 2, requester 00:00, tag 0x00, last 0xf, first 0xf, Addr 0x80000038
19:06:23.587298 IP 192.168.10.1.16384 > omega.16384: NetTLP: MWr, len 2, requester 00:00, tag 0x00, last 0xf, first 0xf, Addr 0x80000030
19:06:23.587299 IP 192.168.10.1.16384 > omega.16384: NetTLP: MWr, len 2, requester 00:00, tag 0x00, last 0xf, first 0xf, Addr 0x80000038
19:06:23.587308 IP omega.12289 > 192.168.10.1.12289: NetTLP: MWr, len 1, requester 01:00, tag 0x01, last 0x0, first 0xf, Addr 0xfee02004
19:06:23.587310 IP omega.12289 > 192.168.10.1.12289: NetTLP: MRd, len 16, requester 01:00, tag 0x01, last 0xf, first 0xf, Addr 0x536c9800
19:06:23.587328 IP 192.168.10.1.16384 > omega.16384: NetTLP: MWr, len 2, requester 00:00, tag 0x00, last 0xf, first 0xf, Addr 0x80000030
19:06:23.587330 IP 192.168.10.1.16384 > omega.16384: NetTLP: MWr, len 2, requester 00:00, tag 0x00, last 0xf, first 0xf, Addr 0x80000038
19:06:23.587331 IP 192.168.10.1.16384 > omega.16384: NetTLP: MWr, len 2, requester 00:00, tag 0x00, last 0xf, first 0xf, Addr 0x80000030
19:06:23.587332 IP 192.168.10.1.16384 > omega.16384: NetTLP: MWr, len 2, requester 00:00, tag 0x00, last 0xf, first 0xf, Addr 0x80000038
19:06:23.587333 IP 192.168.10.1.16384 > omega.16384: NetTLP: MWr, len 2, requester 00:00, tag 0x00, last 0xf, first 0xf, Addr 0x80000030
19:06:23.587334 IP 192.168.10.1.16384 > omega.16384: NetTLP: MWr, len 2, requester 00:00, tag 0x00, last 0xf, first 0xf, Addr 0x80000038
19:06:23.587335 IP 192.168.10.1.12289 > omega.12289: NetTLP: CplD, len 16, completer 00:00, success, bc 64, requester 01:00, tag 0x01, lowaddr 0x00
19:06:23.587337 IP 192.168.10.1.16384 > omega.16384: NetTLP: MWr, len 2, requester 00:00, tag 0x00, last 0xf, first 0xf, Addr 0x80000030
19:06:23.587338 IP 192.168.10.1.16384 > omega.16384: NetTLP: MWr, len 2, requester 00:00, tag 0x00, last 0xf, first 0xf, Addr 0x80000038
19:06:23.587339 IP 192.168.10.1.16384 > omega.16384: NetTLP: MWr, len 2, requester 00:00, tag 0x00, last 0xf, first 0xf, Addr 0x80000030
19:06:23.587340 IP 192.168.10.1.16384 > omega.16384: NetTLP: MWr, len 2, requester 00:00, tag 0x00, last 0xf, first 0xf, Addr 0x80000038
19:06:23.587341 IP 192.168.10.1.16384 > omega.16384: NetTLP: MWr, len 2, requester 00:00, tag 0x00, last 0xf, first 0xf, Addr 0x80000030
19:06:23.587342 IP 192.168.10.1.16384 > omega.16384: NetTLP: MWr, len 2, requester 00:00, tag 0x00, last 0xf, first 0xf, Addr 0x80000038
19:06:23.587343 IP 192.168.10.1.16384 > omega.16384: NetTLP: MWr, len 2, requester 00:00, tag 0x00, last 0xf, first 0xf, Addr 0x80000030
19:06:23.587344 IP 192.168.10.1.16384 > omega.16384: NetTLP: MWr, len 2, requester 00:00, tag 0x00, last 0xf, first 0xf, Addr 0x80000038
19:06:23.587354 IP omega.12289 > 192.168.10.1.12289: NetTLP: MWr, len 1, requester 01:00, tag 0x01, last 0x0, first 0xf, Addr 0xfee02004
19:06:23.587357 IP omega.12289 > 192.168.10.1.12289: NetTLP: MRd, len 16, requester 01:00, tag 0x01, last 0xf, first 0xf, Addr 0x536ca000
19:06:23.587373 IP 192.168.10.1.16384 > omega.16384: NetTLP: MWr, len 2, requester 00:00, tag 0x00, last 0xf, first 0xf, Addr 0x80000030
19:06:23.587375 IP 192.168.10.1.16384 > omega.16384: NetTLP: MWr, len 2, requester 00:00, tag 0x00, last 0xf, first 0xf, Addr 0x80000038
19:06:23.587376 IP 192.168.10.1.16384 > omega.16384: NetTLP: MWr, len 2, requester 00:00, tag 0x00, last 0xf, first 0xf, Addr 0x80000030
19:06:23.587377 IP 192.168.10.1.16384 > omega.16384: NetTLP: MWr, len 2, requester 00:00, tag 0x00, last 0xf, first 0xf, Addr 0x80000038
19:06:23.587378 IP 192.168.10.1.16384 > omega.16384: NetTLP: MWr, len 2, requester 00:00, tag 0x00, last 0xf, first 0xf, Addr 0x80000030
19:06:23.587379 IP 192.168.10.1.16384 > omega.16384: NetTLP: MWr, len 2, requester 00:00, tag 0x00, last 0xf, first 0xf, Addr 0x80000038
19:06:23.587380 IP 192.168.10.1.12289 > omega.12289: NetTLP: CplD, len 16, completer 00:00, success, bc 64, requester 01:00, tag 0x01, lowaddr 0x00
19:06:23.587389 IP omega.12289 > 192.168.10.1.12289: NetTLP: MWr, len 1, requester 01:00, tag 0x01, last 0x0, first 0xf, Addr 0xfee02004
19:06:23.587390 IP omega.12289 > 192.168.10.1.12289: NetTLP: MRd, len 16, requester 01:00, tag 0x01, last 0xf, first 0xf, Addr 0x536ca800
19:06:23.587420 IP 192.168.10.1.16384 > omega.16384: NetTLP: MWr, len 2, requester 00:00, tag 0x00, last 0xf, first 0xf, Addr 0x80000030
19:06:23.587422 IP 192.168.10.1.16384 > omega.16384: NetTLP: MWr, len 2, requester 00:00, tag 0x00, last 0xf, first 0xf, Addr 0x80000038
19:06:23.587423 IP 192.168.10.1.12289 > omega.12289: NetTLP: CplD, len 16, completer 00:00, success, bc 64, requester 01:00, tag 0x01, lowaddr 0x00
19:06:23.587425 IP 192.168.10.1.16384 > omega.16384: NetTLP: MWr, len 2, requester 00:00, tag 0x00, last 0xf, first 0xf, Addr 0x80000030
19:06:23.587426 IP 192.168.10.1.16384 > omega.16384: NetTLP: MWr, len 2, requester 00:00, tag 0x00, last 0xf, first 0xf, Addr 0x80000038
19:06:23.587427 IP 192.168.10.1.16384 > omega.16384: NetTLP: MWr, len 2, requester 00:00, tag 0x00, last 0xf, first 0xf, Addr 0x80000030
19:06:23.587428 IP 192.168.10.1.16384 > omega.16384: NetTLP: MWr, len 2, requester 00:00, tag 0x00, last 0xf, first 0xf, Addr 0x80000038
19:06:23.587429 IP 192.168.10.1.16384 > omega.16384: NetTLP: MWr, len 2, requester 00:00, tag 0x00, last 0xf, first 0xf, Addr 0x80000030
19:06:23.587430 IP 192.168.10.1.16384 > omega.16384: NetTLP: MWr, len 2, requester 00:00, tag 0x00, last 0xf, first 0xf, Addr 0x80000038
19:06:23.587432 IP 192.168.10.1.16384 > omega.16384: NetTLP: MWr, len 2, requester 00:00, tag 0x00, last 0xf, first 0xf, Addr 0x80000030
19:06:23.587433 IP 192.168.10.1.16384 > omega.16384: NetTLP: MWr, len 2, requester 00:00, tag 0x00, last 0xf, first 0xf, Addr 0x80000038
19:06:23.587434 IP 192.168.10.1.16384 > omega.16384: NetTLP: MWr, len 2, requester 00:00, tag 0x00, last 0xf, first 0xf, Addr 0x80000030
19:06:23.587435 IP 192.168.10.1.16384 > omega.16384: NetTLP: MWr, len 2, requester 00:00, tag 0x00, last 0xf, first 0xf, Addr 0x80000038
19:06:23.587436 IP 192.168.10.1.16384 > omega.16384: NetTLP: MWr, len 2, requester 00:00, tag 0x00, last 0xf, first 0xf, Addr 0x80000030
19:06:23.587437 IP 192.168.10.1.16384 > omega.16384: NetTLP: MWr, len 2, requester 00:00, tag 0x00, last 0xf, first 0xf, Addr 0x80000038
19:06:23.587447 IP omega.12289 > 192.168.10.1.12289: NetTLP: MWr, len 1, requester 01:00, tag 0x01, last 0x0, first 0xf, Addr 0xfee02004
19:06:23.587449 IP omega.12289 > 192.168.10.1.12289: NetTLP: MRd, len 16, requester 01:00, tag 0x01, last 0xf, first 0xf, Addr 0x536cb000
19:06:23.587469 IP 192.168.10.1.16384 > omega.16384: NetTLP: MWr, len 2, requester 00:00, tag 0x00, last 0xf, first 0xf, Addr 0x80000030
19:06:23.587471 IP 192.168.10.1.16384 > omega.16384: NetTLP: MWr, len 2, requester 00:00, tag 0x00, last 0xf, first 0xf, Addr 0x80000038
19:06:23.587472 IP 192.168.10.1.16384 > omega.16384: NetTLP: MWr, len 2, requester 00:00, tag 0x00, last 0xf, first 0xf, Addr 0x80000030
19:06:23.587473 IP 192.168.10.1.16384 > omega.16384: NetTLP: MWr, len 2, requester 00:00, tag 0x00, last 0xf, first 0xf, Addr 0x80000038
19:06:23.587474 IP 192.168.10.1.16384 > omega.16384: NetTLP: MWr, len 2, requester 00:00, tag 0x00, last 0xf, first 0xf, Addr 0x80000030
19:06:23.587475 IP 192.168.10.1.16384 > omega.16384: NetTLP: MWr, len 2, requester 00:00, tag 0x00, last 0xf, first 0xf, Addr 0x80000038
19:06:23.587476 IP 192.168.10.1.12289 > omega.12289: NetTLP: CplD, len 16, completer 00:00, success, bc 64, requester 01:00, tag 0x01, lowaddr 0x00
19:06:23.587478 IP 192.168.10.1.16384 > omega.16384: NetTLP: MWr, len 2, requester 00:00, tag 0x00, last 0xf, first 0xf, Addr 0x80000030
19:06:23.587479 IP 192.168.10.1.16384 > omega.16384: NetTLP: MWr, len 2, requester 00:00, tag 0x00, last 0xf, first 0xf, Addr 0x80000038
19:06:23.587480 IP 192.168.10.1.16384 > omega.16384: NetTLP: MWr, len 2, requester 00:00, tag 0x00, last 0xf, first 0xf, Addr 0x80000030
19:06:23.587481 IP 192.168.10.1.16384 > omega.16384: NetTLP: MWr, len 2, requester 00:00, tag 0x00, last 0xf, first 0xf, Addr 0x80000038
19:06:23.587482 IP 192.168.10.1.16384 > omega.16384: NetTLP: MWr, len 2, requester 00:00, tag 0x00, last 0xf, first 0xf, Addr 0x80000030
19:06:23.587483 IP 192.168.10.1.16384 > omega.16384: NetTLP: MWr, len 2, requester 00:00, tag 0x00, last 0xf, first 0xf, Addr 0x80000038
19:06:23.587484 IP 192.168.10.1.16384 > omega.16384: NetTLP: MWr, len 2, requester 00:00, tag 0x00, last 0xf, first 0xf, Addr 0x80000030
19:06:23.587486 IP 192.168.10.1.16384 > omega.16384: NetTLP: MWr, len 2, requester 00:00, tag 0x00, last 0xf, first 0xf, Addr 0x80000038
19:06:23.587496 IP omega.12289 > 192.168.10.1.12289: NetTLP: MWr, len 1, requester 01:00, tag 0x01, last 0x0, first 0xf, Addr 0xfee02004
19:06:23.587498 IP omega.12289 > 192.168.10.1.12289: NetTLP: MRd, len 16, requester 01:00, tag 0x01, last 0xf, first 0xf, Addr 0x536cb800
19:06:23.587521 IP 192.168.10.1.16384 > omega.16384: NetTLP: MWr, len 2, requester 00:00, tag 0x00, last 0xf, first 0xf, Addr 0x80000030
19:06:23.587523 IP 192.168.10.1.16384 > omega.16384: NetTLP: MWr, len 2, requester 00:00, tag 0x00, last 0xf, first 0xf, Addr 0x80000038
19:06:23.587524 IP 192.168.10.1.16384 > omega.16384: NetTLP: MWr, len 2, requester 00:00, tag 0x00, last 0xf, first 0xf, Addr 0x80000030
19:06:23.587525 IP 192.168.10.1.16384 > omega.16384: NetTLP: MWr, len 2, requester 00:00, tag 0x00, last 0xf, first 0xf, Addr 0x80000038
19:06:23.587526 IP 192.168.10.1.16384 > omega.16384: NetTLP: MWr, len 2, requester 00:00, tag 0x00, last 0xf, first 0xf, Addr 0x80000030
19:06:23.587527 IP 192.168.10.1.16384 > omega.16384: NetTLP: MWr, len 2, requester 00:00, tag 0x00, last 0xf, first 0xf, Addr 0x80000038
19:06:23.587528 IP 192.168.10.1.12289 > omega.12289: NetTLP: CplD, len 16, completer 00:00, success, bc 64, requester 01:00, tag 0x01, lowaddr 0x00
19:06:23.587530 IP 192.168.10.1.16384 > omega.16384: NetTLP: MWr, len 2, requester 00:00, tag 0x00, last 0xf, first 0xf, Addr 0x80000030
19:06:23.587531 IP 192.168.10.1.16384 > omega.16384: NetTLP: MWr, len 2, requester 00:00, tag 0x00, last 0xf, first 0xf, Addr 0x80000038
19:06:23.587532 IP 192.168.10.1.16384 > omega.16384: NetTLP: MWr, len 2, requester 00:00, tag 0x00, last 0xf, first 0xf, Addr 0x80000030
19:06:23.587533 IP 192.168.10.1.16384 > omega.16384: NetTLP: MWr, len 2, requester 00:00, tag 0x00, last 0xf, first 0xf, Addr 0x80000038
19:06:23.587534 IP 192.168.10.1.16384 > omega.16384: NetTLP: MWr, len 2, requester 00:00, tag 0x00, last 0xf, first 0xf, Addr 0x80000030
19:06:23.587535 IP 192.168.10.1.16384 > omega.16384: NetTLP: MWr, len 2, requester 00:00, tag 0x00, last 0xf, first 0xf, Addr 0x80000038
19:06:23.587536 IP 192.168.10.1.16384 > omega.16384: NetTLP: MWr, len 2, requester 00:00, tag 0x00, last 0xf, first 0xf, Addr 0x80000030
19:06:23.587537 IP 192.168.10.1.16384 > omega.16384: NetTLP: MWr, len 2, requester 00:00, tag 0x00, last 0xf, first 0xf, Addr 0x80000038
19:06:23.587538 IP 192.168.10.1.16384 > omega.16384: NetTLP: MWr, len 2, requester 00:00, tag 0x00, last 0xf, first 0xf, Addr 0x80000030
19:06:23.587539 IP 192.168.10.1.16384 > omega.16384: NetTLP: MWr, len 2, requester 00:00, tag 0x00, last 0xf, first 0xf, Addr 0x80000038
19:06:23.587541 IP 192.168.10.1.16384 > omega.16384: NetTLP: MWr, len 2, requester 00:00, tag 0x00, last 0xf, first 0xf, Addr 0x80000030
19:06:23.587542 IP 192.168.10.1.16384 > omega.16384: NetTLP: MWr, len 2, requester 00:00, tag 0x00, last 0xf, first 0xf, Addr 0x80000038
19:06:23.587552 IP omega.12289 > 192.168.10.1.12289: NetTLP: MWr, len 1, requester 01:00, tag 0x01, last 0x0, first 0xf, Addr 0xfee02004
19:06:23.587554 IP omega.12289 > 192.168.10.1.12289: NetTLP: MRd, len 16, requester 01:00, tag 0x01, last 0xf, first 0xf, Addr 0x536cc000
19:06:23.587574 IP 192.168.10.1.16384 > omega.16384: NetTLP: MWr, len 2, requester 00:00, tag 0x00, last 0xf, first 0xf, Addr 0x80000030
19:06:23.587576 IP 192.168.10.1.16384 > omega.16384: NetTLP: MWr, len 2, requester 00:00, tag 0x00, last 0xf, first 0xf, Addr 0x80000038
19:06:23.587577 IP 192.168.10.1.16384 > omega.16384: NetTLP: MWr, len 2, requester 00:00, tag 0x00, last 0xf, first 0xf, Addr 0x80000030
19:06:23.587578 IP 192.168.10.1.16384 > omega.16384: NetTLP: MWr, len 2, requester 00:00, tag 0x00, last 0xf, first 0xf, Addr 0x80000038
19:06:23.587579 IP 192.168.10.1.16384 > omega.16384: NetTLP: MWr, len 2, requester 00:00, tag 0x00, last 0xf, first 0xf, Addr 0x80000030
19:06:23.587580 IP 192.168.10.1.16384 > omega.16384: NetTLP: MWr, len 2, requester 00:00, tag 0x00, last 0xf, first 0xf, Addr 0x80000038
19:06:23.587581 IP 192.168.10.1.12289 > omega.12289: NetTLP: CplD, len 16, completer 00:00, success, bc 64, requester 01:00, tag 0x01, lowaddr 0x00
19:06:23.587583 IP 192.168.10.1.16384 > omega.16384: NetTLP: MWr, len 2, requester 00:00, tag 0x00, last 0xf, first 0xf, Addr 0x80000030
19:06:23.587584 IP 192.168.10.1.16384 > omega.16384: NetTLP: MWr, len 2, requester 00:00, tag 0x00, last 0xf, first 0xf, Addr 0x80000038
19:06:23.587585 IP 192.168.10.1.16384 > omega.16384: NetTLP: MWr, len 2, requester 00:00, tag 0x00, last 0xf, first 0xf, Addr 0x80000030
19:06:23.587586 IP 192.168.10.1.16384 > omega.16384: NetTLP: MWr, len 2, requester 00:00, tag 0x00, last 0xf, first 0xf, Addr 0x80000038
19:06:23.587587 IP 192.168.10.1.16384 > omega.16384: NetTLP: MWr, len 2, requester 00:00, tag 0x00, last 0xf, first 0xf, Addr 0x80000030
19:06:23.587588 IP 192.168.10.1.16384 > omega.16384: NetTLP: MWr, len 2, requester 00:00, tag 0x00, last 0xf, first 0xf, Addr 0x80000038
19:06:23.587589 IP 192.168.10.1.16384 > omega.16384: NetTLP: MWr, len 2, requester 00:00, tag 0x00, last 0xf, first 0xf, Addr 0x80000030
19:06:23.587590 IP 192.168.10.1.16384 > omega.16384: NetTLP: MWr, len 2, requester 00:00, tag 0x00, last 0xf, first 0xf, Addr 0x80000038
19:06:23.587592 IP 192.168.10.1.16384 > omega.16384: NetTLP: MWr, len 2, requester 00:00, tag 0x00, last 0xf, first 0xf, Addr 0x80000030
19:06:23.587593 IP 192.168.10.1.16384 > omega.16384: NetTLP: MWr, len 2, requester 00:00, tag 0x00, last 0xf, first 0xf, Addr 0x80000038
19:06:23.587603 IP omega.12289 > 192.168.10.1.12289: NetTLP: MWr, len 1, requester 01:00, tag 0x01, last 0x0, first 0xf, Addr 0xfee02004
19:06:23.587605 IP omega.12289 > 192.168.10.1.12289: NetTLP: MRd, len 16, requester 01:00, tag 0x01, last 0xf, first 0xf, Addr 0x536cc800
19:06:23.587629 IP 192.168.10.1.16384 > omega.16384: NetTLP: MWr, len 2, requester 00:00, tag 0x00, last 0xf, first 0xf, Addr 0x80000030
19:06:23.587631 IP 192.168.10.1.16384 > omega.16384: NetTLP: MWr, len 2, requester 00:00, tag 0x00, last 0xf, first 0xf, Addr 0x80000038
19:06:23.587632 IP 192.168.10.1.16384 > omega.16384: NetTLP: MWr, len 2, requester 00:00, tag 0x00, last 0xf, first 0xf, Addr 0x80000030
19:06:23.587633 IP 192.168.10.1.16384 > omega.16384: NetTLP: MWr, len 2, requester 00:00, tag 0x00, last 0xf, first 0xf, Addr 0x80000038
19:06:23.587634 IP 192.168.10.1.16384 > omega.16384: NetTLP: MWr, len 2, requester 00:00, tag 0x00, last 0xf, first 0xf, Addr 0x80000030
19:06:23.587635 IP 192.168.10.1.16384 > omega.16384: NetTLP: MWr, len 2, requester 00:00, tag 0x00, last 0xf, first 0xf, Addr 0x80000038
19:06:23.587636 IP 192.168.10.1.12289 > omega.12289: NetTLP: CplD, len 16, completer 00:00, success, bc 64, requester 01:00, tag 0x01, lowaddr 0x00
19:06:23.587638 IP 192.168.10.1.16384 > omega.16384: NetTLP: MWr, len 2, requester 00:00, tag 0x00, last 0xf, first 0xf, Addr 0x80000030
