19:40:06.448276 IP 192.168.10.1.16384 > omega.16384: NetTLP: MWr, len 2, requester 00:00, tag 0x00, last 0xf, first 0xf, Addr 0x80000028
19:40:06.448282 IP 192.168.10.1.16384 > omega.16384: NetTLP: MWr, len 2, requester 00:00, tag 0x00, last 0xf, first 0xf, Addr 0x80000028
19:40:06.448283 IP 192.168.10.1.16384 > omega.16384: NetTLP: MWr, len 2, requester 00:00, tag 0x00, last 0xf, first 0xf, Addr 0x80000028
19:40:06.448284 IP 192.168.10.1.16384 > omega.16384: NetTLP: MWr, len 2, requester 00:00, tag 0x00, last 0xf, first 0xf, Addr 0x80000028
19:40:06.448285 IP 192.168.10.1.16384 > omega.16384: NetTLP: MWr, len 2, requester 00:00, tag 0x00, last 0xf, first 0xf, Addr 0x80000028
19:40:06.448286 IP 192.168.10.1.16384 > omega.16384: NetTLP: MWr, len 2, requester 00:00, tag 0x00, last 0xf, first 0xf, Addr 0x80000028
19:40:06.448287 IP 192.168.10.1.16384 > omega.16384: NetTLP: MWr, len 2, requester 00:00, tag 0x00, last 0xf, first 0xf, Addr 0x80000028
19:40:06.448288 IP 192.168.10.1.16384 > omega.16384: NetTLP: MWr, len 2, requester 00:00, tag 0x00, last 0xf, first 0xf, Addr 0x80000028
19:40:06.448295 IP 192.168.10.1.16384 > omega.16384: NetTLP: MWr, len 2, requester 00:00, tag 0x00, last 0xf, first 0xf, Addr 0x80000028
19:40:06.448301 IP omega.12289 > 192.168.10.1.12289: NetTLP: MRd, len 4, requester 01:00, tag 0x01, last 0xf, first 0xf, Addr 0x34822e80
19:40:06.448305 IP 192.168.10.1.16384 > omega.16384: NetTLP: MWr, len 2, requester 00:00, tag 0x00, last 0xf, first 0xf, Addr 0x80000028
19:40:06.448307 IP 192.168.10.1.16384 > omega.16384: NetTLP: MWr, len 2, requester 00:00, tag 0x00, last 0xf, first 0xf, Addr 0x80000028
19:40:06.448356 IP 192.168.10.1.12289 > omega.12289: NetTLP: CplD, len 4, completer 00:00, success, bc 16, requester 01:00, tag 0x01, lowaddr 0x00
19:40:06.448361 IP 192.168.10.1.16384 > omega.16384: NetTLP: MWr, len 2, requester 00:00, tag 0x00, last 0xf, first 0xf, Addr 0x80000028
19:40:06.448362 IP 192.168.10.1.16384 > omega.16384: NetTLP: MWr, len 2, requester 00:00, tag 0x00, last 0xf, first 0xf, Addr 0x80000028
19:40:06.448363 IP 192.168.10.1.16384 > omega.16384: NetTLP: MWr, len 2, requester 00:00, tag 0x00, last 0xf, first 0xf, Addr 0x80000028
19:40:06.448364 IP 192.168.10.1.16384 > omega.16384: NetTLP: MWr, len 2, requester 00:00, tag 0x00, last 0xf, first 0xf, Addr 0x80000028
19:40:06.448365 IP 192.168.10.1.16384 > omega.16384: NetTLP: MWr, len 2, requester 00:00, tag 0x00, last 0xf, first 0xf, Addr 0x80000028
19:40:06.448366 IP 192.168.10.1.16384 > omega.16384: NetTLP: MWr, len 2, requester 00:00, tag 0x00, last 0xf, first 0xf, Addr 0x80000028
19:40:06.448367 IP 192.168.10.1.16384 > omega.16384: NetTLP: MWr, len 2, requester 00:00, tag 0x00, last 0xf, first 0xf, Addr 0x80000028
19:40:06.448368 IP 192.168.10.1.16384 > omega.16384: NetTLP: MWr, len 2, requester 00:00, tag 0x00, last 0xf, first 0xf, Addr 0x80000028
19:40:06.448369 IP 192.168.10.1.16384 > omega.16384: NetTLP: MWr, len 2, requester 00:00, tag 0x00, last 0xf, first 0xf, Addr 0x80000028
19:40:06.448370 IP 192.168.10.1.16384 > omega.16384: NetTLP: MWr, len 2, requester 00:00, tag 0x00, last 0xf, first 0xf, Addr 0x80000028
19:40:06.448376 IP 192.168.10.1.16384 > omega.16384: NetTLP: MWr, len 2, requester 00:00, tag 0x00, last 0xf, first 0xf, Addr 0x80000028
19:40:06.448389 IP omega.12289 > 192.168.10.1.12289: NetTLP: MRd, len 16, requester 01:00, tag 0x01, last 0xf, first 0xf, Addr 0x541e7800
19:40:06.448391 IP 192.168.10.1.16384 > omega.16384: NetTLP: MWr, len 2, requester 00:00, tag 0x00, last 0xf, first 0xf, Addr 0x80000028
19:40:06.448392 IP 192.168.10.1.16384 > omega.16384: NetTLP: MWr, len 2, requester 00:00, tag 0x00, last 0xf, first 0xf, Addr 0x80000028
19:40:06.448394 IP 192.168.10.1.16384 > omega.16384: NetTLP: MWr, len 2, requester 00:00, tag 0x00, last 0xf, first 0xf, Addr 0x80000028
19:40:06.448407 IP 192.168.10.1.16384 > omega.16384: NetTLP: MWr, len 2, requester 00:00, tag 0x00, last 0xf, first 0xf, Addr 0x80000028
19:40:06.448409 IP 192.168.10.1.12289 > omega.12289: NetTLP: CplD, len 16, completer 00:00, success, bc 64, requester 01:00, tag 0x01, lowaddr 0x00
19:40:06.448411 IP 192.168.10.1.16384 > omega.16384: NetTLP: MWr, len 2, requester 00:00, tag 0x00, last 0xf, first 0xf, Addr 0x80000028
19:40:06.448413 IP 192.168.10.1.16384 > omega.16384: NetTLP: MWr, len 2, requester 00:00, tag 0x00, last 0xf, first 0xf, Addr 0x80000028
19:40:06.448413 IP 192.168.10.1.16384 > omega.16384: NetTLP: MWr, len 2, requester 00:00, tag 0x00, last 0xf, first 0xf, Addr 0x80000028
19:40:06.448420 IP 192.168.10.1.16384 > omega.16384: NetTLP: MWr, len 2, requester 00:00, tag 0x00, last 0xf, first 0xf, Addr 0x80000028
19:40:06.448424 IP omega.12289 > 192.168.10.1.12289: NetTLP: MWr, len 1, requester 01:00, tag 0x01, last 0x0, first 0xf, Addr 0xfee02004
19:40:06.448429 IP omega.12289 > 192.168.10.1.12289: NetTLP: MRd, len 4, requester 01:00, tag 0x01, last 0xf, first 0xf, Addr 0x34822e90
19:40:06.448439 IP 192.168.10.1.16384 > omega.16384: NetTLP: MWr, len 2, requester 00:00, tag 0x00, last 0xf, first 0xf, Addr 0x80000028
19:40:06.448441 IP 192.168.10.1.16384 > omega.16384: NetTLP: MWr, len 2, requester 00:00, tag 0x00, last 0xf, first 0xf, Addr 0x80000028
19:40:06.448442 IP 192.168.10.1.12289 > omega.12289: NetTLP: CplD, len 4, completer 00:00, success, bc 16, requester 01:00, tag 0x01, lowaddr 0x10
19:40:06.448449 IP omega.12289 > 192.168.10.1.12289: NetTLP: MRd, len 16, requester 01:00, tag 0x01, last 0xf, first 0xf, Addr 0x541e8000
19:40:06.448495 IP 192.168.10.1.12289 > omega.12289: NetTLP: CplD, len 16, completer 00:00, success, bc 64, requester 01:00, tag 0x01, lowaddr 0x00
19:40:06.448500 IP 192.168.10.1.16384 > omega.16384: NetTLP: MWr, len 2, requester 00:00, tag 0x00, last 0xf, first 0xf, Addr 0x80000028
19:40:06.448501 IP 192.168.10.1.16384 > omega.16384: NetTLP: MWr, len 2, requester 00:00, tag 0x00, last 0xf, first 0xf, Addr 0x80000028
19:40:06.448502 IP 192.168.10.1.16384 > omega.16384: NetTLP: MWr, len 2, requester 00:00, tag 0x00, last 0xf, first 0xf, Addr 0x80000028
19:40:06.448503 IP 192.168.10.1.16384 > omega.16384: NetTLP: MWr, len 2, requester 00:00, tag 0x00, last 0xf, first 0xf, Addr 0x80000028
19:40:06.448504 IP 192.168.10.1.16384 > omega.16384: NetTLP: MWr, len 2, requester 00:00, tag 0x00, last 0xf, first 0xf, Addr 0x80000028
19:40:06.448511 IP 192.168.10.1.16384 > omega.16384: NetTLP: MWr, len 2, requester 00:00, tag 0x00, last 0xf, first 0xf, Addr 0x80000028
19:40:06.448517 IP omega.12289 > 192.168.10.1.12289: NetTLP: MWr, len 1, requester 01:00, tag 0x01, last 0x0, first 0xf, Addr 0xfee02004
19:40:06.448522 IP omega.12289 > 192.168.10.1.12289: NetTLP: MRd, len 4, requester 01:00, tag 0x01, last 0xf, first 0xf, Addr 0x34822ea0
19:40:06.448528 IP 192.168.10.1.16384 > omega.16384: NetTLP: MWr, len 2, requester 00:00, tag 0x00, last 0xf, first 0xf, Addr 0x80000028
19:40:06.448530 IP 192.168.10.1.16384 > omega.16384: NetTLP: MWr, len 2, requester 00:00, tag 0x00, last 0xf, first 0xf, Addr 0x80000028
19:40:06.448531 IP 192.168.10.1.12289 > omega.12289: NetTLP: CplD, len 4, completer 00:00, success, bc 16, requester 01:00, tag 0x01, lowaddr 0x20
19:40:06.448537 IP omega.12289 > 192.168.10.1.12289: NetTLP: MRd, len 16, requester 01:00, tag 0x01, last 0xf, first 0xf, Addr 0x541e8800
19:40:06.448540 IP 192.168.10.1.16384 > omega.16384: NetTLP: MWr, len 2, requester 00:00, tag 0x00, last 0xf, first 0xf, Addr 0x80000028
19:40:06.448586 IP 192.168.10.1.12289 > omega.12289: NetTLP: CplD, len 16, completer 00:00, success, bc 64, requester 01:00, tag 0x01, lowaddr 0x00
19:40:06.448590 IP 192.168.10.1.16384 > omega.16384: NetTLP: MWr, len 2, requester 00:00, tag 0x00, last 0xf, first 0xf, Addr 0x80000028
19:40:06.448592 IP 192.168.10.1.16384 > omega.16384: NetTLP: MWr, len 2, requester 00:00, tag 0x00, last 0xf, first 0xf, Addr 0x80000028
19:40:06.448593 IP 192.168.10.1.16384 > omega.16384: NetTLP: MWr, len 2, requester 00:00, tag 0x00, last 0xf, first 0xf, Addr 0x80000028
19:40:06.448594 IP 192.168.10.1.16384 > omega.16384: NetTLP: MWr, len 2, requester 00:00, tag 0x00, last 0xf, first 0xf, Addr 0x80000028
19:40:06.448595 IP 192.168.10.1.16384 > omega.16384: NetTLP: MWr, len 2, requester 00:00, tag 0x00, last 0xf, first 0xf, Addr 0x80000028
19:40:06.448596 IP 192.168.10.1.16384 > omega.16384: NetTLP: MWr, len 2, requester 00:00, tag 0x00, last 0xf, first 0xf, Addr 0x80000028
19:40:06.448597 IP 192.168.10.1.16384 > omega.16384: NetTLP: MWr, len 2, requester 00:00, tag 0x00, last 0xf, first 0xf, Addr 0x80000028
19:40:06.448598 IP 192.168.10.1.16384 > omega.16384: NetTLP: MWr, len 2, requester 00:00, tag 0x00, last 0xf, first 0xf, Addr 0x80000028
19:40:06.448599 IP 192.168.10.1.16384 > omega.16384: NetTLP: MWr, len 2, requester 00:00, tag 0x00, last 0xf, first 0xf, Addr 0x80000028
19:40:06.448599 IP 192.168.10.1.16384 > omega.16384: NetTLP: MWr, len 2, requester 00:00, tag 0x00, last 0xf, first 0xf, Addr 0x80000028
19:40:06.448606 IP 192.168.10.1.16384 > omega.16384: NetTLP: MWr, len 2, requester 00:00, tag 0x00, last 0xf, first 0xf, Addr 0x80000028
19:40:06.448613 IP omega.12289 > 192.168.10.1.12289: NetTLP: MWr, len 1, requester 01:00, tag 0x01, last 0x0, first 0xf, Addr 0xfee02004
19:40:06.448618 IP omega.12289 > 192.168.10.1.12289: NetTLP: MRd, len 4, requester 01:00, tag 0x01, last 0xf, first 0xf, Addr 0x34822eb0
19:40:06.448621 IP 192.168.10.1.16384 > omega.16384: NetTLP: MWr, len 2, requester 00:00, tag 0x00, last 0xf, first 0xf, Addr 0x80000028
19:40:06.448622 IP 192.168.10.1.16384 > omega.16384: NetTLP: MWr, len 2, requester 00:00, tag 0x00, last 0xf, first 0xf, Addr 0x80000028
19:40:06.448633 IP 192.168.10.1.12289 > omega.12289: NetTLP: CplD, len 4, completer 00:00, success, bc 16, requester 01:00, tag 0x01, lowaddr 0x30
19:40:06.448635 IP 192.168.10.1.16384 > omega.16384: NetTLP: MWr, len 2, requester 00:00, tag 0x00, last 0xf, first 0xf, Addr 0x80000028
19:40:06.448640 IP omega.12289 > 192.168.10.1.12289: NetTLP: MRd, len 16, requester 01:00, tag 0x01, last 0xf, first 0xf, Addr 0x541e9000
19:40:06.448645 IP 192.168.10.1.16384 > omega.16384: NetTLP: MWr, len 2, requester 00:00, tag 0x00, last 0xf, first 0xf, Addr 0x80000028
19:40:06.448647 IP 192.168.10.1.16384 > omega.16384: NetTLP: MWr, len 2, requester 00:00, tag 0x00, last 0xf, first 0xf, Addr 0x80000028
19:40:06.448648 IP 192.168.10.1.12289 > omega.12289: NetTLP: CplD, len 16, completer 00:00, success, bc 64, requester 01:00, tag 0x01, lowaddr 0x00
19:40:06.448653 IP omega.12289 > 192.168.10.1.12289: NetTLP: MWr, len 1, requester 01:00, tag 0x01, last 0x0, first 0xf, Addr 0xfee02004
19:40:06.448657 IP 192.168.10.1.16384 > omega.16384: NetTLP: MWr, len 2, requester 00:00, tag 0x00, last 0xf, first 0xf, Addr 0x80000028
19:40:06.448659 IP 192.168.10.1.16384 > omega.16384: NetTLP: MWr, len 2, requester 00:00, tag 0x00, last 0xf, first 0xf, Addr 0x80000028
19:40:06.448660 IP omega.12289 > 192.168.10.1.12289: NetTLP: MRd, len 4, requester 01:00, tag 0x01, last 0xf, first 0xf, Addr 0x34822ec0
19:40:06.448672 IP 192.168.10.1.16384 > omega.16384: NetTLP: MWr, len 2, requester 00:00, tag 0x00, last 0xf, first 0xf, Addr 0x80000028
19:40:06.448673 IP 192.168.10.1.12289 > omega.12289: NetTLP: CplD, len 4, completer 00:00, success, bc 16, requester 01:00, tag 0x01, lowaddr 0x40
19:40:06.448678 IP omega.12289 > 192.168.10.1.12289: NetTLP: MRd, len 16, requester 01:00, tag 0x01, last 0xf, first 0xf, Addr 0x541e9800
19:40:06.448684 IP 192.168.10.1.16384 > omega.16384: NetTLP: MWr, len 2, requester 00:00, tag 0x00, last 0xf, first 0xf, Addr 0x80000028
19:40:06.448685 IP 192.168.10.1.16384 > omega.16384: NetTLP: MWr, len 2, requester 00:00, tag 0x00, last 0xf, first 0xf, Addr 0x80000028
19:40:06.448686 IP 192.168.10.1.12289 > omega.12289: NetTLP: CplD, len 16, completer 00:00, success, bc 64, requester 01:00, tag 0x01, lowaddr 0x00
19:40:06.448692 IP omega.12289 > 192.168.10.1.12289: NetTLP: MWr, len 1, requester 01:00, tag 0x01, last 0x0, first 0xf, Addr 0xfee02004
19:40:06.448696 IP omega.12289 > 192.168.10.1.12289: NetTLP: MRd, len 4, requester 01:00, tag 0x01, last 0xf, first 0xf, Addr 0x34822ed0
19:40:06.448697 IP 192.168.10.1.16384 > omega.16384: NetTLP: MWr, len 2, requester 00:00, tag 0x00, last 0xf, first 0xf, Addr 0x80000028
19:40:06.448698 IP 192.168.10.1.16384 > omega.16384: NetTLP: MWr, len 2, requester 00:00, tag 0x00, last 0xf, first 0xf, Addr 0x80000028
19:40:06.448711 IP 192.168.10.1.16384 > omega.16384: NetTLP: MWr, len 2, requester 00:00, tag 0x00, last 0xf, first 0xf, Addr 0x80000028
19:40:06.448712 IP 192.168.10.1.12289 > omega.12289: NetTLP: CplD, len 4, completer 00:00, success, bc 16, requester 01:00, tag 0x01, lowaddr 0x50
19:40:06.448717 IP omega.12289 > 192.168.10.1.12289: NetTLP: MRd, len 16, requester 01:00, tag 0x01, last 0xf, first 0xf, Addr 0x541ea000
19:40:06.448723 IP 192.168.10.1.16384 > omega.16384: NetTLP: MWr, len 2, requester 00:00, tag 0x00, last 0xf, first 0xf, Addr 0x80000028
19:40:06.448724 IP 192.168.10.1.16384 > omega.16384: NetTLP: MWr, len 2, requester 00:00, tag 0x00, last 0xf, first 0xf, Addr 0x80000028
19:40:06.448725 IP 192.168.10.1.12289 > omega.12289: NetTLP: CplD, len 16, completer 00:00, success, bc 64, requester 01:00, tag 0x01, lowaddr 0x00
19:40:06.448731 IP omega.12289 > 192.168.10.1.12289: NetTLP: MWr, len 1, requester 01:00, tag 0x01, last 0x0, first 0xf, Addr 0xfee02004
19:40:06.448735 IP omega.12289 > 192.168.10.1.12289: NetTLP: MRd, len 4, requester 01:00, tag 0x01, last 0xf, first 0xf, Addr 0x34822ee0
19:40:06.448735 IP 192.168.10.1.16384 > omega.16384: NetTLP: MWr, len 2, requester 00:00, tag 0x00, last 0xf, first 0xf, Addr 0x80000028
19:40:06.448737 IP 192.168.10.1.16384 > omega.16384: NetTLP: MWr, len 2, requester 00:00, tag 0x00, last 0xf, first 0xf, Addr 0x80000028
19:40:06.448750 IP 192.168.10.1.12289 > omega.12289: NetTLP: CplD, len 4, completer 00:00, success, bc 16, requester 01:00, tag 0x01, lowaddr 0x60
19:40:06.448751 IP 192.168.10.1.16384 > omega.16384: NetTLP: MWr, len 2, requester 00:00, tag 0x00, last 0xf, first 0xf, Addr 0x80000028
19:40:06.448756 IP omega.12289 > 192.168.10.1.12289: NetTLP: MRd, len 16, requester 01:00, tag 0x01, last 0xf, first 0xf, Addr 0x541ea800
19:40:06.448762 IP 192.168.10.1.16384 > omega.16384: NetTLP: MWr, len 2, requester 00:00, tag 0x00, last 0xf, first 0xf, Addr 0x80000028
19:40:06.448763 IP 192.168.10.1.12289 > omega.12289: NetTLP: CplD, len 16, completer 00:00, success, bc 64, requester 01:00, tag 0x01, lowaddr 0x00
19:40:06.448765 IP 192.168.10.1.16384 > omega.16384: NetTLP: MWr, len 2, requester 00:00, tag 0x00, last 0xf, first 0xf, Addr 0x80000028
19:40:06.448772 IP omega.12289 > 192.168.10.1.12289: NetTLP: MWr, len 1, requester 01:00, tag 0x01, last 0x0, first 0xf, Addr 0xfee02004
19:40:06.448774 IP 192.168.10.1.16384 > omega.16384: NetTLP: MWr, len 2, requester 00:00, tag 0x00, last 0xf, first 0xf, Addr 0x80000028
19:40:06.448775 IP 192.168.10.1.16384 > omega.16384: NetTLP: MWr, len 2, requester 00:00, tag 0x00, last 0xf, first 0xf, Addr 0x80000028
19:40:06.448779 IP omega.12289 > 192.168.10.1.12289: NetTLP: MRd, len 4, requester 01:00, tag 0x01, last 0xf, first 0xf, Addr 0x34822ef0
19:40:06.448789 IP 192.168.10.1.16384 > omega.16384: NetTLP: MWr, len 2, requester 00:00, tag 0x00, last 0xf, first 0xf, Addr 0x80000028
19:40:06.448790 IP 192.168.10.1.12289 > omega.12289: NetTLP: CplD, len 4, completer 00:00, success, bc 16, requester 01:00, tag 0x01, lowaddr 0x70
19:40:06.448795 IP omega.12289 > 192.168.10.1.12289: NetTLP: MRd, len 16, requester 01:00, tag 0x01, last 0xf, first 0xf, Addr 0x541eb000
19:40:06.448801 IP 192.168.10.1.16384 > omega.16384: NetTLP: MWr, len 2, requester 00:00, tag 0x00, last 0xf, first 0xf, Addr 0x80000028
19:40:06.448813 IP 192.168.10.1.12289 > omega.12289: NetTLP: CplD, len 16, completer 00:00, success, bc 64, requester 01:00, tag 0x01, lowaddr 0x00
19:40:06.448814 IP 192.168.10.1.16384 > omega.16384: NetTLP: MWr, len 2, requester 00:00, tag 0x00, last 0xf, first 0xf, Addr 0x80000028
19:40:06.448815 IP 192.168.10.1.16384 > omega.16384: NetTLP: MWr, len 2, requester 00:00, tag 0x00, last 0xf, first 0xf, Addr 0x80000028
19:40:06.448816 IP 192.168.10.1.16384 > omega.16384: NetTLP: MWr, len 2, requester 00:00, tag 0x00, last 0xf, first 0xf, Addr 0x80000028
19:40:06.448821 IP omega.12289 > 192.168.10.1.12289: NetTLP: MWr, len 1, requester 01:00, tag 0x01, last 0x0, first 0xf, Addr 0xfee02004
19:40:06.448825 IP 192.168.10.1.16384 > omega.16384: NetTLP: MWr, len 2, requester 00:00, tag 0x00, last 0xf, first 0xf, Addr 0x80000028
19:40:06.448827 IP omega.12289 > 192.168.10.1.12289: NetTLP: MRd, len 4, requester 01:00, tag 0x01, last 0xf, first 0xf, Addr 0x34822f00
19:40:06.448840 IP 192.168.10.1.16384 > omega.16384: NetTLP: MWr, len 2, requester 00:00, tag 0x00, last 0xf, first 0xf, Addr 0x80000028
19:40:06.448841 IP 192.168.10.1.12289 > omega.12289: NetTLP: CplD, len 4, completer 00:00, success, bc 16, requester 01:00, tag 0x01, lowaddr 0x00
19:40:06.448842 IP 192.168.10.1.16384 > omega.16384: NetTLP: MWr, len 2, requester 00:00, tag 0x00, last 0xf, first 0xf, Addr 0x80000028
19:40:06.448847 IP omega.12289 > 192.168.10.1.12289: NetTLP: MRd, len 16, requester 01:00, tag 0x01, last 0xf, first 0xf, Addr 0x541eb800
19:40:06.448852 IP 192.168.10.1.16384 > omega.16384: NetTLP: MWr, len 2, requester 00:00, tag 0x00, last 0xf, first 0xf, Addr 0x80000028
19:40:06.448853 IP 192.168.10.1.16384 > omega.16384: NetTLP: MWr, len 2, requester 00:00, tag 0x00, last 0xf, first 0xf, Addr 0x80000028
19:40:06.448854 IP 192.168.10.1.12289 > omega.12289: NetTLP: CplD, len 16, completer 00:00, success, bc 64, requester 01:00, tag 0x01, lowaddr 0x00
19:40:06.448860 IP omega.12289 > 192.168.10.1.12289: NetTLP: MWr, len 1, requester 01:00, tag 0x01, last 0x0, first 0xf, Addr 0xfee02004
19:40:06.448863 IP omega.12289 > 192.168.10.1.12289: NetTLP: MRd, len 4, requester 01:00, tag 0x01, last 0xf, first 0xf, Addr 0x34822f10
19:40:06.448864 IP 192.168.10.1.16384 > omega.16384: NetTLP: MWr, len 2, requester 00:00, tag 0x00, last 0xf, first 0xf, Addr 0x80000028
19:40:06.448866 IP 192.168.10.1.16384 > omega.16384: NetTLP: MWr, len 2, requester 00:00, tag 0x00, last 0xf, first 0xf, Addr 0x80000028
19:40:06.448879 IP 192.168.10.1.16384 > omega.16384: NetTLP: MWr, len 2, requester 00:00, tag 0x00, last 0xf, first 0xf, Addr 0x80000028
19:40:06.448880 IP 192.168.10.1.12289 > omega.12289: NetTLP: CplD, len 4, completer 00:00, success, bc 16, requester 01:00, tag 0x01, lowaddr 0x10
19:40:06.448885 IP omega.12289 > 192.168.10.1.12289: NetTLP: MRd, len 16, requester 01:00, tag 0x01, last 0xf, first 0xf, Addr 0x541ec000
19:40:06.448891 IP 192.168.10.1.16384 > omega.16384: NetTLP: MWr, len 2, requester 00:00, tag 0x00, last 0xf, first 0xf, Addr 0x80000028
19:40:06.448892 IP 192.168.10.1.16384 > omega.16384: NetTLP: MWr, len 2, requester 00:00, tag 0x00, last 0xf, first 0xf, Addr 0x80000028
19:40:06.448893 IP 192.168.10.1.12289 > omega.12289: NetTLP: CplD, len 16, completer 00:00, success, bc 64, requester 01:00, tag 0x01, lowaddr 0x00
19:40:06.448899 IP omega.12289 > 192.168.10.1.12289: NetTLP: MWr, len 1, requester 01:00, tag 0x01, last 0x0, first 0xf, Addr 0xfee02004
19:40:06.448903 IP omega.12289 > 192.168.10.1.12289: NetTLP: MRd, len 4, requester 01:00, tag 0x01, last 0xf, first 0xf, Addr 0x34822f20
19:40:06.448903 IP 192.168.10.1.16384 > omega.16384: NetTLP: MWr, len 2, requester 00:00, tag 0x00, last 0xf, first 0xf, Addr 0x80000028
19:40:06.448905 IP 192.168.10.1.16384 > omega.16384: NetTLP: MWr, len 2, requester 00:00, tag 0x00, last 0xf, first 0xf, Addr 0x80000028
19:40:06.448918 IP 192.168.10.1.12289 > omega.12289: NetTLP: CplD, len 4, completer 00:00, success, bc 16, requester 01:00, tag 0x01, lowaddr 0x20
19:40:06.448920 IP 192.168.10.1.16384 > omega.16384: NetTLP: MWr, len 2, requester 00:00, tag 0x00, last 0xf, first 0xf, Addr 0x80000028
19:40:06.448924 IP omega.12289 > 192.168.10.1.12289: NetTLP: MRd, len 16, requester 01:00, tag 0x01, last 0xf, first 0xf, Addr 0x541ec800
19:40:06.448930 IP 192.168.10.1.16384 > omega.16384: NetTLP: MWr, len 2, requester 00:00, tag 0x00, last 0xf, first 0xf, Addr 0x80000028
19:40:06.448931 IP 192.168.10.1.16384 > omega.16384: NetTLP: MWr, len 2, requester 00:00, tag 0x00, last 0xf, first 0xf, Addr 0x80000028
19:40:06.448932 IP 192.168.10.1.12289 > omega.12289: NetTLP: CplD, len 16, completer 00:00, success, bc 64, requester 01:00, tag 0x01, lowaddr 0x00
19:40:06.448938 IP omega.12289 > 192.168.10.1.12289: NetTLP: MWr, len 1, requester 01:00, tag 0x01, last 0x0, first 0xf, Addr 0xfee02004
19:40:06.448942 IP omega.12289 > 192.168.10.1.12289: NetTLP: MRd, len 4, requester 01:00, tag 0x01, last 0xf, first 0xf, Addr 0x34822f30
19:40:06.448942 IP 192.168.10.1.16384 > omega.16384: NetTLP: MWr, len 2, requester 00:00, tag 0x00, last 0xf, first 0xf, Addr 0x80000028
19:40:06.448944 IP 192.168.10.1.16384 > omega.16384: NetTLP: MWr, len 2, requester 00:00, tag 0x00, last 0xf, first 0xf, Addr 0x80000028
19:40:06.448957 IP 192.168.10.1.12289 > omega.12289: NetTLP: CplD, len 4, completer 00:00, success, bc 16, requester 01:00, tag 0x01, lowaddr 0x30
19:40:06.448959 IP 192.168.10.1.16384 > omega.16384: NetTLP: MWr, len 2, requester 00:00, tag 0x00, last 0xf, first 0xf, Addr 0x80000028
19:40:06.448963 IP omega.12289 > 192.168.10.1.12289: NetTLP: MRd, len 16, requester 01:00, tag 0x01, last 0xf, first 0xf, Addr 0x541ed000
19:40:06.448969 IP 192.168.10.1.16384 > omega.16384: NetTLP: MWr, len 2, requester 00:00, tag 0x00, last 0xf, first 0xf, Addr 0x80000028
19:40:06.448970 IP 192.168.10.1.16384 > omega.16384: NetTLP: MWr, len 2, requester 00:00, tag 0x00, last 0xf, first 0xf, Addr 0x80000028
19:40:06.448971 IP 192.168.10.1.12289 > omega.12289: NetTLP: CplD, len 16, completer 00:00, success, bc 64, requester 01:00, tag 0x01, lowaddr 0x00
19:40:06.448977 IP omega.12289 > 192.168.10.1.12289: NetTLP: MWr, len 1, requester 01:00, tag 0x01, last 0x0, first 0xf, Addr 0xfee02004
19:40:06.448981 IP omega.12289 > 192.168.10.1.12289: NetTLP: MRd, len 4, requester 01:00, tag 0x01, last 0xf, first 0xf, Addr 0x34822f40
19:40:06.448981 IP 192.168.10.1.16384 > omega.16384: NetTLP: MWr, len 2, requester 00:00, tag 0x00, last 0xf, first 0xf, Addr 0x80000028
19:40:06.448995 IP 192.168.10.1.12289 > omega.12289: NetTLP: CplD, len 4, completer 00:00, success, bc 16, requester 01:00, tag 0x01, lowaddr 0x40
19:40:06.449001 IP omega.12289 > 192.168.10.1.12289: NetTLP: MRd, len 16, requester 01:00, tag 0x01, last 0xf, first 0xf, Addr 0x541ed800
19:40:06.449013 IP 192.168.10.1.12289 > omega.12289: NetTLP: CplD, len 16, completer 00:00, success, bc 64, requester 01:00, tag 0x01, lowaddr 0x00
19:40:06.449019 IP omega.12289 > 192.168.10.1.12289: NetTLP: MWr, len 1, requester 01:00, tag 0x01, last 0x0, first 0xf, Addr 0xfee02004
19:40:06.449022 IP omega.12289 > 192.168.10.1.12289: NetTLP: MRd, len 4, requester 01:00, tag 0x01, last 0xf, first 0xf, Addr 0x34822f50
19:40:06.449033 IP 192.168.10.1.12289 > omega.12289: NetTLP: CplD, len 4, completer 00:00, success, bc 16, requester 01:00, tag 0x01, lowaddr 0x50
19:40:06.449039 IP omega.12289 > 192.168.10.1.12289: NetTLP: MRd, len 16, requester 01:00, tag 0x01, last 0xf, first 0xf, Addr 0x541ee000
19:40:06.449051 IP 192.168.10.1.12289 > omega.12289: NetTLP: CplD, len 16, completer 00:00, success, bc 64, requester 01:00, tag 0x01, lowaddr 0x00
19:40:06.449057 IP omega.12289 > 192.168.10.1.12289: NetTLP: MWr, len 1, requester 01:00, tag 0x01, last 0x0, first 0xf, Addr 0xfee02004
19:40:06.449060 IP omega.12289 > 192.168.10.1.12289: NetTLP: MRd, len 4, requester 01:00, tag 0x01, last 0xf, first 0xf, Addr 0x34822f60
19:40:06.449071 IP 192.168.10.1.12289 > omega.12289: NetTLP: CplD, len 4, completer 00:00, success, bc 16, requester 01:00, tag 0x01, lowaddr 0x60
19:40:06.449077 IP omega.12289 > 192.168.10.1.12289: NetTLP: MRd, len 16, requester 01:00, tag 0x01, last 0xf, first 0xf, Addr 0x541ee800
19:40:06.449089 IP 192.168.10.1.12289 > omega.12289: NetTLP: CplD, len 16, completer 00:00, success, bc 64, requester 01:00, tag 0x01, lowaddr 0x00
19:40:06.449095 IP omega.12289 > 192.168.10.1.12289: NetTLP: MWr, len 1, requester 01:00, tag 0x01, last 0x0, first 0xf, Addr 0xfee02004
19:40:06.449098 IP omega.12289 > 192.168.10.1.12289: NetTLP: MRd, len 4, requester 01:00, tag 0x01, last 0xf, first 0xf, Addr 0x34822f70
19:40:06.449109 IP 192.168.10.1.12289 > omega.12289: NetTLP: CplD, len 4, completer 00:00, success, bc 16, requester 01:00, tag 0x01, lowaddr 0x70
19:40:06.449115 IP omega.12289 > 192.168.10.1.12289: NetTLP: MRd, len 16, requester 01:00, tag 0x01, last 0xf, first 0xf, Addr 0x541ef000
19:40:06.449127 IP 192.168.10.1.12289 > omega.12289: NetTLP: CplD, len 16, completer 00:00, success, bc 64, requester 01:00, tag 0x01, lowaddr 0x00
19:40:06.449132 IP omega.12289 > 192.168.10.1.12289: NetTLP: MWr, len 1, requester 01:00, tag 0x01, last 0x0, first 0xf, Addr 0xfee02004
19:40:06.449136 IP omega.12289 > 192.168.10.1.12289: NetTLP: MRd, len 4, requester 01:00, tag 0x01, last 0xf, first 0xf, Addr 0x34822f80
19:40:06.449147 IP 192.168.10.1.12289 > omega.12289: NetTLP: CplD, len 4, completer 00:00, success, bc 16, requester 01:00, tag 0x01, lowaddr 0x00
19:40:06.449152 IP omega.12289 > 192.168.10.1.12289: NetTLP: MRd, len 16, requester 01:00, tag 0x01, last 0xf, first 0xf, Addr 0x541ef800
19:40:06.449164 IP 192.168.10.1.12289 > omega.12289: NetTLP: CplD, len 16, completer 00:00, success, bc 64, requester 01:00, tag 0x01, lowaddr 0x00
19:40:06.449170 IP omega.12289 > 192.168.10.1.12289: NetTLP: MWr, len 1, requester 01:00, tag 0x01, last 0x0, first 0xf, Addr 0xfee02004
19:40:06.449174 IP omega.12289 > 192.168.10.1.12289: NetTLP: MRd, len 4, requester 01:00, tag 0x01, last 0xf, first 0xf, Addr 0x34822f90
19:40:06.449185 IP 192.168.10.1.12289 > omega.12289: NetTLP: CplD, len 4, completer 00:00, success, bc 16, requester 01:00, tag 0x01, lowaddr 0x10
19:40:06.449190 IP omega.12289 > 192.168.10.1.12289: NetTLP: MRd, len 16, requester 01:00, tag 0x01, last 0xf, first 0xf, Addr 0x541f0000
19:40:06.449202 IP 192.168.10.1.12289 > omega.12289: NetTLP: CplD, len 16, completer 00:00, success, bc 64, requester 01:00, tag 0x01, lowaddr 0x00
19:40:06.449208 IP omega.12289 > 192.168.10.1.12289: NetTLP: MWr, len 1, requester 01:00, tag 0x01, last 0x0, first 0xf, Addr 0xfee02004
19:40:06.449211 IP omega.12289 > 192.168.10.1.12289: NetTLP: MRd, len 4, requester 01:00, tag 0x01, last 0xf, first 0xf, Addr 0x34822fa0
19:40:06.449223 IP 192.168.10.1.12289 > omega.12289: NetTLP: CplD, len 4, completer 00:00, success, bc 16, requester 01:00, tag 0x01, lowaddr 0x20
19:40:06.449228 IP omega.12289 > 192.168.10.1.12289: NetTLP: MRd, len 16, requester 01:00, tag 0x01, last 0xf, first 0xf, Addr 0x541f0800
19:40:06.449240 IP 192.168.10.1.12289 > omega.12289: NetTLP: CplD, len 16, completer 00:00, success, bc 64, requester 01:00, tag 0x01, lowaddr 0x00
19:40:06.449246 IP omega.12289 > 192.168.10.1.12289: NetTLP: MWr, len 1, requester 01:00, tag 0x01, last 0x0, first 0xf, Addr 0xfee02004
19:40:06.449249 IP omega.12289 > 192.168.10.1.12289: NetTLP: MRd, len 4, requester 01:00, tag 0x01, last 0xf, first 0xf, Addr 0x34822fb0
19:40:06.449261 IP 192.168.10.1.12289 > omega.12289: NetTLP: CplD, len 4, completer 00:00, success, bc 16, requester 01:00, tag 0x01, lowaddr 0x30
19:40:06.449266 IP omega.12289 > 192.168.10.1.12289: NetTLP: MRd, len 16, requester 01:00, tag 0x01, last 0xf, first 0xf, Addr 0x541f1000
19:40:06.449278 IP 192.168.10.1.12289 > omega.12289: NetTLP: CplD, len 16, completer 00:00, success, bc 64, requester 01:00, tag 0x01, lowaddr 0x00
19:40:06.449284 IP omega.12289 > 192.168.10.1.12289: NetTLP: MWr, len 1, requester 01:00, tag 0x01, last 0x0, first 0xf, Addr 0xfee02004
19:40:06.449287 IP omega.12289 > 192.168.10.1.12289: NetTLP: MRd, len 4, requester 01:00, tag 0x01, last 0xf, first 0xf, Addr 0x34822fc0
19:40:06.449299 IP 192.168.10.1.12289 > omega.12289: NetTLP: CplD, len 4, completer 00:00, success, bc 16, requester 01:00, tag 0x01, lowaddr 0x40
19:40:06.449304 IP omega.12289 > 192.168.10.1.12289: NetTLP: MRd, len 16, requester 01:00, tag 0x01, last 0xf, first 0xf, Addr 0x541f1800
19:40:06.449316 IP 192.168.10.1.12289 > omega.12289: NetTLP: CplD, len 16, completer 00:00, success, bc 64, requester 01:00, tag 0x01, lowaddr 0x00
19:40:06.449322 IP omega.12289 > 192.168.10.1.12289: NetTLP: MWr, len 1, requester 01:00, tag 0x01, last 0x0, first 0xf, Addr 0xfee02004
19:40:06.449325 IP omega.12289 > 192.168.10.1.12289: NetTLP: MRd, len 4, requester 01:00, tag 0x01, last 0xf, first 0xf, Addr 0x34822fd0
19:40:06.449338 IP 192.168.10.1.12289 > omega.12289: NetTLP: CplD, len 4, completer 00:00, success, bc 16, requester 01:00, tag 0x01, lowaddr 0x50
19:40:06.449344 IP omega.12289 > 192.168.10.1.12289: NetTLP: MRd, len 16, requester 01:00, tag 0x01, last 0xf, first 0xf, Addr 0x541f2000
19:40:06.449355 IP 192.168.10.1.12289 > omega.12289: NetTLP: CplD, len 16, completer 00:00, success, bc 64, requester 01:00, tag 0x01, lowaddr 0x00
19:40:06.449361 IP omega.12289 > 192.168.10.1.12289: NetTLP: MWr, len 1, requester 01:00, tag 0x01, last 0x0, first 0xf, Addr 0xfee02004
19:40:06.449364 IP omega.12289 > 192.168.10.1.12289: NetTLP: MRd, len 4, requester 01:00, tag 0x01, last 0xf, first 0xf, Addr 0x34822fe0
19:40:06.449375 IP 192.168.10.1.12289 > omega.12289: NetTLP: CplD, len 4, completer 00:00, success, bc 16, requester 01:00, tag 0x01, lowaddr 0x60
19:40:06.449381 IP omega.12289 > 192.168.10.1.12289: NetTLP: MRd, len 16, requester 01:00, tag 0x01, last 0xf, first 0xf, Addr 0x541f2800
19:40:06.449393 IP 192.168.10.1.12289 > omega.12289: NetTLP: CplD, len 16, completer 00:00, success, bc 64, requester 01:00, tag 0x01, lowaddr 0x00
19:40:06.449399 IP omega.12289 > 192.168.10.1.12289: NetTLP: MWr, len 1, requester 01:00, tag 0x01, last 0x0, first 0xf, Addr 0xfee02004
19:40:06.449402 IP omega.12289 > 192.168.10.1.12289: NetTLP: MRd, len 4, requester 01:00, tag 0x01, last 0xf, first 0xf, Addr 0x34822ff0
19:40:06.449413 IP 192.168.10.1.12289 > omega.12289: NetTLP: CplD, len 4, completer 00:00, success, bc 16, requester 01:00, tag 0x01, lowaddr 0x70
19:40:06.449419 IP omega.12289 > 192.168.10.1.12289: NetTLP: MRd, len 16, requester 01:00, tag 0x01, last 0xf, first 0xf, Addr 0x541f3000
19:40:06.449431 IP 192.168.10.1.12289 > omega.12289: NetTLP: CplD, len 16, completer 00:00, success, bc 64, requester 01:00, tag 0x01, lowaddr 0x00
19:40:06.449437 IP omega.12289 > 192.168.10.1.12289: NetTLP: MWr, len 1, requester 01:00, tag 0x01, last 0x0, first 0xf, Addr 0xfee02004
19:40:06.449440 IP omega.12289 > 192.168.10.1.12289: NetTLP: MRd, len 4, requester 01:00, tag 0x01, last 0xf, first 0xf, Addr 0x34823000
19:40:06.449451 IP 192.168.10.1.12289 > omega.12289: NetTLP: CplD, len 4, completer 00:00, success, bc 16, requester 01:00, tag 0x01, lowaddr 0x00
19:40:06.449456 IP omega.12289 > 192.168.10.1.12289: NetTLP: MRd, len 16, requester 01:00, tag 0x01, last 0xf, first 0xf, Addr 0x541f3800
19:40:06.449469 IP 192.168.10.1.12289 > omega.12289: NetTLP: CplD, len 16, completer 00:00, success, bc 64, requester 01:00, tag 0x01, lowaddr 0x00
19:40:06.449475 IP omega.12289 > 192.168.10.1.12289: NetTLP: MWr, len 1, requester 01:00, tag 0x01, last 0x0, first 0xf, Addr 0xfee02004
19:40:06.449478 IP omega.12289 > 192.168.10.1.12289: NetTLP: MRd, len 4, requester 01:00, tag 0x01, last 0xf, first 0xf, Addr 0x34823010
19:40:06.449489 IP 192.168.10.1.12289 > omega.12289: NetTLP: CplD, len 4, completer 00:00, success, bc 16, requester 01:00, tag 0x01, lowaddr 0x10
19:40:06.449494 IP omega.12289 > 192.168.10.1.12289: NetTLP: MRd, len 16, requester 01:00, tag 0x01, last 0xf, first 0xf, Addr 0x541f4000
19:40:06.449506 IP 192.168.10.1.12289 > omega.12289: NetTLP: CplD, len 16, completer 00:00, success, bc 64, requester 01:00, tag 0x01, lowaddr 0x00
19:40:06.449512 IP omega.12289 > 192.168.10.1.12289: NetTLP: MWr, len 1, requester 01:00, tag 0x01, last 0x0, first 0xf, Addr 0xfee02004
19:40:06.449516 IP omega.12289 > 192.168.10.1.12289: NetTLP: MRd, len 4, requester 01:00, tag 0x01, last 0xf, first 0xf, Addr 0x34823020
19:40:06.449527 IP 192.168.10.1.12289 > omega.12289: NetTLP: CplD, len 4, completer 00:00, success, bc 16, requester 01:00, tag 0x01, lowaddr 0x20
19:40:06.449533 IP omega.12289 > 192.168.10.1.12289: NetTLP: MRd, len 16, requester 01:00, tag 0x01, last 0xf, first 0xf, Addr 0x541f4800
19:40:06.449544 IP 192.168.10.1.12289 > omega.12289: NetTLP: CplD, len 16, completer 00:00, success, bc 64, requester 01:00, tag 0x01, lowaddr 0x00
19:40:06.449550 IP omega.12289 > 192.168.10.1.12289: NetTLP: MWr, len 1, requester 01:00, tag 0x01, last 0x0, first 0xf, Addr 0xfee02004
19:40:06.449553 IP omega.12289 > 192.168.10.1.12289: NetTLP: MRd, len 4, requester 01:00, tag 0x01, last 0xf, first 0xf, Addr 0x34823030
19:40:06.449565 IP 192.168.10.1.12289 > omega.12289: NetTLP: CplD, len 4, completer 00:00, success, bc 16, requester 01:00, tag 0x01, lowaddr 0x30
19:40:06.449570 IP omega.12289 > 192.168.10.1.12289: NetTLP: MRd, len 16, requester 01:00, tag 0x01, last 0xf, first 0xf, Addr 0x541f5000
19:40:06.449581 IP 192.168.10.1.12289 > omega.12289: NetTLP: CplD, len 16, completer 00:00, success, bc 64, requester 01:00, tag 0x01, lowaddr 0x00
19:40:06.449587 IP omega.12289 > 192.168.10.1.12289: NetTLP: MWr, len 1, requester 01:00, tag 0x01, last 0x0, first 0xf, Addr 0xfee02004
19:40:06.449590 IP omega.12289 > 192.168.10.1.12289: NetTLP: MRd, len 4, requester 01:00, tag 0x01, last 0xf, first 0xf, Addr 0x34823040
19:40:06.449602 IP 192.168.10.1.12289 > omega.12289: NetTLP: CplD, len 4, completer 00:00, success, bc 16, requester 01:00, tag 0x01, lowaddr 0x40
19:40:06.449607 IP omega.12289 > 192.168.10.1.12289: NetTLP: MRd, len 16, requester 01:00, tag 0x01, last 0xf, first 0xf, Addr 0x541f5800
19:40:06.449619 IP 192.168.10.1.12289 > omega.12289: NetTLP: CplD, len 16, completer 00:00, success, bc 64, requester 01:00, tag 0x01, lowaddr 0x00
19:40:06.449625 IP omega.12289 > 192.168.10.1.12289: NetTLP: MWr, len 1, requester 01:00, tag 0x01, last 0x0, first 0xf, Addr 0xfee02004
19:40:06.449628 IP omega.12289 > 192.168.10.1.12289: NetTLP: MRd, len 4, requester 01:00, tag 0x01, last 0xf, first 0xf, Addr 0x34823050
19:40:06.449640 IP 192.168.10.1.12289 > omega.12289: NetTLP: CplD, len 4, completer 00:00, success, bc 16, requester 01:00, tag 0x01, lowaddr 0x50
19:40:06.449645 IP omega.12289 > 192.168.10.1.12289: NetTLP: MRd, len 16, requester 01:00, tag 0x01, last 0xf, first 0xf, Addr 0x541f6000
19:40:06.449657 IP 192.168.10.1.12289 > omega.12289: NetTLP: CplD, len 16, completer 00:00, success, bc 64, requester 01:00, tag 0x01, lowaddr 0x00
19:40:06.449663 IP omega.12289 > 192.168.10.1.12289: NetTLP: MWr, len 1, requester 01:00, tag 0x01, last 0x0, first 0xf, Addr 0xfee02004
19:40:06.449666 IP omega.12289 > 192.168.10.1.12289: NetTLP: MRd, len 4, requester 01:00, tag 0x01, last 0xf, first 0xf, Addr 0x34823060
19:40:06.449677 IP 192.168.10.1.12289 > omega.12289: NetTLP: CplD, len 4, completer 00:00, success, bc 16, requester 01:00, tag 0x01, lowaddr 0x60
19:40:06.449683 IP omega.12289 > 192.168.10.1.12289: NetTLP: MRd, len 16, requester 01:00, tag 0x01, last 0xf, first 0xf, Addr 0x541f6800
19:40:06.449695 IP 192.168.10.1.12289 > omega.12289: NetTLP: CplD, len 16, completer 00:00, success, bc 64, requester 01:00, tag 0x01, lowaddr 0x00
19:40:06.449701 IP omega.12289 > 192.168.10.1.12289: NetTLP: MWr, len 1, requester 01:00, tag 0x01, last 0x0, first 0xf, Addr 0xfee02004
19:40:06.449704 IP omega.12289 > 192.168.10.1.12289: NetTLP: MRd, len 4, requester 01:00, tag 0x01, last 0xf, first 0xf, Addr 0x34823070
19:40:06.449715 IP 192.168.10.1.12289 > omega.12289: NetTLP: CplD, len 4, completer 00:00, success, bc 16, requester 01:00, tag 0x01, lowaddr 0x70
19:40:06.449721 IP omega.12289 > 192.168.10.1.12289: NetTLP: MRd, len 16, requester 01:00, tag 0x01, last 0xf, first 0xf, Addr 0x541f7000
19:40:06.449732 IP 192.168.10.1.12289 > omega.12289: NetTLP: CplD, len 16, completer 00:00, success, bc 64, requester 01:00, tag 0x01, lowaddr 0x00
19:40:06.449738 IP omega.12289 > 192.168.10.1.12289: NetTLP: MWr, len 1, requester 01:00, tag 0x01, last 0x0, first 0xf, Addr 0xfee02004
19:40:06.449741 IP omega.12289 > 192.168.10.1.12289: NetTLP: MRd, len 4, requester 01:00, tag 0x01, last 0xf, first 0xf, Addr 0x34823080
19:40:06.449752 IP 192.168.10.1.12289 > omega.12289: NetTLP: CplD, len 4, completer 00:00, success, bc 16, requester 01:00, tag 0x01, lowaddr 0x00
19:40:06.449758 IP omega.12289 > 192.168.10.1.12289: NetTLP: MRd, len 16, requester 01:00, tag 0x01, last 0xf, first 0xf, Addr 0x541f7800
19:40:06.449770 IP 192.168.10.1.12289 > omega.12289: NetTLP: CplD, len 16, completer 00:00, success, bc 64, requester 01:00, tag 0x01, lowaddr 0x00
19:40:06.449776 IP omega.12289 > 192.168.10.1.12289: NetTLP: MWr, len 1, requester 01:00, tag 0x01, last 0x0, first 0xf, Addr 0xfee02004
19:40:06.449779 IP omega.12289 > 192.168.10.1.12289: NetTLP: MRd, len 4, requester 01:00, tag 0x01, last 0xf, first 0xf, Addr 0x34823090
19:40:06.449790 IP 192.168.10.1.12289 > omega.12289: NetTLP: CplD, len 4, completer 00:00, success, bc 16, requester 01:00, tag 0x01, lowaddr 0x10
19:40:06.449795 IP omega.12289 > 192.168.10.1.12289: NetTLP: MRd, len 16, requester 01:00, tag 0x01, last 0xf, first 0xf, Addr 0x541f8000
19:40:06.449807 IP 192.168.10.1.12289 > omega.12289: NetTLP: CplD, len 16, completer 00:00, success, bc 64, requester 01:00, tag 0x01, lowaddr 0x00
19:40:06.449813 IP omega.12289 > 192.168.10.1.12289: NetTLP: MWr, len 1, requester 01:00, tag 0x01, last 0x0, first 0xf, Addr 0xfee02004
19:40:06.449817 IP omega.12289 > 192.168.10.1.12289: NetTLP: MRd, len 4, requester 01:00, tag 0x01, last 0xf, first 0xf, Addr 0x348230a0
19:40:06.449828 IP 192.168.10.1.12289 > omega.12289: NetTLP: CplD, len 4, completer 00:00, success, bc 16, requester 01:00, tag 0x01, lowaddr 0x20
19:40:06.449834 IP omega.12289 > 192.168.10.1.12289: NetTLP: MRd, len 16, requester 01:00, tag 0x01, last 0xf, first 0xf, Addr 0x541f8800
19:40:06.449845 IP 192.168.10.1.12289 > omega.12289: NetTLP: CplD, len 16, completer 00:00, success, bc 64, requester 01:00, tag 0x01, lowaddr 0x00
19:40:06.449851 IP omega.12289 > 192.168.10.1.12289: NetTLP: MWr, len 1, requester 01:00, tag 0x01, last 0x0, first 0xf, Addr 0xfee02004
19:40:06.449855 IP omega.12289 > 192.168.10.1.12289: NetTLP: MRd, len 4, requester 01:00, tag 0x01, last 0xf, first 0xf, Addr 0x348230b0
19:40:06.449866 IP 192.168.10.1.12289 > omega.12289: NetTLP: CplD, len 4, completer 00:00, success, bc 16, requester 01:00, tag 0x01, lowaddr 0x30
19:40:06.449871 IP omega.12289 > 192.168.10.1.12289: NetTLP: MRd, len 16, requester 01:00, tag 0x01, last 0xf, first 0xf, Addr 0x541f9000
19:40:06.449883 IP 192.168.10.1.12289 > omega.12289: NetTLP: CplD, len 16, completer 00:00, success, bc 64, requester 01:00, tag 0x01, lowaddr 0x00
19:40:06.449889 IP omega.12289 > 192.168.10.1.12289: NetTLP: MWr, len 1, requester 01:00, tag 0x01, last 0x0, first 0xf, Addr 0xfee02004
19:40:06.449892 IP omega.12289 > 192.168.10.1.12289: NetTLP: MRd, len 4, requester 01:00, tag 0x01, last 0xf, first 0xf, Addr 0x348230c0
19:40:06.449904 IP 192.168.10.1.12289 > omega.12289: NetTLP: CplD, len 4, completer 00:00, success, bc 16, requester 01:00, tag 0x01, lowaddr 0x40
19:40:06.449909 IP omega.12289 > 192.168.10.1.12289: NetTLP: MRd, len 16, requester 01:00, tag 0x01, last 0xf, first 0xf, Addr 0x541f9800
19:40:06.449921 IP 192.168.10.1.12289 > omega.12289: NetTLP: CplD, len 16, completer 00:00, success, bc 64, requester 01:00, tag 0x01, lowaddr 0x00
19:40:06.449927 IP omega.12289 > 192.168.10.1.12289: NetTLP: MWr, len 1, requester 01:00, tag 0x01, last 0x0, first 0xf, Addr 0xfee02004
19:40:06.449930 IP omega.12289 > 192.168.10.1.12289: NetTLP: MRd, len 4, requester 01:00, tag 0x01, last 0xf, first 0xf, Addr 0x348230d0
19:40:06.449942 IP 192.168.10.1.12289 > omega.12289: NetTLP: CplD, len 4, completer 00:00, success, bc 16, requester 01:00, tag 0x01, lowaddr 0x50
19:40:06.449947 IP omega.12289 > 192.168.10.1.12289: NetTLP: MRd, len 16, requester 01:00, tag 0x01, last 0xf, first 0xf, Addr 0x541fa000
19:40:06.449959 IP 192.168.10.1.12289 > omega.12289: NetTLP: CplD, len 16, completer 00:00, success, bc 64, requester 01:00, tag 0x01, lowaddr 0x00
19:40:06.449965 IP omega.12289 > 192.168.10.1.12289: NetTLP: MWr, len 1, requester 01:00, tag 0x01, last 0x0, first 0xf, Addr 0xfee02004
19:40:06.449968 IP omega.12289 > 192.168.10.1.12289: NetTLP: MRd, len 4, requester 01:00, tag 0x01, last 0xf, first 0xf, Addr 0x348230e0
19:40:06.449980 IP 192.168.10.1.12289 > omega.12289: NetTLP: CplD, len 4, completer 00:00, success, bc 16, requester 01:00, tag 0x01, lowaddr 0x60
19:40:06.449985 IP omega.12289 > 192.168.10.1.12289: NetTLP: MRd, len 16, requester 01:00, tag 0x01, last 0xf, first 0xf, Addr 0x541fa800
19:40:06.449997 IP 192.168.10.1.12289 > omega.12289: NetTLP: CplD, len 16, completer 00:00, success, bc 64, requester 01:00, tag 0x01, lowaddr 0x00
19:40:06.450003 IP omega.12289 > 192.168.10.1.12289: NetTLP: MWr, len 1, requester 01:00, tag 0x01, last 0x0, first 0xf, Addr 0xfee02004
19:40:06.450006 IP omega.12289 > 192.168.10.1.12289: NetTLP: MRd, len 4, requester 01:00, tag 0x01, last 0xf, first 0xf, Addr 0x348230f0
19:40:06.450017 IP 192.168.10.1.12289 > omega.12289: NetTLP: CplD, len 4, completer 00:00, success, bc 16, requester 01:00, tag 0x01, lowaddr 0x70
19:40:06.450023 IP omega.12289 > 192.168.10.1.12289: NetTLP: MRd, len 16, requester 01:00, tag 0x01, last 0xf, first 0xf, Addr 0x541fb000
19:40:06.450035 IP 192.168.10.1.12289 > omega.12289: NetTLP: CplD, len 16, completer 00:00, success, bc 64, requester 01:00, tag 0x01, lowaddr 0x00
19:40:06.450041 IP omega.12289 > 192.168.10.1.12289: NetTLP: MWr, len 1, requester 01:00, tag 0x01, last 0x0, first 0xf, Addr 0xfee02004
19:40:06.450044 IP omega.12289 > 192.168.10.1.12289: NetTLP: MRd, len 4, requester 01:00, tag 0x01, last 0xf, first 0xf, Addr 0x34823100
19:40:06.450055 IP 192.168.10.1.12289 > omega.12289: NetTLP: CplD, len 4, completer 00:00, success, bc 16, requester 01:00, tag 0x01, lowaddr 0x00
19:40:06.450061 IP omega.12289 > 192.168.10.1.12289: NetTLP: MRd, len 16, requester 01:00, tag 0x01, last 0xf, first 0xf, Addr 0x541fb800
19:40:06.450073 IP 192.168.10.1.12289 > omega.12289: NetTLP: CplD, len 16, completer 00:00, success, bc 64, requester 01:00, tag 0x01, lowaddr 0x00
19:40:06.450079 IP omega.12289 > 192.168.10.1.12289: NetTLP: MWr, len 1, requester 01:00, tag 0x01, last 0x0, first 0xf, Addr 0xfee02004
19:40:06.450082 IP omega.12289 > 192.168.10.1.12289: NetTLP: MRd, len 4, requester 01:00, tag 0x01, last 0xf, first 0xf, Addr 0x34823110
19:40:06.450093 IP 192.168.10.1.12289 > omega.12289: NetTLP: CplD, len 4, completer 00:00, success, bc 16, requester 01:00, tag 0x01, lowaddr 0x10
19:40:06.450099 IP omega.12289 > 192.168.10.1.12289: NetTLP: MRd, len 16, requester 01:00, tag 0x01, last 0xf, first 0xf, Addr 0x541fc000
19:40:06.450111 IP 192.168.10.1.12289 > omega.12289: NetTLP: CplD, len 16, completer 00:00, success, bc 64, requester 01:00, tag 0x01, lowaddr 0x00
19:40:06.450116 IP omega.12289 > 192.168.10.1.12289: NetTLP: MWr, len 1, requester 01:00, tag 0x01, last 0x0, first 0xf, Addr 0xfee02004
19:40:06.450120 IP omega.12289 > 192.168.10.1.12289: NetTLP: MRd, len 4, requester 01:00, tag 0x01, last 0xf, first 0xf, Addr 0x34823120
19:40:06.450131 IP 192.168.10.1.12289 > omega.12289: NetTLP: CplD, len 4, completer 00:00, success, bc 16, requester 01:00, tag 0x01, lowaddr 0x20
19:40:06.450137 IP omega.12289 > 192.168.10.1.12289: NetTLP: MRd, len 16, requester 01:00, tag 0x01, last 0xf, first 0xf, Addr 0x541fc800
19:40:06.450148 IP 192.168.10.1.12289 > omega.12289: NetTLP: CplD, len 16, completer 00:00, success, bc 64, requester 01:00, tag 0x01, lowaddr 0x00
19:40:06.450154 IP omega.12289 > 192.168.10.1.12289: NetTLP: MWr, len 1, requester 01:00, tag 0x01, last 0x0, first 0xf, Addr 0xfee02004
19:40:06.450158 IP omega.12289 > 192.168.10.1.12289: NetTLP: MRd, len 4, requester 01:00, tag 0x01, last 0xf, first 0xf, Addr 0x34823130
19:40:06.450169 IP 192.168.10.1.12289 > omega.12289: NetTLP: CplD, len 4, completer 00:00, success, bc 16, requester 01:00, tag 0x01, lowaddr 0x30
19:40:06.450174 IP omega.12289 > 192.168.10.1.12289: NetTLP: MRd, len 16, requester 01:00, tag 0x01, last 0xf, first 0xf, Addr 0x541fd000
19:40:06.450186 IP 192.168.10.1.12289 > omega.12289: NetTLP: CplD, len 16, completer 00:00, success, bc 64, requester 01:00, tag 0x01, lowaddr 0x00
19:40:06.450192 IP omega.12289 > 192.168.10.1.12289: NetTLP: MWr, len 1, requester 01:00, tag 0x01, last 0x0, first 0xf, Addr 0xfee02004
19:40:06.450195 IP omega.12289 > 192.168.10.1.12289: NetTLP: MRd, len 4, requester 01:00, tag 0x01, last 0xf, first 0xf, Addr 0x34823140
19:40:06.450207 IP 192.168.10.1.12289 > omega.12289: NetTLP: CplD, len 4, completer 00:00, success, bc 16, requester 01:00, tag 0x01, lowaddr 0x40
19:40:06.450212 IP omega.12289 > 192.168.10.1.12289: NetTLP: MRd, len 16, requester 01:00, tag 0x01, last 0xf, first 0xf, Addr 0x541fd800
19:40:06.450224 IP 192.168.10.1.12289 > omega.12289: NetTLP: CplD, len 16, completer 00:00, success, bc 64, requester 01:00, tag 0x01, lowaddr 0x00
19:40:06.450230 IP omega.12289 > 192.168.10.1.12289: NetTLP: MWr, len 1, requester 01:00, tag 0x01, last 0x0, first 0xf, Addr 0xfee02004
19:40:06.450233 IP omega.12289 > 192.168.10.1.12289: NetTLP: MRd, len 4, requester 01:00, tag 0x01, last 0xf, first 0xf, Addr 0x34823150
19:40:06.450245 IP 192.168.10.1.12289 > omega.12289: NetTLP: CplD, len 4, completer 00:00, success, bc 16, requester 01:00, tag 0x01, lowaddr 0x50
19:40:06.450250 IP omega.12289 > 192.168.10.1.12289: NetTLP: MRd, len 16, requester 01:00, tag 0x01, last 0xf, first 0xf, Addr 0x541fe000
19:40:06.450262 IP 192.168.10.1.12289 > omega.12289: NetTLP: CplD, len 16, completer 00:00, success, bc 64, requester 01:00, tag 0x01, lowaddr 0x00
19:40:06.450268 IP omega.12289 > 192.168.10.1.12289: NetTLP: MWr, len 1, requester 01:00, tag 0x01, last 0x0, first 0xf, Addr 0xfee02004
19:40:06.450271 IP omega.12289 > 192.168.10.1.12289: NetTLP: MRd, len 4, requester 01:00, tag 0x01, last 0xf, first 0xf, Addr 0x34823160
19:40:06.450283 IP 192.168.10.1.12289 > omega.12289: NetTLP: CplD, len 4, completer 00:00, success, bc 16, requester 01:00, tag 0x01, lowaddr 0x60
19:40:06.450288 IP omega.12289 > 192.168.10.1.12289: NetTLP: MRd, len 16, requester 01:00, tag 0x01, last 0xf, first 0xf, Addr 0x541fe800
19:40:06.450300 IP 192.168.10.1.12289 > omega.12289: NetTLP: CplD, len 16, completer 00:00, success, bc 64, requester 01:00, tag 0x01, lowaddr 0x00
19:40:06.450306 IP omega.12289 > 192.168.10.1.12289: NetTLP: MWr, len 1, requester 01:00, tag 0x01, last 0x0, first 0xf, Addr 0xfee02004
19:40:06.450309 IP omega.12289 > 192.168.10.1.12289: NetTLP: MRd, len 4, requester 01:00, tag 0x01, last 0xf, first 0xf, Addr 0x34823170
19:40:06.450322 IP 192.168.10.1.12289 > omega.12289: NetTLP: CplD, len 4, completer 00:00, success, bc 16, requester 01:00, tag 0x01, lowaddr 0x70
19:40:06.450327 IP omega.12289 > 192.168.10.1.12289: NetTLP: MRd, len 16, requester 01:00, tag 0x01, last 0xf, first 0xf, Addr 0x541ff000
19:40:06.450339 IP 192.168.10.1.12289 > omega.12289: NetTLP: CplD, len 16, completer 00:00, success, bc 64, requester 01:00, tag 0x01, lowaddr 0x00
19:40:06.450345 IP omega.12289 > 192.168.10.1.12289: NetTLP: MWr, len 1, requester 01:00, tag 0x01, last 0x0, first 0xf, Addr 0xfee02004
19:40:06.450348 IP omega.12289 > 192.168.10.1.12289: NetTLP: MRd, len 4, requester 01:00, tag 0x01, last 0xf, first 0xf, Addr 0x34823180
19:40:06.450359 IP 192.168.10.1.12289 > omega.12289: NetTLP: CplD, len 4, completer 00:00, success, bc 16, requester 01:00, tag 0x01, lowaddr 0x00
19:40:06.450365 IP omega.12289 > 192.168.10.1.12289: NetTLP: MRd, len 16, requester 01:00, tag 0x01, last 0xf, first 0xf, Addr 0x541ff800
19:40:06.450377 IP 192.168.10.1.12289 > omega.12289: NetTLP: CplD, len 16, completer 00:00, success, bc 64, requester 01:00, tag 0x01, lowaddr 0x00
19:40:06.450383 IP omega.12289 > 192.168.10.1.12289: NetTLP: MWr, len 1, requester 01:00, tag 0x01, last 0x0, first 0xf, Addr 0xfee02004
19:40:06.450386 IP omega.12289 > 192.168.10.1.12289: NetTLP: MRd, len 4, requester 01:00, tag 0x01, last 0xf, first 0xf, Addr 0x34823190
19:40:06.450397 IP 192.168.10.1.12289 > omega.12289: NetTLP: CplD, len 4, completer 00:00, success, bc 16, requester 01:00, tag 0x01, lowaddr 0x10
19:40:06.450403 IP omega.12289 > 192.168.10.1.12289: NetTLP: MRd, len 16, requester 01:00, tag 0x01, last 0xf, first 0xf, Addr 0x54200000
19:40:06.450415 IP 192.168.10.1.12289 > omega.12289: NetTLP: CplD, len 16, completer 00:00, success, bc 64, requester 01:00, tag 0x01, lowaddr 0x00
19:40:06.450420 IP omega.12289 > 192.168.10.1.12289: NetTLP: MWr, len 1, requester 01:00, tag 0x01, last 0x0, first 0xf, Addr 0xfee02004
19:40:06.450424 IP omega.12289 > 192.168.10.1.12289: NetTLP: MRd, len 4, requester 01:00, tag 0x01, last 0xf, first 0xf, Addr 0x348231a0
19:40:06.450435 IP 192.168.10.1.12289 > omega.12289: NetTLP: CplD, len 4, completer 00:00, success, bc 16, requester 01:00, tag 0x01, lowaddr 0x20
19:40:06.450441 IP omega.12289 > 192.168.10.1.12289: NetTLP: MRd, len 16, requester 01:00, tag 0x01, last 0xf, first 0xf, Addr 0x54200800
19:40:06.450453 IP 192.168.10.1.12289 > omega.12289: NetTLP: CplD, len 16, completer 00:00, success, bc 64, requester 01:00, tag 0x01, lowaddr 0x00
19:40:06.450459 IP omega.12289 > 192.168.10.1.12289: NetTLP: MWr, len 1, requester 01:00, tag 0x01, last 0x0, first 0xf, Addr 0xfee02004
19:40:06.450462 IP omega.12289 > 192.168.10.1.12289: NetTLP: MRd, len 4, requester 01:00, tag 0x01, last 0xf, first 0xf, Addr 0x348231b0
19:40:06.450473 IP 192.168.10.1.12289 > omega.12289: NetTLP: CplD, len 4, completer 00:00, success, bc 16, requester 01:00, tag 0x01, lowaddr 0x30
19:40:06.450479 IP omega.12289 > 192.168.10.1.12289: NetTLP: MRd, len 16, requester 01:00, tag 0x01, last 0xf, first 0xf, Addr 0x54201000
19:40:06.450490 IP 192.168.10.1.12289 > omega.12289: NetTLP: CplD, len 16, completer 00:00, success, bc 64, requester 01:00, tag 0x01, lowaddr 0x00
19:40:06.450497 IP omega.12289 > 192.168.10.1.12289: NetTLP: MWr, len 1, requester 01:00, tag 0x01, last 0x0, first 0xf, Addr 0xfee02004
19:40:06.450500 IP omega.12289 > 192.168.10.1.12289: NetTLP: MRd, len 4, requester 01:00, tag 0x01, last 0xf, first 0xf, Addr 0x348231c0
19:40:06.450511 IP 192.168.10.1.12289 > omega.12289: NetTLP: CplD, len 4, completer 00:00, success, bc 16, requester 01:00, tag 0x01, lowaddr 0x40
19:40:06.450516 IP omega.12289 > 192.168.10.1.12289: NetTLP: MRd, len 16, requester 01:00, tag 0x01, last 0xf, first 0xf, Addr 0x54201800
19:40:06.450528 IP 192.168.10.1.12289 > omega.12289: NetTLP: CplD, len 16, completer 00:00, success, bc 64, requester 01:00, tag 0x01, lowaddr 0x00
19:40:06.450534 IP omega.12289 > 192.168.10.1.12289: NetTLP: MWr, len 1, requester 01:00, tag 0x01, last 0x0, first 0xf, Addr 0xfee02004
19:40:06.450537 IP omega.12289 > 192.168.10.1.12289: NetTLP: MRd, len 4, requester 01:00, tag 0x01, last 0xf, first 0xf, Addr 0x348231d0
19:40:06.450550 IP 192.168.10.1.12289 > omega.12289: NetTLP: CplD, len 4, completer 00:00, success, bc 16, requester 01:00, tag 0x01, lowaddr 0x50
19:40:06.450556 IP omega.12289 > 192.168.10.1.12289: NetTLP: MRd, len 16, requester 01:00, tag 0x01, last 0xf, first 0xf, Addr 0x54202000
19:40:06.450567 IP 192.168.10.1.12289 > omega.12289: NetTLP: CplD, len 16, completer 00:00, success, bc 64, requester 01:00, tag 0x01, lowaddr 0x00
19:40:06.450573 IP omega.12289 > 192.168.10.1.12289: NetTLP: MWr, len 1, requester 01:00, tag 0x01, last 0x0, first 0xf, Addr 0xfee02004
19:40:06.450576 IP omega.12289 > 192.168.10.1.12289: NetTLP: MRd, len 4, requester 01:00, tag 0x01, last 0xf, first 0xf, Addr 0x348231e0
19:40:06.450588 IP 192.168.10.1.12289 > omega.12289: NetTLP: CplD, len 4, completer 00:00, success, bc 16, requester 01:00, tag 0x01, lowaddr 0x60
19:40:06.450593 IP omega.12289 > 192.168.10.1.12289: NetTLP: MRd, len 16, requester 01:00, tag 0x01, last 0xf, first 0xf, Addr 0x54202800
19:40:06.450605 IP 192.168.10.1.12289 > omega.12289: NetTLP: CplD, len 16, completer 00:00, success, bc 64, requester 01:00, tag 0x01, lowaddr 0x00
19:40:06.450611 IP omega.12289 > 192.168.10.1.12289: NetTLP: MWr, len 1, requester 01:00, tag 0x01, last 0x0, first 0xf, Addr 0xfee02004
19:40:06.450614 IP omega.12289 > 192.168.10.1.12289: NetTLP: MRd, len 4, requester 01:00, tag 0x01, last 0xf, first 0xf, Addr 0x348231f0
19:40:06.450626 IP 192.168.10.1.12289 > omega.12289: NetTLP: CplD, len 4, completer 00:00, success, bc 16, requester 01:00, tag 0x01, lowaddr 0x70
19:40:06.450631 IP omega.12289 > 192.168.10.1.12289: NetTLP: MRd, len 16, requester 01:00, tag 0x01, last 0xf, first 0xf, Addr 0x54203000
19:40:06.450643 IP 192.168.10.1.12289 > omega.12289: NetTLP: CplD, len 16, completer 00:00, success, bc 64, requester 01:00, tag 0x01, lowaddr 0x00
19:40:06.450649 IP omega.12289 > 192.168.10.1.12289: NetTLP: MWr, len 1, requester 01:00, tag 0x01, last 0x0, first 0xf, Addr 0xfee02004
19:40:06.450652 IP omega.12289 > 192.168.10.1.12289: NetTLP: MRd, len 4, requester 01:00, tag 0x01, last 0xf, first 0xf, Addr 0x34823200
19:40:06.450664 IP 192.168.10.1.12289 > omega.12289: NetTLP: CplD, len 4, completer 00:00, success, bc 16, requester 01:00, tag 0x01, lowaddr 0x00
19:40:06.450669 IP omega.12289 > 192.168.10.1.12289: NetTLP: MRd, len 16, requester 01:00, tag 0x01, last 0xf, first 0xf, Addr 0x54203800
19:40:06.450681 IP 192.168.10.1.12289 > omega.12289: NetTLP: CplD, len 16, completer 00:00, success, bc 64, requester 01:00, tag 0x01, lowaddr 0x00
19:40:06.450687 IP omega.12289 > 192.168.10.1.12289: NetTLP: MWr, len 1, requester 01:00, tag 0x01, last 0x0, first 0xf, Addr 0xfee02004
19:40:06.450690 IP omega.12289 > 192.168.10.1.12289: NetTLP: MRd, len 4, requester 01:00, tag 0x01, last 0xf, first 0xf, Addr 0x34823210
19:40:06.450702 IP 192.168.10.1.12289 > omega.12289: NetTLP: CplD, len 4, completer 00:00, success, bc 16, requester 01:00, tag 0x01, lowaddr 0x10
19:40:06.450707 IP omega.12289 > 192.168.10.1.12289: NetTLP: MRd, len 16, requester 01:00, tag 0x01, last 0xf, first 0xf, Addr 0x54204000
19:40:06.450719 IP 192.168.10.1.12289 > omega.12289: NetTLP: CplD, len 16, completer 00:00, success, bc 64, requester 01:00, tag 0x01, lowaddr 0x00
19:40:06.450725 IP omega.12289 > 192.168.10.1.12289: NetTLP: MWr, len 1, requester 01:00, tag 0x01, last 0x0, first 0xf, Addr 0xfee02004
19:40:06.450728 IP omega.12289 > 192.168.10.1.12289: NetTLP: MRd, len 4, requester 01:00, tag 0x01, last 0xf, first 0xf, Addr 0x34823220
19:40:06.450739 IP 192.168.10.1.12289 > omega.12289: NetTLP: CplD, len 4, completer 00:00, success, bc 16, requester 01:00, tag 0x01, lowaddr 0x20
19:40:06.450745 IP omega.12289 > 192.168.10.1.12289: NetTLP: MRd, len 16, requester 01:00, tag 0x01, last 0xf, first 0xf, Addr 0x54204800
19:40:06.450757 IP 192.168.10.1.12289 > omega.12289: NetTLP: CplD, len 16, completer 00:00, success, bc 64, requester 01:00, tag 0x01, lowaddr 0x00
19:40:06.450763 IP omega.12289 > 192.168.10.1.12289: NetTLP: MWr, len 1, requester 01:00, tag 0x01, last 0x0, first 0xf, Addr 0xfee02004
19:40:06.450766 IP omega.12289 > 192.168.10.1.12289: NetTLP: MRd, len 4, requester 01:00, tag 0x01, last 0xf, first 0xf, Addr 0x34823230
19:40:06.450777 IP 192.168.10.1.12289 > omega.12289: NetTLP: CplD, len 4, completer 00:00, success, bc 16, requester 01:00, tag 0x01, lowaddr 0x30
19:40:06.450783 IP omega.12289 > 192.168.10.1.12289: NetTLP: MRd, len 16, requester 01:00, tag 0x01, last 0xf, first 0xf, Addr 0x54205000
19:40:06.450795 IP 192.168.10.1.12289 > omega.12289: NetTLP: CplD, len 16, completer 00:00, success, bc 64, requester 01:00, tag 0x01, lowaddr 0x00
19:40:06.450800 IP omega.12289 > 192.168.10.1.12289: NetTLP: MWr, len 1, requester 01:00, tag 0x01, last 0x0, first 0xf, Addr 0xfee02004
19:40:06.450804 IP omega.12289 > 192.168.10.1.12289: NetTLP: MRd, len 4, requester 01:00, tag 0x01, last 0xf, first 0xf, Addr 0x34823240
19:40:06.450815 IP 192.168.10.1.12289 > omega.12289: NetTLP: CplD, len 4, completer 00:00, success, bc 16, requester 01:00, tag 0x01, lowaddr 0x40
19:40:06.450820 IP omega.12289 > 192.168.10.1.12289: NetTLP: MRd, len 16, requester 01:00, tag 0x01, last 0xf, first 0xf, Addr 0x54205800
19:40:06.450832 IP 192.168.10.1.12289 > omega.12289: NetTLP: CplD, len 16, completer 00:00, success, bc 64, requester 01:00, tag 0x01, lowaddr 0x00
19:40:06.450838 IP omega.12289 > 192.168.10.1.12289: NetTLP: MWr, len 1, requester 01:00, tag 0x01, last 0x0, first 0xf, Addr 0xfee02004
19:40:06.450842 IP omega.12289 > 192.168.10.1.12289: NetTLP: MRd, len 4, requester 01:00, tag 0x01, last 0xf, first 0xf, Addr 0x34823250
19:40:06.450853 IP 192.168.10.1.12289 > omega.12289: NetTLP: CplD, len 4, completer 00:00, success, bc 16, requester 01:00, tag 0x01, lowaddr 0x50
19:40:06.450858 IP omega.12289 > 192.168.10.1.12289: NetTLP: MRd, len 16, requester 01:00, tag 0x01, last 0xf, first 0xf, Addr 0x54206000
19:40:06.450870 IP 192.168.10.1.12289 > omega.12289: NetTLP: CplD, len 16, completer 00:00, success, bc 64, requester 01:00, tag 0x01, lowaddr 0x00
19:40:06.450876 IP omega.12289 > 192.168.10.1.12289: NetTLP: MWr, len 1, requester 01:00, tag 0x01, last 0x0, first 0xf, Addr 0xfee02004
19:40:06.450880 IP omega.12289 > 192.168.10.1.12289: NetTLP: MRd, len 4, requester 01:00, tag 0x01, last 0xf, first 0xf, Addr 0x34823260
19:40:06.450891 IP 192.168.10.1.12289 > omega.12289: NetTLP: CplD, len 4, completer 00:00, success, bc 16, requester 01:00, tag 0x01, lowaddr 0x60
19:40:06.450896 IP omega.12289 > 192.168.10.1.12289: NetTLP: MRd, len 16, requester 01:00, tag 0x01, last 0xf, first 0xf, Addr 0x54206800
19:40:06.450908 IP 192.168.10.1.12289 > omega.12289: NetTLP: CplD, len 16, completer 00:00, success, bc 64, requester 01:00, tag 0x01, lowaddr 0x00
19:40:06.450914 IP omega.12289 > 192.168.10.1.12289: NetTLP: MWr, len 1, requester 01:00, tag 0x01, last 0x0, first 0xf, Addr 0xfee02004
19:40:06.450917 IP omega.12289 > 192.168.10.1.12289: NetTLP: MRd, len 4, requester 01:00, tag 0x01, last 0xf, first 0xf, Addr 0x34823270
19:40:06.450929 IP 192.168.10.1.12289 > omega.12289: NetTLP: CplD, len 4, completer 00:00, success, bc 16, requester 01:00, tag 0x01, lowaddr 0x70
19:40:06.450934 IP omega.12289 > 192.168.10.1.12289: NetTLP: MRd, len 16, requester 01:00, tag 0x01, last 0xf, first 0xf, Addr 0x54207000
19:40:06.450946 IP 192.168.10.1.12289 > omega.12289: NetTLP: CplD, len 16, completer 00:00, success, bc 64, requester 01:00, tag 0x01, lowaddr 0x00
19:40:06.450952 IP omega.12289 > 192.168.10.1.12289: NetTLP: MWr, len 1, requester 01:00, tag 0x01, last 0x0, first 0xf, Addr 0xfee02004
19:40:06.450955 IP omega.12289 > 192.168.10.1.12289: NetTLP: MRd, len 4, requester 01:00, tag 0x01, last 0xf, first 0xf, Addr 0x34823280
19:40:06.450967 IP 192.168.10.1.12289 > omega.12289: NetTLP: CplD, len 4, completer 00:00, success, bc 16, requester 01:00, tag 0x01, lowaddr 0x00
19:40:06.450972 IP omega.12289 > 192.168.10.1.12289: NetTLP: MRd, len 16, requester 01:00, tag 0x01, last 0xf, first 0xf, Addr 0x54207800
19:40:06.450984 IP 192.168.10.1.12289 > omega.12289: NetTLP: CplD, len 16, completer 00:00, success, bc 64, requester 01:00, tag 0x01, lowaddr 0x00
19:40:06.450990 IP omega.12289 > 192.168.10.1.12289: NetTLP: MWr, len 1, requester 01:00, tag 0x01, last 0x0, first 0xf, Addr 0xfee02004
19:40:06.450993 IP omega.12289 > 192.168.10.1.12289: NetTLP: MRd, len 4, requester 01:00, tag 0x01, last 0xf, first 0xf, Addr 0x34823290
19:40:06.451005 IP 192.168.10.1.12289 > omega.12289: NetTLP: CplD, len 4, completer 00:00, success, bc 16, requester 01:00, tag 0x01, lowaddr 0x10
19:40:06.451010 IP omega.12289 > 192.168.10.1.12289: NetTLP: MRd, len 16, requester 01:00, tag 0x01, last 0xf, first 0xf, Addr 0x54208000
19:40:06.451022 IP 192.168.10.1.12289 > omega.12289: NetTLP: CplD, len 16, completer 00:00, success, bc 64, requester 01:00, tag 0x01, lowaddr 0x00
19:40:06.451028 IP omega.12289 > 192.168.10.1.12289: NetTLP: MWr, len 1, requester 01:00, tag 0x01, last 0x0, first 0xf, Addr 0xfee02004
19:40:06.451031 IP omega.12289 > 192.168.10.1.12289: NetTLP: MRd, len 4, requester 01:00, tag 0x01, last 0xf, first 0xf, Addr 0x348232a0
19:40:06.451042 IP 192.168.10.1.12289 > omega.12289: NetTLP: CplD, len 4, completer 00:00, success, bc 16, requester 01:00, tag 0x01, lowaddr 0x20
19:40:06.451048 IP omega.12289 > 192.168.10.1.12289: NetTLP: MRd, len 16, requester 01:00, tag 0x01, last 0xf, first 0xf, Addr 0x54208800
19:40:06.451060 IP 192.168.10.1.12289 > omega.12289: NetTLP: CplD, len 16, completer 00:00, success, bc 64, requester 01:00, tag 0x01, lowaddr 0x00
19:40:06.451067 IP omega.12289 > 192.168.10.1.12289: NetTLP: MWr, len 1, requester 01:00, tag 0x01, last 0x0, first 0xf, Addr 0xfee02004
19:40:06.451070 IP omega.12289 > 192.168.10.1.12289: NetTLP: MRd, len 4, requester 01:00, tag 0x01, last 0xf, first 0xf, Addr 0x348232b0
19:40:06.451081 IP 192.168.10.1.12289 > omega.12289: NetTLP: CplD, len 4, completer 00:00, success, bc 16, requester 01:00, tag 0x01, lowaddr 0x30
19:40:06.451087 IP omega.12289 > 192.168.10.1.12289: NetTLP: MRd, len 16, requester 01:00, tag 0x01, last 0xf, first 0xf, Addr 0x54209000
19:40:06.451099 IP 192.168.10.1.12289 > omega.12289: NetTLP: CplD, len 16, completer 00:00, success, bc 64, requester 01:00, tag 0x01, lowaddr 0x00
19:40:06.451105 IP omega.12289 > 192.168.10.1.12289: NetTLP: MWr, len 1, requester 01:00, tag 0x01, last 0x0, first 0xf, Addr 0xfee02004
19:40:06.451108 IP omega.12289 > 192.168.10.1.12289: NetTLP: MRd, len 4, requester 01:00, tag 0x01, last 0xf, first 0xf, Addr 0x348232c0
19:40:06.451119 IP 192.168.10.1.12289 > omega.12289: NetTLP: CplD, len 4, completer 00:00, success, bc 16, requester 01:00, tag 0x01, lowaddr 0x40
19:40:06.451125 IP omega.12289 > 192.168.10.1.12289: NetTLP: MRd, len 16, requester 01:00, tag 0x01, last 0xf, first 0xf, Addr 0x54209800
19:40:06.451137 IP 192.168.10.1.12289 > omega.12289: NetTLP: CplD, len 16, completer 00:00, success, bc 64, requester 01:00, tag 0x01, lowaddr 0x00
19:40:06.451143 IP omega.12289 > 192.168.10.1.12289: NetTLP: MWr, len 1, requester 01:00, tag 0x01, last 0x0, first 0xf, Addr 0xfee02004
19:40:06.451146 IP omega.12289 > 192.168.10.1.12289: NetTLP: MRd, len 4, requester 01:00, tag 0x01, last 0xf, first 0xf, Addr 0x348232d0
19:40:06.451158 IP 192.168.10.1.12289 > omega.12289: NetTLP: CplD, len 4, completer 00:00, success, bc 16, requester 01:00, tag 0x01, lowaddr 0x50
19:40:06.451163 IP omega.12289 > 192.168.10.1.12289: NetTLP: MRd, len 16, requester 01:00, tag 0x01, last 0xf, first 0xf, Addr 0x5420a000
19:40:06.451176 IP 192.168.10.1.12289 > omega.12289: NetTLP: CplD, len 16, completer 00:00, success, bc 64, requester 01:00, tag 0x01, lowaddr 0x00
19:40:06.451181 IP omega.12289 > 192.168.10.1.12289: NetTLP: MWr, len 1, requester 01:00, tag 0x01, last 0x0, first 0xf, Addr 0xfee02004
19:40:06.451185 IP omega.12289 > 192.168.10.1.12289: NetTLP: MRd, len 4, requester 01:00, tag 0x01, last 0xf, first 0xf, Addr 0x348232e0
19:40:06.451196 IP 192.168.10.1.12289 > omega.12289: NetTLP: CplD, len 4, completer 00:00, success, bc 16, requester 01:00, tag 0x01, lowaddr 0x60
19:40:06.451201 IP omega.12289 > 192.168.10.1.12289: NetTLP: MRd, len 16, requester 01:00, tag 0x01, last 0xf, first 0xf, Addr 0x5420a800
19:40:06.451212 IP 192.168.10.1.12289 > omega.12289: NetTLP: CplD, len 16, completer 00:00, success, bc 64, requester 01:00, tag 0x01, lowaddr 0x00
19:40:06.451218 IP omega.12289 > 192.168.10.1.12289: NetTLP: MWr, len 1, requester 01:00, tag 0x01, last 0x0, first 0xf, Addr 0xfee02004
19:40:06.451221 IP omega.12289 > 192.168.10.1.12289: NetTLP: MRd, len 4, requester 01:00, tag 0x01, last 0xf, first 0xf, Addr 0x348232f0
19:40:06.451233 IP 192.168.10.1.12289 > omega.12289: NetTLP: CplD, len 4, completer 00:00, success, bc 16, requester 01:00, tag 0x01, lowaddr 0x70
19:40:06.451238 IP omega.12289 > 192.168.10.1.12289: NetTLP: MRd, len 16, requester 01:00, tag 0x01, last 0xf, first 0xf, Addr 0x5420b000
19:40:06.451250 IP 192.168.10.1.12289 > omega.12289: NetTLP: CplD, len 16, completer 00:00, success, bc 64, requester 01:00, tag 0x01, lowaddr 0x00
19:40:06.451256 IP omega.12289 > 192.168.10.1.12289: NetTLP: MWr, len 1, requester 01:00, tag 0x01, last 0x0, first 0xf, Addr 0xfee02004
19:40:06.451260 IP omega.12289 > 192.168.10.1.12289: NetTLP: MRd, len 4, requester 01:00, tag 0x01, last 0xf, first 0xf, Addr 0x34823300
19:40:06.451271 IP 192.168.10.1.12289 > omega.12289: NetTLP: CplD, len 4, completer 00:00, success, bc 16, requester 01:00, tag 0x01, lowaddr 0x00
19:40:06.451276 IP omega.12289 > 192.168.10.1.12289: NetTLP: MRd, len 16, requester 01:00, tag 0x01, last 0xf, first 0xf, Addr 0x5420b800
19:40:06.451288 IP 192.168.10.1.12289 > omega.12289: NetTLP: CplD, len 16, completer 00:00, success, bc 64, requester 01:00, tag 0x01, lowaddr 0x00
19:40:06.451294 IP omega.12289 > 192.168.10.1.12289: NetTLP: MWr, len 1, requester 01:00, tag 0x01, last 0x0, first 0xf, Addr 0xfee02004
19:40:06.451297 IP omega.12289 > 192.168.10.1.12289: NetTLP: MRd, len 4, requester 01:00, tag 0x01, last 0xf, first 0xf, Addr 0x34823310
19:40:06.451309 IP 192.168.10.1.12289 > omega.12289: NetTLP: CplD, len 4, completer 00:00, success, bc 16, requester 01:00, tag 0x01, lowaddr 0x10
19:40:06.451314 IP omega.12289 > 192.168.10.1.12289: NetTLP: MRd, len 16, requester 01:00, tag 0x01, last 0xf, first 0xf, Addr 0x5420c000
19:40:06.451326 IP 192.168.10.1.12289 > omega.12289: NetTLP: CplD, len 16, completer 00:00, success, bc 64, requester 01:00, tag 0x01, lowaddr 0x00
19:40:06.451332 IP omega.12289 > 192.168.10.1.12289: NetTLP: MWr, len 1, requester 01:00, tag 0x01, last 0x0, first 0xf, Addr 0xfee02004
19:40:06.451335 IP omega.12289 > 192.168.10.1.12289: NetTLP: MRd, len 4, requester 01:00, tag 0x01, last 0xf, first 0xf, Addr 0x34823320
19:40:06.451347 IP 192.168.10.1.12289 > omega.12289: NetTLP: CplD, len 4, completer 00:00, success, bc 16, requester 01:00, tag 0x01, lowaddr 0x20
19:40:06.451352 IP omega.12289 > 192.168.10.1.12289: NetTLP: MRd, len 16, requester 01:00, tag 0x01, last 0xf, first 0xf, Addr 0x5420c800
19:40:06.451364 IP 192.168.10.1.12289 > omega.12289: NetTLP: CplD, len 16, completer 00:00, success, bc 64, requester 01:00, tag 0x01, lowaddr 0x00
19:40:06.451370 IP omega.12289 > 192.168.10.1.12289: NetTLP: MWr, len 1, requester 01:00, tag 0x01, last 0x0, first 0xf, Addr 0xfee02004
19:40:06.451373 IP omega.12289 > 192.168.10.1.12289: NetTLP: MRd, len 4, requester 01:00, tag 0x01, last 0xf, first 0xf, Addr 0x34823330
19:40:06.451384 IP 192.168.10.1.12289 > omega.12289: NetTLP: CplD, len 4, completer 00:00, success, bc 16, requester 01:00, tag 0x01, lowaddr 0x30
19:40:06.451390 IP omega.12289 > 192.168.10.1.12289: NetTLP: MRd, len 16, requester 01:00, tag 0x01, last 0xf, first 0xf, Addr 0x5420d000
19:40:06.451402 IP 192.168.10.1.12289 > omega.12289: NetTLP: CplD, len 16, completer 00:00, success, bc 64, requester 01:00, tag 0x01, lowaddr 0x00
19:40:06.451408 IP omega.12289 > 192.168.10.1.12289: NetTLP: MWr, len 1, requester 01:00, tag 0x01, last 0x0, first 0xf, Addr 0xfee02004
19:40:06.451411 IP omega.12289 > 192.168.10.1.12289: NetTLP: MRd, len 4, requester 01:00, tag 0x01, last 0xf, first 0xf, Addr 0x34823340
19:40:06.451422 IP 192.168.10.1.12289 > omega.12289: NetTLP: CplD, len 4, completer 00:00, success, bc 16, requester 01:00, tag 0x01, lowaddr 0x40
19:40:06.451428 IP omega.12289 > 192.168.10.1.12289: NetTLP: MRd, len 16, requester 01:00, tag 0x01, last 0xf, first 0xf, Addr 0x5420d800
19:40:06.451440 IP 192.168.10.1.12289 > omega.12289: NetTLP: CplD, len 16, completer 00:00, success, bc 64, requester 01:00, tag 0x01, lowaddr 0x00
19:40:06.451446 IP omega.12289 > 192.168.10.1.12289: NetTLP: MWr, len 1, requester 01:00, tag 0x01, last 0x0, first 0xf, Addr 0xfee02004
19:40:06.451449 IP omega.12289 > 192.168.10.1.12289: NetTLP: MRd, len 4, requester 01:00, tag 0x01, last 0xf, first 0xf, Addr 0x34823350
19:40:06.451460 IP 192.168.10.1.12289 > omega.12289: NetTLP: CplD, len 4, completer 00:00, success, bc 16, requester 01:00, tag 0x01, lowaddr 0x50
19:40:06.451466 IP omega.12289 > 192.168.10.1.12289: NetTLP: MRd, len 16, requester 01:00, tag 0x01, last 0xf, first 0xf, Addr 0x5420e000
19:40:06.451478 IP 192.168.10.1.12289 > omega.12289: NetTLP: CplD, len 16, completer 00:00, success, bc 64, requester 01:00, tag 0x01, lowaddr 0x00
19:40:06.451484 IP omega.12289 > 192.168.10.1.12289: NetTLP: MWr, len 1, requester 01:00, tag 0x01, last 0x0, first 0xf, Addr 0xfee02004
19:40:06.451487 IP omega.12289 > 192.168.10.1.12289: NetTLP: MRd, len 4, requester 01:00, tag 0x01, last 0xf, first 0xf, Addr 0x34823360
19:40:06.451498 IP 192.168.10.1.12289 > omega.12289: NetTLP: CplD, len 4, completer 00:00, success, bc 16, requester 01:00, tag 0x01, lowaddr 0x60
19:40:06.451503 IP omega.12289 > 192.168.10.1.12289: NetTLP: MRd, len 16, requester 01:00, tag 0x01, last 0xf, first 0xf, Addr 0x5420e800
19:40:06.451515 IP 192.168.10.1.12289 > omega.12289: NetTLP: CplD, len 16, completer 00:00, success, bc 64, requester 01:00, tag 0x01, lowaddr 0x00
19:40:06.451520 IP omega.12289 > 192.168.10.1.12289: NetTLP: MWr, len 1, requester 01:00, tag 0x01, last 0x0, first 0xf, Addr 0xfee02004
19:40:06.451524 IP omega.12289 > 192.168.10.1.12289: NetTLP: MRd, len 4, requester 01:00, tag 0x01, last 0xf, first 0xf, Addr 0x34823370
19:40:06.451535 IP 192.168.10.1.12289 > omega.12289: NetTLP: CplD, len 4, completer 00:00, success, bc 16, requester 01:00, tag 0x01, lowaddr 0x70
19:40:06.451540 IP omega.12289 > 192.168.10.1.12289: NetTLP: MRd, len 16, requester 01:00, tag 0x01, last 0xf, first 0xf, Addr 0x5420f000
19:40:06.451552 IP 192.168.10.1.12289 > omega.12289: NetTLP: CplD, len 16, completer 00:00, success, bc 64, requester 01:00, tag 0x01, lowaddr 0x00
19:40:06.451558 IP omega.12289 > 192.168.10.1.12289: NetTLP: MWr, len 1, requester 01:00, tag 0x01, last 0x0, first 0xf, Addr 0xfee02004
19:40:06.451562 IP omega.12289 > 192.168.10.1.12289: NetTLP: MRd, len 4, requester 01:00, tag 0x01, last 0xf, first 0xf, Addr 0x34823380
19:40:06.451573 IP 192.168.10.1.12289 > omega.12289: NetTLP: CplD, len 4, completer 00:00, success, bc 16, requester 01:00, tag 0x01, lowaddr 0x00
19:40:06.451578 IP omega.12289 > 192.168.10.1.12289: NetTLP: MRd, len 16, requester 01:00, tag 0x01, last 0xf, first 0xf, Addr 0x5420f800
19:40:06.451590 IP 192.168.10.1.12289 > omega.12289: NetTLP: CplD, len 16, completer 00:00, success, bc 64, requester 01:00, tag 0x01, lowaddr 0x00
19:40:06.451596 IP omega.12289 > 192.168.10.1.12289: NetTLP: MWr, len 1, requester 01:00, tag 0x01, last 0x0, first 0xf, Addr 0xfee02004
19:40:06.451599 IP omega.12289 > 192.168.10.1.12289: NetTLP: MRd, len 4, requester 01:00, tag 0x01, last 0xf, first 0xf, Addr 0x34823390
19:40:06.451611 IP 192.168.10.1.12289 > omega.12289: NetTLP: CplD, len 4, completer 00:00, success, bc 16, requester 01:00, tag 0x01, lowaddr 0x10
19:40:06.451616 IP omega.12289 > 192.168.10.1.12289: NetTLP: MRd, len 16, requester 01:00, tag 0x01, last 0xf, first 0xf, Addr 0x54210000
19:40:06.451628 IP 192.168.10.1.12289 > omega.12289: NetTLP: CplD, len 16, completer 00:00, success, bc 64, requester 01:00, tag 0x01, lowaddr 0x00
19:40:06.451634 IP omega.12289 > 192.168.10.1.12289: NetTLP: MWr, len 1, requester 01:00, tag 0x01, last 0x0, first 0xf, Addr 0xfee02004
19:40:06.451637 IP omega.12289 > 192.168.10.1.12289: NetTLP: MRd, len 4, requester 01:00, tag 0x01, last 0xf, first 0xf, Addr 0x348233a0
19:40:06.451649 IP 192.168.10.1.12289 > omega.12289: NetTLP: CplD, len 4, completer 00:00, success, bc 16, requester 01:00, tag 0x01, lowaddr 0x20
19:40:06.451654 IP omega.12289 > 192.168.10.1.12289: NetTLP: MRd, len 16, requester 01:00, tag 0x01, last 0xf, first 0xf, Addr 0x54210800
19:40:06.451666 IP 192.168.10.1.12289 > omega.12289: NetTLP: CplD, len 16, completer 00:00, success, bc 64, requester 01:00, tag 0x01, lowaddr 0x00
19:40:06.451672 IP omega.12289 > 192.168.10.1.12289: NetTLP: MWr, len 1, requester 01:00, tag 0x01, last 0x0, first 0xf, Addr 0xfee02004
19:40:06.451675 IP omega.12289 > 192.168.10.1.12289: NetTLP: MRd, len 4, requester 01:00, tag 0x01, last 0xf, first 0xf, Addr 0x348233b0
19:40:06.451687 IP 192.168.10.1.12289 > omega.12289: NetTLP: CplD, len 4, completer 00:00, success, bc 16, requester 01:00, tag 0x01, lowaddr 0x30
19:40:06.451692 IP omega.12289 > 192.168.10.1.12289: NetTLP: MRd, len 16, requester 01:00, tag 0x01, last 0xf, first 0xf, Addr 0x54211000
19:40:06.451704 IP 192.168.10.1.12289 > omega.12289: NetTLP: CplD, len 16, completer 00:00, success, bc 64, requester 01:00, tag 0x01, lowaddr 0x00
19:40:06.451710 IP omega.12289 > 192.168.10.1.12289: NetTLP: MWr, len 1, requester 01:00, tag 0x01, last 0x0, first 0xf, Addr 0xfee02004
19:40:06.451713 IP omega.12289 > 192.168.10.1.12289: NetTLP: MRd, len 4, requester 01:00, tag 0x01, last 0xf, first 0xf, Addr 0x348233c0
19:40:06.451724 IP 192.168.10.1.12289 > omega.12289: NetTLP: CplD, len 4, completer 00:00, success, bc 16, requester 01:00, tag 0x01, lowaddr 0x40
19:40:06.451730 IP omega.12289 > 192.168.10.1.12289: NetTLP: MRd, len 16, requester 01:00, tag 0x01, last 0xf, first 0xf, Addr 0x54211800
19:40:06.451742 IP 192.168.10.1.12289 > omega.12289: NetTLP: CplD, len 16, completer 00:00, success, bc 64, requester 01:00, tag 0x01, lowaddr 0x00
19:40:06.451748 IP omega.12289 > 192.168.10.1.12289: NetTLP: MWr, len 1, requester 01:00, tag 0x01, last 0x0, first 0xf, Addr 0xfee02004
19:40:06.451751 IP omega.12289 > 192.168.10.1.12289: NetTLP: MRd, len 4, requester 01:00, tag 0x01, last 0xf, first 0xf, Addr 0x348233d0
19:40:06.451764 IP 192.168.10.1.12289 > omega.12289: NetTLP: CplD, len 4, completer 00:00, success, bc 16, requester 01:00, tag 0x01, lowaddr 0x50
19:40:06.451769 IP omega.12289 > 192.168.10.1.12289: NetTLP: MRd, len 16, requester 01:00, tag 0x01, last 0xf, first 0xf, Addr 0x54212000
19:40:06.451781 IP 192.168.10.1.12289 > omega.12289: NetTLP: CplD, len 16, completer 00:00, success, bc 64, requester 01:00, tag 0x01, lowaddr 0x00
19:40:06.451787 IP omega.12289 > 192.168.10.1.12289: NetTLP: MWr, len 1, requester 01:00, tag 0x01, last 0x0, first 0xf, Addr 0xfee02004
19:40:06.451790 IP omega.12289 > 192.168.10.1.12289: NetTLP: MRd, len 4, requester 01:00, tag 0x01, last 0xf, first 0xf, Addr 0x348233e0
19:40:06.451801 IP 192.168.10.1.12289 > omega.12289: NetTLP: CplD, len 4, completer 00:00, success, bc 16, requester 01:00, tag 0x01, lowaddr 0x60
19:40:06.451807 IP omega.12289 > 192.168.10.1.12289: NetTLP: MRd, len 16, requester 01:00, tag 0x01, last 0xf, first 0xf, Addr 0x54212800
19:40:06.451819 IP 192.168.10.1.12289 > omega.12289: NetTLP: CplD, len 16, completer 00:00, success, bc 64, requester 01:00, tag 0x01, lowaddr 0x00
19:40:06.451825 IP omega.12289 > 192.168.10.1.12289: NetTLP: MWr, len 1, requester 01:00, tag 0x01, last 0x0, first 0xf, Addr 0xfee02004
19:40:06.451828 IP omega.12289 > 192.168.10.1.12289: NetTLP: MRd, len 4, requester 01:00, tag 0x01, last 0xf, first 0xf, Addr 0x348233f0
19:40:06.451839 IP 192.168.10.1.12289 > omega.12289: NetTLP: CplD, len 4, completer 00:00, success, bc 16, requester 01:00, tag 0x01, lowaddr 0x70
19:40:06.451844 IP omega.12289 > 192.168.10.1.12289: NetTLP: MRd, len 16, requester 01:00, tag 0x01, last 0xf, first 0xf, Addr 0x54213000
19:40:06.451857 IP 192.168.10.1.12289 > omega.12289: NetTLP: CplD, len 16, completer 00:00, success, bc 64, requester 01:00, tag 0x01, lowaddr 0x00
19:40:06.451862 IP omega.12289 > 192.168.10.1.12289: NetTLP: MWr, len 1, requester 01:00, tag 0x01, last 0x0, first 0xf, Addr 0xfee02004
19:40:06.451866 IP omega.12289 > 192.168.10.1.12289: NetTLP: MRd, len 4, requester 01:00, tag 0x01, last 0xf, first 0xf, Addr 0x34823400
19:40:06.451877 IP 192.168.10.1.12289 > omega.12289: NetTLP: CplD, len 4, completer 00:00, success, bc 16, requester 01:00, tag 0x01, lowaddr 0x00
19:40:06.451882 IP omega.12289 > 192.168.10.1.12289: NetTLP: MRd, len 16, requester 01:00, tag 0x01, last 0xf, first 0xf, Addr 0x54213800
19:40:06.451894 IP 192.168.10.1.12289 > omega.12289: NetTLP: CplD, len 16, completer 00:00, success, bc 64, requester 01:00, tag 0x01, lowaddr 0x00
19:40:06.451900 IP omega.12289 > 192.168.10.1.12289: NetTLP: MWr, len 1, requester 01:00, tag 0x01, last 0x0, first 0xf, Addr 0xfee02004
19:40:06.451904 IP omega.12289 > 192.168.10.1.12289: NetTLP: MRd, len 4, requester 01:00, tag 0x01, last 0xf, first 0xf, Addr 0x34823410
19:40:06.451915 IP 192.168.10.1.12289 > omega.12289: NetTLP: CplD, len 4, completer 00:00, success, bc 16, requester 01:00, tag 0x01, lowaddr 0x10
19:40:06.451920 IP omega.12289 > 192.168.10.1.12289: NetTLP: MRd, len 16, requester 01:00, tag 0x01, last 0xf, first 0xf, Addr 0x54214000
19:40:06.451932 IP 192.168.10.1.12289 > omega.12289: NetTLP: CplD, len 16, completer 00:00, success, bc 64, requester 01:00, tag 0x01, lowaddr 0x00
19:40:06.451938 IP omega.12289 > 192.168.10.1.12289: NetTLP: MWr, len 1, requester 01:00, tag 0x01, last 0x0, first 0xf, Addr 0xfee02004
19:40:06.451941 IP omega.12289 > 192.168.10.1.12289: NetTLP: MRd, len 4, requester 01:00, tag 0x01, last 0xf, first 0xf, Addr 0x34823420
19:40:06.451953 IP 192.168.10.1.12289 > omega.12289: NetTLP: CplD, len 4, completer 00:00, success, bc 16, requester 01:00, tag 0x01, lowaddr 0x20
19:40:06.451959 IP omega.12289 > 192.168.10.1.12289: NetTLP: MRd, len 16, requester 01:00, tag 0x01, last 0xf, first 0xf, Addr 0x54214800
19:40:06.451970 IP 192.168.10.1.12289 > omega.12289: NetTLP: CplD, len 16, completer 00:00, success, bc 64, requester 01:00, tag 0x01, lowaddr 0x00
19:40:06.451976 IP omega.12289 > 192.168.10.1.12289: NetTLP: MWr, len 1, requester 01:00, tag 0x01, last 0x0, first 0xf, Addr 0xfee02004
19:40:06.451979 IP omega.12289 > 192.168.10.1.12289: NetTLP: MRd, len 4, requester 01:00, tag 0x01, last 0xf, first 0xf, Addr 0x34823430
19:40:06.451991 IP 192.168.10.1.12289 > omega.12289: NetTLP: CplD, len 4, completer 00:00, success, bc 16, requester 01:00, tag 0x01, lowaddr 0x30
19:40:06.451996 IP omega.12289 > 192.168.10.1.12289: NetTLP: MRd, len 16, requester 01:00, tag 0x01, last 0xf, first 0xf, Addr 0x54215000
19:40:06.452008 IP 192.168.10.1.12289 > omega.12289: NetTLP: CplD, len 16, completer 00:00, success, bc 64, requester 01:00, tag 0x01, lowaddr 0x00
19:40:06.452014 IP omega.12289 > 192.168.10.1.12289: NetTLP: MWr, len 1, requester 01:00, tag 0x01, last 0x0, first 0xf, Addr 0xfee02004
19:40:06.452017 IP omega.12289 > 192.168.10.1.12289: NetTLP: MRd, len 4, requester 01:00, tag 0x01, last 0xf, first 0xf, Addr 0x34823440
19:40:06.452029 IP 192.168.10.1.12289 > omega.12289: NetTLP: CplD, len 4, completer 00:00, success, bc 16, requester 01:00, tag 0x01, lowaddr 0x40
19:40:06.452034 IP omega.12289 > 192.168.10.1.12289: NetTLP: MRd, len 16, requester 01:00, tag 0x01, last 0xf, first 0xf, Addr 0x54215800
19:40:06.452046 IP 192.168.10.1.12289 > omega.12289: NetTLP: CplD, len 16, completer 00:00, success, bc 64, requester 01:00, tag 0x01, lowaddr 0x00
19:40:06.452052 IP omega.12289 > 192.168.10.1.12289: NetTLP: MWr, len 1, requester 01:00, tag 0x01, last 0x0, first 0xf, Addr 0xfee02004
19:40:06.452055 IP omega.12289 > 192.168.10.1.12289: NetTLP: MRd, len 4, requester 01:00, tag 0x01, last 0xf, first 0xf, Addr 0x34823450
19:40:06.452066 IP 192.168.10.1.12289 > omega.12289: NetTLP: CplD, len 4, completer 00:00, success, bc 16, requester 01:00, tag 0x01, lowaddr 0x50
19:40:06.452072 IP omega.12289 > 192.168.10.1.12289: NetTLP: MRd, len 16, requester 01:00, tag 0x01, last 0xf, first 0xf, Addr 0x54216000
19:40:06.452084 IP 192.168.10.1.12289 > omega.12289: NetTLP: CplD, len 16, completer 00:00, success, bc 64, requester 01:00, tag 0x01, lowaddr 0x00
19:40:06.452090 IP omega.12289 > 192.168.10.1.12289: NetTLP: MWr, len 1, requester 01:00, tag 0x01, last 0x0, first 0xf, Addr 0xfee02004
19:40:06.452093 IP omega.12289 > 192.168.10.1.12289: NetTLP: MRd, len 4, requester 01:00, tag 0x01, last 0xf, first 0xf, Addr 0x34823460
19:40:06.452104 IP 192.168.10.1.12289 > omega.12289: NetTLP: CplD, len 4, completer 00:00, success, bc 16, requester 01:00, tag 0x01, lowaddr 0x60
19:40:06.452110 IP omega.12289 > 192.168.10.1.12289: NetTLP: MRd, len 16, requester 01:00, tag 0x01, last 0xf, first 0xf, Addr 0x54216800
19:40:06.452122 IP 192.168.10.1.12289 > omega.12289: NetTLP: CplD, len 16, completer 00:00, success, bc 64, requester 01:00, tag 0x01, lowaddr 0x00
19:40:06.452128 IP omega.12289 > 192.168.10.1.12289: NetTLP: MWr, len 1, requester 01:00, tag 0x01, last 0x0, first 0xf, Addr 0xfee02004
19:40:06.452131 IP omega.12289 > 192.168.10.1.12289: NetTLP: MRd, len 4, requester 01:00, tag 0x01, last 0xf, first 0xf, Addr 0x34823470
19:40:06.452136 IP omega.12297 > 192.168.10.1.12297: NetTLP: MWr, len 23, requester 01:00, tag 0x09, last 0xf, first 0xf, Addr 0x34a00000
19:40:06.452139 IP omega.12297 > 192.168.10.1.12297: NetTLP: MWr, len 2, requester 01:00, tag 0x09, last 0xf, first 0xf, Addr 0x34826080
19:40:06.452141 IP omega.12297 > 192.168.10.1.12297: NetTLP: MWr, len 1, requester 01:00, tag 0x09, last 0x0, first 0xf, Addr 0xfee40004
19:40:06.452142 IP 192.168.10.1.12289 > omega.12289: NetTLP: CplD, len 4, completer 00:00, success, bc 16, requester 01:00, tag 0x01, lowaddr 0x70
19:40:06.452148 IP omega.12289 > 192.168.10.1.12289: NetTLP: MRd, len 16, requester 01:00, tag 0x01, last 0xf, first 0xf, Addr 0x54217000
19:40:06.452160 IP 192.168.10.1.12289 > omega.12289: NetTLP: CplD, len 16, completer 00:00, success, bc 64, requester 01:00, tag 0x01, lowaddr 0x00
19:40:06.452166 IP omega.12289 > 192.168.10.1.12289: NetTLP: MWr, len 1, requester 01:00, tag 0x01, last 0x0, first 0xf, Addr 0xfee02004
19:40:06.452169 IP omega.12289 > 192.168.10.1.12289: NetTLP: MRd, len 4, requester 01:00, tag 0x01, last 0xf, first 0xf, Addr 0x34823480
19:40:06.452180 IP 192.168.10.1.12289 > omega.12289: NetTLP: CplD, len 4, completer 00:00, success, bc 16, requester 01:00, tag 0x01, lowaddr 0x00
19:40:06.452185 IP omega.12289 > 192.168.10.1.12289: NetTLP: MRd, len 16, requester 01:00, tag 0x01, last 0xf, first 0xf, Addr 0x54217800
19:40:06.452198 IP 192.168.10.1.12289 > omega.12289: NetTLP: CplD, len 16, completer 00:00, success, bc 64, requester 01:00, tag 0x01, lowaddr 0x00
19:40:06.452200 IP omega.12297 > 192.168.10.1.12297: NetTLP: MWr, len 23, requester 01:00, tag 0x09, last 0xf, first 0xf, Addr 0x34a00000
19:40:06.452201 IP omega.12297 > 192.168.10.1.12297: NetTLP: MWr, len 2, requester 01:00, tag 0x09, last 0xf, first 0xf, Addr 0x34826090
19:40:06.452203 IP omega.12297 > 192.168.10.1.12297: NetTLP: MWr, len 1, requester 01:00, tag 0x09, last 0x0, first 0xf, Addr 0xfee40004
19:40:06.452204 IP omega.12289 > 192.168.10.1.12289: NetTLP: MWr, len 1, requester 01:00, tag 0x01, last 0x0, first 0xf, Addr 0xfee02004
19:40:06.452206 IP omega.12297 > 192.168.10.1.12297: NetTLP: MWr, len 23, requester 01:00, tag 0x09, last 0xf, first 0xf, Addr 0x34a00000
19:40:06.452207 IP omega.12289 > 192.168.10.1.12289: NetTLP: MRd, len 4, requester 01:00, tag 0x01, last 0xf, first 0xf, Addr 0x34823490
19:40:06.452208 IP omega.12297 > 192.168.10.1.12297: NetTLP: MWr, len 2, requester 01:00, tag 0x09, last 0xf, first 0xf, Addr 0x348260a0
19:40:06.452210 IP omega.12297 > 192.168.10.1.12297: NetTLP: MWr, len 1, requester 01:00, tag 0x09, last 0x0, first 0xf, Addr 0xfee40004
19:40:06.452218 IP 192.168.10.1.12289 > omega.12289: NetTLP: CplD, len 4, completer 00:00, success, bc 16, requester 01:00, tag 0x01, lowaddr 0x10
19:40:06.452221 IP omega.12297 > 192.168.10.1.12297: NetTLP: MWr, len 23, requester 01:00, tag 0x09, last 0xf, first 0xf, Addr 0x34a00000
19:40:06.452222 IP omega.12297 > 192.168.10.1.12297: NetTLP: MWr, len 2, requester 01:00, tag 0x09, last 0xf, first 0xf, Addr 0x348260b0
19:40:06.452224 IP omega.12289 > 192.168.10.1.12289: NetTLP: MRd, len 16, requester 01:00, tag 0x01, last 0xf, first 0xf, Addr 0x54218000
19:40:06.452224 IP omega.12297 > 192.168.10.1.12297: NetTLP: MWr, len 1, requester 01:00, tag 0x09, last 0x0, first 0xf, Addr 0xfee40004
19:40:06.452235 IP 192.168.10.1.12289 > omega.12289: NetTLP: CplD, len 16, completer 00:00, success, bc 64, requester 01:00, tag 0x01, lowaddr 0x00
19:40:06.452241 IP omega.12289 > 192.168.10.1.12289: NetTLP: MWr, len 1, requester 01:00, tag 0x01, last 0x0, first 0xf, Addr 0xfee02004
19:40:06.452244 IP omega.12289 > 192.168.10.1.12289: NetTLP: MRd, len 4, requester 01:00, tag 0x01, last 0xf, first 0xf, Addr 0x348234a0
19:40:06.452256 IP 192.168.10.1.12289 > omega.12289: NetTLP: CplD, len 4, completer 00:00, success, bc 16, requester 01:00, tag 0x01, lowaddr 0x20
19:40:06.452258 IP omega.12297 > 192.168.10.1.12297: NetTLP: MWr, len 23, requester 01:00, tag 0x09, last 0xf, first 0xf, Addr 0x34a00000
19:40:06.452260 IP omega.12297 > 192.168.10.1.12297: NetTLP: MWr, len 2, requester 01:00, tag 0x09, last 0xf, first 0xf, Addr 0x348260c0
19:40:06.452261 IP omega.12297 > 192.168.10.1.12297: NetTLP: MWr, len 1, requester 01:00, tag 0x09, last 0x0, first 0xf, Addr 0xfee40004
19:40:06.452261 IP omega.12289 > 192.168.10.1.12289: NetTLP: MRd, len 16, requester 01:00, tag 0x01, last 0xf, first 0xf, Addr 0x54218800
19:40:06.452273 IP 192.168.10.1.12289 > omega.12289: NetTLP: CplD, len 16, completer 00:00, success, bc 64, requester 01:00, tag 0x01, lowaddr 0x00
19:40:06.452279 IP omega.12289 > 192.168.10.1.12289: NetTLP: MWr, len 1, requester 01:00, tag 0x01, last 0x0, first 0xf, Addr 0xfee02004
19:40:06.452283 IP omega.12289 > 192.168.10.1.12289: NetTLP: MRd, len 4, requester 01:00, tag 0x01, last 0xf, first 0xf, Addr 0x348234b0
19:40:06.452294 IP 192.168.10.1.12289 > omega.12289: NetTLP: CplD, len 4, completer 00:00, success, bc 16, requester 01:00, tag 0x01, lowaddr 0x30
19:40:06.452299 IP omega.12289 > 192.168.10.1.12289: NetTLP: MRd, len 16, requester 01:00, tag 0x01, last 0xf, first 0xf, Addr 0x54219000
19:40:06.452300 IP omega.12297 > 192.168.10.1.12297: NetTLP: MWr, len 23, requester 01:00, tag 0x09, last 0xf, first 0xf, Addr 0x34a00000
19:40:06.452301 IP omega.12297 > 192.168.10.1.12297: NetTLP: MWr, len 2, requester 01:00, tag 0x09, last 0xf, first 0xf, Addr 0x348260d0
19:40:06.452303 IP omega.12297 > 192.168.10.1.12297: NetTLP: MWr, len 1, requester 01:00, tag 0x09, last 0x0, first 0xf, Addr 0xfee40004
19:40:06.452311 IP 192.168.10.1.12289 > omega.12289: NetTLP: CplD, len 16, completer 00:00, success, bc 64, requester 01:00, tag 0x01, lowaddr 0x00
19:40:06.452317 IP omega.12289 > 192.168.10.1.12289: NetTLP: MWr, len 1, requester 01:00, tag 0x01, last 0x0, first 0xf, Addr 0xfee02004

