19:32:48.408295 IP 192.168.10.1.16384 > omega.16384: NetTLP: MWr, len 2, requester 00:00, tag 0x00, last 0xf, first 0xf, Addr 0x80000020
19:32:48.408301 IP 192.168.10.1.16384 > omega.16384: NetTLP: MWr, len 2, requester 00:00, tag 0x00, last 0xf, first 0xf, Addr 0x80000020
19:32:48.408303 IP 192.168.10.1.16384 > omega.16384: NetTLP: MWr, len 2, requester 00:00, tag 0x00, last 0xf, first 0xf, Addr 0x80000020
19:32:48.408304 IP 192.168.10.1.16384 > omega.16384: NetTLP: MWr, len 2, requester 00:00, tag 0x00, last 0xf, first 0xf, Addr 0x80000020
19:32:48.408305 IP 192.168.10.1.16384 > omega.16384: NetTLP: MWr, len 2, requester 00:00, tag 0x00, last 0xf, first 0xf, Addr 0x80000020
19:32:48.408306 IP 192.168.10.1.16384 > omega.16384: NetTLP: MWr, len 2, requester 00:00, tag 0x00, last 0xf, first 0xf, Addr 0x80000020
19:32:48.408313 IP 192.168.10.1.16384 > omega.16384: NetTLP: MWr, len 2, requester 00:00, tag 0x00, last 0xf, first 0xf, Addr 0x80000020
19:32:48.408320 IP omega.12288 > 192.168.10.1.12288: NetTLP: MRd, len 4, requester 01:00, tag 0x00, last 0xf, first 0xf, Addr 0x34820000
19:32:48.408324 IP 192.168.10.1.16384 > omega.16384: NetTLP: MWr, len 2, requester 00:00, tag 0x00, last 0xf, first 0xf, Addr 0x80000020
19:32:48.408326 IP 192.168.10.1.16384 > omega.16384: NetTLP: MWr, len 2, requester 00:00, tag 0x00, last 0xf, first 0xf, Addr 0x80000020
19:32:48.408372 IP 192.168.10.1.12288 > omega.12288: NetTLP: CplD, len 4, completer 00:00, success, bc 16, requester 01:00, tag 0x00, lowaddr 0x00
19:32:48.408377 IP 192.168.10.1.16384 > omega.16384: NetTLP: MWr, len 2, requester 00:00, tag 0x00, last 0xf, first 0xf, Addr 0x80000020
19:32:48.408389 IP omega.12288 > 192.168.10.1.12288: NetTLP: MRd, len 16, requester 01:00, tag 0x00, last 0xf, first 0xf, Addr 0x54071000
19:32:48.408441 IP 192.168.10.1.12288 > omega.12288: NetTLP: CplD, len 16, completer 00:00, success, bc 64, requester 01:00, tag 0x00, lowaddr 0x00
19:32:48.408455 IP omega.12288 > 192.168.10.1.12288: NetTLP: MWr, len 1, requester 01:00, tag 0x00, last 0x0, first 0xf, Addr 0xfee02004
19:32:48.408460 IP omega.12288 > 192.168.10.1.12288: NetTLP: MRd, len 4, requester 01:00, tag 0x00, last 0xf, first 0xf, Addr 0x34820010
19:32:48.408507 IP 192.168.10.1.12288 > omega.12288: NetTLP: CplD, len 4, completer 00:00, success, bc 16, requester 01:00, tag 0x00, lowaddr 0x10
19:32:48.408520 IP omega.12288 > 192.168.10.1.12288: NetTLP: MRd, len 16, requester 01:00, tag 0x00, last 0xf, first 0xf, Addr 0x54071800
19:32:48.408568 IP 192.168.10.1.12288 > omega.12288: NetTLP: CplD, len 16, completer 00:00, success, bc 64, requester 01:00, tag 0x00, lowaddr 0x00
19:32:48.408582 IP omega.12288 > 192.168.10.1.12288: NetTLP: MWr, len 1, requester 01:00, tag 0x00, last 0x0, first 0xf, Addr 0xfee02004
19:32:48.408587 IP omega.12288 > 192.168.10.1.12288: NetTLP: MRd, len 4, requester 01:00, tag 0x00, last 0xf, first 0xf, Addr 0x34820020
19:32:48.408636 IP 192.168.10.1.12288 > omega.12288: NetTLP: CplD, len 4, completer 00:00, success, bc 16, requester 01:00, tag 0x00, lowaddr 0x20
19:32:48.408649 IP omega.12288 > 192.168.10.1.12288: NetTLP: MRd, len 16, requester 01:00, tag 0x00, last 0xf, first 0xf, Addr 0x54072000
19:32:48.408698 IP 192.168.10.1.12288 > omega.12288: NetTLP: CplD, len 16, completer 00:00, success, bc 64, requester 01:00, tag 0x00, lowaddr 0x00
19:32:48.408712 IP omega.12288 > 192.168.10.1.12288: NetTLP: MWr, len 1, requester 01:00, tag 0x00, last 0x0, first 0xf, Addr 0xfee02004
19:32:48.408717 IP omega.12288 > 192.168.10.1.12288: NetTLP: MRd, len 4, requester 01:00, tag 0x00, last 0xf, first 0xf, Addr 0x34820030
19:32:48.408728 IP 192.168.10.1.12288 > omega.12288: NetTLP: CplD, len 4, completer 00:00, success, bc 16, requester 01:00, tag 0x00, lowaddr 0x30
19:32:48.408734 IP omega.12288 > 192.168.10.1.12288: NetTLP: MRd, len 16, requester 01:00, tag 0x00, last 0xf, first 0xf, Addr 0x54072800
19:32:48.408746 IP 192.168.10.1.12288 > omega.12288: NetTLP: CplD, len 16, completer 00:00, success, bc 64, requester 01:00, tag 0x00, lowaddr 0x00
19:32:48.408752 IP omega.12288 > 192.168.10.1.12288: NetTLP: MWr, len 1, requester 01:00, tag 0x00, last 0x0, first 0xf, Addr 0xfee02004
19:32:48.408756 IP omega.12288 > 192.168.10.1.12288: NetTLP: MRd, len 4, requester 01:00, tag 0x00, last 0xf, first 0xf, Addr 0x34820040
19:32:48.408768 IP 192.168.10.1.12288 > omega.12288: NetTLP: CplD, len 4, completer 00:00, success, bc 16, requester 01:00, tag 0x00, lowaddr 0x40
19:32:48.408773 IP omega.12288 > 192.168.10.1.12288: NetTLP: MRd, len 16, requester 01:00, tag 0x00, last 0xf, first 0xf, Addr 0x54073000
19:32:48.408785 IP 192.168.10.1.12288 > omega.12288: NetTLP: CplD, len 16, completer 00:00, success, bc 64, requester 01:00, tag 0x00, lowaddr 0x00
19:32:48.408791 IP omega.12288 > 192.168.10.1.12288: NetTLP: MWr, len 1, requester 01:00, tag 0x00, last 0x0, first 0xf, Addr 0xfee02004
19:32:48.408794 IP omega.12288 > 192.168.10.1.12288: NetTLP: MRd, len 4, requester 01:00, tag 0x00, last 0xf, first 0xf, Addr 0x34820050
19:32:48.408806 IP 192.168.10.1.12288 > omega.12288: NetTLP: CplD, len 4, completer 00:00, success, bc 16, requester 01:00, tag 0x00, lowaddr 0x50
19:32:48.408811 IP omega.12288 > 192.168.10.1.12288: NetTLP: MRd, len 16, requester 01:00, tag 0x00, last 0xf, first 0xf, Addr 0x54073800
19:32:48.408823 IP 192.168.10.1.12288 > omega.12288: NetTLP: CplD, len 16, completer 00:00, success, bc 64, requester 01:00, tag 0x00, lowaddr 0x00
19:32:48.408829 IP omega.12288 > 192.168.10.1.12288: NetTLP: MWr, len 1, requester 01:00, tag 0x00, last 0x0, first 0xf, Addr 0xfee02004
19:32:48.408832 IP omega.12288 > 192.168.10.1.12288: NetTLP: MRd, len 4, requester 01:00, tag 0x00, last 0xf, first 0xf, Addr 0x34820060
19:32:48.408844 IP 192.168.10.1.12288 > omega.12288: NetTLP: CplD, len 4, completer 00:00, success, bc 16, requester 01:00, tag 0x00, lowaddr 0x60
19:32:48.408849 IP omega.12288 > 192.168.10.1.12288: NetTLP: MRd, len 16, requester 01:00, tag 0x00, last 0xf, first 0xf, Addr 0x54074000
19:32:48.408861 IP 192.168.10.1.12288 > omega.12288: NetTLP: CplD, len 16, completer 00:00, success, bc 64, requester 01:00, tag 0x00, lowaddr 0x00
19:32:48.408867 IP omega.12288 > 192.168.10.1.12288: NetTLP: MWr, len 1, requester 01:00, tag 0x00, last 0x0, first 0xf, Addr 0xfee02004
19:32:48.408870 IP omega.12288 > 192.168.10.1.12288: NetTLP: MRd, len 4, requester 01:00, tag 0x00, last 0xf, first 0xf, Addr 0x34820070
19:32:48.408882 IP 192.168.10.1.12288 > omega.12288: NetTLP: CplD, len 4, completer 00:00, success, bc 16, requester 01:00, tag 0x00, lowaddr 0x70
19:32:48.408888 IP omega.12288 > 192.168.10.1.12288: NetTLP: MRd, len 16, requester 01:00, tag 0x00, last 0xf, first 0xf, Addr 0x54074800
19:32:48.408900 IP 192.168.10.1.12288 > omega.12288: NetTLP: CplD, len 16, completer 00:00, success, bc 64, requester 01:00, tag 0x00, lowaddr 0x00
19:32:48.408906 IP omega.12288 > 192.168.10.1.12288: NetTLP: MWr, len 1, requester 01:00, tag 0x00, last 0x0, first 0xf, Addr 0xfee02004
19:32:48.408909 IP omega.12288 > 192.168.10.1.12288: NetTLP: MRd, len 4, requester 01:00, tag 0x00, last 0xf, first 0xf, Addr 0x34820080
19:32:48.408920 IP 192.168.10.1.12288 > omega.12288: NetTLP: CplD, len 4, completer 00:00, success, bc 16, requester 01:00, tag 0x00, lowaddr 0x00
19:32:48.408926 IP omega.12288 > 192.168.10.1.12288: NetTLP: MRd, len 16, requester 01:00, tag 0x00, last 0xf, first 0xf, Addr 0x54075000
19:32:48.408938 IP 192.168.10.1.12288 > omega.12288: NetTLP: CplD, len 16, completer 00:00, success, bc 64, requester 01:00, tag 0x00, lowaddr 0x00
19:32:48.408944 IP omega.12288 > 192.168.10.1.12288: NetTLP: MWr, len 1, requester 01:00, tag 0x00, last 0x0, first 0xf, Addr 0xfee02004
19:32:48.408947 IP omega.12288 > 192.168.10.1.12288: NetTLP: MRd, len 4, requester 01:00, tag 0x00, last 0xf, first 0xf, Addr 0x34820090
19:32:48.408958 IP 192.168.10.1.12288 > omega.12288: NetTLP: CplD, len 4, completer 00:00, success, bc 16, requester 01:00, tag 0x00, lowaddr 0x10
19:32:48.408964 IP omega.12288 > 192.168.10.1.12288: NetTLP: MRd, len 16, requester 01:00, tag 0x00, last 0xf, first 0xf, Addr 0x54075800
19:32:48.408976 IP 192.168.10.1.12288 > omega.12288: NetTLP: CplD, len 16, completer 00:00, success, bc 64, requester 01:00, tag 0x00, lowaddr 0x00
19:32:48.408982 IP omega.12288 > 192.168.10.1.12288: NetTLP: MWr, len 1, requester 01:00, tag 0x00, last 0x0, first 0xf, Addr 0xfee02004

