19:41:02.715419 IP 192.168.10.1.16384 > omega.16384: NetTLP: MWr, len 2, requester 00:00, tag 0x00, last 0xf, first 0xf, Addr 0x80000020
19:41:02.715425 IP 192.168.10.1.16384 > omega.16384: NetTLP: MWr, len 2, requester 00:00, tag 0x00, last 0xf, first 0xf, Addr 0x80000020
19:41:02.715426 IP 192.168.10.1.16384 > omega.16384: NetTLP: MWr, len 2, requester 00:00, tag 0x00, last 0xf, first 0xf, Addr 0x80000020
19:41:02.715427 IP 192.168.10.1.16384 > omega.16384: NetTLP: MWr, len 2, requester 00:00, tag 0x00, last 0xf, first 0xf, Addr 0x80000020
19:41:02.715428 IP 192.168.10.1.16384 > omega.16384: NetTLP: MWr, len 2, requester 00:00, tag 0x00, last 0xf, first 0xf, Addr 0x80000020
19:41:02.715429 IP 192.168.10.1.16384 > omega.16384: NetTLP: MWr, len 2, requester 00:00, tag 0x00, last 0xf, first 0xf, Addr 0x80000020
19:41:02.715430 IP 192.168.10.1.16384 > omega.16384: NetTLP: MWr, len 2, requester 00:00, tag 0x00, last 0xf, first 0xf, Addr 0x80000020
19:41:02.715431 IP 192.168.10.1.16384 > omega.16384: NetTLP: MWr, len 2, requester 00:00, tag 0x00, last 0xf, first 0xf, Addr 0x80000020
19:41:02.715437 IP 192.168.10.1.16384 > omega.16384: NetTLP: MWr, len 2, requester 00:00, tag 0x00, last 0xf, first 0xf, Addr 0x80000020
19:41:02.715444 IP omega.12288 > 192.168.10.1.12288: NetTLP: MRd, len 4, requester 01:00, tag 0x00, last 0xf, first 0xf, Addr 0x34820430
19:41:02.715448 IP 192.168.10.1.16384 > omega.16384: NetTLP: MWr, len 2, requester 00:00, tag 0x00, last 0xf, first 0xf, Addr 0x80000020
19:41:02.715450 IP 192.168.10.1.16384 > omega.16384: NetTLP: MWr, len 2, requester 00:00, tag 0x00, last 0xf, first 0xf, Addr 0x80000020
19:41:02.715496 IP 192.168.10.1.12288 > omega.12288: NetTLP: CplD, len 4, completer 00:00, success, bc 16, requester 01:00, tag 0x00, lowaddr 0x30
19:41:02.715501 IP 192.168.10.1.16384 > omega.16384: NetTLP: MWr, len 2, requester 00:00, tag 0x00, last 0xf, first 0xf, Addr 0x80000020
19:41:02.715502 IP 192.168.10.1.16384 > omega.16384: NetTLP: MWr, len 2, requester 00:00, tag 0x00, last 0xf, first 0xf, Addr 0x80000020
19:41:02.715503 IP 192.168.10.1.16384 > omega.16384: NetTLP: MWr, len 2, requester 00:00, tag 0x00, last 0xf, first 0xf, Addr 0x80000020
19:41:02.715504 IP 192.168.10.1.16384 > omega.16384: NetTLP: MWr, len 2, requester 00:00, tag 0x00, last 0xf, first 0xf, Addr 0x80000020
19:41:02.715505 IP 192.168.10.1.16384 > omega.16384: NetTLP: MWr, len 2, requester 00:00, tag 0x00, last 0xf, first 0xf, Addr 0x80000020
19:41:02.715506 IP 192.168.10.1.16384 > omega.16384: NetTLP: MWr, len 2, requester 00:00, tag 0x00, last 0xf, first 0xf, Addr 0x80000020
19:41:02.715507 IP 192.168.10.1.16384 > omega.16384: NetTLP: MWr, len 2, requester 00:00, tag 0x00, last 0xf, first 0xf, Addr 0x80000020
19:41:02.715508 IP 192.168.10.1.16384 > omega.16384: NetTLP: MWr, len 2, requester 00:00, tag 0x00, last 0xf, first 0xf, Addr 0x80000020
19:41:02.715509 IP 192.168.10.1.16384 > omega.16384: NetTLP: MWr, len 2, requester 00:00, tag 0x00, last 0xf, first 0xf, Addr 0x80000020
19:41:02.715510 IP 192.168.10.1.16384 > omega.16384: NetTLP: MWr, len 2, requester 00:00, tag 0x00, last 0xf, first 0xf, Addr 0x80000020
19:41:02.715516 IP 192.168.10.1.16384 > omega.16384: NetTLP: MWr, len 2, requester 00:00, tag 0x00, last 0xf, first 0xf, Addr 0x80000020
19:41:02.715518 IP 192.168.10.1.16384 > omega.16384: NetTLP: MWr, len 2, requester 00:00, tag 0x00, last 0xf, first 0xf, Addr 0x80000020
19:41:02.715523 IP omega.12288 > 192.168.10.1.12288: NetTLP: MRd, len 16, requester 01:00, tag 0x00, last 0xf, first 0xf, Addr 0x542a8000
19:41:02.715535 IP 192.168.10.1.16384 > omega.16384: NetTLP: MWr, len 2, requester 00:00, tag 0x00, last 0xf, first 0xf, Addr 0x80000020
19:41:02.715537 IP 192.168.10.1.16384 > omega.16384: NetTLP: MWr, len 2, requester 00:00, tag 0x00, last 0xf, first 0xf, Addr 0x80000020
19:41:02.715538 IP 192.168.10.1.12288 > omega.12288: NetTLP: CplD, len 16, completer 00:00, success, bc 64, requester 01:00, tag 0x00, lowaddr 0x00
19:41:02.715540 IP 192.168.10.1.16384 > omega.16384: NetTLP: MWr, len 2, requester 00:00, tag 0x00, last 0xf, first 0xf, Addr 0x80000020
19:41:02.715541 IP 192.168.10.1.16384 > omega.16384: NetTLP: MWr, len 2, requester 00:00, tag 0x00, last 0xf, first 0xf, Addr 0x80000020
19:41:02.715547 IP 192.168.10.1.16384 > omega.16384: NetTLP: MWr, len 2, requester 00:00, tag 0x00, last 0xf, first 0xf, Addr 0x80000020
19:41:02.715551 IP omega.12288 > 192.168.10.1.12288: NetTLP: MWr, len 1, requester 01:00, tag 0x00, last 0x0, first 0xf, Addr 0xfee01004
19:41:02.715555 IP omega.12288 > 192.168.10.1.12288: NetTLP: MRd, len 4, requester 01:00, tag 0x00, last 0xf, first 0xf, Addr 0x34820440
19:41:02.715565 IP 192.168.10.1.16384 > omega.16384: NetTLP: MWr, len 2, requester 00:00, tag 0x00, last 0xf, first 0xf, Addr 0x80000020
19:41:02.715567 IP 192.168.10.1.16384 > omega.16384: NetTLP: MWr, len 2, requester 00:00, tag 0x00, last 0xf, first 0xf, Addr 0x80000020
19:41:02.715568 IP 192.168.10.1.12288 > omega.12288: NetTLP: CplD, len 4, completer 00:00, success, bc 16, requester 01:00, tag 0x00, lowaddr 0x40
19:41:02.715569 IP 192.168.10.1.16384 > omega.16384: NetTLP: MWr, len 2, requester 00:00, tag 0x00, last 0xf, first 0xf, Addr 0x80000020
19:41:02.715576 IP 192.168.10.1.16384 > omega.16384: NetTLP: MWr, len 2, requester 00:00, tag 0x00, last 0xf, first 0xf, Addr 0x80000020
19:41:02.715577 IP omega.12288 > 192.168.10.1.12288: NetTLP: MRd, len 16, requester 01:00, tag 0x00, last 0xf, first 0xf, Addr 0x542a8800
19:41:02.715624 IP 192.168.10.1.16384 > omega.16384: NetTLP: MWr, len 2, requester 00:00, tag 0x00, last 0xf, first 0xf, Addr 0x80000020
19:41:02.715628 IP 192.168.10.1.12288 > omega.12288: NetTLP: CplD, len 16, completer 00:00, success, bc 64, requester 01:00, tag 0x00, lowaddr 0x00
19:41:02.715630 IP 192.168.10.1.16384 > omega.16384: NetTLP: MWr, len 2, requester 00:00, tag 0x00, last 0xf, first 0xf, Addr 0x80000020
19:41:02.715631 IP 192.168.10.1.16384 > omega.16384: NetTLP: MWr, len 2, requester 00:00, tag 0x00, last 0xf, first 0xf, Addr 0x80000020
19:41:02.715632 IP 192.168.10.1.16384 > omega.16384: NetTLP: MWr, len 2, requester 00:00, tag 0x00, last 0xf, first 0xf, Addr 0x80000020
19:41:02.715633 IP 192.168.10.1.16384 > omega.16384: NetTLP: MWr, len 2, requester 00:00, tag 0x00, last 0xf, first 0xf, Addr 0x80000020
19:41:02.715634 IP 192.168.10.1.16384 > omega.16384: NetTLP: MWr, len 2, requester 00:00, tag 0x00, last 0xf, first 0xf, Addr 0x80000020
19:41:02.715635 IP 192.168.10.1.16384 > omega.16384: NetTLP: MWr, len 2, requester 00:00, tag 0x00, last 0xf, first 0xf, Addr 0x80000020
19:41:02.715636 IP 192.168.10.1.16384 > omega.16384: NetTLP: MWr, len 2, requester 00:00, tag 0x00, last 0xf, first 0xf, Addr 0x80000020
19:41:02.715637 IP 192.168.10.1.16384 > omega.16384: NetTLP: MWr, len 2, requester 00:00, tag 0x00, last 0xf, first 0xf, Addr 0x80000020
19:41:02.715638 IP 192.168.10.1.16384 > omega.16384: NetTLP: MWr, len 2, requester 00:00, tag 0x00, last 0xf, first 0xf, Addr 0x80000020
19:41:02.715644 IP 192.168.10.1.16384 > omega.16384: NetTLP: MWr, len 2, requester 00:00, tag 0x00, last 0xf, first 0xf, Addr 0x80000020
19:41:02.715646 IP 192.168.10.1.16384 > omega.16384: NetTLP: MWr, len 2, requester 00:00, tag 0x00, last 0xf, first 0xf, Addr 0x80000020
19:41:02.715652 IP omega.12288 > 192.168.10.1.12288: NetTLP: MWr, len 1, requester 01:00, tag 0x00, last 0x0, first 0xf, Addr 0xfee01004
19:41:02.715657 IP omega.12288 > 192.168.10.1.12288: NetTLP: MRd, len 4, requester 01:00, tag 0x00, last 0xf, first 0xf, Addr 0x34820450
19:41:02.715660 IP 192.168.10.1.16384 > omega.16384: NetTLP: MWr, len 2, requester 00:00, tag 0x00, last 0xf, first 0xf, Addr 0x80000020
19:41:02.715661 IP 192.168.10.1.16384 > omega.16384: NetTLP: MWr, len 2, requester 00:00, tag 0x00, last 0xf, first 0xf, Addr 0x80000020
19:41:02.715662 IP 192.168.10.1.16384 > omega.16384: NetTLP: MWr, len 2, requester 00:00, tag 0x00, last 0xf, first 0xf, Addr 0x80000020
19:41:02.715710 IP 192.168.10.1.12288 > omega.12288: NetTLP: CplD, len 4, completer 00:00, success, bc 16, requester 01:00, tag 0x00, lowaddr 0x50
19:41:02.715715 IP 192.168.10.1.16384 > omega.16384: NetTLP: MWr, len 2, requester 00:00, tag 0x00, last 0xf, first 0xf, Addr 0x80000020
19:41:02.715716 IP 192.168.10.1.16384 > omega.16384: NetTLP: MWr, len 2, requester 00:00, tag 0x00, last 0xf, first 0xf, Addr 0x80000020
19:41:02.715717 IP 192.168.10.1.16384 > omega.16384: NetTLP: MWr, len 2, requester 00:00, tag 0x00, last 0xf, first 0xf, Addr 0x80000020
19:41:02.715718 IP 192.168.10.1.16384 > omega.16384: NetTLP: MWr, len 2, requester 00:00, tag 0x00, last 0xf, first 0xf, Addr 0x80000020
19:41:02.715720 IP 192.168.10.1.16384 > omega.16384: NetTLP: MWr, len 2, requester 00:00, tag 0x00, last 0xf, first 0xf, Addr 0x80000020
19:41:02.715721 IP 192.168.10.1.16384 > omega.16384: NetTLP: MWr, len 2, requester 00:00, tag 0x00, last 0xf, first 0xf, Addr 0x80000020
19:41:02.715722 IP 192.168.10.1.16384 > omega.16384: NetTLP: MWr, len 2, requester 00:00, tag 0x00, last 0xf, first 0xf, Addr 0x80000020
19:41:02.715722 IP 192.168.10.1.16384 > omega.16384: NetTLP: MWr, len 2, requester 00:00, tag 0x00, last 0xf, first 0xf, Addr 0x80000020
19:41:02.715723 IP 192.168.10.1.16384 > omega.16384: NetTLP: MWr, len 2, requester 00:00, tag 0x00, last 0xf, first 0xf, Addr 0x80000020
19:41:02.715724 IP 192.168.10.1.16384 > omega.16384: NetTLP: MWr, len 2, requester 00:00, tag 0x00, last 0xf, first 0xf, Addr 0x80000020
19:41:02.715725 IP 192.168.10.1.16384 > omega.16384: NetTLP: MWr, len 2, requester 00:00, tag 0x00, last 0xf, first 0xf, Addr 0x80000020
19:41:02.715732 IP 192.168.10.1.16384 > omega.16384: NetTLP: MWr, len 2, requester 00:00, tag 0x00, last 0xf, first 0xf, Addr 0x80000020
19:41:02.715737 IP omega.12288 > 192.168.10.1.12288: NetTLP: MRd, len 16, requester 01:00, tag 0x00, last 0xf, first 0xf, Addr 0x542a9000
19:41:02.715750 IP 192.168.10.1.16384 > omega.16384: NetTLP: MWr, len 2, requester 00:00, tag 0x00, last 0xf, first 0xf, Addr 0x80000020
19:41:02.715752 IP 192.168.10.1.16384 > omega.16384: NetTLP: MWr, len 2, requester 00:00, tag 0x00, last 0xf, first 0xf, Addr 0x80000020
19:41:02.715753 IP 192.168.10.1.12288 > omega.12288: NetTLP: CplD, len 16, completer 00:00, success, bc 64, requester 01:00, tag 0x00, lowaddr 0x00
19:41:02.715755 IP 192.168.10.1.16384 > omega.16384: NetTLP: MWr, len 2, requester 00:00, tag 0x00, last 0xf, first 0xf, Addr 0x80000020
19:41:02.715761 IP 192.168.10.1.16384 > omega.16384: NetTLP: MWr, len 2, requester 00:00, tag 0x00, last 0xf, first 0xf, Addr 0x80000020
19:41:02.715762 IP 192.168.10.1.16384 > omega.16384: NetTLP: MWr, len 2, requester 00:00, tag 0x00, last 0xf, first 0xf, Addr 0x80000020
19:41:02.715765 IP omega.12288 > 192.168.10.1.12288: NetTLP: MWr, len 1, requester 01:00, tag 0x00, last 0x0, first 0xf, Addr 0xfee01004
19:41:02.715769 IP omega.12288 > 192.168.10.1.12288: NetTLP: MRd, len 4, requester 01:00, tag 0x00, last 0xf, first 0xf, Addr 0x34820460
19:41:02.715776 IP 192.168.10.1.16384 > omega.16384: NetTLP: MWr, len 2, requester 00:00, tag 0x00, last 0xf, first 0xf, Addr 0x80000020
19:41:02.715777 IP 192.168.10.1.16384 > omega.16384: NetTLP: MWr, len 2, requester 00:00, tag 0x00, last 0xf, first 0xf, Addr 0x80000020
19:41:02.715778 IP 192.168.10.1.12288 > omega.12288: NetTLP: CplD, len 4, completer 00:00, success, bc 16, requester 01:00, tag 0x00, lowaddr 0x60
19:41:02.715780 IP 192.168.10.1.16384 > omega.16384: NetTLP: MWr, len 2, requester 00:00, tag 0x00, last 0xf, first 0xf, Addr 0x80000020
19:41:02.715785 IP omega.12288 > 192.168.10.1.12288: NetTLP: MRd, len 16, requester 01:00, tag 0x00, last 0xf, first 0xf, Addr 0x542a9800
19:41:02.715789 IP 192.168.10.1.16384 > omega.16384: NetTLP: MWr, len 2, requester 00:00, tag 0x00, last 0xf, first 0xf, Addr 0x80000020
19:41:02.715790 IP 192.168.10.1.16384 > omega.16384: NetTLP: MWr, len 2, requester 00:00, tag 0x00, last 0xf, first 0xf, Addr 0x80000020
19:41:02.715802 IP 192.168.10.1.12288 > omega.12288: NetTLP: CplD, len 16, completer 00:00, success, bc 64, requester 01:00, tag 0x00, lowaddr 0x00
19:41:02.715804 IP 192.168.10.1.16384 > omega.16384: NetTLP: MWr, len 2, requester 00:00, tag 0x00, last 0xf, first 0xf, Addr 0x80000020
19:41:02.715805 IP 192.168.10.1.16384 > omega.16384: NetTLP: MWr, len 2, requester 00:00, tag 0x00, last 0xf, first 0xf, Addr 0x80000020
19:41:02.715810 IP omega.12288 > 192.168.10.1.12288: NetTLP: MWr, len 1, requester 01:00, tag 0x00, last 0x0, first 0xf, Addr 0xfee01004
19:41:02.715814 IP omega.12288 > 192.168.10.1.12288: NetTLP: MRd, len 4, requester 01:00, tag 0x00, last 0xf, first 0xf, Addr 0x34820470
19:41:02.715815 IP 192.168.10.1.16384 > omega.16384: NetTLP: MWr, len 2, requester 00:00, tag 0x00, last 0xf, first 0xf, Addr 0x80000020
19:41:02.715816 IP 192.168.10.1.16384 > omega.16384: NetTLP: MWr, len 2, requester 00:00, tag 0x00, last 0xf, first 0xf, Addr 0x80000020
19:41:02.715829 IP 192.168.10.1.16384 > omega.16384: NetTLP: MWr, len 2, requester 00:00, tag 0x00, last 0xf, first 0xf, Addr 0x80000020
19:41:02.715830 IP 192.168.10.1.12288 > omega.12288: NetTLP: CplD, len 4, completer 00:00, success, bc 16, requester 01:00, tag 0x00, lowaddr 0x70
19:41:02.715831 IP 192.168.10.1.16384 > omega.16384: NetTLP: MWr, len 2, requester 00:00, tag 0x00, last 0xf, first 0xf, Addr 0x80000020
19:41:02.715832 IP 192.168.10.1.16384 > omega.16384: NetTLP: MWr, len 2, requester 00:00, tag 0x00, last 0xf, first 0xf, Addr 0x80000020
19:41:02.715837 IP omega.12288 > 192.168.10.1.12288: NetTLP: MRd, len 16, requester 01:00, tag 0x00, last 0xf, first 0xf, Addr 0x542aa000
19:41:02.715841 IP 192.168.10.1.16384 > omega.16384: NetTLP: MWr, len 2, requester 00:00, tag 0x00, last 0xf, first 0xf, Addr 0x80000020
19:41:02.715843 IP 192.168.10.1.16384 > omega.16384: NetTLP: MWr, len 2, requester 00:00, tag 0x00, last 0xf, first 0xf, Addr 0x80000020
19:41:02.715855 IP 192.168.10.1.12288 > omega.12288: NetTLP: CplD, len 16, completer 00:00, success, bc 64, requester 01:00, tag 0x00, lowaddr 0x00
19:41:02.715857 IP 192.168.10.1.16384 > omega.16384: NetTLP: MWr, len 2, requester 00:00, tag 0x00, last 0xf, first 0xf, Addr 0x80000020
19:41:02.715858 IP 192.168.10.1.16384 > omega.16384: NetTLP: MWr, len 2, requester 00:00, tag 0x00, last 0xf, first 0xf, Addr 0x80000020
19:41:02.715864 IP omega.12288 > 192.168.10.1.12288: NetTLP: MWr, len 1, requester 01:00, tag 0x00, last 0x0, first 0xf, Addr 0xfee01004
19:41:02.715867 IP omega.12288 > 192.168.10.1.12288: NetTLP: MRd, len 4, requester 01:00, tag 0x00, last 0xf, first 0xf, Addr 0x34820480
19:41:02.715868 IP 192.168.10.1.16384 > omega.16384: NetTLP: MWr, len 2, requester 00:00, tag 0x00, last 0xf, first 0xf, Addr 0x80000020
19:41:02.715869 IP 192.168.10.1.16384 > omega.16384: NetTLP: MWr, len 2, requester 00:00, tag 0x00, last 0xf, first 0xf, Addr 0x80000020
19:41:02.715882 IP 192.168.10.1.16384 > omega.16384: NetTLP: MWr, len 2, requester 00:00, tag 0x00, last 0xf, first 0xf, Addr 0x80000020
19:41:02.715884 IP 192.168.10.1.12288 > omega.12288: NetTLP: CplD, len 4, completer 00:00, success, bc 16, requester 01:00, tag 0x00, lowaddr 0x00
19:41:02.715885 IP 192.168.10.1.16384 > omega.16384: NetTLP: MWr, len 2, requester 00:00, tag 0x00, last 0xf, first 0xf, Addr 0x80000020
19:41:02.715886 IP 192.168.10.1.16384 > omega.16384: NetTLP: MWr, len 2, requester 00:00, tag 0x00, last 0xf, first 0xf, Addr 0x80000020
19:41:02.715891 IP omega.12288 > 192.168.10.1.12288: NetTLP: MRd, len 16, requester 01:00, tag 0x00, last 0xf, first 0xf, Addr 0x542aa800
19:41:02.715895 IP 192.168.10.1.16384 > omega.16384: NetTLP: MWr, len 2, requester 00:00, tag 0x00, last 0xf, first 0xf, Addr 0x80000020
19:41:02.715896 IP 192.168.10.1.16384 > omega.16384: NetTLP: MWr, len 2, requester 00:00, tag 0x00, last 0xf, first 0xf, Addr 0x80000020
19:41:02.715909 IP 192.168.10.1.12288 > omega.12288: NetTLP: CplD, len 16, completer 00:00, success, bc 64, requester 01:00, tag 0x00, lowaddr 0x00
19:41:02.715910 IP 192.168.10.1.16384 > omega.16384: NetTLP: MWr, len 2, requester 00:00, tag 0x00, last 0xf, first 0xf, Addr 0x80000020
19:41:02.715911 IP 192.168.10.1.16384 > omega.16384: NetTLP: MWr, len 2, requester 00:00, tag 0x00, last 0xf, first 0xf, Addr 0x80000020
19:41:02.715912 IP 192.168.10.1.16384 > omega.16384: NetTLP: MWr, len 2, requester 00:00, tag 0x00, last 0xf, first 0xf, Addr 0x80000020
19:41:02.715917 IP omega.12288 > 192.168.10.1.12288: NetTLP: MWr, len 1, requester 01:00, tag 0x00, last 0x0, first 0xf, Addr 0xfee01004
19:41:02.715921 IP 192.168.10.1.16384 > omega.16384: NetTLP: MWr, len 2, requester 00:00, tag 0x00, last 0xf, first 0xf, Addr 0x80000020
19:41:02.715923 IP omega.12288 > 192.168.10.1.12288: NetTLP: MRd, len 4, requester 01:00, tag 0x00, last 0xf, first 0xf, Addr 0x34820490
19:41:02.715935 IP 192.168.10.1.16384 > omega.16384: NetTLP: MWr, len 2, requester 00:00, tag 0x00, last 0xf, first 0xf, Addr 0x80000020
19:41:02.715937 IP 192.168.10.1.12288 > omega.12288: NetTLP: CplD, len 4, completer 00:00, success, bc 16, requester 01:00, tag 0x00, lowaddr 0x10
19:41:02.715938 IP 192.168.10.1.16384 > omega.16384: NetTLP: MWr, len 2, requester 00:00, tag 0x00, last 0xf, first 0xf, Addr 0x80000020
19:41:02.715939 IP 192.168.10.1.16384 > omega.16384: NetTLP: MWr, len 2, requester 00:00, tag 0x00, last 0xf, first 0xf, Addr 0x80000020
19:41:02.715944 IP omega.12288 > 192.168.10.1.12288: NetTLP: MRd, len 16, requester 01:00, tag 0x00, last 0xf, first 0xf, Addr 0x542ab000
19:41:02.715948 IP 192.168.10.1.16384 > omega.16384: NetTLP: MWr, len 2, requester 00:00, tag 0x00, last 0xf, first 0xf, Addr 0x80000020
19:41:02.715949 IP 192.168.10.1.16384 > omega.16384: NetTLP: MWr, len 2, requester 00:00, tag 0x00, last 0xf, first 0xf, Addr 0x80000020
19:41:02.715962 IP 192.168.10.1.12288 > omega.12288: NetTLP: CplD, len 16, completer 00:00, success, bc 64, requester 01:00, tag 0x00, lowaddr 0x00
19:41:02.715964 IP 192.168.10.1.16384 > omega.16384: NetTLP: MWr, len 2, requester 00:00, tag 0x00, last 0xf, first 0xf, Addr 0x80000020
19:41:02.715965 IP 192.168.10.1.16384 > omega.16384: NetTLP: MWr, len 2, requester 00:00, tag 0x00, last 0xf, first 0xf, Addr 0x80000020
19:41:02.715970 IP omega.12288 > 192.168.10.1.12288: NetTLP: MWr, len 1, requester 01:00, tag 0x00, last 0x0, first 0xf, Addr 0xfee01004
19:41:02.715973 IP omega.12288 > 192.168.10.1.12288: NetTLP: MRd, len 4, requester 01:00, tag 0x00, last 0xf, first 0xf, Addr 0x348204a0
19:41:02.715974 IP 192.168.10.1.16384 > omega.16384: NetTLP: MWr, len 2, requester 00:00, tag 0x00, last 0xf, first 0xf, Addr 0x80000020
19:41:02.715976 IP 192.168.10.1.16384 > omega.16384: NetTLP: MWr, len 2, requester 00:00, tag 0x00, last 0xf, first 0xf, Addr 0x80000020
19:41:02.715989 IP 192.168.10.1.16384 > omega.16384: NetTLP: MWr, len 2, requester 00:00, tag 0x00, last 0xf, first 0xf, Addr 0x80000020
19:41:02.715990 IP 192.168.10.1.12288 > omega.12288: NetTLP: CplD, len 4, completer 00:00, success, bc 16, requester 01:00, tag 0x00, lowaddr 0x20
19:41:02.715991 IP 192.168.10.1.16384 > omega.16384: NetTLP: MWr, len 2, requester 00:00, tag 0x00, last 0xf, first 0xf, Addr 0x80000020
19:41:02.715992 IP 192.168.10.1.16384 > omega.16384: NetTLP: MWr, len 2, requester 00:00, tag 0x00, last 0xf, first 0xf, Addr 0x80000020
19:41:02.715997 IP omega.12288 > 192.168.10.1.12288: NetTLP: MRd, len 16, requester 01:00, tag 0x00, last 0xf, first 0xf, Addr 0x542ab800
19:41:02.716001 IP 192.168.10.1.16384 > omega.16384: NetTLP: MWr, len 2, requester 00:00, tag 0x00, last 0xf, first 0xf, Addr 0x80000020
19:41:02.716002 IP 192.168.10.1.16384 > omega.16384: NetTLP: MWr, len 2, requester 00:00, tag 0x00, last 0xf, first 0xf, Addr 0x80000020
19:41:02.716015 IP 192.168.10.1.12288 > omega.12288: NetTLP: CplD, len 16, completer 00:00, success, bc 64, requester 01:00, tag 0x00, lowaddr 0x00
19:41:02.716017 IP 192.168.10.1.16384 > omega.16384: NetTLP: MWr, len 2, requester 00:00, tag 0x00, last 0xf, first 0xf, Addr 0x80000020
19:41:02.716018 IP 192.168.10.1.16384 > omega.16384: NetTLP: MWr, len 2, requester 00:00, tag 0x00, last 0xf, first 0xf, Addr 0x80000020
19:41:02.716019 IP 192.168.10.1.16384 > omega.16384: NetTLP: MWr, len 2, requester 00:00, tag 0x00, last 0xf, first 0xf, Addr 0x80000020
19:41:02.716024 IP omega.12288 > 192.168.10.1.12288: NetTLP: MWr, len 1, requester 01:00, tag 0x00, last 0x0, first 0xf, Addr 0xfee01004
19:41:02.716027 IP 192.168.10.1.16384 > omega.16384: NetTLP: MWr, len 2, requester 00:00, tag 0x00, last 0xf, first 0xf, Addr 0x80000020
19:41:02.716029 IP omega.12288 > 192.168.10.1.12288: NetTLP: MRd, len 4, requester 01:00, tag 0x00, last 0xf, first 0xf, Addr 0x348204b0
19:41:02.716042 IP 192.168.10.1.16384 > omega.16384: NetTLP: MWr, len 2, requester 00:00, tag 0x00, last 0xf, first 0xf, Addr 0x80000020
19:41:02.716043 IP 192.168.10.1.16384 > omega.16384: NetTLP: MWr, len 2, requester 00:00, tag 0x00, last 0xf, first 0xf, Addr 0x80000020
19:41:02.716044 IP 192.168.10.1.12288 > omega.12288: NetTLP: CplD, len 4, completer 00:00, success, bc 16, requester 01:00, tag 0x00, lowaddr 0x30
19:41:02.716045 IP 192.168.10.1.16384 > omega.16384: NetTLP: MWr, len 2, requester 00:00, tag 0x00, last 0xf, first 0xf, Addr 0x80000020
19:41:02.716046 IP 192.168.10.1.16384 > omega.16384: NetTLP: MWr, len 2, requester 00:00, tag 0x00, last 0xf, first 0xf, Addr 0x80000020
19:41:02.716051 IP omega.12288 > 192.168.10.1.12288: NetTLP: MRd, len 16, requester 01:00, tag 0x00, last 0xf, first 0xf, Addr 0x542ac000
19:41:02.716054 IP 192.168.10.1.16384 > omega.16384: NetTLP: MWr, len 2, requester 00:00, tag 0x00, last 0xf, first 0xf, Addr 0x80000020
19:41:02.716068 IP 192.168.10.1.12288 > omega.12288: NetTLP: CplD, len 16, completer 00:00, success, bc 64, requester 01:00, tag 0x00, lowaddr 0x00
19:41:02.716070 IP 192.168.10.1.16384 > omega.16384: NetTLP: MWr, len 2, requester 00:00, tag 0x00, last 0xf, first 0xf, Addr 0x80000020
19:41:02.716071 IP 192.168.10.1.16384 > omega.16384: NetTLP: MWr, len 2, requester 00:00, tag 0x00, last 0xf, first 0xf, Addr 0x80000020
19:41:02.716072 IP 192.168.10.1.16384 > omega.16384: NetTLP: MWr, len 2, requester 00:00, tag 0x00, last 0xf, first 0xf, Addr 0x80000020
19:41:02.716077 IP omega.12288 > 192.168.10.1.12288: NetTLP: MWr, len 1, requester 01:00, tag 0x00, last 0x0, first 0xf, Addr 0xfee01004
19:41:02.716080 IP 192.168.10.1.16384 > omega.16384: NetTLP: MWr, len 2, requester 00:00, tag 0x00, last 0xf, first 0xf, Addr 0x80000020
19:41:02.716082 IP 192.168.10.1.16384 > omega.16384: NetTLP: MWr, len 2, requester 00:00, tag 0x00, last 0xf, first 0xf, Addr 0x80000020
19:41:02.716084 IP omega.12288 > 192.168.10.1.12288: NetTLP: MRd, len 4, requester 01:00, tag 0x00, last 0xf, first 0xf, Addr 0x348204c0
19:41:02.716095 IP 192.168.10.1.16384 > omega.16384: NetTLP: MWr, len 2, requester 00:00, tag 0x00, last 0xf, first 0xf, Addr 0x80000020
19:41:02.716096 IP 192.168.10.1.12288 > omega.12288: NetTLP: CplD, len 4, completer 00:00, success, bc 16, requester 01:00, tag 0x00, lowaddr 0x40
19:41:02.716098 IP 192.168.10.1.16384 > omega.16384: NetTLP: MWr, len 2, requester 00:00, tag 0x00, last 0xf, first 0xf, Addr 0x80000020
19:41:02.716099 IP 192.168.10.1.16384 > omega.16384: NetTLP: MWr, len 2, requester 00:00, tag 0x00, last 0xf, first 0xf, Addr 0x80000020
19:41:02.716103 IP omega.12288 > 192.168.10.1.12288: NetTLP: MRd, len 16, requester 01:00, tag 0x00, last 0xf, first 0xf, Addr 0x542ac800
19:41:02.716107 IP 192.168.10.1.16384 > omega.16384: NetTLP: MWr, len 2, requester 00:00, tag 0x00, last 0xf, first 0xf, Addr 0x80000020
19:41:02.716109 IP 192.168.10.1.16384 > omega.16384: NetTLP: MWr, len 2, requester 00:00, tag 0x00, last 0xf, first 0xf, Addr 0x80000020
19:41:02.716122 IP 192.168.10.1.12288 > omega.12288: NetTLP: CplD, len 16, completer 00:00, success, bc 64, requester 01:00, tag 0x00, lowaddr 0x00
19:41:02.716123 IP 192.168.10.1.16384 > omega.16384: NetTLP: MWr, len 2, requester 00:00, tag 0x00, last 0xf, first 0xf, Addr 0x80000020
19:41:02.716128 IP omega.12288 > 192.168.10.1.12288: NetTLP: MWr, len 1, requester 01:00, tag 0x00, last 0x0, first 0xf, Addr 0xfee01004
19:41:02.716132 IP omega.12288 > 192.168.10.1.12288: NetTLP: MRd, len 4, requester 01:00, tag 0x00, last 0xf, first 0xf, Addr 0x348204d0
19:41:02.716134 IP 192.168.10.1.16384 > omega.16384: NetTLP: MWr, len 2, requester 00:00, tag 0x00, last 0xf, first 0xf, Addr 0x80000020
19:41:02.716135 IP 192.168.10.1.16384 > omega.16384: NetTLP: MWr, len 2, requester 00:00, tag 0x00, last 0xf, first 0xf, Addr 0x80000020
19:41:02.716136 IP 192.168.10.1.16384 > omega.16384: NetTLP: MWr, len 2, requester 00:00, tag 0x00, last 0xf, first 0xf, Addr 0x80000020
19:41:02.716148 IP 192.168.10.1.12288 > omega.12288: NetTLP: CplD, len 4, completer 00:00, success, bc 16, requester 01:00, tag 0x00, lowaddr 0x50
19:41:02.716150 IP 192.168.10.1.16384 > omega.16384: NetTLP: MWr, len 2, requester 00:00, tag 0x00, last 0xf, first 0xf, Addr 0x80000020
19:41:02.716151 IP 192.168.10.1.16384 > omega.16384: NetTLP: MWr, len 2, requester 00:00, tag 0x00, last 0xf, first 0xf, Addr 0x80000020
19:41:02.716156 IP omega.12288 > 192.168.10.1.12288: NetTLP: MRd, len 16, requester 01:00, tag 0x00, last 0xf, first 0xf, Addr 0x542ad000
19:41:02.716161 IP 192.168.10.1.16384 > omega.16384: NetTLP: MWr, len 2, requester 00:00, tag 0x00, last 0xf, first 0xf, Addr 0x80000020
19:41:02.716162 IP 192.168.10.1.16384 > omega.16384: NetTLP: MWr, len 2, requester 00:00, tag 0x00, last 0xf, first 0xf, Addr 0x80000020
19:41:02.716163 IP 192.168.10.1.12288 > omega.12288: NetTLP: CplD, len 16, completer 00:00, success, bc 64, requester 01:00, tag 0x00, lowaddr 0x00
19:41:02.716169 IP omega.12288 > 192.168.10.1.12288: NetTLP: MWr, len 1, requester 01:00, tag 0x00, last 0x0, first 0xf, Addr 0xfee01004
19:41:02.716172 IP omega.12288 > 192.168.10.1.12288: NetTLP: MRd, len 4, requester 01:00, tag 0x00, last 0xf, first 0xf, Addr 0x348204e0
19:41:02.716173 IP 192.168.10.1.16384 > omega.16384: NetTLP: MWr, len 2, requester 00:00, tag 0x00, last 0xf, first 0xf, Addr 0x80000020
19:41:02.716174 IP 192.168.10.1.16384 > omega.16384: NetTLP: MWr, len 2, requester 00:00, tag 0x00, last 0xf, first 0xf, Addr 0x80000020
19:41:02.716187 IP 192.168.10.1.16384 > omega.16384: NetTLP: MWr, len 2, requester 00:00, tag 0x00, last 0xf, first 0xf, Addr 0x80000020
19:41:02.716189 IP 192.168.10.1.12288 > omega.12288: NetTLP: CplD, len 4, completer 00:00, success, bc 16, requester 01:00, tag 0x00, lowaddr 0x60
19:41:02.716190 IP 192.168.10.1.16384 > omega.16384: NetTLP: MWr, len 2, requester 00:00, tag 0x00, last 0xf, first 0xf, Addr 0x80000020
19:41:02.716191 IP 192.168.10.1.16384 > omega.16384: NetTLP: MWr, len 2, requester 00:00, tag 0x00, last 0xf, first 0xf, Addr 0x80000020
19:41:02.716195 IP omega.12288 > 192.168.10.1.12288: NetTLP: MRd, len 16, requester 01:00, tag 0x00, last 0xf, first 0xf, Addr 0x542ad800
19:41:02.716200 IP 192.168.10.1.16384 > omega.16384: NetTLP: MWr, len 2, requester 00:00, tag 0x00, last 0xf, first 0xf, Addr 0x80000020
19:41:02.716201 IP 192.168.10.1.16384 > omega.16384: NetTLP: MWr, len 2, requester 00:00, tag 0x00, last 0xf, first 0xf, Addr 0x80000020
19:41:02.716214 IP 192.168.10.1.12288 > omega.12288: NetTLP: CplD, len 16, completer 00:00, success, bc 64, requester 01:00, tag 0x00, lowaddr 0x00
19:41:02.716215 IP 192.168.10.1.16384 > omega.16384: NetTLP: MWr, len 2, requester 00:00, tag 0x00, last 0xf, first 0xf, Addr 0x80000020
19:41:02.716216 IP 192.168.10.1.16384 > omega.16384: NetTLP: MWr, len 2, requester 00:00, tag 0x00, last 0xf, first 0xf, Addr 0x80000020
19:41:02.716217 IP 192.168.10.1.16384 > omega.16384: NetTLP: MWr, len 2, requester 00:00, tag 0x00, last 0xf, first 0xf, Addr 0x80000020
19:41:02.716222 IP omega.12288 > 192.168.10.1.12288: NetTLP: MWr, len 1, requester 01:00, tag 0x00, last 0x0, first 0xf, Addr 0xfee01004
19:41:02.716226 IP 192.168.10.1.16384 > omega.16384: NetTLP: MWr, len 2, requester 00:00, tag 0x00, last 0xf, first 0xf, Addr 0x80000020
19:41:02.716228 IP 192.168.10.1.16384 > omega.16384: NetTLP: MWr, len 2, requester 00:00, tag 0x00, last 0xf, first 0xf, Addr 0x80000020
19:41:02.716229 IP omega.12288 > 192.168.10.1.12288: NetTLP: MRd, len 4, requester 01:00, tag 0x00, last 0xf, first 0xf, Addr 0x348204f0
19:41:02.716240 IP 192.168.10.1.16384 > omega.16384: NetTLP: MWr, len 2, requester 00:00, tag 0x00, last 0xf, first 0xf, Addr 0x80000020
19:41:02.716242 IP 192.168.10.1.12288 > omega.12288: NetTLP: CplD, len 4, completer 00:00, success, bc 16, requester 01:00, tag 0x00, lowaddr 0x70
19:41:02.716243 IP 192.168.10.1.16384 > omega.16384: NetTLP: MWr, len 2, requester 00:00, tag 0x00, last 0xf, first 0xf, Addr 0x80000020
19:41:02.716244 IP 192.168.10.1.16384 > omega.16384: NetTLP: MWr, len 2, requester 00:00, tag 0x00, last 0xf, first 0xf, Addr 0x80000020
19:41:02.716249 IP omega.12288 > 192.168.10.1.12288: NetTLP: MRd, len 16, requester 01:00, tag 0x00, last 0xf, first 0xf, Addr 0x542ae000
19:41:02.716253 IP 192.168.10.1.16384 > omega.16384: NetTLP: MWr, len 2, requester 00:00, tag 0x00, last 0xf, first 0xf, Addr 0x80000020
19:41:02.716267 IP 192.168.10.1.16384 > omega.16384: NetTLP: MWr, len 2, requester 00:00, tag 0x00, last 0xf, first 0xf, Addr 0x80000020
19:41:02.716268 IP 192.168.10.1.12288 > omega.12288: NetTLP: CplD, len 16, completer 00:00, success, bc 64, requester 01:00, tag 0x00, lowaddr 0x00
19:41:02.716270 IP 192.168.10.1.16384 > omega.16384: NetTLP: MWr, len 2, requester 00:00, tag 0x00, last 0xf, first 0xf, Addr 0x80000020
19:41:02.716271 IP 192.168.10.1.16384 > omega.16384: NetTLP: MWr, len 2, requester 00:00, tag 0x00, last 0xf, first 0xf, Addr 0x80000020
19:41:02.716272 IP 192.168.10.1.16384 > omega.16384: NetTLP: MWr, len 2, requester 00:00, tag 0x00, last 0xf, first 0xf, Addr 0x80000020
19:41:02.716277 IP omega.12288 > 192.168.10.1.12288: NetTLP: MWr, len 1, requester 01:00, tag 0x00, last 0x0, first 0xf, Addr 0xfee01004
19:41:02.716279 IP 192.168.10.1.16384 > omega.16384: NetTLP: MWr, len 2, requester 00:00, tag 0x00, last 0xf, first 0xf, Addr 0x80000020
19:41:02.716283 IP omega.12288 > 192.168.10.1.12288: NetTLP: MRd, len 4, requester 01:00, tag 0x00, last 0xf, first 0xf, Addr 0x34820500
19:41:02.716294 IP 192.168.10.1.16384 > omega.16384: NetTLP: MWr, len 2, requester 00:00, tag 0x00, last 0xf, first 0xf, Addr 0x80000020
19:41:02.716295 IP 192.168.10.1.16384 > omega.16384: NetTLP: MWr, len 2, requester 00:00, tag 0x00, last 0xf, first 0xf, Addr 0x80000020
19:41:02.716296 IP 192.168.10.1.12288 > omega.12288: NetTLP: CplD, len 4, completer 00:00, success, bc 16, requester 01:00, tag 0x00, lowaddr 0x00
19:41:02.716297 IP 192.168.10.1.16384 > omega.16384: NetTLP: MWr, len 2, requester 00:00, tag 0x00, last 0xf, first 0xf, Addr 0x80000020
19:41:02.716302 IP omega.12288 > 192.168.10.1.12288: NetTLP: MRd, len 16, requester 01:00, tag 0x00, last 0xf, first 0xf, Addr 0x542ae800
19:41:02.716306 IP 192.168.10.1.16384 > omega.16384: NetTLP: MWr, len 2, requester 00:00, tag 0x00, last 0xf, first 0xf, Addr 0x80000020
19:41:02.716320 IP 192.168.10.1.12288 > omega.12288: NetTLP: CplD, len 16, completer 00:00, success, bc 64, requester 01:00, tag 0x00, lowaddr 0x00
19:41:02.716322 IP 192.168.10.1.16384 > omega.16384: NetTLP: MWr, len 2, requester 00:00, tag 0x00, last 0xf, first 0xf, Addr 0x80000020
19:41:02.716323 IP 192.168.10.1.16384 > omega.16384: NetTLP: MWr, len 2, requester 00:00, tag 0x00, last 0xf, first 0xf, Addr 0x80000020
19:41:02.716324 IP 192.168.10.1.16384 > omega.16384: NetTLP: MWr, len 2, requester 00:00, tag 0x00, last 0xf, first 0xf, Addr 0x80000020
19:41:02.716329 IP omega.12288 > 192.168.10.1.12288: NetTLP: MWr, len 1, requester 01:00, tag 0x00, last 0x0, first 0xf, Addr 0xfee01004
19:41:02.716332 IP 192.168.10.1.16384 > omega.16384: NetTLP: MWr, len 2, requester 00:00, tag 0x00, last 0xf, first 0xf, Addr 0x80000020
19:41:02.716334 IP 192.168.10.1.16384 > omega.16384: NetTLP: MWr, len 2, requester 00:00, tag 0x00, last 0xf, first 0xf, Addr 0x80000020
19:41:02.716335 IP omega.12288 > 192.168.10.1.12288: NetTLP: MRd, len 4, requester 01:00, tag 0x00, last 0xf, first 0xf, Addr 0x34820510
19:41:02.716347 IP 192.168.10.1.16384 > omega.16384: NetTLP: MWr, len 2, requester 00:00, tag 0x00, last 0xf, first 0xf, Addr 0x80000020
19:41:02.716348 IP 192.168.10.1.12288 > omega.12288: NetTLP: CplD, len 4, completer 00:00, success, bc 16, requester 01:00, tag 0x00, lowaddr 0x10
19:41:02.716350 IP 192.168.10.1.16384 > omega.16384: NetTLP: MWr, len 2, requester 00:00, tag 0x00, last 0xf, first 0xf, Addr 0x80000020
19:41:02.716350 IP 192.168.10.1.16384 > omega.16384: NetTLP: MWr, len 2, requester 00:00, tag 0x00, last 0xf, first 0xf, Addr 0x80000020
19:41:02.716355 IP omega.12288 > 192.168.10.1.12288: NetTLP: MRd, len 16, requester 01:00, tag 0x00, last 0xf, first 0xf, Addr 0x542af000
19:41:02.716359 IP 192.168.10.1.16384 > omega.16384: NetTLP: MWr, len 2, requester 00:00, tag 0x00, last 0xf, first 0xf, Addr 0x80000020
19:41:02.716373 IP 192.168.10.1.16384 > omega.16384: NetTLP: MWr, len 2, requester 00:00, tag 0x00, last 0xf, first 0xf, Addr 0x80000020
19:41:02.716375 IP 192.168.10.1.12288 > omega.12288: NetTLP: CplD, len 16, completer 00:00, success, bc 64, requester 01:00, tag 0x00, lowaddr 0x00
19:41:02.716376 IP 192.168.10.1.16384 > omega.16384: NetTLP: MWr, len 2, requester 00:00, tag 0x00, last 0xf, first 0xf, Addr 0x80000020
19:41:02.716377 IP 192.168.10.1.16384 > omega.16384: NetTLP: MWr, len 2, requester 00:00, tag 0x00, last 0xf, first 0xf, Addr 0x80000020
19:41:02.716378 IP 192.168.10.1.16384 > omega.16384: NetTLP: MWr, len 2, requester 00:00, tag 0x00, last 0xf, first 0xf, Addr 0x80000020
19:41:02.716384 IP omega.12288 > 192.168.10.1.12288: NetTLP: MWr, len 1, requester 01:00, tag 0x00, last 0x0, first 0xf, Addr 0xfee01004
19:41:02.716386 IP 192.168.10.1.16384 > omega.16384: NetTLP: MWr, len 2, requester 00:00, tag 0x00, last 0xf, first 0xf, Addr 0x80000020
19:41:02.716390 IP omega.12288 > 192.168.10.1.12288: NetTLP: MRd, len 4, requester 01:00, tag 0x00, last 0xf, first 0xf, Addr 0x34820520
19:41:02.716402 IP 192.168.10.1.16384 > omega.16384: NetTLP: MWr, len 2, requester 00:00, tag 0x00, last 0xf, first 0xf, Addr 0x80000020
19:41:02.716403 IP 192.168.10.1.16384 > omega.16384: NetTLP: MWr, len 2, requester 00:00, tag 0x00, last 0xf, first 0xf, Addr 0x80000020
19:41:02.716404 IP 192.168.10.1.12288 > omega.12288: NetTLP: CplD, len 4, completer 00:00, success, bc 16, requester 01:00, tag 0x00, lowaddr 0x20
19:41:02.716406 IP 192.168.10.1.16384 > omega.16384: NetTLP: MWr, len 2, requester 00:00, tag 0x00, last 0xf, first 0xf, Addr 0x80000020
19:41:02.716410 IP omega.12288 > 192.168.10.1.12288: NetTLP: MRd, len 16, requester 01:00, tag 0x00, last 0xf, first 0xf, Addr 0x542af800
19:41:02.716412 IP 192.168.10.1.16384 > omega.16384: NetTLP: MWr, len 2, requester 00:00, tag 0x00, last 0xf, first 0xf, Addr 0x80000020
19:41:02.716414 IP 192.168.10.1.16384 > omega.16384: NetTLP: MWr, len 2, requester 00:00, tag 0x00, last 0xf, first 0xf, Addr 0x80000020
19:41:02.716427 IP 192.168.10.1.12288 > omega.12288: NetTLP: CplD, len 16, completer 00:00, success, bc 64, requester 01:00, tag 0x00, lowaddr 0x00
19:41:02.716428 IP 192.168.10.1.16384 > omega.16384: NetTLP: MWr, len 2, requester 00:00, tag 0x00, last 0xf, first 0xf, Addr 0x80000020
19:41:02.716429 IP 192.168.10.1.16384 > omega.16384: NetTLP: MWr, len 2, requester 00:00, tag 0x00, last 0xf, first 0xf, Addr 0x80000020
19:41:02.716430 IP 192.168.10.1.16384 > omega.16384: NetTLP: MWr, len 2, requester 00:00, tag 0x00, last 0xf, first 0xf, Addr 0x80000020
19:41:02.716436 IP omega.12288 > 192.168.10.1.12288: NetTLP: MWr, len 1, requester 01:00, tag 0x00, last 0x0, first 0xf, Addr 0xfee01004
19:41:02.716439 IP 192.168.10.1.16384 > omega.16384: NetTLP: MWr, len 2, requester 00:00, tag 0x00, last 0xf, first 0xf, Addr 0x80000020
19:41:02.716440 IP 192.168.10.1.16384 > omega.16384: NetTLP: MWr, len 2, requester 00:00, tag 0x00, last 0xf, first 0xf, Addr 0x80000020
19:41:02.716442 IP omega.12288 > 192.168.10.1.12288: NetTLP: MRd, len 4, requester 01:00, tag 0x00, last 0xf, first 0xf, Addr 0x34820530
19:41:02.716453 IP 192.168.10.1.16384 > omega.16384: NetTLP: MWr, len 2, requester 00:00, tag 0x00, last 0xf, first 0xf, Addr 0x80000020
19:41:02.716455 IP 192.168.10.1.12288 > omega.12288: NetTLP: CplD, len 4, completer 00:00, success, bc 16, requester 01:00, tag 0x00, lowaddr 0x30
19:41:02.716456 IP 192.168.10.1.16384 > omega.16384: NetTLP: MWr, len 2, requester 00:00, tag 0x00, last 0xf, first 0xf, Addr 0x80000020
19:41:02.716457 IP 192.168.10.1.16384 > omega.16384: NetTLP: MWr, len 2, requester 00:00, tag 0x00, last 0xf, first 0xf, Addr 0x80000020
19:41:02.716462 IP omega.12288 > 192.168.10.1.12288: NetTLP: MRd, len 16, requester 01:00, tag 0x00, last 0xf, first 0xf, Addr 0x542b0000
19:41:02.716466 IP 192.168.10.1.16384 > omega.16384: NetTLP: MWr, len 2, requester 00:00, tag 0x00, last 0xf, first 0xf, Addr 0x80000020
19:41:02.716480 IP 192.168.10.1.16384 > omega.16384: NetTLP: MWr, len 2, requester 00:00, tag 0x00, last 0xf, first 0xf, Addr 0x80000020
19:41:02.716481 IP 192.168.10.1.12288 > omega.12288: NetTLP: CplD, len 16, completer 00:00, success, bc 64, requester 01:00, tag 0x00, lowaddr 0x00
19:41:02.716482 IP 192.168.10.1.16384 > omega.16384: NetTLP: MWr, len 2, requester 00:00, tag 0x00, last 0xf, first 0xf, Addr 0x80000020
19:41:02.716483 IP 192.168.10.1.16384 > omega.16384: NetTLP: MWr, len 2, requester 00:00, tag 0x00, last 0xf, first 0xf, Addr 0x80000020
19:41:02.716489 IP omega.12288 > 192.168.10.1.12288: NetTLP: MWr, len 1, requester 01:00, tag 0x00, last 0x0, first 0xf, Addr 0xfee01004
19:41:02.716493 IP omega.12288 > 192.168.10.1.12288: NetTLP: MRd, len 4, requester 01:00, tag 0x00, last 0xf, first 0xf, Addr 0x34820540
19:41:02.716507 IP 192.168.10.1.16384 > omega.16384: NetTLP: MWr, len 2, requester 00:00, tag 0x00, last 0xf, first 0xf, Addr 0x80000020
19:41:02.716508 IP 192.168.10.1.12288 > omega.12288: NetTLP: CplD, len 4, completer 00:00, success, bc 16, requester 01:00, tag 0x00, lowaddr 0x40
19:41:02.716510 IP 192.168.10.1.16384 > omega.16384: NetTLP: MWr, len 2, requester 00:00, tag 0x00, last 0xf, first 0xf, Addr 0x80000020
19:41:02.716511 IP 192.168.10.1.16384 > omega.16384: NetTLP: MWr, len 2, requester 00:00, tag 0x00, last 0xf, first 0xf, Addr 0x80000020
19:41:02.716515 IP omega.12288 > 192.168.10.1.12288: NetTLP: MRd, len 16, requester 01:00, tag 0x00, last 0xf, first 0xf, Addr 0x542b0800
19:41:02.716524 IP 192.168.10.1.16384 > omega.16384: NetTLP: MWr, len 2, requester 00:00, tag 0x00, last 0xf, first 0xf, Addr 0x80000020
19:41:02.716525 IP 192.168.10.1.16384 > omega.16384: NetTLP: MWr, len 2, requester 00:00, tag 0x00, last 0xf, first 0xf, Addr 0x80000020
19:41:02.716526 IP 192.168.10.1.12288 > omega.12288: NetTLP: CplD, len 16, completer 00:00, success, bc 64, requester 01:00, tag 0x00, lowaddr 0x00
19:41:02.716527 IP 192.168.10.1.16384 > omega.16384: NetTLP: MWr, len 2, requester 00:00, tag 0x00, last 0xf, first 0xf, Addr 0x80000020
19:41:02.716533 IP omega.12288 > 192.168.10.1.12288: NetTLP: MWr, len 1, requester 01:00, tag 0x00, last 0x0, first 0xf, Addr 0xfee01004
19:41:02.716536 IP omega.12288 > 192.168.10.1.12288: NetTLP: MRd, len 4, requester 01:00, tag 0x00, last 0xf, first 0xf, Addr 0x34820550
19:41:02.716542 IP 192.168.10.1.16384 > omega.16384: NetTLP: MWr, len 2, requester 00:00, tag 0x00, last 0xf, first 0xf, Addr 0x80000020
19:41:02.716543 IP 192.168.10.1.16384 > omega.16384: NetTLP: MWr, len 2, requester 00:00, tag 0x00, last 0xf, first 0xf, Addr 0x80000020
19:41:02.716544 IP 192.168.10.1.16384 > omega.16384: NetTLP: MWr, len 2, requester 00:00, tag 0x00, last 0xf, first 0xf, Addr 0x80000020
19:41:02.716545 IP 192.168.10.1.12288 > omega.12288: NetTLP: CplD, len 4, completer 00:00, success, bc 16, requester 01:00, tag 0x00, lowaddr 0x50
